60000,INTRODUCTION TO GRADUATE STUDIES IN JOURNALISM AND MASS COMMUNICATION ,JMC,Graduate standing.,,An introductory survey of the various areas of professional and scholarly concentration in the fields of journalism and mass communication. Consideration of the relationship between professional practice and scholarly activity in those fields.,2012
60001,THEORY OF MASS COMMUNICATION ,JMC,Graduate standing.,,"Introduction to theory of mass communication, with emphasis on the process and effects of mass communication.",2012
60002,LEGAL PROBLEMS IN MASS COMMUNICATIONS ,JMC,Special approval and graduate standing.,,"Case studies related to the first amendment, libel, invasion of privacy, regulation of broadcasting and new media copyright, and access to information. Course focus will be the theories underlying these issues as well as practical application of the legal concepts.",2012
60003,ETHICS OF MASS COMMUNICATIONS ,JMC,Journalism and mass communication (JMC) major and graduate standing.,,Study of ethical problems of mass media in society; analysis of media policies; performance evaluation.,2012
60004,CYBERMEDIA LAW ,JMC,graduate standing.,,"Investigates how the law affects those who gather information and publish online, including issues relating to blogging, web site hosting, posting and online journalism, along with a basic ability to apply that knowledge in specific situations. Focus is on both existing law and developing public policy.",2012
60007,RESEARCH METHODS IN MASS COMMUNICATION ,JMC,Special approval and graduate standing.,,Introduction to methods of social science research which are applicable to study of mass communication.,2012
60009,SOCIAL ROLE OF THE MASS MEDIA ,JMC,Journalism and mass communication (JMC) major and graduate standing.,,"Application of professional, theoretical, historical, economic and political perspectives to examine the role of mass media in society both in terms of structure and function.",2012
60010,QUALITATIVE RESEARCH IN JOURNALISM AND MASS COMMUNICATION: DATA COLLECTION ,JMC,graduate standing.,,Designed to develop skills in qualitative data collection in journalism and mass communication with primary focus on human subjects and textual data.,2012
60015,ADVANCED MEDIA MANAGEMENT ,JMC,JMC 50015 and graduate standing.,,Theory and practice of management operations and problem-solving techniques specifically related to media companies. Emphasis will be using case studies from the media.,2012
60021,ADVANCED MAGAZINE WRITING ,JMC,JMC 56016 and JMC 50005 and graduate standing.,,Course builds on content in JMC 56016 and 50006. Purpose is to refine and hone writing skills for nonfiction magazine stories in print and online.,2012
60040,QUALITATIVE RESEARCH METHODS IN JOURNALISMA ND MASS COMMUNICATION: DATA ANALYSIS ,JMC,graduate standing.,,"Emphasizes the development of skills in the analysis of data collected through qualitative research methods, particularly interviews and ethnographies. Designed to help prepare graduate students who plan to use qualitative methods in their academic or applied research, particularly those who are adopting these methods for theses or dissertations.",2012
60096,INDIVIDUAL INVESTIGATION IN MASS COMMUNICATION,JMC,Special approval and graduate standing.,,(Repeatable for a maximum of 6 credit hours)Individual investigation of selected area or problem approved by graduate faculty.,2012
60098,RESEARCH,JMC,Special approval and graduate standing.,,(Repeatable for credit) Research or individual investigation for master's level graduate students. Credits earned may be applied toward meeting degree Requirements if school approves. Maximum of 3 hours may be applied to degree if school approves.,2012
60195,SPECIAL TOPICS SEMINAR,JMC,Special approval and graduate standing.,,(Repeatable for credit)Study of important topics in mass communication. Offered irregularly in response to existing interests and opportunities.,2012
60196,READINGS IN MASS COMMUNICATIONS,JMC,Special approval and graduate standing.,,(Repeatable for credit)Student pursues course of readings approved by instructor to cover subject specialty student cannot obtain from formal course offerings.,2012
60199,THESIS I ,JMC,Special approval and graduate standing.,,"Thesis students must register for a total of 6 hours, 2 to 6 hours in single semester distributed over several semesters if desired.",2012
60296,ADVANCED READINGS IN JOURNALISM AND MASS COMMUNICATION,JMC,Graduate standing and special approval.,,(Repeatable for credit)Consolidation and synthesis of learning experiences in the graduate program. Application of graduate study to future professional careers. Updates on latest developments in the fields of JMC and their impact on the future of academic study and professional practice in the discipline.,2012
60299,THESIS II ,JMC,JMC 60199 and graduate standing.,,Thesis student must continue registration each semester until all degree Requirements are met.,2012
60396,MASTER'S PROFESSIONAL PROJECT ,JMC,Special approval and graduate standing.,,Completion and defense of a substantial professional project in one of the fields of journalism and mass communication.,2012
66010,SPECIALIZED REPORTING ,JMC,JMC 56009 and JMC 55051 and graduate standing.,,"Newsgathering techniques in specialty areas such as politics, labor, medicine, business and technology techniques of team reporting.",2012
66092,INTERNSHIP IN JOURNALISM AND MASS COMMUNICATION,JMC,Special approval and graduate standing.,,(Repeatable for credit)Experience in a department or company involving supervised professional responsibilities in journalism and mass communication. Minimum 150 hours of work for each credit hour.,2012
67094,COLLEGE TEACHING OF JOURNALISM,JMC,Special approval and graduate standing. 1.000 or,,(Repeatable for credit)Staff training and experience in college teaching. Only 3 hours may be applied toward master's degree.,2012
68000,PUBLIC RELATIONS THEORY AND PROCESS ,JMC,Special approval and graduate standing.,,Introduces students to the profession of public relations by exploring both the theories and the processes employed by PR practitioners. Course also explores the history and social role of public relations as well as ethics and social responsibility.,2012
68001,PUBLIC RELATIONS MANAGEMENT ,JMC,JMC 68000 and graduate standing.,,"Perspectives, skills needed to manage an organization's PR function, particularly strategic planning, implementation and evaluation. Emphasis on managerial aspects of negotiating organizational relationships with publics.",2012
68004,SOCIAL MEDIA AND PUBLIC RELATIONS ,JMC,JMC 68000 and JMC 68001; and JMC graduate student.,,"Provides an in-depth study of social media and public relations, emphasizing how the two are used by organizations to build stronger relations with consumers, media, analysts, and others.",2012
68005,STRATEGIC WRITING AND MESSAGING IN PUBLIC RELATIONS ,JMC,JMC 68000 and JMC 68001; and JMC graduate standing,,"Focuses on Public Relations writing and strategic messaging, a critical foundational skill. Course content includes skill building in online channels and across traditional mediums.",2012
68006,VALUES AND ETHICS MANAGEMENT IN PUBLIC RELATIONS ,JMC,JMC 68000 and 68001; and journalism and mass communication (JMC) major; and graduate standing.,,"Explores the theory and application of ethics in public relations. Examines case studies, ethics theory, values and management thought.",2012
68008,PUBLIC RELATIONS MEASUREMENT AND RETURN ON INVESTMENT ,JMC,JMC 68000 and 68001; and journalism and mass communication (JMC) major; and graduate standing.,,Examines the strategic and tactical processes for measuring outcomes in public relations campaigns.,2012
68009,PUBLIC RELATIONS HISTORY AND THE MODERN WORLD ,JMC,JMC 68000 and JMC 68001; and JMC graduate student.,,"Examines development of Public Relations as a profession, focusing on the Twentieth Century. Detailed study of historical case studies, campaigns and initiatives.",2012
68010,PUBLIC RELATIONS INTERNAL COMMUNICATIONS ,JMC,JMC 68000 and JMC 68001; JMC graduate student.,,Explores strategies and tactics of internal communications. Includes development of organizational intranets and other employee-focused communications channels with special emphasis on social media to communicate public relations messages.,2012
68011,FINANCIAL ISSUES IN PUBLIC RELATIONS ,JMC,JMC 68000 and JMC 68001; and JMC graduate student.,,"Focuses on financial topics related to a career in public relations, particularly the role of communicators in the growing field of investor relations.",2012
80001,THEORY OF MASS COMMUNICATION ,JMC,doctoral standing.,,Introduction to theory of mass communication with emphasis on the process and effects of mass communication.,2012
80004,CYBERMEDIA LAW ,JMC,doctoral standing.,,"Investigates how the law affects those who gather information and publish online, including issues relating to blogging, web site hosting, posting and online journalism, along with a basic ability to apply that knowledge in specific situations. Focus is on both existing law and developing public policy.",2012
80010,QUALITATIVE RESEARCH IN JOURNALISM AND MASS COMMUNICATION: DATA COLLECTION ,JMC,doctoral standing.,,Designed to develop skills in qualitative data collection in journalism and mass communication with primary focus on human subjects and textual data.,2012
80040,QUALITATIVE RESEARCH METHODS IN JOURNALISM AND MASS COMMUNICATION: DATA ANALYSIS ,JMC,doctoral standing.,,"Emphasizes the development of skills in the analysis of data collected through qualitative research methods, particularly interviews and ethnographies. Designed to help prepare graduate students who plan to use qualitative methods in their academic or applied research, particularly those who will be adopting these methods for theses or dissertations.",2012
80195,SPECIAL TOPICS IN JOURNALISM AND MASS COMMUNICATION,JMC,doctoral standing and special approval.,,(Repeatable for credit)Study of important topics in Mass Communication. Offered irregularly in response to existing interests and opportunities.,2012
