42008,ADVANCED PHOTOJOURNALISM ,JMC,2.750 overall GPA; and JMC 26007 and 32002 both with a grade of C- (1.700) or better.,,Discussion of contemporary photojournalists and issues. Production of photo documentary multimedia and illustrations appropriate to photojournalism. Senior portfolio review.,2012
42092,PRACTICUM IN PHOTOGRAPHY,JMC,2.750 overall GPA; and junior or senior standing and special approval.,,(repeatable for a total of 10 hours) individual or group investigation into student selected areas of photographic field.,2012
43035,ADVANCED TELEVISION NEWS PRODUCING ,JMC,2.750 overall GPA; and journalism and mass communication (JMC) major and special approval.,,Advanced understanding of how to produce news content for broadcast and the web.,2012
43036,RECORD PROMOTION ,JMC,2.750 overall GPA; and journalism and mass communication (JMC) or communications studies (COMM) major.,,"Class operates as an independent record label to critique, select, promote, publicize and sell original recorded music.",2012
44042,LIVE SPORTS PRODUCTION ,JMC,"2.750 overall GPA; and JMC 23030 and 23031 with a grade of C- or better; JMC 30004 with a grade of C- or better; JMC major; and a score of at least 70% on the Grammar, Usage & Punctuation (GUP) test.",JMC 44043 and 45000.,"The study and broadcast of live sporting events, sports news and sports commentary shows. Hands-on production of such sporting events as basketball, wrestling and gymnastics. Live broadcasts in both studio and remote locations.",2012
44043,SPORTS FIELD PRODUCTION ,JMC,"2.750 overall GPA and JMC 23030 and 23031 with a grade of C- or better. JMC 30004 with a grade of C- or better. JMC major and a score of at least 70% on the Grammar, Usage & Punctuation (GUP) test.",JMC 44042 and 45000.,"Video shooting and editing of sports packages and short documentaries. This includes player and coach profiles, highlights and lead-ins.",2012
44045,PROMOTIONS FOR ELECTRONIC MEDIA ,JMC,2.750 cumulative GPA and journalism and mass communication (JMC) major.,,Fundamental and latest trends in broadcast and cable promotion.,2012
44050,AUDIO FOR VIDEO ,JMC,2.750 cumulative GPA and journalism and mass communication (JMC) major.,,"Understanding of the sonic aspects of visual productions including video studio, video field and online applications.",2012
45000,TELEVISION SPORTS GRAPHICS PRODUCTION ,JMC,"2.750 overall GPA; and JMC 23030 and 23031 with a grade of C- or better. JMC 30004 as a pre- or co-requisite with a grade of C- or better. JMC major and a score of at least 70% on the Grammar, Usage & Punctuation (GUP) test.",JMC 44042 and 44043.,Techniques in creating and preparing TV and video graphics for live sports events.,2012
45001,LIGHTING FOR VIDEO PRODUCTION ,JMC,cumulative 2.750 GPA; minimum grade of C- (1.700) in JMC 23030; and journalism and mass communication major or minor.,,"Introduction to theory and technique of lighting for video production. Course includes critical analysis of video lighting situations, the various tools available to light various production locations including interviews and multi-camera narrative scenes.",2012
45005,HISTORICAL DOCUMENTARY PRODUCTION ,JMC,,,Chronicles the evolution of the historical television documentary and demonstrates the step-by-step production process required to create such a program. Students research and assemble a documentary with an overall appreciation of this genre's purpose in both the television industry and the popular culture.,2012
45010,DIGITAL FILM PREPRODUCTION ,JMC,cumulative 2.750 GPA; and a minimum grade of C- (1.700) in JMC 23030.,,"Gives students practical, hands-on experience in the preproduction of a feature length digital film. Students work on script revising, budgeting, location scouting, casting, developing a script breakdown and developing a daily production schedule for the film.",2012
45013,DIGITAL FILM POST PRODUCTION ,JMC,cumulative 2.750 GPA; and minimum grade of C- (1.700) in JMC 23030.,,"Advanced video editing course designed to offer students the experience in the postproduction and finishing of a feature length digital narrative film. Students will refine their technical and aesthetic skills through a combination of practice, reading, presenting, viewing and discussion. Students are assigned specific scenes that they are to complete from string out and assembly cut to fine cut and picture lock. Students then work on sound effects, visual effects, titles or color correction.",2012
45020,AVID EDITOR CERTIFICATION ,JMC,cumulative 2.750 GPA.,,Prepares students to take the official Avid Media Composer MC 101 certification exam. Students who pass the exam will be certified as Avid Video editors.,2012
46000,NEWSPAPER DESIGN ,JMC,2.750 overall GPA; and JMC 26001; and JMC 22001 or 22000; and VCD 37000 all with a grade of C- (1.700) or better.,,Design of newspapers from small inside pages to elaborate feature pages. News judgment. Basic information graphics and photo editing.,2012
46001,INFORMATION GRAPHICS ,JMC,2.750 overall GPA; and a grade of B- (2.700) or better in JMC 20004; and VCD 37000 with a grade of C- (1.700) or better; and a journalism and mass communication (JMC) major; and a score of at least 70% on the Grammar Usage and Punctuation (GUP) test.,,"Introduction to shapes, color type and combinations of these for computer designed news graphics maps charts graphs and diagrams.",2012
46003,PRODUCING TELEVISION NEWS ,JMC,2.750 overall GPA; and minimum grade of C- (1.700) in JMC 26008 and a journalism and mass communication (JMC) major.,,"Introduction to the theory and practice of producing content for TV news and public affairs programs. Emphasis is placed on understanding news philosophies, storytelling story selection and rundown placement.",2012
46006,EDITORIAL WRITING ,JMC,2.750 overall GPA; and JMC 26007 or 26008 either with a grade of C- (1.700) or better; and a journalism and mass communication (JMC) major.,,Structures and purpose of editorial and column writing; study of editorial section of newspaper practice in writing editorials.,2012
46007,REPORTING IN DEPTH ,JMC,2.750 overall GPA; and JMC 26007 with a grade of C- or better or JMC 26008 with a grade of C- or better; and a journalism and mass communication (JMC) major.,,"Techniques involved in researching, interviewing and writing in depth news articles and analyses.",2012
46009,REPORTING PUBLIC AFFAIRS ,JMC,2.750 overall GPA; and JMC 26007 or 26008; and JMC 36005 or 46003 all with a grade of C- or better; and journalism and mass communication (JMC) major.,,"Instruction and practice in reporting all areas of public affairs, including government and the courts. Use of precision journalism techniques.",2012
46016,MAGAZINE PUBLISHING ,JMC,2.750 overall GPA; and a grade of B- (2.700) or better in JMC 20004; and a journalism and mass communication (JMC) major and junior standing; and a score of at least 70% on the Grammar Usage and Punctuation (GUP) test .,,"Overview of magazine publishing-editorial, advertising, circulation and production. Analysis of magazines.",2012
46018,FEATURE WRITING ,JMC,2.750 overall GPA; and JMC 26007 with a grade of C- (1.700) or better.,,"Researching, writing and placement of feature stories in publications.",2012
46020,MAGAZINE DESIGN ,JMC,2.750 overall GPA; and JMC 22000 and 26001 and 46016 and VCD 37000 all with a grade of C- (1.700) or better.,,Marriage of words and visuals for designing magazine layouts and covers in desktop publishing.,2012
46021,MAGAZINE WRITING AND EDITING ,JMC,2.750 overall GPA; and JMC 36005 and 40005 both with a grade of C- (1.700) or better.,,"Research, interviewing writing and marketing of major magazine articles. Also editing techniques for magazines.",2012
46052,ADVANCED BROADCAST NEWS PRACTICES ,JMC,2.750 overall GPA and JMC 26008 with a grade of C- (1.700) or better.,,"Study of investigative news stories, newsroom operations, editing and producing broadcast news programs. Advanced projects in broadcast news.",2012
46054,BROADCAST DOCUMENTARY ,JMC,"2.750 overall GPA; and two of the following: JMC 33033, JMC 33034, JMC 33042, JMC 33043 -- all with a grade of C- (1.700) or better.",,Development of documentary form for radio and television. Analysis and production of documentaries. Utilization of audio and video recording and editing.,2012
46055,ENTREPRENEURIAL DOCUMENTARY PHOTOGRAPHY ,JMC,minimum grade of C- in JMC 32001 and JMC 32005; and ENTR 27056; and journalism and mass communication (JMC) major or minor.,,Exploring techniques that allow students desiring to make a difference in the world with their visual story-telling skills and make a living. Students work with local and regional non-profits and non-governmental agencies to develop photo reports and increase visibility and understanding with still and multimedia.,2012
46056,CYBERMEDIA PRODUCTION ,JMC,cumulative 2.750 GPA; and a minimum grade of C- (1.700) in JMC 26005 and JMC 36005 and VCD 37000; and journalism and mass communication major or minor.,,"Prepares journalism students to work on media delivered online or by tablet. Deals with multimedia news, magazines, information design and photojournalism.",2012
46057,MOTION GRAPHICS FOR VIDEO EDITING ,JMC,cumulative 2.750 GPA; and a minimum grade of C- (1.700) in JMC 22002 and 22003.,,Covers the creation of motion graphics for video editing from the perspective of a professional editor. Students learn basic video effects such as digital matte creation and layered graphics for video productions. Students also gain a basic understanding of how to convert and compress video files for various deliverable formats. Adobe After Effects is the industry standard software application for creating motion graphics and will be used extensively in the course.,2012
46091,NEW YORK MEDIA SEMINAR ,JMC,"cumulative 2.750 GPA; and sophomore, junior or senior standing in the College of Communication and Information.",,"Introduction of students to the New York media, the thinking of industry professionals and the job opportunities in the city. Students attend presentations by media professionals and seminars to discuss media based in New York City.",2012
47003,TEACHING HIGH SCHOOL JOURNALISM ,JMC,junior or senior standing and special approval of instructor.,,Methods and materials for teaching journalism in high school.,2012
47004,DESKTOP PUBLISHING FOR HIGH SCHOOL JOURNALISM TEACHERS ,JMC,,,Basics of InDesign desktop publishing program as it relates to high school newspapers and magazines.,2012
48001,MEDIA RELATIONS AND PUBLICITY ,JMC,2.750 overall GPA; JMC 26001; and JMC 26007 or 26008; and JMC 38002 all with a grade of C- (1.700) or better; and journalism and mass communication (JMC) major.,,"Planning and preparation of materials for use by the news media, both on paper and online. The course explores the media relations function along with the uses and limitations of mass media in public relations practice.",2012
48002,PUBLIC RELATIONS TACTICS ,JMC,2.750 overall GPA; and JMC 26001 and 38002 both with a grade of C- (1.700) or better.,,"Planning and preparation of face-to-face public relations tactics, including spokesperson training for on and off camera appearances special event planning speeches and presentations with visual support and other applications of ""writing for the ear.""",2012
48003,PUBLIC RELATIONS ONLINE TACTICS ,JMC,2.750 overall GPA; and JMC 26001 and 28001; and JMC 26007 or 26008; and 38002 all with a grade of C- (1.700) or better.,,Explore fundamentals of web site planning and design and provides hands-on skills development using the full range of cyber media techniques. Includes emphasis on writing for online audiences.,2012
48006,PUBLIC RELATIONS PUBLICATIONS ,JMC,2.750 overall GPA; and JMC 26001 and VCD 37000 both with a grade of C- (1.700) or better; and a journalism and mass communication (JMC) major.,,"Planning, writing and design of organizational publications including newsletters brochures flyers promotional mailers and web sites. Course also explores the print production process.",2012
48091,SEMINAR: PUBLIC RELATIONS CAMPAIGNS,JMC,2.750 overall GPA; and JMC 26007 or 26008; and JMC 38002; and three of these four--JMC 48001 and 48002 and 48003 and 48006--all with a grade of C- (1.700) or better.,,"(Repeatable for credit) This capstone course in the public relations major requires student teams to combine research, planning and execution into a single public relations campaign developed for a real world organization.",2012
49021,CORPORATE VIDEO ,JMC,2.750 overall GPA; and two of the following: JMC 33033 and 33034 and 33042 and 33043 both with a grade of C- or better; and a journalism and mass communication (JMC) major.,,The use of video in corporate and organizational environments. Emphasis is placed on the structure and function of the medium within each environment.,2012
50002,REPORTING FOR MASS MEDIA ,JMC,Special approval and graduate standing.,,Theory and practice in newswriting and reporting; news values and news judgment; lead and story development; techniques of gathering information and dealing with sources of news; writing for deadline. Hours do not count toward degree.,2012
50003,EDITING FOR MASS MEDIA ,JMC,JMC 50002 and graduate standing.,,"Theory and practice in copy editing, headline writing and editing photographs and information graphics for print and on-line publications. Hours do not count toward degree.",2012
50004,COMPUTER-ASSISTED REPORTING ,JMC,JMC 50002 and graduate standing.,,"Computer analysis of large data sets focusing on government, court, police records, for preparation of news stories, basics of on-line searching; software and databases.",2012
50006,LAW OF MASS COMMUNICATION ,JMC,Graduate standing.,,"Libel and slander; privacy, copyright, obscenity; regulation of advertising and broadcasting; antitrust law and mass media; legal problems reporting courts, legislatures; taxation, licensing.",2012
50007,REVIEWING THE ARTS ,JMC,Special approval and graduate standing.,,"Reviewing and criticism of performing, visual and literary arts. Emphasis on books, film, TV and theater.",2012
50012,ONLINE JOURNALISM ,JMC,JMC 50002 and graduate standing.,,"Study and evaluation of online news and news sites; reporting and writing for online news media; design, production and maintenance of an online news site; ethical, legal and economic issues related to online news.",2012
50013,TELEVISION SPORTS PRODUCTION ,JMC,journalism and mass communication (JMC) major and graduate standing.,,A comprehensive study of the production of live action television sports coverage.,2012
50015,MEDIA MANAGEMENT ,JMC,Graduate standing.,,"A study of administrative problems, methods, procedures in the management of media corporations.",2012
50016,LAW FOR ADVERTISING AND PUBLIC RELATIONS ,JMC,Special approval and graduate standing.,,Regulation of advertising and public relations; first amendment; libel and privacy; legal problems of new media; research in persuasive media.,2012
50020,AUDIO AND STILL PHOTO PRODUCTION ,JMC,journalism and mass communication (JMC) major and graduate standing.,,Develop skills in telling journalistic stories by producing multimedia news stories through research and planning; reporting using digital cameras and digital audio recorders; editing photos and audio.,2012
50023,NON-TRADITIONAL JOURNALISM ,JMC,journalism and mass communication (JMC) major and graduate standing.,,The study of journalistic writing that goes beyond the inverted pyramid and traditional feature story and has topics traditionally not defined as news. Students will also work as part of a team on multi-part stories.,2012
50027,MANAGING MEDIA DIVERSITY ,JMC,graduate standing.,,Aspects of diversity and how it changes our environment with emphasis on the field of mass communication.,2012
50030,COLLABORATIVE ONLINE PRODUCING ,JMC,journalism and mass communication (JMC) major and graduate standing.,,"The use of multimedia and interactive storytelling rolls such as video, audio and graphics. students work in teams to produce packages for online news sites and organizational videos.",2012
50035,TELEVISION GRAPHICS ,JMC,graduate standing.,,"Basic design, theory and technique in creating and preparing TV and Video graphics.",2012
50036,NON-LINEAR VIDEO EDITING ,JMC,journalism and mass communication (JMC) major and graduate standing.,,Introduction to planning and creating short computer video programs integrating multi-layered digital effects and transitions for application by end users in a variety of current video file formats.,2012
50037,SCRIPTWRITING FOR VIDEO AND FILM ,JMC,Special approval and graduate standing.,,The emphasis of the course is on writing dramatic scripts for broadcast or motion pictures. The course also includes current perspectives on market needs.,2012
50091,BUSINESS MEDIA SEMINAR ,JMC,graduate standing.,,Study of specialized business media and preparation of portfolio appropriate for these companies. Projects will be aligned with student's graduate concentration.,2012
50193,VARIABLE TITLE WORKSHOP IN JOURNALISM AND MASS COMMUNICATION,JMC,Special approval and graduate standing.,,"(Repeatable for credit)Intensive study of professional issues and problems in various areas of mass communication, utilizing the expertise of faculty and professionals in the field.",2012
53035,ADVANCED TELEVISION NEW PRODUCING ,JMC,graduate standing and special approval.,,Advanced understanding of how to produce news content for broadcast and the web.,2012
53036,RECORD PROMOTION ,JMC,journalism and mass communication (JMC) major and graduate standing.,,"Class operates as an independent record label to critique, select, promote, publicize and seal original recorded music.",2012
53042,VIDEO STUDIO PRODUCTION ,JMC,Special approval and graduate standing.,,"Study of producing and direction of various types of television studio programs. 2 hours lecture, 2 hours lab.",2012
54045,PROMOTIONS FOR ELECTRONIC MEDIA ,JMC,journalism and mass communication (JMC) major and graduate standing.,,Fundamental and latest trends in broadcast and cable promotion.,2012
54050,AUDIO FOR VIDEO ,JMC,journalism and mass communication (JMC) major and graduate standing.,,"Understanding of the sonic aspects of visual productions including video studio, video field and online applications.",2012
55001,LIGHTING FOR VIDEO PRODUCTION ,JMC,journalism and mass communication (JMC) major and graduate standing.,,"Introduction to theory and technique of lighting for video production. Includes critical analysis of video lighting situations, the various tools available to light various production locations including interviews and multi-camera narrative scenes.",2012
55005,HISTORICAL DOCUMENTARY PRODUCTION ,JMC,graduate standing.,,Chronicles the evolution of the historical television documentary and demonstrates the step-by-step production process required to create such a program. Students research and assemble a documentary with an overall appreciation of this genre's purpose in both the television industry and the popular culture.,2012
55010,DIGITAL FILM PREPRODUCTION ,JMC,journalism and mass communication major; and graduate standing.,,"Gives students practical, hands-on experience in the preproduction of a feature length digital film. Students work on script revising, budgeting, location scouting, casting, developing a script breakdown, and developing a daily production schedule for the film. Graduate students are expected to take a leadership position in the preproduction of the film.",2012
55013,DIGITAL FILM POST PRODUCTION ,JMC,journalism and mass communication (JMC) major; and graduate standing.,,"Advanced Video editing course designed to offer students the experience in the postproduction and finishing of a feature length digital narrative film. The students will refine their technical and aesthetic skills through a combination of practice, reading, presenting, viewing and discussion. Students are assigned specific scenes that they are to complete from string out and assembly cut to fine cut and picture lock. Students work on sound effects, visual effects, titles or color correction. In addition, graduate students assume a leadership position.",2012
55020,AVID EDITOR CERTIFICATION ,JMC,graduate standing.,,Prepares students to take the official Avid Media Composer MC 101 certification exam. Students who pass the exam will be certified as Avid video editors.,2012
55051,REPORTING BROADCAST NEWS ,JMC,JMC 50002 and graduate standing.,,"Gathering and preparing broadcast news, with emphasis on unique style and presentation methods of broadcast media. Use of both audio and video recorders and editing equipment.",2012
56000,NEWSPAPER DESIGN ,JMC,JMC 50003 and graduate standing.,,Design of newspapers from small inside pages to elaborate feature pages. News judgment. Basic information graphics and photo editing.,2012
56001,INFORMATION GRAPHICS ,JMC,Special approval and graduate standing.,,"Introduction to shapes, color, type and combinations of these for computer-designed news graphics: maps, charts, graphs and diagrams.",2012
56003,PRODUCING TELEVISION NEWS ,JMC,JMC 55051 and journalism and mass communication (JMC) major and graduate standing.,,"Knowledge of the theory and practice of producing content for TV news and public affairs programs. Emphasis is placed on understanding news philosophies, storytelling story selection and rundown placement.",2012
56006,EDITORIAL WRITING ,JMC,JMC 50002 and graduate standing.,,Structure and purpose of editorial and column writing; study of editorial page practice in writing editorials.,2012
56009,REPORTING PUBLIC AFFAIRS ,JMC,JMC 50002 and graduate standing.,,"Instruction and practice in reporting all areas of public affairs, including government and the courts. Use of precision journalism techniques.",2012
56016,MAGAZINE PUBLISHING ,JMC,Special approval and graduate standing.,,"Overview of magazine publishing-editorial, advertising, circulation and production. Analysis of magazines.",2012
56018,FEATURE WRITING ,JMC,JMC 50002 and graduate standing.,,"Researching, writing and placement of feature stories in publications.",2012
56020,MAGAZINE DESIGN ,JMC,JMC 50002 and JMC 50003 and JMC 56016 and graduate standing.,,Marriage of words and visuals for designing magazine layouts and covers in desktop publishing.,2012
56021,MAGAZINE WRITING AND EDITING ,JMC,JMC 50002 and JMC 50003 and graduate standing.,,"Research, interviewing, writing and marketing of major magazine articles. Also editing techniques for magazines.",2012
56052,ADVANCED BROADCAST NEWS PRACTICES ,JMC,JMC 55051 or JMC 56054 and graduate standing.,,"Study of investigative news stories, newsroom operations editing and producing broadcast news programs. Advanced projects in broadcast news.",2012
56054,BROADCAST DOCUMENTARY ,JMC,JMC 55051.,,"Development of the documentary form for radio/TV; analysis, production of radio/ TV documentary; utilization of audio/video recording/editing.",2012
56056,CYBERMEDIA PRODUCTION ,JMC,journalism and mass communication (JMC) major; and graduate standing.,,"Prepares journalism students to work on media delivered online or by tablet. Deals with multimedia news, magazines, information design and photojournalism.",2012
56057,MOTION GRAPHICS FOR VIDEO EDITING ,JMC,journalism and mass communication (JMC) major; and graduate standing.,,Covers the creation of motion graphics for video editing from the perspective of a professional editor. Students learn basic video effects such as digital matte creation and layered graphics for video productions. Students also gain a basic understanding of how to covert and compress video files for various deliverable formats. Adobe After Effects is the industry standard software application for creating motion graphics and will be used extensively in this course.,2012
56091,NEW YORK MEDIA SEMINAR ,JMC,graduate standing in the College of Communication and Information.,,"Introduction of students to the New York media, the thinking of industry professionals and the job opportunities in the city. Students will attend presentations by media professionals and seminars to discuss media based in New York City.",2012
57003,TEACHING HIGH SCHOOL JOURNALISM ,JMC,Graduate standing and special approval.,,Methods and materials for teaching journalism in high school.,2012
57004,DESKTOP PUBLISHING FOR HIGH SCHOOL JOURNALISM TEACHERS ,JMC,graduate standing.,,Basics of InDesign desktop publishing program as it relates to high school newspapers and magazines.,2012
58001,MEDIA RELATIONS AND PUBLICITY ,JMC,Special approval and graduate standing.,,"Planning and preparation of materials for use by news media, Both on paper and Online. Analysis of media relations function and media relations strategies. Uses and limitations of mass media in public relations practice.",2012
58002,PUBLIC RELATIONS TACTICS ,JMC,Graduate standing.,,"Planning and preparation of face-to-face public relations tactics, including spokesperson training for on- and off- camera appearances, special event planning, speeches and presentations with visual support and other applications of ""writing for the ear.""",2012
58003,PUBLIC RELATIONS: ONLINE TACTICS ,JMC,Special approval and graduate standing.,,Explore fundamentals of web site planning and design and provide hands-on skills development using the full range of cyber media techniques. Includes emphasis on writing for online audiences.,2012
58006,PUBLIC RELATIONS PUBLICATIONS ,JMC,Special approval and graduate standing.,,"Planning, writing and design of organizational publications including newsletters, brochures, fliers and promotional materials.",2012
59021,CORPORATE VIDEO ,JMC,Special approval and graduate standing.,,"The use of video in the legal, medical and corporate environments. Emphasis is placed on the structure and function of the medium within each environment.",2012
