60022,ACUTE CARE THERAPEUTICS ,NURS,NURS 60441 and graduate standing.,,"Emphasizes clinical understanding, evidenced based selection, monitoring and use of selected pharmacologic agents, parental nutritional products, and hematological gents used in acute care, critical care, emergency and sub-acute patient populations. Management of fluid and electrolyte disorders, basic toxicology and hospital and community acquired infection related therapies.",2012
60023,ADULT CLINICAL NURSE SPECIALIST II ,NURS,NURS 60000 and 60045 and graduate standing.,,"Further develops the clinical nurse specialist (CNS) role with an emphasis on nursing and organizational spheres. Students use system-level thinking to identify and address nursing practice and organizational problems across the continuum of adult health settings. Essential core content includes research and scientific innovations, nurse sensitive outcomes, change theory, collaborative practice, technology and cost effectiveness. Focus is on developing solutions to problems identified in nursing and organizational spheres. Comprised of 2 didactic content hours per week and a clinical practicum of 14 hours per week.",2012
60030,HELATH PROMOTIONS ACROSS THE LIFESPAN FOR FAMILY PRACTICE ,NURS,graduate standing.,,This lecture course will augment both the lecture course and Advanced Assessment Across the Lifespan and Advanced Physical and Health Assessment Laboratory for Family Practice. Focus on the anticipatory guidance and health promotional activities which are age and developmentally appropriate across the lifespan.,2012
60035,ADULT CLINICAL NURSE SPECIALIST III ,NURS,NURS 60000 and 60023 and graduate standing.,,"Provides the clinical nurse specialist student the opportunity to apply previously acquired knowledge in advanced nursing practice in the patient, and nurse spheres with special emphasis on the organizational sphere in their clinical focus area. Focus is on role transition, clinical expertise, application and synthesis. Comprised of 2 didactic content hours per week and a clinical practicum of 14 hours per week.",2012
60036,WOMEN'S HEALTH NURSE PRACTITIONER CLINICAL PRACTICUM ,NURS,NURS 60081 and graduate standing.,,Emphasis will be placed on refinement of women's health nurse practitioner skills and expansion of knowledge base related to women's health in selected areas of concentration.,2012
60037,PEDIATRIC NURSE PRACTITIONER CLINICAL PRACTICUM ,NURS,graduate standing.,,"Clinical focus is on advanced nursing practice in the primary care of children. Students improve on physical assessment skills diagnostic reasoning and critical thinking through practice. ""IP"" grade permissible.",2012
60041,ADVANCED ASSESSMENT OF ADULT CLIENTS ,NURS,graduate standing.,,"Assessment, reasoning and decision making skills for the advanced practice nurse to formulate comprehensive health data bases and therapeutic regimens for adult clients. Only students admitted to the Adult NP, Family NP, Geriatric NP, Adult CNS, Women's Health NP and Acute Care NP concentrations or post-master's certificate programs may register for this course.",2012
60042,ADULT PRIMARY HEALTH CARE I ,NURS,NURS 60041 and NURS 60045 and NURS 60206 and graduate standing.,,Advanced primary health care for the nurse practitioner student caring for adult clients with common acute and chronic disorders. Emphasis on nursing and health care management within a multidisciplinary context.,2012
60043,ADULT PRIMARY HEALTH CARE II ,NURS,NURS 60041 and NURS 60205 and NURS 60206 and NURS 60441. Graduate standing.,,Advanced primary health care for the nurse practitioner student caring for adult clients with complex acute and chronic disorders. Emphasis on nursing and health care management in a multidisciplinary context.,2012
60045,PATHOPHYSIOLOGY FOR ADVANCED PRACTICE NURSES ,NURS,graduate standing.,,"Provides graduate nursing students with a theoretic foundation of human physiology and the phenomena that produce alterations or pathology in human physiologic function; and an understanding of the basis of disease processes. Assumes students have basic understanding of human biology comparable to BSCI 20020, Structure and Function and BSCI 30030, Human Physiology content.",2012
60050,PHARMACOLOGY FOR WOMEN'S HEALTH NURSE PRACTITIONERS ,NURS,NURS 60441 and 60080 and graduate standing.,,Web-based course focuses on pharmacology related specifically to women throughout their lifespan. Prepares Advanced Nurse Practitioners to meet the pharmacological healthcare needs of women in primary healthcare settings.,2012
60051,NEUROBILOGY AND PSYCHOPHARMACOLOGY OF MAJOR PSYCHIATRIC DISORDERS ACROSS THE LIFESPAN ,NURS,Graduate standing; and Psychiatric Mental Health Nursing Family Nurse Practitioner [PMNF] concentration.,,Focuses on the neurobiology of severe and persistent psychiatric disorders across the lifespan. Addresses fundamental principles underlying psychopharmacology related to these disorders.,2012
60072,WOMEN'S HEALTH NURSE PRACTITIONER CAPSTONE ,NURS,NURS 60085 and graduate standing.,,Focus is on synthesizing women's health nurse practitioner knowledge and skills to provide expert care to a selected population of women's health clients.,2012
60073,WOMEN'S HEALTH CLINICAL NURSE SPECIALIST CAPSTONE ,NURS,NURS 60031 and NURS 60032 and NURS 60033 and NURS 60431. Graduate standing.,,Focus on synthesizing women's health clinical nurse specialist knowledge and skills to provide expert care to a selected population of women's health clients.,2012
60074,PEDIATRIC NURSE PRACTITIONER CAPSTONE ,NURS,graduate standing.,,Focus on synthesizing pediatric nurse practitioner knowledge and skills to provide expert care to a selected population of pediatric clients.,2012
60075,PEDIATRIC CLINICAL NURSE SPECIALIST CAPSTONE ,NURS,NURS 60031 and NURS 60032 and NURS 60033. Graduate standing.,,Focus on synthesizing clinical nurse specialist knowledge and skills to provide expert care to a selected population of pediatric clients. .,2012
60080,HEALTH CARE OF THE WELL WOMAN ,NURS,Graduate standing and NURS 60101.,,"Development of foundational basis for competent clinical practice of women within a healthcare setting. Clinical assessment skills are emphasized and the student is expected to concentrate efforts in attainment of and safe execution of skills pertinent to the care of the well woman. Course also focuses on the study of selected theories and models used by professional nurses when working with adolescent and adult women. Emphasis is placed on fertility control and is provided through individually planned experiences with faculty who are serving as primary care providers in family planning and gynecology care settings. Course will also emphasize the coordination of care needed within the clinical setting through the diagnostic, planning and evaluation components pertinent to clinical practice. Only students admitted to the Women's Health NP concentration or post-master's certificate program may register for this course.",2012
60081,HEALTH CARE OF THE REPRODUCTIVE AGE WOMAN ,NURS,Graduate standing and NURS 60041 and 60080.,,"Application of nursing theory, practice and research by advanced practice nurses in the promotion of health and wellness of women during the reproductive years. The emphasis is on normal pregnancy focusing on prevention and health promotion as well as the management of deviation from normal. Clinical assessment skills, including diagnosis, nursing intervention, treatment and evaluation are emphasized; students are expected to concentrate efforts in attaining and safely executing skills pertinent to caring for women during their reproductive years.",2012
60082,GERIATRIC PRIMARY CARE I ,NURS,NURS 60041 and NURS 60206 and BSCI 60446; and graduate standing.,,Major clinical course that develops the cognitive and perceptual skills needed to provide primary health care services to older adults in ambulatory care settings.,2012
60083,GERIATRIC PRIMARY CARE II ,NURS,NURS 60082 and NURS 60192 and graduate standing.,,Focus on chronic and acute health problems common in geriatric patients. Develops the cognitive and perceptual skills needed to provide primary health care services to older adults in ambulatory and community care settings.,2012
60085,PRIMARY HEALTH CARE OF WOMEN ,NURS,Graduate standing and NURS 60081.,,"Further development of a foundations basis for competent clinical practice within a healthcare setting. Introduces the student to the practice of primary health care of women including premenopausal and menopausal women. Included are principles of growth and development, health promotion, disease prevention and management of common acute and chronic health problems. Emphasis is placed on the biological, psychological and social cultural aspects of care. Pathophysiology assessment and diagnostic techniques specific to the acute and common problems are stressed. Nursing strategies related to health problems used to enhance, maintain and restore health are emphasized. Also emphasized are the coordination of care needed within the clinical setting, collaboration and use of community resources..",2012
60092,NURSE PRACTITIONER SUMMER PRACTICUM,NURS,NURS 60041 and 60042 and graduate standing.,,"(Repeatable for credit)Course provides an individualized, goal directed primary care clinical practicum and addresses professional issues of nurse practitioners. In addition, students will participate in the care of diverse culture population through the migrant farmer camp.",2012
60101,THEORETICAL BASIS FOR NURSING PRACTICE I ,NURS,Graduate standing in nursing.,,This course will be used to study concepts and theories common to all specialty areas of nursing. It provides a firm basis for advanced clinical nursing practice. Progress in theory development for nursing practice is addressed.,2012
60110,ADULT GERONTOLOGY CLINICAL NURSE SPECIALIST I ,NURS,"graduate standing; and Adult Gerontology Clinical Nurse Specialist [AGCN] concentration; and NURS 60007, NURS 60008 and NURS 60045 with a minimum ""B"" (3.000) grade.",NURS 60441 and 61192.,"Introduction to the clinical nurse specialist (CNS) role with adult gerontological patients experiencing common health and illness conditions. Identification and management of symptoms, functional problems and risk behaviors are addressed. The focus of the course is on the evidence base for advanced nursing practice in health promotion and illness care to achieve clinical outcomes in selected patient conditions.",2012
60120,PRIMARY CARE I: ADULTS ACROSS THE LIFESPAN ,NURS,graduate standing; and NURS 60007 and NURS 60011.,NURS 61292.,"Introduction to the Advanced Practice Registered Nurse (APRN) role with adult patients across the lifespan. Identification and examination of evidence-based primary health care problems, needs, and interventions. The course will focus on biological and behavioral parameters at primary, secondary and tertiary levels of prevention.",2012
60125,ADVANCED PRACTICE REGISTERED NURSE ROLE ,NURS,graduate standing; and NURS 60120 and NURS 61292 with a minimum B (3.000) grade.,NURS 61892.,"This course continues to develop competencies of the Advanced Practice Registered Nurse including Requirements for practice, and prescribing. Quality of health care delivery across the lifespan through Advanced Practice Registered Nurse is examined.",2012
60130,ADULT GERONOTLOGY ACUTE CARE NURSE PRACTITIONER ROLE ,NURS,"graduate standing; and NURS 60045, NURS 60120, NURS 60441 and NURS 61292 with a minimum ""B"" (3.000) grade.",NURS 61392.,"This course introduces the acute care nurse practitioner student to the role of inpatient medical management, utilizing evidence based practice, working with the multidisciplinary team members. The student will also have an experience caring for the underserved in the hospital and or community setting. Additionally, the student will participate in an on-hands simulation workshop, demonstrating common inpatient procedures. The student will also be introduced to the role of the nurse practitioner, the professional responsibilities and stewardship.",2012
60140,WOMEN'S HELATH CARE NURSE PRACTITIONER I ,NURS,NURS 60007 and NURS 60045; and Women's Health Care Nurse Practitioner [WHNP] concentration or the Women's Health Nurse Practitioner [C807] certificate; and graduate standing.,NURS 61492.,"Development of foundational basis for competent clinical practice of women within a health care setting is the basis for this course. Emphasis is placed on the menstrual cycle, fertility control, and normal and abnormal gynecological conditions. Course also emphasizes the coordination of care needed within the clinical setting through the diagnostic, planning and evolutional components pertinent to clinical practice. Only students admitted to the Women's Health NP concentration or post-master's certificate program may register for this course.",2012
60151,PSYCHIATRIC MENTAL HEALTH ADVANCED PRACTICE NURSE I: INDIVIDUAL PSYCHOTHERAPY ACROSS THE LIFESPAN ,NURS,NURS 60011 and NURS 60012; and graduate standing.,NURS 61592.,"Study of theoretical approaches to advanced psychiatric mental health nursing practice with individuals who are experiencing identified mental health problems. Basic elements related to individual psychotherapy, as well as various theoretical approaches to individual psychotherapy are examined.",2012
60160,PRIMARY CARE PEDIATRICS ,NURS,"graduate standing; and Advanced Practice Registered Nurse: Nurse Practitioner Family [APNF] concentration; and NURS 60007, 60013 and NURS 60030 with a minimum ""B"" (3.000) grade.",NURS 61692.,Addresses the care of pediatric patients in a primary care setting. Focus will be on the acute illnesses and management of age and developmentally appropriate anticipatory guidance for infants and children.,2012
60170,PEDIATRIC ASSESSMENT FOR ADVANCED PRACTICE NURSE ,NURS,NURS 60101 and NURS 60045; and graduate standing; and Pediatric Clinical Nurse Specialist [PCNS] or Pediatric Nurse Practitioner [PNPR] concentration.,NURS 61792 and NURS 60007.,"Initial Pediatric Assessment course emphasizes primary care of the infants, children and teens with a holistic approach to well child development, health promotion, illness prevention, and management of developmental challenges with a family centered approach.",2012
60192,PRACTICUM: ADULT-GERIATRIC NURSE PRACTITIONER,NURS,NURS 60082 and graduate standing.,,"(Repeatable for credit)Provides individualized, goal directed clinical practicum in geriatric primary care. Addresses professional issues of geriatric nurse practitioners. Additionally, students participate in comprehensive geriatric assessment setting.",2012
60199,THESIS I ,NURS,NURS 60401 or NURS 60001 or NURS 60021; and special approval; and graduate standing.,,"Thesis students must register for a total of 6 credit hours, 2 to 6 hours in a single semester distributed over several semesters if desired.",2012
60201,THEORIES FOR ADVANCED PSYCHIATRIC MENTAL HEALTH NURSING ,NURS,Nursing (NURS) major and graduate standing.,,Major theories of historical importance to psychiatric nursing are studied. Significant relationships between various theories are examined and related to psychiatric nursing practice. Only students admitted to the Psychiatric Mental Health NP or CNS concentrations or post-master's certificate programs may register.,2012
60204,HEALTH CARE ISSUES OF AGING: NURSING CONCEPTS ,NURS,Graduate standing.,,"This course focuses on the theory and research related to bio physiological, psychosocial, cultural, ethical developmental, environmental and policy factors related to aging and health. It is intended that students will gain a basic understanding of the multiple factors related to the functional health patterns among an older adult population and that this knowledge can be applied by professionals in research and practice with aging adults in a variety of health care settings. This course is open to graduate students in any discipline and is recommended for students in the Nursing of the Adult graduate program.",2012
60205,INTRODUCTION TO APPLIED EPIDEMIOLOGY ,NURS,Graduate standing.,,"Seminar on basic epidemiology principles, concepts and procedures for disease surveillance and investigation.",2012
60206,AMBULATORY DIAGNOSTICS FOR ADVANCED NURSING PRACTICE ,NURS,,NURS 60041 and graduate standing.,"Experience for the nurse practitioner student in selection, safe use and interpretation of basic laboratory testing, screening and examinations for client management in primary care. Pre/corequisite: NURS 60041 and graduate standing.",2012
60208,"THEORY FOR ADVANCED PSYCHIATRIC MENTAL HEALTH NURSING, CHILD AND ADOLESCENT FOCUS ",NURS,Nursing (NURS) major and graduate standing.,,"Major theories of historical importance to psychiatric nursing are studied. Significant relationships between various theories are examined and related to psychiatric nursing practice with children, adolescents and their families. Only students admitted to the Psychiatric Mental Health NP or CNS concentrations or post-master's certificate programs may register for this course.",2012
60210,ADULT GERONTOLOGY CLINICAL NURSE SPCIALIST II ,NURS,"graduate standing; and NURS 60110 and 61192 with a minimum ""B"" (3.000) grade.",NURS 62192.,"Develop competencies of the clinical nurse specialist (CNS) role with adult gerontological patients experiencing common health and illness conditions including identification and management of symptoms, functional problems and risk behaviors. Patient outcomes and quality related to health care organization factors and environments of care are examined.",2012
60220,PRIMARY CARE II: CHRONICALLY ILL ADULTS ACROSS THE LIFESPAN ,NURS,graduate standing; and NURS 60125 and NURS 61892 with a minimum B (3.000) grade.,NURS 62292.,Focus of this course is to establish a knowledge base of appropriate collaboration and consultation within a multidisciplinary approach to maximize the effectiveness of health care systems and community services in the health care of adults across the lifespan.,2012
60230,ADULT GERONTOLOGY ACUTE CARE NURSE PRACTITIONER I ,NURS,"graduate standing; and NURS 60130 and NURS 61392 with a minimum ""B"" (3.000) grade.",NURS 62392.,"The student will apply techniques for critical care evaluation and treatment for the adult gerontology patient, specifically, in the acute care setting. The student will be instructed about pharmacotherapeutic and non-pharmacotherapeutic treatment for acute, acute on chronic and chronic illness. This will be accomplished via classroom lecture, case studies and simulation case studies.",2012
60240,WOMEN'S HELATH CARE NURSE PRACTITIONER II ,NURS,"NURS 60140 and 61492 with a minimum ""B"" (3.000) grade; and graduate standing.",NURS 62492.,"The primary purpose of Women’s Health Care Nurse Practitioner II is the application of evidence- based practice and research by advanced practice nurses in the promotion of health and wellness of women during the reproductive years. The emphasis is on normal pregnancy focusing on prevention and health promotion as well as the management of deviations from normal. Clinical assessment skills, including diagnosis, nursing intervention, treatment, and evaluation, will be emphasized and the student is expected to concentrate efforts in attainment and safe execution of skills pertinent to the women during the reproductive years.",2012
60251,PSYCHIATRIC MENTAL HEALTH APN ADULT II: FAMILY AND GROUP PSYCHOTHERAPY ACROSS THE LIFESPAN ,NURS,"NURS 60151 and NURS 61592 with a minimum ""B"" (3.000) grade; and graduate standing.",NURS 62592.,Study of theoretical approaches to advanced psychiatric mental health nursing practice with individuals who are experiencing identified mental health problems. Basic elements related to family and group psychotherapy are examined.,2012
60270,PEDIATRIC NURSE PRACITIONER I ,NURS,"graduate standing; and NURS 60007, and NURS 60170 and NURS 61792 with minimum B (3.000) grade.",NURS 62792.,"Emphasizes the development of competent advanced practice nursing skills and comprehensive knowledge of acute physical and psychosocial illnesses in children including diagnoses, management and evaluation in primary care.",2012
60272,PEDIATRIC CLINICAL NURSE SPECIALIST I ,NURS,"graduate standing; and Pediatric Clinical Nurse Specialist [PCNS] concentration; and NURS 60007, 60170 and NURS 61792 with a minimum B (3.000) grade.",NURS 62992.,Focuses on the complex physical and psychological needs of hospitalized acutely ill children and their families. Analysis and synthesis of holistic assessment serve as conceptual framework for advanced practice nursing interventions.,2012
60292,PRACTICUM: ADULT-GERIATRIC PRIMARY CARE NURSE,NURS,NURS 60041 and NURS 60082 and NURS 60083 and NURS 60192; and graduate standing.,,"(Repeatable for credit) Individually planned practicum in the final semester in which students test the effectiveness of various strategies inherent within the role of advanced practice nurse practitioner, and to demonstrate leadership through role implementation under the guidance of an experienced preceptor.",2012
60299,THESIS II ,NURS,NURS 60199 and graduate standing.,,Thesis students must continue registration each semester until all degree Requirements are met.,2012
60303,GERONTOLOGICAL CNS I ,NURS,,NURS 60101 and 60041 and 60045 and 60204; and graduate standing.,"Introduces students to the Clinical Nurse Specialist (CNS) role in a specialty area with an emphasis on the patient sphere. Students have the opportunity to apply and evaluate theory and research in advanced assessment, pathophysiological processes, evidence-based interventions for disease management, and principles of teaching and coaching across the continuum of gerontological healthcare settings. The focus of the course is on acquiring advanced knowledge in patient diagnosis, management and treatment in care of the older adult. Emphasis is on identification and management of symptoms, functional problems, social, psychological, legal, economic issues facing the older adult and risk behaviors commonly encountered in practice. Students select benchmarks and apply clinical measurement strategies in identifying achievement of clinical outcomes. Course comprises three didactic contact hours and seven clinical hours per week. Pre/Corequisites: NURS 60101 and 60041 and 60045 and 60204; and graduate standing.",2012
60304,GERONTOLOGY CLINICAL NURSE SPECIALIST II ,NURS,NURS 60303 and graduate standing.,,"Provides the Clinical Nurse Specialist student the opportunity to apply previously acquired knowledge in advanced gerontological nursing practice in the patient and nurse spheres with special emphasis on the organizational sphere. The focus of the course is on role transition, clinical expertise, application and synthesis. Course comprises two didactic content hours and 14 clinical hours per week.",2012
60305,GERONTOLOGICAL CLINICAL NURSE SPECIALIST III ,NURS,NURS 60304 and graduate standing.,,"Provides the clinical nurse specialist student the opportunity to apply previously acquired knowledge in advanced gerontological nursing practice in the patient and nurse spheres with special emphasis on the organizational sphere. The focus of the course is on role transition, clinical expertise, application and synthesis. Course comprises two didactic content hours and 14 clinical hours per week.",2012
60310,ADULT GERONTOLOGY CLINICAL NURSE SPECIALIST III ,NURS,"NURS 60210 and NURS 62192 with a minimum ""B"" (3.000) grade.",NURS 63192.,"The focus is on the Clinical Nurse Specialist role in promoting patient outcomes within the organizational context. Clinical Nurse Specialist leadership competencies in consultation, mentoring, coaching, role modeling and education with the interdisciplinary health care team are developed. Strategies for maximizing system resources through financial principles and program development and evaluation are applied.",2012
60314,INTERNSHIP IN HEALTH CARE MANAGEMENT ,NURS,NURS 65092 and BAD 64271 and BAD 6404 and graduate standing.,,"Provides an opportunity for students to gain practical experience and be exposed to processes of strategy creation, policy development, decision-making and patient care with the health care industry.",2012
60315,BUDGETARY AND FISCAL MANAGEMENT FOR NURSES ,NURS,graduate standing.,,Examines management of fiscal resources in nursing service settings.,2012
60320,COMPREHENSIVE PRIMARY CARE III: ADULTS ACROSS THE LIFESPAN ,NURS,graduate standing; and NURS 60220 and 62292 with a minimum B (3.000) grade.,NURS 63692.,"Synthesizes an understanding of the transition to the professional role of the primary care Advanced Practice Registered Nurse. Integration of practice, theory, leadership and evidence-based research will all be applied to primary care.",2012
60325,PRIMARY CARE: FAMILY HELATH AND CHRONIC ILLNESS ACROSS THE LIFESPAN ,NURS,,NURS 63292.,"The content of this course is organized around common health issues, needs and problems of women and children. Additional focus will be given to the health promotion and disease detection as related to pediatric primary care, preconception, pregnancy, and post-partum patients. Major concepts underlying the content and practice are anticipatory guidance, health maintenance, risk detection and surveillance, primary, secondary and tertiary prevention, coordination and continuity of care, recognition and assessment of issues, needs, and problems, and comprehensive management. The student is guided in the planning and provision of family health care services within a framework which takes into consideration the behavioral and physical development of the individual woman and child; the interaction and relationship of her family or significant others, her community settings and resources. Perquisites: graduate standing; and NURS 60220 and 62292 with a minimum ""B"" (3.000) grade. Corequisite: NURS 63292.",2012
