Course Number,Course Name,Department,Prerequisites,Corequesites,Description
SPED 23000 ,"INTRODUCTION TO EXCEPTIONALITIES
",SPED,None.,None,"Introduction to student exceptionalities, service delivery/placement options and multidisciplinary team process.
 Focus on identification of characteristics definition and identification procedures of students with
 exceptionalities. 15 clinical hours."
SPED 40093 ,"WORKSHOP IN SPECIAL EDUCATION
",SPED,None.,None,"(Repeatable for credit)Topics of special interest to students desiring to intensify their knowledge in particular
 areas. Presenters include Kent State University faculty and other institutions. Offered irregularly."
SPED 43010 ,"FAMILY AND PROFESSIONAL COLLABORATION
",SPED,"SPED 23000 and admissionto advanced study.
",None,"This course provides knowledge and strategies for working with family members of exceptional individuals and
 members of related professions which provide services to them. Use of collaborative, interdisciplinary and
 interagency models in special education. 20 clinical and 10 field hours."
SPED 43020 ,"ASSESSMENT IN SPECIAL EDUCATION
",SPED,Prerequisite: CI 47501 and 47504. ,"SPED 43992 or 43392 or44092 or 44192.
","Use/interpretation normed, criterion-referenced and informal curriculum-based assessments for students with
 mild/moderate disabilities. Standards-based alternative assessments for student with intensive needs. 10 field
 and 20 clinical hours."
SPED 43021 ,"ASSESSMENT FOR INDIVIDUALS WITH MODERATE TO INTENSIVE NEEDS
",SPED,SPED 23000.,None,"(Cross-listed with SPED 53021) Investigates issues and methods for assessing the academic, behavioral,
 physiological, mental health, and life skills of individuals with moderate to intensive disabilities. Interpretation
 of norm- and criterion formal assessments, creation of alternative assessments, modification of informal
 assessments, ecological and community-based assessments specific to individuals with low incidence and
 multiple disabilities."
SPED 43030 ,"APPLIED BEHAVIOR ANALYSIS I: THEORY AND TECHNIQUES
",SPED,SPED 23000 and admission to advanced study.,None,"Theory and techniques associated with applied behavior analysis. Approaches for establishing, implementing,
2015 Kent State University Catalog - Spring 2016 Course Descriptions
maintaining and monitoring skill development are emphasized. Procedures for assessing and modifying
 classroom environments/instructional techniques to enhance learning/behavior of individuals with disabilities,
 with specific emphasis on preventing, increasing positive and decreasing inappropriate
behavior are introduced.
 25 field hours."
SPED 43031 ,"APPLIED BEHAVIOR ANALYSIS II: APPLICATION
",SPED,"SPED43030 and admission to advanced study.
",None,"Equips students with the skills necessary to integrate the technology of
applied behavior analysis (as learned in
 SPED 43030, Applied Behavior Analysis I) with the analytical skills necessary to prevent, teach, manage and
 assess behavior. Specific behavioral interventions are presented. Includes 40 field hours."
SPED 43040 ,"LANGUAGE AND READING IN SPECIAL EDUCATION
",SPED,"Admission to advanced study and ECED 40105 and 40126; and CI47504.
",None,"Instructional approaches to teaching reading/language arts to students with disabilities. Emphasis on adapting
 instructional techniques, materials, assessments to meet the needs of learners with disabilities. Contains 15
 clinical and 15 field hours."
SPED 43050 ,"CHARACTERISTICS OF STUDENTS WITH MILD/MODERATE INTERVENTION NEEDS
",SPED,SPED 23000.,None,"Definitions, causes and characteristics and social and educational implications of learning developmental and
 emotional/behavioral disorders of students identified with mild/moderate disabilities. Methods of assessment
 and interventions current issues. 10 clinical and 10 field hours."
SPED 43051 ,"CHARACTERISTICS OF STUDENTS WITH MODERATE/INTENSIVE INTERVENTION NEEDS
",SPED,SPED 23000.,None,"2015 Kent State University Catalog - Spring 2016 Course Descriptions
Overview of specific facets and causes of severe disabilities, physical/psychological aspects, family societal
 responses political trends etiology and medical implications educational and vocational programming
 assessment and treatment planning assistive technology. 10 clinical 10 field hours."
SPED 43060 ,"CURRICULUM METHODS IN SPECIAL EDUCATION
",SPED,admission to advanced study.,None,"Curriculum development, programming, delivery for students with mild, moderate or intensive disabilities.
 Emphasis on application of state standards to IEP development. Adapting instructional techniques, materials,
 assessment to meet needs. 33 field/clinical hours."
SPED 43062 ,"CURRICULUM METHODS MILD/MODERATE INTERVENTION
",SPED,"SPED 43060 andadmission to advanced study.
",None,"Delivery and adaptation of evidence-based practices for students with mild/moderate disabilities. Emphasis on
 achievement in general curriculum. Training to mentor other professionals."
SPED 43063 ,"CURRICULUM METHODS MODERATE/INTENSIVE INTERVENTION
",SPED,SPED 43060 and admission to advanced study.,None,"(Cross-listed with SPED 53063) Delivery and adaptation of evidence based
practices for students with moderate
 to intensive educational needs. An
emphasis is placed on instruction of functional academic and life skills within
 naturalistic contexts."
SPED 43070 ,"PLANNING AND PROGRAMMING FOR TRANSITIONS
",SPED,SPED 43050 or SPED 43051 and admission to advanced study.,None,"This course addresses lifespan community participation and the planning,
support development and services
 available to accomplish it. Introduction to community agencies and adult services. 10 clinical and 15 field hours."
SPED 43080 ,"ASSISTIVE TECHNOLOGY FOR STUDENTS WITH DISABILITIES
",SPED,SPED 43050 or SPED 43051 and admission to advanced study.,None,"Examines application of high and low technology assistive devices for students with intensive intervention
 needs. Analysis of technology needs; selection/development of technology; training/evaluation of technology
 use by students. 20 clinical hours."
SPED 43092 ,"DEAF RESIDENTIAL SCHOOL FIELD EXPERIENCE
",SPED,"ASL 49309 or SPED 43309;and admission to advanced study;
and pre/",None,"(Repeatable for credit) Week-long practicum at a residential school for the deaf; 24-hour interaction with deaf
 students and adults. Students stay on campus. Conduct, interaction, sign language skills, maturity,
responsibility and performance are evaluated by staff at the school."
SPED 43100 ,"SURVEY OF THE INTERPRETING PROFESSION
",SPED,ASL19202. ,SPED 43106. Pre/Corequisite: ASL 29201.,"(Cross-listed with SPED 53100) Introduction to the field of ASL-English interpreting. The following will be
 discussed: the history of the interpreting profession; the varied roles and responsibilities of interpreters; issues
 & concerns facing interpreters; legal mandates & constraints governing the provision of interpreters; ethical
guidelines and their application to educational environments. Since interpreters are expected to be fluent in
 both English and ASL, this course will strive to enhance students' facility with both languages."
SPED 43102 ,"INTERPRETING PROCESSES I
",SPED,ASL 29202; and SPED 43100; and SPED 43107; and admission to advancedstudy. ,ASL 39201; and SPED 43105.,"(Cross-listed with SPED 53102) Beginning level interpreting course that examines the models of interpreting
 and their application to practice. Consecutive and simultaneous interpreting strategies are used to develop
2015 Kent State University Catalog - Spring 2016 Course Descriptions
processing skills for both English to ASL and ASL to English interpretations. Samples of narrative genre are the
 texts used for interpretations as students examine the linguistic and cultural differences between ASL and
 English narratives."
SPED 43103 ,"INTERPRETING PROCESSES II
",SPED,ASL39201; and SPED 43102 and SPED 43105; and SPED 43111; and admission to advancedstudy. ,"ASL 39202; andSPED 43110.
","(Cross-listed with SPED 53103) Intermediate level interpreting course that challenges students to interpret the
 more complex genres including expository, procedural, and argumentative texts. Students will study and
apply
 contextualization strategies. Discourse that is common to both the adult deaf community and educational
 settings will be interpreted and transliterated. Students will be assigned to a thirty-hour practicum
placement."
SPED 43104 ,"INTERPRETING PROCESS III
",SPED,"ASL 39202; and SPED 43103; and SPED 43110 and admission toadvanced
 study. ",ASL 49108.,"(Cross-listed with SPED 53104) Advanced level interpreting course focused on enhancing students’ English to
 ASL and ASL to English skills in a variety of settings. Complex texts are selected from a variety of disciplines
 from both community and educational settings. Students build on previously developed self-assessment skills to
 create detailed and analytical diagnostic charts of their interpreted work. Students will be assigned to a 30-hour
 practicum placement."
SPED 43105 ,"TRANSLITERATING
",SPED,ASL 29202; and SPED43107; and admission to advanced study. ,ASL 39201; and SPED 43102.,"(Cross-listed with SPED 53105) Receptive and expressive use of English-based sign language systems; ASL root
 words, prefix/ suffix use,
simultaneous speaking and signing. Explanation and demonstration of Cued speech;
 exploration of the research related to individuals who use Cued speech."
SPED 43106 ,"SCHOOL SETTING INTERPRETING
",SPED,ASL 19202; and ASL/English Interpretingconcentration (ASEI) within the Special Education (SPED) major. Pre/,None,"(Cross-listed with SPED 53106) Issues, challenges, roles, responsibilities, and ethics of classroom-based
 educational interpreting
are explored. Students are exposed to the variety of classroom designs where
 interpreters work such us mainstreaming, inclusion, resource room,
and self-contained classrooms. K-12
 settings place additional expectations for interpreter participation including IEP meetings, counseling, school
 assemblies and performing arts presentations."
SPED 43107 ,"COMMUNITY SETTING INTERPRETING
",SPED,ASL 29201; and SPED 43100; and SPED 43106; and enrolled in the ASL/EnglishInterpreting (ASEI) concentration within the Special Education (SPED) major. ,ASL 29202.,"(Cross-listed with SPED 53107) This course explores the various venues that interpreters can work in the
 community. Emphasis will be given to the development of specialized vocabulary. Students participate in mock
interpreting situations common to community interpreting in order to identify ethical dilemmas, demands, and
 controls."
SPED 43110 ,"DISCOURSE ANALYSIS FOR INTERPRETERS
",SPED,ASL 39201; and SPED 43100; and SPED 43102; andSPED 43106; and SPED 43107. ,SPED 43103.,"(Cross-listed with SPED 53110) This course will explore the field of discourse analysis and its relation to the
 work of an interpreter. Students will complete the course with an understanding of terminology specific to
 discourse analysis, a better understanding of one’s own discourse style, and a better idea of how English and
 ASL use various discourse features. These features include the following: Turn-taking, Conversational Repair-
 false starts, Discourse Markers, Constructing Dialogue & Action, Cohesion, Rhythm, Rhyme, & Repetition."
SPED 43111 ,"THE PROFESSIONAL INTERPRETER
",SPED,"ASL 29202; and SPED 43100; and SPED 43107; andadmission to advanced study.
",None,"(Cross-listed with SPED 53111) Covers current trends in the field regarding situational and ethical issues.
 Demand-control schema and the RID Code of Professional Conduct are key components of the students'
investigation and application. Students receive guidance in preparing for the RID NIC and participate in
 practicing for the RID performance test."
SPED 43112 ,"INTERACTIVE INTERPRETING
",SPED,"ASL 29202; and SPED 43100; and SPED 43103; and SPED 43110with a grade of C (2.000) or
 better.
",None,"(Cross-listed with SPED 53112) Guides students through a process of examining the complex nature of
 interpreting interactive discourse. Discussions will focus on managing this multi-layered process when
participants' roles, assumptions, and goals can be congruent or adversarial. Student will learn to navigate
 contrasting cultural, linguistic, and discourse expectations. This course will present numerous interactive
 scenarios for students to interpret typical of a variety of settings with different participant configurations."
SPED 43113 ,"ASL TO ENGLISH INTERPRETING PROCESSES
",SPED,ASL 29202 and SPED 43100.,None,"(Cross-listed with SPED 53113) Guides students in developing interpreting skills from their L2 (ASL) to their L1
 (English). Students will learn strategies for increasing their ASL and English vocabularies for the purposes of
 understanding equivalents when applying English vocabulary to ASL signs. Students will examine their ability to
 apply this proficiency to various registers of ASL. Course will also emphasize
incorporating Academic English
 into written scholarly papers to increase students' abilities to apply this to their interpretations."
SPED 43192 ,"ADVANCED PRACTICUM: ASL ENGLISH INTERPRETING
",SPED,"ASL 29202; and SPED 43100; and admission to advancedstudy.
",None,"(Repeatable for maximum of 9 credit hours) Field-based practicum experience provides pre-service educational
 interpreters with opportunity to participate with currently practicing master educational interpreters. Students
 placed in education and-or community settings. University supervisor and teacher mentor observe and assess
 student skill. Students are required to complete Bureau of Criminal Investigation and Identification (BCII) and
 Federal Bureau of Investigation (FBI) background checks and submit the results to authorized personnel at their
 assigned school-agency before the first day of the semester in which student teaching internship will take place.
 Official valid certification of Child Safety Training, approved Basic Life Support and A.L.I.C.E. Training must be
 presented to the campus office of clinical experience or designated faculty-staff at Regional campuses as
 prerequisite for student teaching."""
SPED 43309 ,"INTRODUCTION TO DEAF STUDIES
",SPED,None.,None,"(Cross-listed with ASL 49309 and SPED 53309) Introductory survey course provides informational base and
 understanding of experiences of deaf people as a cultural minority. Includes etiology and prevalence data,
service delivery systems, diagnosis and assessment of issues and communication systems. 20 field hours."
SPED 43310 ,"LANGUAGE DEVELOPMENT FOR DEAF AND HARD-OF-HEARING STUDENTS
",SPED,"SPED 43309; and ASL 19202; and admissionto advanced study.
",None,"(Cross-listed with SPED 53310) Reviews research, theories and theorists
in the field of language development
 for hearing and deaf children; develops awareness of language differences commonly demonstrated by deaf
and
 hard-of hearing children; demonstrates ways to assess linguistic differences and facilitate instruction. Six topic
 areas include theories
of language development (review), language and cognition, normal language acquisition
 in signed and spoken languages, child-caregiver interaction, language learning in a bilingual setting and
 language assessment. Students gain foundational understanding of language development and awareness of
 classroom applications for this knowledge. Includes 20 hours of field-lab experience. Deaf Education majors
 must achieve a minimum grade of B (3.000) in SPED 43309 before registering for this course."
SPED 43311 ,"INSTRUCTION OF DEAF/HARD-OF-HEARING STUDENTS WITH SPECIAL NEEDS
",SPED,"SPED43313 with a minimum grade of B (3.000); and
 admission to advanced study. ",2 credit hours of SPED 43392.,"IEP and transition planning strategies and program content for deaf/hard-of-hearing students w/ADHD, BD, DD,
 VI, DB, LD, CMI, TBI, chronically health impaired/medically fragile, gifted.Curriculum and lesson development
 and adaptation for impacted areas."
SPED 43313 ,"LITERACY ASSESSMENT AND INTERVENTION FOR DEAF/HARD-OF-HEARING STUDENTS
",SPED,"SPED 43310 with a minimumgrade of B (3.000);and CI 47504 or ECED 40126; and admission to advanced study; and
pre/",2 credit hours of SPED 43392. Pre/Corequisite: ASL 29202.,"(Cross-listed with SPED 53313) Theoretical overview of integrated linguistics curriculum and reading theories.
2015 Kent State University Catalog - Spring 2016 Course Descriptions
Strategies to address DHH difficulties and barriers, instructional planning and materials design, and ongoing
 assessment strategies. Course includes a practicum placement."
SPED 43324 ,"CURRICULUM METHODS AND MATERIALS FOR DEAF/HARD-OF-HEARING STUDENTS
",SPED,SPED 43313 with a minimum grade of B (3.000); CI 47501 and 47502; and admission toadvanced study. ,2 credit hours of SPED 43392.,"Designed to provide students with basic knowledge and skills needed to effectively design and implement
 instruction for deaf and hard-of-hearing students. Conducted through a combination of lectures, discussions,
 demonstrations and group activities. Upon successful completion, students posses foundational understanding
 of how to design and implement lessons and curriculum with students who are deaf and hard
of hearing."
SPED 43392 ,"PRACTICUM:DEAF EDUCATION
",SPED,none.,None,"(Repeatable for a maximum of 3 credit hours) This classroom and field-based experience is designed to provide
 students pre-service deaf education teachers with the opportunity to develop professional-level skills in working
 with deaf and hard-of-hearing (DHH) students. The field component will provide experience in working with
 DHH students with diverse needs, disabilities and ethnic-cultural backgrounds. The class will address
 appropriate lesson planning and implementation and meets at least 6 times per semester."
SPED 43529 ,"NATURE AND NEEDS OF GIFTED CHILDREN
",SPED,"PSYC 11762 andsophomore standing and admission to advanced study.
",None,"Personal characteristics, abilities and potentialities of gifted through
review of related research. Evaluation of
 research findings and implications for psycho-educational development."
SPED 43530 ,"INSTRUCTIONAL PROCESSES FOR GIFTED CHILDREN
",SPED,"SPED 43529and
 admission to advanced study.
",None,"Discovery and guidance of mentally superior children. Provision for school attention and accommodations. Case
 studies of gifted children. Selecting appropriate instructional strategies."
SPED 43981 ,"STUDENT TEACHING IN SPECIAL EDUCATION
",SPED,"Admission to advanced study; and Official valid certification of Child Safety Training, approved Basic LifeSupport and A.L.I.C.E. Training must be presented to
the campus office of clinical experience or designated
 faculty/staff at
Regional campuses as prerequisite for student teaching. ",SPED 49525.,"Provides opportunity to demonstrate skills in teaching. Students placed in education-based settings; assume
 total teaching responsibilities of students with exceptionalities for 480 clock hours under the supervision
of the
 school-based mentor teacher and the university supervisor. Students are required to complete Bureau of
 Criminal Investigation and Identification (BCII) and Federal Bureau of Investigation (FBI) background checks
 and submit the results to authorized personnel at their assigned school-agency before the first day of the
 semester in which student teaching internship will take place. Official valid certification of Child Safety Training,
 approved Basic Life Support and A.L.I.C.E. Training must be presented to the campus office of clinical
experience or designated faculty-staff at Regional campuses as prerequisite for student teaching."
SPED 43991 ,"SEMINAR IN SPECIAL EDUCATION
",SPED,"Admission toadvanced study.
",None,(Repeatable for credit)Undergraduate seminar in special education; varied topics.
SPED 43992 ,"FIELD EXPERIENCE IN SPECIAL EDUCATION
",SPED,Admission to advanced study.,None,"Provides opportunity to observe master teachers and begin working with students. Students are placed in
 education-based settings and work with a
team of professionals to understand techniques for providing services
 to students with exceptionalities. Additional seminar meetings."
SPED 43996 ,"INDIVIDUAL INVESTIGATION IN SPECIAL EDUCATION
",SPED,special approval.,None,(Repeatable for credit) (Cross-listed with ASL 49096)
SPED 44092 ,"FIELD EXPERIENCE FOR MILD/MODERATE INTERVENTION SPECIALIST
",SPED,"SPED 43992 and 43060 and admission toadvanced study.
",None,"Field assignments in conjunction with mild-moderate coursework. Evaluates students in personal conduct,
 communication skills, instructional design and methods, and impact on student learning aligned
with CEC
 standards."
SPED 44192 ,"FIELD EXPERIENCE FOR MODERATE/INTENSIVE INTERVENTION SPECIALIST
",SPED,"SPED 43992 and43060 and admission to advanced study.
",None,"(Repeatable for credit) Field assignments in conjunction with moderate-intensive coursework. Evaluates
 students in personal conduct, communication skills, instructional design and methods, and impact on student
 learning aligned with CEC standards."
SPED 44309 ,"AUTISM SPECTRUM DISORDERS: THEORY AND DIAGNOSIS
",SPED,"none.2015 Kent State University Catalog - Spring 2016 Course Descriptions
",None,"(Cross-listed with SPED 64309, SPA 64309 and SPA 74309) Provides an overview of Autism Spectrum Disorders
 (ASD). Examines the history, characteristics, and prevalence of ASD. Assessment and intervention models are
 explored as they relate to various theoretical models for understanding ASD."
SPED 49525 ,"INQUIRY SEMINAR INTO PROFESSIONAL PRACTICE
",SPED,Admission to advanced study. ,SPED 43981.,"Focus on effective, ethical and responsible implication of professional practice. Provides vehicle to articulate and
 demonstrate professional competencies, commitment and ethical decision making for providing services to
 students."
SPED 49625 ,"INQUIRY SEMINAR FOR ASL-ENGLISH INTERPRETERS
",SPED,"ASL 49108; and SPED 43104; and SPED 43111; andadmission into advanced study status. Corerequisite: SPED 43192.
",None,"Final semester course to coincide with the advanced practice. Students present a professional description of
 their interpreting site analyzing students' needs, school and instructor expectations or barriers, application of
 the Demand – Control Schema, and ethical challenges. Current research in the field of interpreting is examined
and a diagnostic chart of a work sample is created. Students explore the
EIPA exam, its theoretical foundations,
 and participate in practicing for the EIPA."
SPED 50093 ,"VARIABLE TITLE WORKSHOP IN SPECIAL EDUCATION
",SPED,Graduate standing.,None,"(Repeatable for credit)Topics of special interest to students desiring to intensify their knowledge in particular
 areas. Presenters include Kent State University and other institution faculty. Offered irregularly."
SPED 53010 ,"FAMILY AND PROFESSIONAL COLLABORATION
",SPED,"SPED 63200 and graduatestanding.
",None,"This course provides knowledge and strategies for working with family members of exceptional individuals and
 members of related professions which provide services to them. Use of collaborative interdisciplinary and
 interagency models in special education. 20 clinical and 10 field hours."
SPED 53020 ,"ASSESSMENT IN SPECIAL EDUCATION
",SPED,graduate standing.,None,"Use/interpretation normed, criterion-referenced and informal curriculum-based assessments for students with
 mild/moderate disabilities. Standards-based alternative assessments for student with intensive needs. 10 field
 and 20 clinical hours."
SPED 53021 ,"ASSESSMENT FOR INDIVIDUALS WITH MODERATE TO INTENSIVE NEEDS
",SPED,SPED 63000 and graduate standing.,None,"(Cross-listed with SPED 43021) Investigates issues and methods for assessing the academic, behavioral,
 physiological, mental health, and life skills of individuals with moderate to intensive disabilities. Interpretation
 of norm- and criterion formal assessments, creation of alternative assessments, modification of informal
 assessments, ecological and community-based assessments specific to individuals with low incidence and
 multiple disabilities."
SPED 53030 ,"APPLIED BEHAVIOR ANALYSIS I: THEORY AND TECHNIQUES
",SPED,graduate standing.,None,"Theory and techniques associated with applied behavior analysis. Approaches for establishing, implementing,
 maintaining and monitoring skill development are emphasized. Procedures for assessing and modifying
 classroom environments/instructional techniques to enhance learning/behavior of individuals with disabilities,
 with specific emphasis on preventing, increasing positive and decreasing inappropriate
behavior are introduced.
 25 field hours."
SPED 53031 ,"APPLIED BEHAVIOR ANALYSIS II: APPLICATION
",SPED,"SPED53030 and graduate standing.
2015 Kent State University Catalog - Spring 2016 Course Descriptions
",None,"Equips students with the skills necessary to integrate the technology of applied behavior analysis (as learned in
 SPED 43030, Applied Behavior Analysis I) with the analytical skills necessary to prevent, teach, manage and
 assess behavior. Specific behavioral interventions are presented. Includes 40 field hours."
SPED 53040 ,"LANGUAGE AND READING IN SPECIAL EDUCATION
",SPED,graduate standing.,None,"Instructional approaches to teaching reading/language arts to students with disabilities. Emphasis on adapting
 instructional techniques, materials, assessments to meet the needs of learners with disabilities. Contains 15
 clinical and 15 field hours."
