Course Number,Course Name,Department,Prerequisites,Corequesites,Description
SPED 63954 ,"PRACTICAL APPLICATIONS: TEAMING
",SPED,Graduate standing.,None,"2015 Kent State University Catalog - Spring 2016 Course Descriptions
The purpose of this course is to help students understand and apply the principles of effective collaborative
 teaming as related to their professional roles and responsibilities in a variety of educational settings serving
 young children with disabilities. A range of topics will be addressed throughout the course, including giving and
 receiving feedback, reflective practices, effective meeting, conflict resolution and communication skills,
 developing and providing quality professional development, supervising, coaching, mentoring, working with
para-professionals, itinerant teaching, service coordination, and consulting with general educators."
SPED 63955 ,"TYPICAL AND ATYPICAL DEVELOPMENT IN YOUNG CHILDREN
",SPED,Graduate standing.,None,"Overview of typical and atypical development pathways from birth to grade 3 including: theories of behavior,
 implications of atypical development on play, learning, early childhood development within ecological
 framework."
SPED 63956 ,"FOUNDATIONS IN EARLY CHILDHOOD SERVICES
",SPED,Graduate standing.,None,"(Cross-listed with ECED 60156 and SPED 73956) Overview of issues facing young children within context of
 family/society including: history, early childhood services, theoretical perspectives, implications of childhood
 disabilities, and recommended assessment intervention and evaluation."
SPED 63957 ,"ASSESSMENT AND EVALUATION OF EARLY CHILDHOOD SERVICES
",SPED,Graduate standing.,None,"(Cross-listed with ECED 60157 and SPED 73957) Examines a range of systems for comparing and observing
 early childhood services, practices,
young children and families: types and purposes of assessment procedures
 and instruments, monitoring progress."
SPED 63958 ,"EARLY CHILDHOOD INTERVENTION METHODS
",SPED,Graduate standing.,None,"Specific strategies for working with children birth to eight with intensive needs (e.g.cerebral palsy, spina bifida,
2015 Kent State University Catalog - Spring 2016 Course Descriptions
autism). 30 clinical hours will provide students with the opportunity to practice newly acquired intervention
 strategies, knowledge and skills."
SPED 63959 ,"MEDICAL ASPECTS OF LIFESPAN DISABILITIES
",SPED,graduate standing.,None,"Description of medical issues facing individuals with lifespan disabilities and their families. Examination of
 etiology, co-occuring disabilities and disorders, and treatment options in relation to individuals with Autism
 Spectrum Disorders and other developmental disabilities."
SPED 63991 ,"SEMINAR IN SPECIAL EDUCATION
",SPED,Graduate standing.,None,"(Repeatable for credit)Various topics include: behavior modification, research problems in special education,
 theories in special education, social processes in special education."
SPED 63992 ,"STUDENT TEACHING IN SPECIAL EDUCATION
",SPED,"Graduate standing and special approval; and Official validcertification of Child Safety Training, approved Basic Life Support and A.L.I.C.E. Training must be presented to
 the campus office of clinical experience or designated faculty/staff at Regional campuses as prerequisite for
 student teaching. ",SPED 69525.,"(Repeatable for maximum of 8 credit hours) Provides opportunity to demonstrate skills in teaching. Students
 placed in education-based settings; assume total teaching responsibilities of students with exceptionalities for
 480 clock hours under the supervision of the school-based mentor teacher and the university supervisor.
 Students are required to complete Bureau of Criminal Investigation and Identification
(BCII) and Federal Bureau
 of Investigation (FBI) background checks and submit the results to authorized personnel at their assigned
schoolagency before the first day of the semester in which student teaching internship will take place. Official
 valid certification of Child Safety Training, approved Basic Life Support and A.L.I.C.E. Training must be
 presented to the campus office of clinical experience or designated faculty-staff at Regional campuses as
 prerequisite for student teaching."
SPED 63995 ,"SPECIAL TOPICS IN SPED
",SPED,Graduate standing.,None,(Repeatable for credit)Specialized offerings in response to emerging or selected program needs.
SPED 63996 ,"INDIVIDUAL INVESTIGATION IN SPECIAL EDUCATION
",SPED,graduate standing and special approval.,None,(Repeatable for credit)
SPED 63998 ,"RESEARCH:SPECIAL EDUCATION
",SPED,Graduate standing and special approval.,None,(Repeatable for credit)
SPED 64309 ,"AUTISM SPECTRUM DISORDERS: THEORY AND DIAGNOSIS
",SPED,graduate standing.,None,"(Cross-listed with SPED 44309, SPA 64309 and SPA 74309) Provides an overview of Autism Spectrum Disorders
 (ASD). Examines the history, characteristics, and prevalence of ASD. Assessment and intervention models are
 explored as they relate to various theoretical models for understanding ASD."
SPED 64310 ,"AUTISM SPECTRUM DISORDERS: LIFESPAN INTERVENTIONS
",SPED,"graduatestudy.
",None,"Provides students with a review of the significant aspects related to educational, social, vocational transitions
 for children, adolescents, and young adults with ASD. Students learn skills necessary to evaluate and develop
 programs designed to meet the changing and long term needs of individuals with ASD."
SPED 64892 ,"ADVANCED PRACTICUM
",SPED,graduate standing and special approval.3.000 OR ,None,"(Repeatable for credit) The purpose of this advanced practicum is to integrate the knowledge and skills acquired
 through prior curricula to a
field-based setting assisting individuals with disabilities. Settings may include, but
 are not limited to, general education and special education classrooms as well as therapeutic, residential and
 vocational programs."
SPED 64951 ,"DEVELOPING IFSPS AND IEPS FOR YOUNG CHILDREN
",SPED,graduate standing.,None,"This course is designed to increase students understanding regarding federal and state rules for developing IEPs
 and IFSPs for young children
and their families. Students will learn how to write functional and measurable IEP
 goals, objectives and IFSP outcomes, and to use assessment information directly for identifying, writing, and
 monitoring
IFSP outcomes and IEP goals. This course will also teach how to form partnerships with families
 around developing, implementing and evaluating the IFSP and IEP."
SPED 69525 ,"INQUIRY PROFESSIONAL PRACTICE
",SPED,graduate standing. ,SPED 63992.,"This course is to support students during their student teaching experience in the last semester of the program.
 Planning for instruction
and assessment, instructing and engaging students in various special education
 settings, and assessing learning outcomes are the focus of this course. The course also includes information
 specific to the professional responsibilities in their placements."
SPED 70093 ,"VARIABLE TITLE WORKSHOP IN SPECIAL EDUCATION
",SPED,Doctoral standing.,None,"(Repeatable for credit)Topics of special interest to students desiring to intensify their knowledge in particular
 areas. Presenters include Kent State University and other institution faculty. Offered irregularly."
SPED 70094 ,"COLLEGE TEACHING
",SPED,Doctoral standing.,None,"(Repeatable for credit) (Cross-listed with EPSY 70094 and SPSY 60094 and
SPSY 70094) Discusses major
 aspects of teaching in higher education, including such topics as students, philosophy of teaching, principles of
 adult learning, instructional strategies, students assessment and others."
SPED 73030 ,"PHARMACOLOGICAL INTERVENTIONS IN SPECIAL EDUCATION
",SPED,Doctoral standing.,None,"Introduce mechanisms by which drugs act; identify benefits/side effects;
implications for delivery/intervention;
 monitoring in classroom. Classes of drugs examined; issues examined; delineation of responsibilities and
 prohibitions."
SPED 73533 ,"GIFTED SUBPOPULATIONS
",SPED,Doctoral standing.,None,"The characteristics and needs of intellectually gifted individuals who often are not high academic achievers are
 studied with consideration of the implications for school practices."
SPED 73950 ,"CURRICULUM AND INTERVENTION IN EARLY CHILDHOOD SERVICES
",SPED,Doctoral standing.,None,"Overview and comparison of early childhood service approaches, including
history and issues in delivering
 services, developmentally appropriate practice, environmental arrangement and how to modify curriculum."
SPED 73956 ,"FOUNDATIONS IN EARLY CHILDHOOD SERVICES
",SPED,Doctoral standing.,None,"2015 Kent State University Catalog - Spring 2016 Course Descriptions
(Cross-listed with ECED 60156 and SPED 63956) Overview of issues facing young children within context of
 family/society including: history, early childhood services, theoretical perspectives, implications of childhood
 disabilities, and recommended assessment intervention and evaluation."
SPED 73957 ,"ASSESSMENT AND EVALUATION OF EARLY CHILDHOOD SERVICES
",SPED,Doctoral standing.,None,"(Cross-listed with ECED 60157 and SPED 73957) Examines a range of systems for comparing and observing
 early childhood services, practices,
young children and families: types and purposes of assessment procedures
 and instruments monitoring progress."
SPED 73991 ,"SEMINAR IN SPECIAL EDUCATION
",SPED,Doctoral standing.1.000 OR ,None,"(Repeatable for credit)Various topics include: behavior modification, research problems in special education,
 theories in special education, social processes in special education."
SPED 73995 ,"SPECIAL TOPICS IN SPED
",SPED,Doctoral standing.,None,(Repeatable for credit)Specialized offerings in response to emerging or selected program needs.
SPED 73996 ,"INDIVIDUAL INVESTIGATION IN SPECIAL EDUCATION
",SPED,Doctoral standing and special approval.,None,(Repeatable for credit)
SPED 80001 ,"SPECIAL EDUCATION RESIDENCY
",SPED,doctoral standing.,None,"This course is designed to provide beginning SPED doctoral students skills and knowledge in the following global
 areas: information literacy
and plagiarism, basic APA style writing and building a writing routine.
Additionally,
 the course will prepare students in the following SPED specific areas: effectively synthesizing intervention based
 empirical research, establishing a line of inquiry in the disability related fields, and developing a CV for disability
 related positions in Higher Education. Overall, the course will help students to understand life in academia
 during the doctoral studies in SPED and life after graduation conducting timely SPED research and teaching
 SPED content (e.g., institutional differences for SPED higher education jobs, tenure, work and life balance, time
 management, etc). In-progress (IP) mark permissible."
SPED 80002 ,"ANALYSIS OF THE LITERATURE IN SPECIAL EDUCATION
",SPED,SPED 80001; and doctoral standing.,None,"This course is designed to assist doctoral students in the acquisition, organization, and interpretation of
 information about research in special education. The seminar introduces students to the nature of inquiry and
 the process of generating questions about a broad array of disability-related research topics. Students will gain
 knowledge to analyze critically the outcomes of research in special education. In-progress (IP) mark
 permissible."
SPED 80003 ,"IMPLEMENTATION SCIENCE IN SPECIAL EDUCATION
",SPED,"doctoralstanding.
",None,"This course is designed to provide students an overview of implementation science, and seminal leadership and
 systems change literature. The course will describe current state of the science of implementation, and identify
 strategies that foster the effective transmission and implementation of innovative programs in intervention
focused disability studies special education fields. Students analyze and apply the literature at the teacher,
 family, school building, district, state and federal levels. Students will gain skills and knowledge in
 implementation drivers that have the potential in reducing the research to practice gap, and increasing the
 integration of evidence
based practices. Strategies for developing and mobilizing stakeholders to support the
 process of change will be covered."
SPED 80005 ,"EMPIRICAL INVESTIGATIONS IN SPECIAL EDUCATION
",SPED,"SPED 80002; anddoctoral standing.
",None,"The course is intended to help students solidify their knowledge, skills, and dispositions related to research
 design, research methods, and scholarly writing by applying and expanding them in the context of special
2015 Kent State University Catalog - Spring 2016 Course Descriptions
education research. Students will review and analyze quality indicators for special education research, critique
 select special education research literature, and develop a preliminary research proposal.
 Satisfactory/unsatisfactory (S/U) graded; In-progress (IP) mark permissible."
SPED 80040 ,"RESEARCH GRANT DEVELOPMENT FOR DISABILITY PROGRAMS
",SPED,doctoral standing.,None,"Students develop and write research proposals for grant competitions focusing on disability issues.
 Considerations for types of competitions and funding sources are discussed. Focus of instruction is related to
how to describe the importance of the research proposed, research methods identified, budget, administration
 of grant activities and evaluation of implementation."
SPED 80090 ,"DOCTORAL RESIDENCY SEMINAR
",SPED,Doctoral standing and special approval.,None,"Provides students with the opportunity to synthesize courses, research and practice by focusing on diverse
 issues and topics. Ordinarily, SPED 80090 is taken no earlier than the second year of doctoral studies as a
culminating course in the doctoral sequence."
SPED 80092 ,"PRACTICUM IN COLLEGE TEACHING
",SPED,doctoral standing. Pre/,None,"(Repeatable for credit) This course will provide the student supervised experience in design, delivery, and
 evaluation of a college course in special education. The student will demonstrate skills learned in the pre-
requisite course (SPED 70094) under the supervision of a designated special education faculty member.
 Satisfactory/unsatisfactory (S/U) graded."
SPED 80199 ,"DISSERTATION I
",SPED,Doctoral standing.,None,"(Repeatable for credit)Doctoral dissertation for which registration in at least two semesters is required,first of
 which will be semester in which dissertation work is begun and continuing until the completion of 30 hours.
2015 Kent State University Catalog - Spring 2016 Course Descriptions"
SPED 80299 ,"DISSERTATION II
",SPED,"Doctoralstanding and
 SPED 80199.
",None,"(Repeatable for credit)Continuing registration required of doctoral students who have completed the initial 30
 hours of dissertation and continuing until all degree requirements are met."
SPED 83201 ,"CONTEMPORARY ISSUES IN SPECIAL EDUCATION
",SPED,doctoral standing.,None,"(Slashed with SPED 63201) This course is designed to help doctoral students to develop (a) foundational
 knowledge for understanding important and controversial issues in special education and related disciplines; (b)
 skills in critical analysis and synthesis of research; and, (c) skills in effective oral and written communication
 about historical and contemporary issues in special education."
SPED 83301 ,"SINGLE SUBJECT RESEARCH METHODS
",SPED,doctoral standing.,None,"(Repeatable for credit) Research designs and techniques associated with behavioral observation and a
 description of single subject experimental methodology are presented. The study of this methodology includes
 topics
related to applied behavior analysis, assessment, experimental design and data evaluation. In addition,
 single subject methods are discussed in relations to other research designs. 20 field hours."
SPED 83952 ,"THE LAW AND SPECIAL EDUCATION
",SPED,Doctoral standing.,None,"Selected principles of constitutional, statutory, case and common law affecting handicapped and special
 education students, teachers and administrators are studied."
SPED 83991 ,"SEMINAR IN SPECIAL EDUCATION
",SPED,Doctoral standing.,None,(Repeatable for credit)
SPED 83992 ,"INTERNSHIP IN SPECIAL EDUCATION
",SPED,"Doctoral standing andspecial approval.
",None,"(Repeatable for credit) A college-university doctoral-level supervised teaching experience. The candidates
 participate fully in the course and material development as well as delivery and grading of an undergraduate
or
 masters level course under the direct supervision of a faculty member assigned to teach the class. Candidates
 are expected to partially
participate in the delivery of a third of the course and fully deliver at least a third of
 the course under the observation and supervision of a
faculty member."
SPED 83998 ,"RESEARCH:SPECIAL EDUCATION
",SPED,Doctoral standing and special approval.,None,(Repeatable for credit)
