Course Number,Course Name,Department,Prerequisites,Corequesites,Description
SPED 53050 ,"CHARACTERISTICS OF STUDENTS WITH MILD/MODERATE INTERVENTION NEEDS
",SPED,graduate standing.,None,"Definitions, causes, characteristics; social, educational implications of learning developmental and emotional
 behavioral disorders of students
identified with mild/moderate disabilities. Methods of assessment and
interventions; current issues. 10 clinical and 10 field hours."
SPED 53051 ,"CHARACTERISTICS OF STUDENTS WITH MODERATE/INTENSIVE INTERVENTION NEEDS
",SPED,"graduatestanding.
",None,"Overview of specific facets and causes of severe disabilities, physical/psychological aspects family/societal
 responses, political trends, etiology and medical implications, educational and vocational programming,
 assessment and treatment planning, assistive technology. 10
clinical 10 field hours."
SPED 53060 ,"CURRICULUM METHODS IN SPECIAL EDUCATION
",SPED,graduate standing.,None,"Curriculum development, programming, delivery for students with mild to moderate disabilities. Introduction to
 transition planning. Emphasis on functional curriculum and adapting instructional techniques, materials,
assessment to meet needs. 33 field clinical hours."
SPED 53062 ,"CURRICULUM METHODS MILD/MODERATE INTERVENTION
",SPED,graduate standing.,None,"Delivery and adaptation of evidence-based practices for students with mild/moderate disabilities. Emphasis on
 achievement in general curriculum. Training to mentor other professionals."
SPED 53063 ,"CURRICULUM METHODS MODERATE/INTENSIVE INTERVENTION
",SPED,SPED 53060 and graduate standing.,None,"(Cross-listed with SPED 43063) Delivery and adaptation of evidence based
practices for students with moderate
 to intensive educational needs. An
emphasis is placed on instruction of functional academic and life skills within
 naturalistic contexts."
SPED 53070 ,"PLANNING AND PROGRAMMING FOR TRANSITIONS
",SPED,graduate standing.,None,"This course addresses life-span community participation and the planning, support, development, and services
 available to accomplish it.
Introduction to community agencies and adult services. 10 clinical 15 field hours."
SPED 53080 ,"ASSISTIVE TECHNOLOGY FOR STUDENTS WITH DISABILITIES
",SPED,SPED 53050 or SPED53051and graduate standing.,None,"Examines application of high and low technology assistive devices for students with intensive intervention
 needs. Analysis of technology needs; selection/development of technology; training/evaluation of technology
 use by students. 20 clinical hours."
SPED 53092 ,"DEAF RESIDENTIAL SCHOOL FIELD EXPERIENCE
",SPED,SPED 53309; and graduate standing.Pre/,None,"(Slashed with SPED 43092) Week-long practicum at a residential or post-secondary school for the deaf; 24-
hour per day interaction with deaf students and adults to learn about and participate in activities, resources, and
 programs and interact with staff with expertise in deafness."
SPED 53100 ,"SURVEY OF INTERPRETING PROFESSION
",SPED,ASL19202; and graduate standing. Pre/,ASL 29201. Corequisite: SPED 53106.,"(Cross-listed with SPED 43100) Introduction to the field of ASL-English interpreting. The following will be
 discussed: the history of the interpreting profession; the varied roles-responsibilities of interpreters; issues and
 concerns facing interpreters; legal mandates and constraints governing the provision of interpreters; ethical
guidelines and their application to educational environments. Since interpreters are expected to be fluent in
 both English and ASL, this course will strive to enhance students’ facility with both languages."
SPED 53101 ,"DEAF CULTURE AND COMMUNITY
",SPED,Graduate standing.,None,"(Cross-listed with ASL 49401)Exploration of historical events and figures from deaf community perspective. Life
 experiences of ""typical"" deaf individuals as minority culture representatives interacting with majority culture
 institutions and processes as depicted in narrative storytelling and folklore."
SPED 53102 ,"INTERPRETING PROCESSES I
",SPED,"ASL 29202;and SPED 53100; and SPED 53107; and graduate standing.
 ","ASL39201 and SPED 53105.
","(Cross-listed with SPED 43102) Beginning level interpreting course that examines the models of interpreting
 and their application to practice. Consecutive and simultaneous interpreting strategies are used to develop
 processing skills for both English to ASL and ASL to English interpretations. Samples of narrative genre are the
 texts used for interpretations as students examine the linguistic and cultural differences between ASL and
 English narratives."
SPED 53103 ,"INTERPRETING PROCESSES II
",SPED,"ASL 39201; and SPED 53102; and SPED 53105; andSPED 53107; and SPED 53111 and graduate
 standing. ",ASL 39202 and SPED 53110.,"(Cross-listed with SPED 43103) Intermediate level interpreting course that challenges students to interpret the
 more complex genres including expository, procedural, and argumentative texts. Students will study and
apply
 contextualization strategies. Discourse that is common to both the adult deaf community and educational
 settings will be interpreted and transliterated. Students will be assigned to a thirty-hour practicum
placement."
SPED 53104 ,"INTERPRETING PROCESS III
",SPED,ASL 39202 and SPED 53103; and SPED 53110 and graduate standing.,uisie: ASL 49108.,"(Cross-listed with SPED 43104) Advanced level interpreting course focused on enhancing students’ English to
 ASL and ASL to English skills in a variety of settings. Complex texts are selected from a variety of disciplines
 from both community and educational settings. Students build on previously developed self-assessment skills to
 create detailed and analytical diagnostic charts of their interpreted work. Students will be assigned to a 30-hour
 practicum placement."
SPED 53105 ,"TRANSLITERATING
",SPED,SPED 53100 and ASL 29202 and graduate standing.,ASL 39201 and SPED 53102.,"(Cross-listed with SPED 43105) Students are exposed to the various English-based sign systems that are used
 in the education of deaf students as well as variations of sign communication in the deaf community. Focus is
 placed on developing transliterating skills utilizing conceptually accurate signed English. Students examine the
implications of a diverse sign continuum and the professional expectation of identifying and meeting the
 language preferences of deaf consumers."
SPED 53106 ,"SCHOOL SETTING INTERPRETING
",SPED,"ASL 19201; asl english interpreting (ASEI)2015 Kent State University Catalog - Spring 2016 Course Descriptions
concentration within the special education (SPED) major and graduate standing. Pre/",None,"(Cross-listed with SPED 43106) Issues, challenges, roles, responsibilities, and ethics of classroom-based
 educational interpreting
are explored. Students are exposed to the variety of classroom designs where
 interpreters work such us mainstreaming, inclusion, resource room,
and self-contained classrooms. K-12
 settings place additional expectations for interpreter participation including IEP meetings, counseling, school
 assemblies and performing arts presentations."
SPED 53107 ,"COMMUNITY SETTING INTERPRETING
",SPED,ASL 29201; SPED 53100; and SPED 53106; and admission to the asl english interpreting(ASEI) concentration with the special education (SPED) major and graduate standing. ,ASL 29202.,"(Cross-listed with SPED 43107) This course explores the various venues that interpreters can work in the
 community. Emphasis will be given to the development of specialized vocabulary. Students participate in mock
interpreting situations common to community interpreting on order to identify ethical dilemmas, demands and
 controls."
SPED 53108 ,"AMERICAN SIGN LANGUAGE LINGUISTICS AND USAGE
",SPED,"SPED 4/53100 andSPED 29202 and graduate standing.
",None,"(Cross-listed with ASL 49108) Analytical study of American Sign Language
syntactic, semantic, morphology and
 pragmatics; comparison of spoken languages and ASL using the Stokoe system, impact of educational-setting
 characteristics on linguistic processes."
SPED 53110 ,"DISCOURSE ANALYSIS FOR INTERPRETERS
",SPED,ASL 39201; and SPED 53100 and SPED 53102 and SPED 53106 and SPED 53107. ,SPED 53103.,"(Cross-listed with SPED 43110) This course will explore the field of discourse analysis and its relation to the
 work of an interpreter. Students will complete the course with an understanding of terminology specific to
 discourse analysis, a better understanding of one's own discourse style, and a better idea of how English and
 ASL use various discourse features. These features include the following: Turn-taking, Conversational Repair -
 false starts, Discourse Markers, Constructing Dialogue & Action, Cohesion, Rhythm, Rhyme, and Repetition."
SPED 53111 ,"THE PROFESSIONAL INTERPRETER
",SPED,"ASL 29202; and SPED 53100 andSPED 53107; and graduate standing.
",None,"2015 Kent State University Catalog - Spring 2016 Course Descriptions
Covers current trends in the field regarding situational and ethical issues. Demand-Control Schema and the RID
 Code of Professional Conduct are key components of the students' investigation and application. Students
 receive guidance in preparing for the RID performance test."
SPED 53112 ,"INTERACTIVE INTERPRETING
",SPED,"ASL 29202; and SPED 53100; and SPED 53103; and SPED 53110with a grade of C (2.000) or
 better. ",SPED 53102.,"(Cross-listed with SPED 43112) Guides students through a process of examining the complex nature of
 interpreting interactive discourse. Discussions will focus on managing this multi-layered process when
participants' roles, assumptions, and goals can be congruent or adversarial. Student will learn to navigate
 contrasting cultural, linguistic, and discourse expectations. This course will present numerous interactive
 scenarios for students to interpret typical of a variety of settings with different participant configurations."
SPED 53113 ,"ASL TO ENGLISH INTERPRETING PROCESSES
",SPED,ASL 29202 and SPED 53100; and graduate standing.,None,"(Slashed with SPED 43113) Guides students in developing interpreting skills from their L2 (ASL) to their L1
 (English). Students will learn strategies for increasing their ASL and English vocabularies for the purposes of
 understanding equivalents when applying English vocabulary to ASL signs. Students will examine their ability to
 apply this proficiency to various registers of ASL. Course will also emphasize incorporating Academic English
 into written scholarly apers to increase students' abilities to apply this to their interpretations."
SPED 53192 ,"ADVANCED PRACTICUM: ASL ENGLISH INTERPRETING
",SPED,ASL 29202 and graduate standing.,None,"(Repeatable for a maximum of 9 credit hours) Field-based practicum experience provides pre-service
 educational interpreters with opportunity to participate with currently practicing master educational
interpreters. Students placed in education and-or community settings. University supervisor and teacher mentor
 observe and assess student skill."
SPED 53309 ,"INTRODUCTION TO DEAF STUDIES
",SPED,Graduate standing.,None,"Introductory survey course provides informational base and understanding
of experiences of deaf people as a
 cultural minority. Includes etiology
and prevalence data, service delivery systems, diagnosis and assessment
of
 issues and communication systems. 20 field hours."
SPED 53310 ,"LANGUAGE DEVELOPMENT FOR DEAF AND HARD-OF-HEARING STUDENTS
",SPED,"SPED 53309; and ASL 19202;and graduate standing.
",None,"Reviews research, theories and theorists in the field of language development for hearing and deaf children;
 develops awareness of language differences commonly demonstrated by deaf and hard-of hearing children;
 demonstrates ways to assess linguistic differences and facilitate instruction. Six topic areas include theories of
 language development (review), language and cognition, normal language acquisition in signed and spoken
 languages, child-caregiver interaction,
language learning in a bilingual setting and language assessment.
Students gain foundational understanding of language development and awareness of classroom applications
 for this knowledge. Includes 20 hours of field-lab experience. Deaf Education majors must achieve a minimum
 grade of B (3.000) in SPED 53309 before registering for this course."
SPED 53311 ,"INSTRUCTION OF DEAF/HARD-OF-HEARING STUDENTS WITH SPECIAL NEEDS
",SPED,"SPED53313 with a minimum grade of B (3.000)
 and graduate standing. ",2 credit hours of SPED 63392.,"IEP and transition planning strategies and program content for deaf/hard-of-hearing students with ADHD, BD,
 DD,VI,DB, LD, CMI, TBI, chronically health impaired/medically fragile, gifted. Curriculum and lesson
 development and adaptation for impacted areas."
SPED 53313 ,"LITERACY ASSESSMENT AND INTERVENTION FOR DEAF/HARD-OF-HEARING STUDENTS
",SPED,SPED 53310 with a minimum grade of B (3.000); and CI 67310or CI 57504; and graduate standing. Pre/,None,"Theoretical overview of integrated linguistics curriculum and reading theories. Strategies to address DHH
 difficulties and barriers, instructional planning and materials design, and ongoing assessment strategies.Course
 includes a practicum placement."
SPED 53316 ,"EARLY CHILDHOOD DEAF EDUCATION: FAMILY AND CHILD SERVICE PROVISION
",SPED,"SPED 4/53310; ASL/SPED 29202 or Sign Language Proficiency Inteview (SLPI) at intermediate or above; andgraduate standing.
",None,"Targets the issues and needs of young deaf/hard-of-hearing children and their families. Topics covered relate to
 service provision in the home and classroom for deaf/hard-of-hearing children from birth to 5 years of
age.
 Includes 30 hours of work in a practicum placement with a young D/HH child and his/her family."
SPED 53324 ,"CURRICULUM METHODS AND MATERIALS FOR DEAF/HARD OF HEARING STUDENTS
",SPED,SPED 53313 with a minimumg rade of B (3.000); and CI 57501 and 57502; and graduatestanding. ,2 credit hours of SPED 63392.,"Designed to provide students with basic knowledge and skills needed to effectively design and implement
 instruction for deaf and hard-of-hearing students. Conducted through a combination of lectures, discussions,
 demonstrations and group activities. Upon successful completion, students possess foundational understanding
 of how to design
and implement lessons and curriculum with students who are deaf and hard of hearing."
SPED 53529 ,"NATURE AND NEEDS OF GIFTED CHILDREN
",SPED,"Graduatestanding.
",None,"Personal characteristics, abilities and potentialities of gifted children through review of related research.
 Evaluation of research findings and implications for psychoeducational development."
SPED 53530 ,"INSTRUCTIONAL PROCESSES FOR GIFTED CHILDREN
",SPED,"SPED 53529and graduate
 standing.
",None,"Discovery and guidance of mentally superior children. Provision for school attention and accommodations. Case
 studies of gifted children. Selecting appropriate instructional strategies."
SPED 53534 ,"SOCIAL/EMOTIONAL COMPONENTS OF GIFTEDNESS
",SPED,Graduate standing.,None,"Affective growth of gifted persons is reviewed through research literature and analysis of case studies. Reviews
 adjustment problems of gifted youth and adults."
SPED 54161 ,"TRANSITIONAL PROGRAMMING AND SERVICES FOR DISABLED YOUTH
",SPED,graduate standing.,None,"Transition from school to work and community life; vocational exploration/assessment and
 preparation/placement methods and techniques for secondary and postsecondary disabled youth."
SPED 60199 ,"THESIS I
",SPED,Graduate standing and special approval.,None,"Thesis students must register for a total of 6 hours, 2 to 6 hours in a single semester distributed over several
 semesters if desired."
SPED 60299 ,"THESIS II
",SPED,SPED 60199 and graduate standing.,None,Thesis students must continue registration each semester until all degree requirements are met.
SPED 62951 ,"EARLY INTERVENTION IN NATURAL ENVIRONMENTS
",SPED,graduate standing.,None,"This seminar targets early childhood special education and intervention professionals that comprise the field of
2015 Kent State University Catalog - Spring 2016 Course Descriptions
early intervention from practitioners to future leaders in the field. Recommended practice guidelines of the
 Division for Early Childhood (DEC) indicate that interventions should be embedded and distributed within and
 across the routines, activities and places that are part of the child’s daily
experience. In keeping with DEC
 recommendations, this course will explore issues related to the various natural environments of the children in
 search of the routines, activities, and places that offer the maximum learning and practice opportunities that
 are family centered, developmentally and individually appropriate, culturally sensitive, and least intrusive."
SPED 63030 ,"PHARMACOLOGICAL INTERVENTIONS IN SPECIAL EDUCATION
",SPED,Graduate standing.,None,"Introduce mechanisms by which drugs act; identify benefits/side effects;
implications for delivery/ intervention;
 monitoring in classroom. Classes of drugs examined; issues examined; delineation of responsibilities and
 prohibitions."
SPED 63031 ,"PROGRAM DEVELOPMENT AND ETHICAL APPLICATION OF APPLIED BEHAVIOR
",SPED,SPED 53030 and graduate standing.,None,"ANALYSIS
Describe and apply methodology and research design in monitoring the effectiveness of behavioral interventions
 and to use such information to
evaluate overall program efficacy. Consideration is given to student
characteristics (e.g., underlying disability) when developing and evaluating behavior programs based. Use of
 specific tools for prioritizing behaviors, evaluating progress, and making treatment program decisions are
 presented. Issues related to ethics, treatment implementation fidelity, and behavioral program development are
 also emphasized."
SPED 63032 ,"ADVANCED INTERVENTIONS FOR ADDRESSING SEVERE BEHAVIOR
",SPED,"SPED 53030,SPED 53031, SPED 63031, SPED 63301 and SPED 63033; and graduate
standing.
",None,"Use and interpretation of functional behavioral assessment in educational settings to lead to the identification of
 empirically-supported interventions to address the behavioral needs of children. The development,
 implementation and analysis of functional analysis procedures. Special emphasis given to identifying designing,
implementing and assessing the effectiveness of advanced behavioral interventions in consultation. 20 field
 hours."
SPED 63033 ,"ETHICAL AND PROFESSIONAL CONDUCT IN APPLIED BEHAVIOR ANALYSIS
",SPED,"SPED53030 and SPED 63031; and graduate standing.
",None,"This course provides an intensive focus on ethical and professional conduct as it applies to day-to-day
 implementation of applied behavior analytic strategies by professional behavior analysts. Responsible conduct of
 a behavior analyst, ethical responsibilities to clients, colleagues, the field of applied behavior analysis, and
 society are featured. BACB Guidelines for Responsible Conduct for Behavior Analyst and BACB Disciplinary and
 Ethical Standards are reviewed and studied. This course focuses on meeting the updated standards for ethics
 set forth by the Behavior Analyst Certification Board in the BACB Fourth Edition Task List."
SPED 63092 ,"FIELD EXPERIENCE IN SPECIAL EDUCATION
",SPED,graduate standing.,None,"Provides opportunity to observe master teachers and begin working with students. Students are placed in
 education-based settings and work with a
team of professionals to understand techniques for providing services
 to students with exceptionalities. Additional seminar meetings."
SPED 63101 ,"ADMINISTRATION AND SUPERVISION IN SPECIAL EDUCATION
",SPED,Graduate standing.,None,"Administration of educational programs for exceptional children; improvement of teacher competencies;
 function of special education supervisors; and special education operations at local, state and national levels."
SPED 63200 ,"INTRODUCTION TO EXCEPTIONALITIES
",SPED,Graduate standing.,None,"Introduction to exceptionalities of student development. Focus on foundations/theories associated with
 characteristics and accommodations for human exceptionalities. Collaborative/multidiscipline educational
service design. Fifteen clinical/field hours."
SPED 63201 ,"CONTEMPORARY ISSUES IN SPECIAL EDUCATION
",SPED,graduate standing.,None,"(Slashed with SPED 83201) Surveys current research, literature and policy issues that affect identification,
 assessment and service provision to students with exceptionalities."
SPED 63300 ,"RESEARCH APPLICATIONS IN SPECIAL EDUCATION
",SPED,"graduate standing;and EDPF 65510 or 65511.
",None,"Culminating experience in which students apply their content, methods and research skills to develop a final
 project that addresses an area of
special education. Focuses on techniques for answering research questions,
 developing curriculum, and assimilating knowledge through applied projects."
SPED 63301 ,"SINGLE SUBJECT RESEARCH METHODS
",SPED,graduate standing.,None,"(Repeatable 2 times for credit) Research designs and techniques associated with behavioral observation and a
 description of single subject experimental methodology are presented. The study of this methodology includes
 topics related to applied behavior analysis, assessment, experimental design and data evaluation. In addition,
 single
subject methods are discussed in relations to other research designs. 20 field hours."
SPED 63392 ,"PRACTICUM IN DEAF EDUCATION
",SPED,graduate standing.,None,"(Repeatable for a maximum of 3 credit hours) This classroom and field-based experience is designed to provide
 students pre-service deaf education teachers with the opportunity to develop professional-level skills in working
 with deaf and hard-of-hearing (DHH) students. The field component will provide experience in working with
 DHH students with diverse needs, disabilities and ethnic-cultural backgrounds. The class will address
 appropriate lesson planning and implementation and meets at least 6 times per semester."
SPED 63531 ,"CURRICULUM DEVELOPMENT FOR GIFTED LEARNERS
",SPED,Graduate standing.,None,"Focus on design/development of curriculum for gifted learners; adapt/modify existing curricula; design
 curricular materials through predetermined process assessment of suitability of materials."
SPED 63532 ,"GIFTED PROGRAM DESIGN AND ADMINISTRATION
",SPED,"SPED53529 and SPED 53530 and graduate standing.
",None,"Fundamentals of designing gifted programs are reviewed. Topics include student identification in service
 advocacy program evaluation compliance
with state standards and teacher preparation."
SPED 63533 ,"GIFTED SUBPOPULATIONS
",SPED,Graduate standing.,None,"The characteristics and needs of intellectually gifted individuals who often are not high academic achievers are
 studied with consideration of the implications for school practices."
SPED 63892 ,"EARLY INTERVENTION INTERNSHIP
",SPED,"graduate standing and specialapproval.
",None,"(Repeatable for a maximum of 9 credit hours) The Early Intervention Internship involves supervised observation
 and participation in an early
intervention setting(s) for children ages birth to three with developmental delays
 and disabilities or supervised observation and participation in research and scholarly activities related to the
development, delivery, and evaluation of early intervention services to children and their families. Students may
 be placed at a county board of
developmental disabilities, center-, community-, or home-based early
intervention program, a developmental center, childcare center, a neonatal intensive care unit (NICU) or other
 approved placement. The Early Intervention internship will provide students practical experience
in an Early
 Intervention professional setting, one that allows students
to develop and refine a variety of skills when working
 with infants and
toddlers with disabilities and their families."
SPED 63949 ,"AUTISM SPECTRUM DISORDER CAPSTONE
",SPED,graduate standing.,None,"Knowledge and skills gained through participation in the Autism Spectrum
Disorders (ASD) program are utilized
 to develop a project related to the education of individuals with ASD and-or the individuals who support
them."
SPED 63950 ,"CURRICULUM AND INTERVENTION IN EARLY CHILDHOOD SERVICES
",SPED,Graduate standing.,None,"Overview and comparison of early childhood service approaches including:
history and issues in delivering
 services, developmentally appropriate practice, environmental arrangement and how to modify curriculum."
SPED 63952 ,"FAMILY AND PROFESSIONAL COLLABORATION IN EARLY CHILDHOOD
",SPED,Graduate standing.,None,"(Cross-listed with ECED 60159 and SPED 73952) Examines issues facing families and professionals serving
 young children who are at-risk, disabled and typically developing."
SPED 63953 ,"PRACTICAL APPLICATIONS:BIRTH TO FIVE
",SPED,Graduate standing.,None,"Practical application of recommended practices for young children birth-five. Observation of young children in
 natural environments. Plan and evaluate intervention with families and professionals. Sixty field hours."
