72079,ADVANCED ENGINEERING GEOLOGY,GEOL,GEOL 4 52078 and doctoral standing.,,"(Cross-listed with GEOL 62079) Role of geology in site selection, design and construction relative to dams tunnels highways slope stability and nuclear power plants. Selected case histories. Lecture three hours weekly. Field trip and term paper required.",2013
72082,INTRODUCTION TO SOIL MECHANICS,GEOL,doctoral standing.,,"(Cross-listed with GEOL 62082) Engineering properties and engineering behavior of soils including classification properties, compaction permeability strength and compressibility. Lecture three hours and lab two hours weekly.",2013
72083,ROCK SLOPE STABILITY ,GEOL,doctoral standing.,,"Provide information used to recognize, avoid design for control and correct slope movements in rocks determination of shear strength along rock discontinuities stability analysis of rock slopes.",2013
72084,FOUNDATION ENGINEERING,GEOL,GEOL 42078 or 52078 or 42082 or 52082 or 72082; and doctoral standing.,,(Cross-listed with GEOL 62084) Seepage and drainage of foundation soils. Subsurface investigations. Principles design and construction of shallow and deep foundations. Earth retaining structures. Lecture three hours weekly.,2013
73042,ENVIRONMENTAL GEOCHEMISTRY,GEOL,doctoral standing.,,"(Cross-listed with GEOL 43042 and GEOL 53042) Explores chemical processes that influence the natural environment including anthropogenic impacts. Topics include atmospheric chemistry and air pollution, energy and climate change, toxic organic compounds, water chemistry and water pollution, metals, soils, sediments and waste disposal. Environmental problem solving using steady state and non-steady state box models, thermodynamics and energy transfer, and chemical reactions and equilibria is emphasized. Required half-day field trip.",2013
73044,ENVIRONMENTAL ISOTOPES,GEOL,doctoral standing.,,"(Cross-listed with GEOL 43044 and GEOL 53044) Deals with the fundamentals of isotope geochemistry and the application of primarily light stable isotopes (H, O, C, N) to earth system processes (involving the hydrosphere, biosphere, and upper geosphere) .",2013
73063,SEDIMENTARY PETROLOGY ,GEOL,doctoral standing.,,"Classification, texture composition provenance and diagenesis of sandstones and carbonates following review of optical mineralogy. Petrographic microscopy and other laboratory techniques are emphasized.",2013
73067,CARBONATE ROCKS,GEOL,doctoral standing.,,"(Cross-listed with GEOL 63067) Basic principles of carbonate sedimentology including composition, classification origin and distribution of carbonate sediments their diagenesis and lithification.",2013
74028,PALEOECOLOGY,GEOL,doctoral standing.,,"(Cross-listed with GEOL 64028) Relationships between ancient organisms and their environments, as interpreted from fossils, enclosing rock strata and recent analogs. Field and laboratory studies. Saturday field trips.",2013
74030,SYSTEMATIC INVERTEBRATE PALEONTOLOGY I,GEOL,doctoral standing.,,"(Cross-listed with GEOL 64030) Detailed investigation and examination of important literature concerning taxonomic characters of invertebrate phyla: Protista, Porifera, Cnidaria and Bryozoa. Numerous oral reports, specimen examination.",2013
74032,SYSTEMATIC INVERTEBRATE PALEONTOLOGY II,GEOL,doctoral standing.,,"(Cross-listed with GEOL 64032) Detailed investigation and examination of important literature concerning taxonomic characters of invertebrate phyla: Brachiopoda, Mollusca, Arthropoda and Echinodermata. Numerous oral reports, specimen examination.",2013
74036,CENOZOIC CLIMATE CHANGE,GEOL,Doctoral standing.,,(Cross-listed with GEOL 64036) An overview of the concepts and principles involved in interpreting global and hemispheric Cenozoic climate change (past 65 million years) . Emphasis on particular temporal and spatial scales and cycles. Extensive reading in scientific journals.,2013
74052,GLACIERS AND GLACIATION,GEOL,Doctoral standing.,,"(Cross-listed with GEOG 41052, GEOG 51052 and GEOG 71052) Examination of how glacial ice masses change the shape of the earth's surface, how they are integral to climate and sea level change and how they pose high risk hazards.",2013
74065,SEDIMENTOLOGY,GEOL,Doctoral standing.,,"(Cross-listed with GEOL 64065) Fluid dynamics, grain transport, sedimentary structures, granulometry, bedform and facies sequences and facies architecture. Interpretation of continental and marine clastic depositional environments and processes.",2013
80091,SEMINAR IN APPLIED GEOLOGY,GEOL,Doctoral standing.,,(Repeatable for credit) Specialized topics in applied geology. Precise title to be inserted in schedule of classes.,2013
80095,ADVANCED TOPICS IN GEOLOGY,GEOL,Special approval and doctoral standing.,,(Repeatable for credit) Advanced topics presented by visiting professors or one-time offerings presented by regular faculty.,2013
80098,RESEARCH,GEOL,Doctoral standing.,,(Repeatable for credit) Research for doctoral students. Credits earned may be applied toward degree if department approves.,2013
80199,DISSERTATION I,GEOL,Admission to candidacy for doctoral degree and doctoral standing.,,"(Repeatable for credit) Doctoral dissertation, for which registration in at least two semesters is required first of which will be semester in which dissertation work is begun and continuing until the completion of 30 hours.",2013
80299,DISSERTATION II,GEOL,GEOL 80199 and doctoral standing.,,"(Repeatable for credit) Continuing registration required of doctoral students who have completed the initial 30 hours of dissertation, continuing until all degree requirements are met.",2013
