12001,ELEMENTARY PHOTOGRAPHY I,JMC,,,Introduction to fundamentals and techniques of still and motion picture photography. Terminal course for students who do not have photography requirements.,2013
20001,"MEDIA, POWER AND CULTURE ",JMC,Not open to journalism and mass communication premajors or majors.,,"Fosters critical understanding of mass media in their historical, ideological, economic and cultural contexts. Examines what forces influence media and how media influence consumers.",2013
20003,INTRODUCTION TO MASS COMMUNICATION I,JMC,Journalism and mass communication (JMC) major.,,Introduction to various fields of mass communication with a particular emphasis on evolution of new media technologies. History of technological and cultural change leading to the present media forms and consideration of new media.,2013
20004,MEDIA WRITING I,JMC,,JMC major or minor.,Introduces students to variety of writing skills used in various media professions and demonstrates how writing types vary by audience. Incorporates grammar skills as part of the writing process. Pre/corequisite: JMC major or minor.,2013
20005,FUNDAMENTALS OF MEDIA MESSAGES ,JMC,Communication studies (COMM) major or fashion merchandising (FM) or community health education (CHED) major.,,"Working with messages for print, broadcast, electronic and new media outlets. Course may not be taken for credit nor applied toward any requirements by a journalism and mass communication (JMC) major.",2013
20006,MULTIMEDIA TECHNIQUES I,JMC,JMC major.,,"Introduction to basic elements of multimedia journalistic storytelling, including the creation of audio, video, slideshows and multimedia packages for distribution via the Internet.",2013
20008,AUDIENCE ANALYSIS AND RESEARCH ,JMC,2.750 cumulative GPA; minimum grade of C- (1.700) JMC 20001 or JMC 20003; and minimum grade of C- (1.700) JMC 20004; and a journalism and mass communication (JMC) major or minor.,,"An overview of the principles used to understand, interpret and design audience research. This includes terminology methodologies of syndicated research, audience ratings analysis and psychographic lifestyle data.",2013
21001,PRINCIPLES OF ADVERTISING ,JMC,,,"Advertising history, purposes, techniques, media and research; analysis of functions of advertising organizations.",2013
21005,ADVERTISING MESSAGING I,JMC,2.750 cumulative GPA; minimum grade of C- (1.700) in JMC 20001 or JMC 20003; and minimum grade of C- (1.700) in JMC 20004 and JMC 21001; and advertising (ADV) major or minor.,,"Introduces students to the history and development of 19th- to 21st-century advertising practices, along with a strong emphasis on college level writing skills.",2013
21008,SOCIAL MEDIA STRATEGIES,JMC,,,"(Cross-listed with COMM 21008) Designed to help students understand and use social media in critical and strategic ways that will improve their lives and careers. Helps students harness the power and potential of the social Web, including strategies used to position and market organizations as well as individuals. Exposes students to the latest social-media applications and to critical views of social media's impact on business, society and culture. Students are also introduced to interaction perspectives of social media, which are embedded within both the communication studies and the journalism and mass communication curriculum. Students emerge from the class with a strategic plan designed to enhance their lives and their careers.",2013
22000,PHOTOGRAPHY BASICS ,JMC,"2.750 overall GPA; integrated language arts (INLA) , electronic media (ELMD) or news (NEWS) major.",,Fundamentals of b/w and color photography and digital manipulation software. Introduction of basic themes of journalistic photography including flash photography. Student furnishes 35mm or APS camera with flash. Disposable cameras not acceptable.,2013
22001,PHOTOGRAPHY ,JMC,art education (ARTE) or visual journalism (VJNL) major.,,Basic camera and digital techniques to provide a better understanding of photography as a creative and journalistic skill.,2013
22002,VIDEOGRAPHY BASICS I,JMC,class. Prerequisites: journalism and mass communication (JMC) or integrated language arts (INLA) or visual communication and design (VCD) major.,,Instruction in basic camcorder videographyvideo editing techniques to provide understanding of processes as creativejournalistic skills and as practical application of knowledge acquired in the,2013
22003,VIDEOGRAPHY BASICS II ,JMC,journalism and mass communication (JMC) major or minor. Pre- or,JMC 22002 with a grade of C- (1.700) or better.,Emphasis on video editing for broadcast news and electronic media production applications using computer video editing skills.,2013
22004,VISUAL STORYTELLING ,JMC,2.750 cumulative GPA; JMC 22001 or VCD 28000; and journalism and mass communication (JMC) or visual communication design (VCD) major.,,"Technical and digital skills needed to produce photos that communicate. Course will stress narrative work, detailed caption information and reporting.",2013
23030,BASIC VIDEO PRODUCTION ,JMC,2.750 overall GPA; and minimum grade of C- (1.700) in JMC 20001 or JMC 20003; and minimum grade of C- (1.700) in JMC 20004 and JMC 22002; and journalism and mass communication (JMC) major.,,Theoretical and practical application of program production for video.,2013
23031,BASIC AUDIO PRODUCTION ,JMC,2.750 overall GPA; and a grade of C- (1.700) or better in JMC 20001 or JMC 20003; and a grade of C- (1.700) or better in JMC 20004 and 22002; and journalism and mass communication (JMC) major or minor.,,Theoretical and practical application of program production for audio production.,2013
26001,MULTIMEDIA NEWSWRITING ,JMC,major or minor in journalism and mass communication (JMC) or major in integrated language arts (INLA) . Pre-/or corequisite: JMC 20001 or 20003.,JMC 20001 or 20003.,Theory and practice in writing basic print and electronic news and feature stories.,2013
26005,MULTIMEDIA STORYTELLING ,JMC,"2.750 cumulative GPA; and a grade of C- (1.700) in COMM 21000 and JMC 26001; and journalism (JNL) , news (NEWS) , public relations (PR) or visual journalism (VJNL) major.",,"Multimedia as story telling tools. Developing the multimedia mindset. Using different delivery platforms and understanding deadlines of various media forms. Formatting stories for webmobile delivery. Learning different multimedia formats. Using multimedia in breaking news situations. Creating multimedia features and packages. Stand alone vs. complementary stories. Learning more about capturing and using video, audio and still photos. Ethical and legal issues surrounding online news reporting and presentation.",2013
26007,PRINT BEAT REPORTING ,JMC,2.750 overall GPA; and JMC 26001 and JMC 26005 and COMM 21000 with a grade of C- (1.700) or better; and journalism and mass communication (JMC) major.,,"Gathering and writing news: interviewing techniques, cultivating sources, developing beats, meeting deadlines. Includes campus reporting for Daily Kent Stater.",2013
26008,BROADCAST BEAT REPORTING ,JMC,2.750 overall GPA; and JMC 20006 and 26001 and COMM 21000 with a grade of C- (1.7) or better; and a journalism and mass communication (JMC) major.,,"Writing news, developing sources and beats, meeting deadlines as they relate to electronic media. Includes reporting campus news for daily broadcasts.",2013
28001,PRINCIPLES OF PUBLIC RELATIONS ,JMC,,,"Explores strategic role and function of public relations in business, nonprofit public institutions and society. Covers public relations practice from development to present.",2013
30004,WRITING FOR ELECTRONIC MEDIA ,JMC,2.750 overall GPA; and a grade of C- (1.700) or better in JMC 20004; and journalism and mass communication (JMC) major.,,"A Application of standard writing styles and formats in the electronic media. Writing practice in commercials, continuity, promotions and introductory scriptwriting techniques.",2013
30034,PROGRAMMING FOR ELECTRONIC MEDIA ,JMC,2.750 overall GPA; and a grade of C- (1.700) or better in JMC 20004; and journalism and mass communication (JMC) major.,,"A Background analysis of radio, TV, cable and Internet programming and the relationship to audience needs, interests, expectations and audience measurement procedures.",2013
31002,ADVERTISING COPYWRITING ,JMC,2.750 cumulative GPA; minimum grade of C- (1.700) in JMC 20004 and 21001 and 31011; and a journalism and mass communication (JMC) major.,,Examination and practice in various forms of advertising copywriting and their applications.,2013
31003,ADVERTISING MEDIA PLANNING ,JMC,2.750 cumulative GPA; minimum grade of C- (1.700) in JMC 20004 and 20008 and 21001; and a journalism and mass communication (JMC) major.,,"Analysis, selection and scheduling of advertising media. Examination of advertising research, technique and application.",2013
31011,CREATIVE ADVERTISING STRATEGIES ,JMC,2.750 overall GPA; and a grade of C- (1.700) or better in JMC 20004 and JMC 21001.,,"Ad majors learn problem-solving techniques, which they will apply to business and creative proposals designed to promote products and or services. Development of good, clear writing skills is a key component of the course.",2013
32001,PHOTOJOURNALISM I ,JMC,2.750 overall GPA; and minimum C- (1.700) in JMC 22004 and JMC 22001 and JMC 26001 and VCD 37000; and journalism and mass communication (JMC) major,,"Production of photographs for newspapers, magazines and online news media. A laboratory course emphasizing color and black and white photography.",2013
32002,PHOTOJOURNALISM II,JMC,2.750 overall GPA and JMC 32001 with a grade of C- (1.700) or better and a journalism and mass communication (JMC) major.,,"(Repeatable once for credit) Continuation of JMC 32001. Advanced news and feature photography for newspapers, magazines and online including a collaborative project.",2013
32005,VIDEO FOR STILL PHOTOGRAPHERS ,JMC,JMC major; and 2.750 overall GPA; and minimum grade of C- (1.700) in JMC 22004 and JMC 26001.,,"Teaches video skills for photojournalists, including interviewing, establishing a narrative, editing, and how video is paired with the written story.",2013
33024,PERFORMANCE FOR ELECTRONIC MEDIA ,JMC,2.750 overall GPA and JMC 20003 with a grade of C- (1.700) or better.,,A Development of effective communication techniques in performance situations for electronic media.,2013
33032,AUDIO STUDIO PRODUCTION ,JMC,2.750 overall GPA; and JMC 23031 and JMC 30004 with a grade of C- (1.700) or better; and a journalism and mass communication (JMC) major.,,"Production of in-studio audio programming units, with laboratory unit required as part of course.",2013
33033,AUDIO FIELD PRODUCTION ,JMC,2.750 overall GPA; and JMC 23031 and JMC 30004 with a grade of C- (1.700) or better; and a journalism and mass communication (JMC) major.,,"A study of the theory and craft of audio field production, providing analysis and practice of remote information gathering techniques and music recording.",2013
33036,BASIC MEDIA ENGINEERING I,JMC,2.750 overall GPA; and MATH 11009; and JMC 23030 with a grade of C- (1.700) or better and JMC 23031 with a grade of C- (1.700) or better; and a journalism and mass communication (JMC) major.,,"Introduction to basic electronic media technology and systems, providing knowledge and vocabulary to allow communication with broadcast engineers. Overview of radio/TV operations and legal viewpoint. Prep for SBE operators' cert. Exam.",2013
33042,VIDEO STUDIO PRODUCTION ,JMC,2.750 overall GPA; and JMC 23030 with a grade of C- (1.700) or better; and JMC 30004 with a grade of C- (1.700) or better; and a journalism and mass communication (JMC) major.,,Study of producing and directing various types of video studio programs. Two hours lecture two hours lab.,2013
33043,VIDEO FIELD PRODUCTION ,JMC,2.750 overall GPA; and JMC 22002 and 22003 and 23030 and 30004 all with a grade of C- (1.700) or better; and a journalism and mass communication (JMC) major.,,Producing programs and packages with portable video equipment outside the studio. Editing program material. Two hours lecture three hours lab.,2013
33092,RADIO-TELEVISION OPERATIONS,JMC,2.750 overall GPA; and JMC 20003 with a grade of C- (1.700) or better; and sophomore standing and special approval.,,(Repeatable for a maximum of 3 credit hours) Performance of assigned activities in radio or television under faculty supervision.,2013
34038,MEDIA SALES AND SALES MANAGEMENT ,JMC,2.750 overall GPA; and JMC 30034 or 31003 either with a grade of C- (1.700) or better; and journalism and mass communication (JMC) major.,,Selling techniques in electronic and print media; sales policies procedures rate card structure sales proposals and related promotional aspects.,2013
36005,COPYEDITING I,JMC,2.750 overall GPA; and COMM 21000 and JMC 26001 with a grade of C- (1.700) or better.,,Improving the writing of other journalists and writing headlines. Intensive review of AP style and grammar.,2013
38002,PUBLIC RELATIONS CASE STUDIES ,JMC,2.750 overall GPA; and minimum grade of C- (1.700) or better in JMC 26001 and JMC 28001.,,Explores the process and the practice of public relations through review and analysis of actual case studies. Students also learn pr process by planning and preparing their own case study projects for a real world client organization.,2013
40004,COMPUTER ASSISTED REPORTING ,JMC,2.750 overall GPA; and JMC 26007 or 26008 either with a grade of C- (1.700) or better.,,"Computer analysis of large data sets, focusing on government court police records for preparation of news stories basics of online searching software and databases.",2013
40006,LAW OF MASS COMMUNICATION ,JMC,courses. Prerequisite: 2.75 overall GPA; and journalsim and mass communication (JMC) major and senior standing and special approval needed from department.,,Libel and slander; privacy copyright obscenity regulation of advertising broadcasting and corporate speech access to government legal; problems of new media. See your adviser for major specific,2013
40007,REVIEWING THE ARTS ,JMC,2.750 overall GPA; and a grade of B- (2.700) or better in JMC 20004 or JMC 26001 with a grade of C- (1.700) or better; and junior or senior standing.,,"Reviewing and criticizing of performing, visual and literary arts. Emphasis on books, film, TV and theatre.",2013
40009,COMPARATIVE MEDIA SYSTEMS ,JMC,2.750 overall GPA; and junior or senior standing and special approval.,,"Study of the forms, organization scope and modes of operation of media systems in foreign lands. Also examines agents channels and contents of international communication.",2013
40010,ETHICS AND ISSUES IN MASS COMMUNICATION ,JMC,"2.750 overall GPA; and journalism and mass communication (JMC) ; and senior standing; and at least 18 hours of JMC courses with a C- (1.700) or better, including a grade of C- (2.700) or better in JMC 20004 or 26001.",,"Ethical problems and issues in mass communication within a framework of basic theories, functions and social roles of the mass media.",2013
40011,ETHICAL ISSUES IN INTEGRATED COMMUNICATION ,JMC,JMC 31002 and 31003 or JMC 38002; and advertising (ADV) or public relations (PR) major.,,"Focuses specifically on the ethical and moral issues affecting Advertising and Public Relations professionals. Focuses solely on Integrated Communications. Students will understand and appreciate the complex moral and ethical decisions that professionals make each day, often under intense deadline pressure. They also acquire their basic problem-solving skills to manage these issues in real time.",2013
40012,ONLINE JOURNALISM ,JMC,2.750 overall GPA; and JMC 26007 or 26008 with a grade of C- (1.700) or better.,,Study and evaluation of online news and news sites; reporting and writing for online news media design production and maintenance of an online news site ethical legal and economic issues related to online news.,2013
40013,TELEVISION SPORTS PRODUCTION ,JMC,"2.750 cumulative GPA; and sophomore, junior or senior standing; and journalism and mass communication (JMC) major.",,A comprehensive study of the productio of live action television.,2013
40015,MEDIA MANAGEMENT ,JMC,2.750 overall GPA; and a C- (1.700) or better in JMC 20004 or JMC 26001; and journalism and mass communication (JMC) major and senior standing.,,"Exploring management issues unique to media organizations and the impact of those issues on the organization's structure, economics markets and employees.",2013
40016,LAW OF ADVERTISING AND PUBLIC RELATIONS ,JMC,2.750 overall GPA; and 18 hours of JMC courses all with a grade of C- (1.700) or better; and JMC 31002 or 31003 or 38002 with a grade of C-(1.700) or better; and advertising (ADV) or public relations (PR) majors.,,Regulation of advertising and corporate speec; first amendement libel and privacy legal problems of new media.,2013
40020,AUDIO AND STILL PHOTO PRODUCTION ,JMC,2.750 overall GPA; and minimum grade of C- (1.700) in JMC 22001 and journalism and mass communication (JMC) major and junior or senior standing.,,Develop skills in telling journalistic stories by producing multimedia news stories through research and plannin; reporting using digital cameras and digital audio recorders; editing photos and audio.,2013
40022,FILM AS COMMUNICATION ,JMC,2.750 overall GPA; and JMC 20004 with a grade of B- (2.700) or better or JMC 20005 with a grade of C- (1.700) or better.,,Study of the relationship of television and theatre films to the mass audience in terms of components and effects.,2013
40023,NON-TRADITIONAL JOURNALISM ,JMC,2.750 overall GPA; and minimum grade of C- (1.700) in JMC 26007 and journalism and mass communication (JMC) major and junior or senior standing.,,The study of journalistic writing that goes beyond the inverted pyramid and traditional feature story and has topics traditionally not defined as news. Students will also work as part of a team on multi-part stories.,2013
40027,MANAGING MEDIA DIVERSITY ,JMC,,,Aspects of diversity and how it changes our environment with emphasis on the field of mass communication.,2013
40030,COLLABORATIVE ONLINE PRODUCING ,JMC,2.750overall GPA; and minimum grade of C- (1.700) in JMC 40012 and journalism and mass communication (JMC) major and special approval.,,"The use of multimedia and interactive storytelling tools such as video, audio and graphics. Students work in teams to produce packages for online news sites and organizational videos.",2013
40035,TELEVISION GRAPHICS ,JMC,2.750 overall GPA; and journalism and mass communication (JMC) major and junior or senior standing.,,"Basic design, theory and technique in creating and preparing TV and video graphics.",2013
40036,NON-LINEAR VIDEO EDITING I,JMC,2.750 overall GPA; and journalism and mass communication (JMC) major and junior or senior standing.,,Introduction to planning and creating short computer video programs integrating multi-layered didgital effects and transitions for application by end users in a variety of current video field formats.,2013
40037,SCRIPTWRITING FOR VIDEO AND FILM ,JMC,2.750 overall GPA; and JMC 30004 with a grade of C- (1.700) or better; and journalism and mass communication (JMC) major.,,The emphasis of the course is on writing dramatic scripts for broadcast or motion pictures. The course also includes current perspectives on market needs.,2013
40091,BUSINESS MEDIA SEMINAR ,JMC,JMC 26001 or JMC 20004; and JMC major.,,Study of specialized business media and preparation of portfolio appropriate for these companies. Projects are aligned with student's major.,2013
40092,INTERNSHIP,JMC,2.750 overall GPA and special approval.,,(Repeatable once for credit) Experience in a professional setting under professional supervision in student's field of specialization.,2013
40095,SPECIAL TOPICS IN JMC,JMC,,,(Repeatable for credit) Selected topics of special interest not covered in depth in existing courses; offered as resources permit.,2013
40096,INDIVIDUAL PROJECTS IN MASS COMMUNICATIONS,JMC,2.750 overall GPA; junior or senior standing and special approval.,,(Repeatable for credit) Individual research projects in mass communications. Letter grades and ip permissible.,2013
40099,SENIOR HONORS PROJECT ,JMC,2.75 overall GPA; open only to journalism and mass communication (JMC) majors admitted to the Honors College.,,Thesis or other independent study project in mass communication. Ip grades permissible.,2013
40192,RADIO-TELEVISION INTERNSHIP,JMC,2.750 overall GPA and special approval.,,"(Repeatable once for credit) Experience, under professional supervision in a radio or television station or other industry using electronic audio or video communications.",2013
40193,VARIABLE TITLE WORKSHOP IN JMC,JMC,2.75 overall GPA and special approval.,,(Repeatable for credit) Workshop setting dealing with topics in mass communications.,2013
40196,INDEPENDENT STUDY IN RADIO AND TELEVISION ,JMC,2.750 overall GPA; and junior or senior standing and special approval.,,Research and writing on topics approved by the students' advisers and study directors. Repeatable for a total of 6 hours.,2013
40295,SELECTED TOPICS IN JOURNALISM AND MASS COMMUNICATION,JMC,2.750 overall GPA.,,(Repeatable for credit) Selected topics of special interest not covered in depth in existing courses; offered as resources permit.,2013
41002,ADVANCED ADVERTISING COPYWRITING ,JMC,2.750 overall GPA; and JMC 31002 and 31003 both with a grade of C- (1.700) or better; and special approval.,,Advanced copywriting projects in print advertising and corporate communications and execution of the entire print advertising campaigns.,2013
41003,ADVERTISING ACCOUNT MANAGEMENT ,JMC,2.750 overall GPA and JMC 31002 with a grade of C- (1.700) or better and JMC 31003 with a grade of C- (1.700) or better.,,"An introduction to advertising account management including the functions of an account manager, skills required to be an account manager and how to effectively lead a team of professionals.",2013
41005,ADVERTISING CAMPAIGNS ,JMC,2.750 overall GPA; and JMC 31002 and 31003 both with a grade of C- (1.700) or better; and a journalism and mass communication (JMC) major.,,"Analysis of the planning, financing and execution of an advertising campaign through case study methods.",2013
41081,ADVERTISING PRACTICES ,JMC,2.750 overall GPA; and JMC 31002 and 31003 with a grade of C- (1.700) or better.,,The study of current advertising practices and issues.,2013
41111,FASHION PUBLISHING I,JMC,2.750 overall GPA; and ENTR 27056 or FDM 35280; and journalism and mass communication (JMC) or fashion merchandising (FM) majors.,,"Introduction to 21st Century Fashion publishing. An overview of the evolution of fashion magazines in print and digital formats, magazine entrepreneurs, the editors role, branding, advertising, circulation, writing and production.",2013
42001,SPORTS PHOTOGRAPHY ,JMC,JMC 22001; minimum grade of C- (1.700) in JMC 22004 and 32001; and journalism and mass communication (JMC) major or minor.,,"Photographing various college events, including action, portraiture and lighting in a variety of outdoor and indoor venues. Photo captioning, image transmission and archiving and ethics.",2013
42005,COLOR PHOTOGRAPHY ,JMC,2.750 overall GPA; and JMC 32001 with a grade of C- (1.700) or better; and journalism and mass communication (JMC) major.,,Nature of color transparency and negative films. Student produces transparencies and prints for assignments. Photojournalism majors must have a 35mm camera photo illustration majors must have a 4x5 camera.,2013
42008,ADVANCED PHOTOJOURNALISM ,JMC,2.750 overall GPA; and JMC 26007 and 32002 both with a grade of C- (1.700) or better.,,Discussion of contemporary photojournalists and issues. Production of photo documentary multimedia and illustrations appropriate to photojournalism. Senior portfolio review.,2013
42092,PRACTICUM IN PHOTOGRAPHY,JMC,2.750 overall GPA; and junior or senior standing and special approval.,,(Repeatable for a total of 10 hours) Individual or group investigation into student selected areas of photographic field.,2013
43035,ADVANCED TELEVISION NEWS PRODUCING ,JMC,2.750 overall GPA; and journalism and mass communication (JMC) major and special approval.,,Advanced understanding of how to produce news content for broadcast and the web.,2013
43036,RECORD PROMOTION ,JMC,2.750 overall GPA; and journalism and mass communication (JMC) or communications studies (COMM) major.,,"Class operates as an independent record label to critique, select, promote, publicize and sell original recorded music.",2013
44042,LIVE SPORTS PRODUCTION ,JMC,2.750 overall GPA; and JMC 23030 and 23031 with a grade of C- (1.700) or better; JMC 30004 with a grade of C- (1.700) or better; JMC major.,JMC 44043.,"The study and broadcast of live sporting events, sports news and sports commentary shows. Hands-on production of such sporting events as basketball, wrestling and gymnastics. Live broadcasts in both studio and remote locations.",2013
44043,SPORTS FIELD PRODUCTION ,JMC,2.750 overall GPA and JMC 23030 and 23031 with a grade of C- (1.700) or better; and JMC 30004 with a grade of C- (1.700) or better and JMC major.,JMC 44042.,"Video shooting and editing of sports packages and short documentaries. This includes player and coach profiles, highlights and lead-ins.",2013
44045,PROMOTIONS FOR ELECTRONIC MEDIA ,JMC,2.750 cumulative GPA and journalism and mass communication (JMC) major.,,A Fundamental and latest trends in broadcast and cable promotion.,2013
44050,AUDIO FOR VIDEO ,JMC,2.750 cumulative GPA and journalism and mass communication (JMC) major.,,"Understanding of the sonic aspects of visual productions including video studion, video field and online applications.",2013
