60009,SOCIAL ROLE OF THE MASS MEDIA ,JMC,Journalism and mass communication (JMC) major and graduate standing.,,"A Application of professional, theoretical, historical, economic and political perspectives to examine the role of mass media in society both in terms of structure and function.",2013
60010,QUALITATIVE RESEARCH IN JOURNALISM AND MASS COMMUNICATION: DATA COLLECTION ,JMC,graduate standing.,,Designed to develop skills in qualitative data collection in journalism and mass communication with primary focus on human subjects and textual data.,2013
60015,ADVANCED MEDIA MANAGEMENT ,JMC,JMC 50015 and graduate standing.,,Theory and practice of management operations and problem-solving techniques specifically related to media companies. Emphasis will be using case studies from the media.,2013
60021,ADVANCED MAGAZINE WRITING ,JMC,JMC 56016 and JMC 50005 and graduate standing.,,Course builds on content in JMC 56016 and 50006. Purpose is to refine and hone writing skills for nonfiction magazine stories in print and online.,2013
60040,QUALITATIVE RESEARCH METHODS IN JOURNALISM AND MASS COMMUNICATION: DATA ANALYSIS ,JMC,graduate standing.,,"Emphasizes the development of skills in the analysis of data collected through qualitative research methods, particularly interviews and ethnographies. Designed to help prepare graduate students who plan to use qualitative methods in their academic or applied research, particularly those who are adopting these methods for theses or dissertations.",2013
60096,INDIVIDUAL INVESTIGATION IN MASS COMMUNICATION,JMC,Special approval and graduate standing.,,(Repeatable for a maximum of 6 credit hours) Individual investigation of selected area or problem approved by graduate faculty.,2013
60098,RESEARCH,JMC,Special approval and graduate standing.,,(Repeatable for credit) Research or individual investigation for master's level graduate students. Credits earned may be applied toward meeting degree requirements if school approves. Maximum of 3 hours may be applied to degree if school approves.,2013
60195,SPECIAL TOPICS SEMINAR,JMC,Special approval and graduate standing.,,(Repeatable for credit) Study of important topics in mass communication. Offered irregularly in response to existing interests and opportunities.,2013
60196,READINGS IN MASS COMMUNICATIONS,JMC,Special approval and graduate standing.,,(Repeatable for credit) Student pursues course of readings approved by instructor to cover subject specialty student cannot obtain from formal course offerings.,2013
60199,THESIS I ,JMC,Special approval and graduate standing.,,"Thesis students must register for a total of 6 hours, 2 to 6 hours in single semester distributed over several semesters if desired.",2013
60295,SPECIAL TOPICS IN COMPUTER LAB,JMC,Special approval.,,(Repeatable for credit) Selected topics of special interest not covered in depth in existing courses; offered as resources permit.,2013
60296,ADVANCED READINGS IN JOURNALISM AND MASS COMMUNICATION,JMC,Graduate standing and special approval.,,(Repeatable for credit) Consolidation and synthesis of learning experiences in the graduate program. Application of graduate study to future professional careers. Updates on latest developments in the fields of JMC and their impact on the future of academic study and professional practice in the discipline.,2013
60299,THESIS II ,JMC,JMC 60199 and graduate standing.,,Thesis student must continue registration each semester until all degree requirements are met.,2013
60396,MASTER'S PROFESSIONAL PROJECT ,JMC,Special approval and graduate standing.,,Completion and defense of a substantial professional project in one of the fields of journalism and mass communication.,2013
66010,SPECIALIZED REPORTING ,JMC,JMC 56009 and JMC 55051 and graduate standing.,,"Newsgathering techniques in specialty areas such as politics, labor, medicine, business and technology techniques of team reporting.",2013
66092,INTERNSHIP IN JOURNALISM AND MASS COMMUNICATION,JMC,Special approval and graduate standing.,,(Repeatable for credit) Experience in a department or company involving supervised professional responsibilities in journalism and mass communication. Minimum 150 hours of work for each credit hour.,2013
67076,TEACHING BROADCAST JOURNALISM ,JMC,graduate standing and special approval.,,"Deals with the base knowledge that a teacher needs to begin teaching broadcast journalism. This includes modules on cultivating student broadcast journalism, project-based instruction, as well as one on legalities and ethics along with production skills. While the primary focus is on teaching technique, class participants are given basic journalism content in order to review, learn and or focus on teaching methods for that same material.",2013
67079,TEACHING PHOTO EDITING ,JMC,graduate standing and special approval.,,"Utilization of current photo editing software provides users with powerful tools to acquire, manipulate, and output a variety of images, from fine art to instructional and web graphics. The focus of this course is learning the fundamental operations and controls of industry standard photo editing software and dialogue concerning various issues in teaching and learning photo editing software.",2013
67083,TEACHING NEWS DESIGN ,JMC,graduate standing.,,"Provides an introduction to the components of news content and design. This includes type and typography, printing processes, photography, illustration, the thought process in creating a news product and further introductions in the developing field of visual journalism. Shows journalism educators how a student media staff can effectively communicate with readers through visual elements.",2013
67085,TEACHING PHOTOJOURNALISM ,JMC,graduate standing and special approval.,,"Examines the components of photojournalism and prepares instructors to teach those components to their students. In addition to traditional assignments and projects, instructors and students maintain a weekly dialog. Students gain the following skills necessary to teach their classes: basic operation of a digital camera, essential components of good photography, how to capture images that tell a story, strategies for covering news, features and sporting events as well as portraits and group shots, strategies for organizing and archiving images and ethical practices for capturing images and using them in publication work.",2013
67087,ADVISING YEARBOOK ,JMC,graduate standing and special approval.,,"Students gain contextual information regarding yearbook roles in history and memory along with practical skills for recruitment, staff organization, staffing and production, and incorporating the creation of the yearbook into a classroom setting.",2013
68000,PUBLIC RELATIONS THEORY AND PROCESS I,JMC,Special approval and graduate standing.,,Introduces students to the profession of public relations by exploring both the theories and the processes employed by PR practitioners. Course also explores the history and social role of public relations as well as ethics and social responsibility.,2013
68001,PUBLIC RELATIONS MANAGEMENT ,JMC,JMC 68000 and graduate standing.,,"Perspectives, skills needed to manage an organization's PR function, particularly strategic planning, implementation and evaluation. Emphasis on managerial aspects of negotiating organizational relationships with publics.",2013
68004,SOCIAL MEDIA AND PUBLIC RELATIONS ,JMC,JMC 68000 and JMC 68001; and JMC graduate student.,,"Provides an in-depth study of social media and public relations, emphasizing how the two are used by organizations to build stronger relations with consumers, media, analysts, and others.",2013
68005,STRATEGIC WRITING AND MESSAGING IN PUBLIC RELATIONS ,JMC,JMC 68000 and JMC 68001; and JMC graduate standing,,"Focuses on Public Relations writing and strategic messaging, a critical foundational skill. Course content includes skill building in online channels and across traditional mediums.",2013
68006,VALUES AND ETHICS MANAGEMENT IN PUBLIC RELATIONS ,JMC,JMC 68000 and 68001; and journalism and mass communication (JMC) major; and graduate standing.,,"Explores the theory and application of ethics in public relations. Examines case studies, ethics theory, values and management thought.",2013
68008,PUBLIC RELATIONS MEASUREMENT AND RETURN ON INVESTMENT ,JMC,JMC 68000 and 68001; and journalism and mass communication (JMC) major; and graduate standing.,,Examines the strategic and tactical processes for measuring outcomes in public relations campaigns.,2013
68009,PUBLIC RELATIONS HISTORY AND THE MODERN WORLD ,JMC,JMC 68000 and JMC 68001; and JMC graduate student.,,"Examines development of Public Relations as a profession, focusing on the Twentieth Century. Detailed study of historical case studies, campaigns and initiatives.",2013
68010,PUBLIC RELATIONS INTERNAL COMMUNICATIONS ,JMC,JMC 68000 and JMC 68001; JMC graduate student.,,Explores strategies and tactics of internal communications. Includes development of organizational intranets and other employee-focused communications channels with special emphasis on social media to communicate public relations messages.,2013
68011,FINANCIAL ISSUES IN PUBLIC RELATIONS ,JMC,JMC 68000 and JMC 68001; and JMC graduate student.,,"Focuses on financial topics related to a career in public relations, particularly the role of communicators in the growing field of investor relations.",2013
80001,THEORY OF MASS COMMUNICATION I,JMC,doctoral standing.,,Introduction to theory of mass communication with emphasis on the process and effects of mass communication.,2013
80004,CYBERMEDIA LAW I,JMC,doctoral standing.,,"Investigates how the law affects those who gather information and publish online, including issues relating to blogging, web site hosting, posting and online journalism, along with a basic ability to apply that knowledge in specific situations. Focus is on both existing law and developing public policy.",2013
80010,QUALITATIVE RESEARCH IN JOURNALISM AND MASS COMMUNICATION: DATA COLLECTION ,JMC,doctoral standing.,,Designed to develop skills in qualitative data collection in journalism and mass communication with primary focus on human subjects and textual data.,2013
80040,QUALITATIVE RESEARCH METHODS IN JOURNALISM AND MASS COMMUNICATION: DATA ANALYSIS ,JMC,doctoral standing.,,"Emphasizes the development of skills in the analysis of data collected through qualitative research methods, particularly interviews and ethnographies. Designed to help prepare graduate students who plan to use qualitative methods in their academic or applied research, particularly those who will be adopting these methods for theses or dissertations.",2013
80195,SPECIAL TOPICS IN JOURNALISM AND MASS COMMUNICATION,JMC,doctoral standing and special approval.,,(Repeatable for credit) Study of important topics in Mass Communication. Offered irregularly in response to existing interests and opportunities.,2013
