Course Number,Course Name,Department,Prerequisites,Corequesites,Description
ECET 21005,PARTNERSHIPS IN CHILD GUIDANCE,ECET,ECED 10120 and ECED 20163.,None,"(Equivalent to ECED 30142) The course's foundation is the understanding that children are a part of a family,\n culture and community. Students gain knowledge and skills to implement developmentally appropriate child\n guidance strategies and learn cross-cultural communication skills. Twelve field experience hours required.\n Students are required to complete Bureau of Criminal Investigation and Identification (BCII) and Federal Bureau\n of Investigation (FBI) background checks and submit the results to authorized personnel at their assigned\n school/agency before the first day of the semester in which student teaching/internship will take place."
ECET 21010,INFANT/TODDLER CURRICULUM AND SERVICES,ECET,ECED 10120 and 20163.,None,"Infant/toddler development, environments and curriculum; theoretical perspectives; family involvement;\n community involvement; community resources, collaboration and advocacy; 38 hours of field experience\nrequired. Students are required to complete Bureau of Criminal Investigation and Identification (BCII) and\n Federal Bureau of Investigation (FBI) background checks and submit the results to authorized personnel at their\n assigned school/agency before the first day of the semester in which student teaching/internship will take place."
ECET 21095,SPECIAL TOPICS IN EARLY CHILDHOOD EDUCATION TECHNOLOGY,ECET,Departmental permission.,None,(Repeatable for credit)Intensive study of significant current issues in the early childhood education field.
ECET 21096,INDIVIDUAL INVESTIGATION IN EARLY CHILDHOOD EDUCATION TECHNOLOGY,ECET,departmental special approval.,None,(Repeatable for a maximum of 6 credit hours) Analysis and special research in the early childhood education\n field.
ECET 22000,PRESCHOOL CURRICULUM,ECET,ECET 21010 andECED 20163.,None,"Preschoolers' development, environments and curriculum; theoretical perspectives; family involvement;\n community resources, collaboration and advocacy; 38 hours of field experience required. Students are required\nto complete Bureau of Criminal Investigation and Identification (BCII) and Federal Bureau of Investigation (FBI)\n background checks and submit the results to authorized personnel at their assigned school/agency before the\n first day of the semester in which student teaching/ internship will take place."
ECET 22130,EMERGING LITERACY,ECET,ECED 10120 and 20163.,None,"(Equivalent to ECED 30123) Theoretical and practical issues in acquisition and development of literacy.\n Developmentally appropriate instructional practices, integration across the curriculum, individual differences\n and assessment are addressed. Field hours required. Students are required to complete Bureau of Criminal\n Investigation and Identification (BCII) and Federal Bureau of Investigation (FBI) background checks and submit\n the results to authorized personnel at their assigned school/agency before the first day of the semester in which\n student teaching/ internship will take place."
ECET 22140,STUDENT TEACHING SEMINAR,ECET,departmentalspecial approval.,ECET 22150.,"(Equivalent to ECED 40165) A reflective approach to make student teaching experience more valuable.\n Students develop and implement developmentally appropriate curriculum and assessment for young children,\n prepare a professional development plan and develop a professional portfolio."
ECET 22192,STUDENT TEACHING,ECET,"departmental special approval; andofficial valid certification of Child Safety Training, approved Basic Life Support and A.L.I.C.E. Training must be\n presented to the campus office of clinical experience or designated faculty or staff at Regional campuses as\nprerequisite for student teaching.Prerequisite: special approval.",ECET 22140.,(Equivalent to ECED 40192) Student spends 180 hours at an approved preschool program under the supervision\n of an ECET or ECED faculty member or supervising teacher. Students are required to complete Bureau of\n Criminal Investigation and Identification (BCII) and Federal Bureau of Investigation (FBI) background checks\n and submit the results to authorized personnel at their assigned schoolagency before the first day of the\n semester in which student teachinginternship will take place.
