INTRODUCTION TO FINANCIAL ACCOUNTING,ACCT,None,,"
(Equivalent to ACTT 11000) Introduction to the basic concepts and standards underlying financial accounting. Topics to be covered include revenue recognition, receivables, inventory, long-lived assets, liabilities and stockholders' equity. The impact of transactions on the accounting equation and financial statements (balance sheet, income statement and cash flows) is emphasized. ",2017
INTRODUCTION TO MANAGERIAL ACCOUNTING,ACCT,ACCT 23020 or ACTT 11000,,"
(Equivalent to ACTT 11001) Introduction to managerial accounting concepts and tools that can be used to support decision-making in organizations. Includes coverage of cost systems, cost behavior, cost-volume-profit analysis, relevant costs, and budgets. ",2017
FUNDAMENTAL TAX PROCEDURES,ACCT,Minimum 2.500 overall GPA; and ACCT 23020 or ACTT 11000; and ACCT 23021 or ACTT 11001; not open to Accounting (ACCT) majors,,"
Non-technical presentation of federal income tax laws and regulations as they relate to individuals. ",2017
CORPORATE ACCOUNTING I,ACCT,Accounting (ACCT) major or minor; and minimum 2.500 overall GPA; and MATH 11012 or MATH 12002; and minimum B- grade in ACCT 23020 (or ACTT 11000) and ACCT 23021 (or ACTT 11001); and minimum C grade in ENG 21011 and COMM 15000 and MATH 11010,,"
Review of the accounting cycle; financial statement preparation, accounting for sales, receivables, inventory, current liabilities and long-term assets. Professional accounting research skills are emphasized. ",2017
INTRODUCTION TO ACCOUNTING SYSTEMS,ACCT,"cumulative 2.500 GPA; and MIS 24053; and MATH 11012 or MATH 12002; and a minimum B- (2.700) grade in ACCT 23021 or ACTT 11001 and ACCT 23020 or ACTT 11000; and minimum C (2.000) in ENG 21011, COMM 15000 and MATH 11010; and accounting (ACCT) major or minor",,"
Overview of accounting information systems with emphasis on internal controls. The course explores how the integrity and efficiency of business process are supported by information systems. Interpersonal skills and computer applications are emphasized. ",2017
COST ACCOUNTING,ACCT,cumulative 2.500 GPA; and accounting (ACCT) major or minor; and ACCT 33001 and ACCT 33004 both with a minimum grade of C (2.000),,"
Cost accounting for manufacturing and service organizations including cost determination, cost analysis, costing systems, cost-volume-profit analysis, budgeting, cost allocation, activity-based costing, capital investment, and performance measurement. Computer application skills are emphasized. ",2017
CORPORATE ACCOUNTING II,ACCT,cumulative 2.500 GPA; and accounting (ACCT) major and minor; and ACCT 33001 and ACCT 33004 both with a minimum grade of C (2.000),,"
Accounting for long-term liabilities, debt and equity investments, leases, pensions and other post-retirement benefits, income tax allocation, owners' equity, and statement of cash flows. Professional accounting research skills and written communication skills are emphasized. ",2017
FINANCIAL REPORTING ISSUES AND ANALYSIS,ACCT,cumulative 2.500 GPA; and ACCT 23021 or ACTT 11001; not open to accounting (ACCT) majors,,"
Financial analysis and interpretation of issues relative to the balance sheet, income statement and cash flow statement. Topics include assets, liabilities, owner's equity, intercorporate investments, revenue and expense recognition, and ratio analysis. Cannot be counted towards accounting major. ",2017
COST CONTROL AND ANALYSIS FOR MANAGEMENT,ACCT,Minimum overall 2.500 GPA; and ACCT 23021 or ACTT 11001; not open to Accounting (ACCT) major,,"
An in-depth study of cost accounting, focusing on the use of cost accounting information in planning, control and decision-making. Topics include cost terminology, costing systems, cost-volume-profit analysis, budgeting, cost allocation, activity-based costing, variance analysis, ethics and performance measurement. Course cannot be counted towards Accounting major. ",2017
PRINCIPLES OF AUDITING AND CONTROL (ELR) (WIC),ACCT,cumulative 2.500 GPA; and senior standing; and accounting (ACCT) major; and ACCT 33010 and ACCT 33012 both with a minimum grade of C (2.000),,"
Integration of conceptual and practical aspects of auditing, importance of strong internal controls is stressed. Ethical decision making, written and verbal communication and interpersonal skills are emphasized. ",2017
ADVANCED MANAGEMENT ACCOUNTING,ACCT,cumulative 2.500 GPA; and senior standing; and accounting (ACCT) major; and ACCT 33010 and ACCT 33012 both with a minimum grade of C (2.000),,"
(Slashed with ACCT 53013) Advanced contemporary topics relating to the use of accounting information in managerial decision-making. Topical coverage varies from budgeting, cost behavior, corporate governance, executive compensation, tax strategies to sticky costs. Accounting research, verbal and written communication, ethical decision-making, and analytical skills are emphasized. ",2017
ADVANCED ACCOUNTING SYSTEMS,ACCT,cumulative 2.500 GPA; and senior standing; and accounting (ACCT) major; and ACCT 33001 and ACCT 33004 and ACCT 33010 and ACCT 33012 all with a minimum grade of C (2.000),,"
(Slashed ACCT 53014) Analysis, design and implementation of accounting information systems with a focus on creating effective business processes and internal controls. Students work with enterprise resource planning, ERP, software to deepen their understanding of key concepts. Introduction to retrieving and analyzing data via Structured Query Language, SQL. Enhanced statistical analysis and written and verbal communications skills are emphasized. 
",2017
CORPORATE ACCOUNTING III,ACCT,cumulative 2.500 GPA; and senior standing; and Accounting (ACCT) major; and ACCT 33001 and ACCT 33004 and ACCT 33010 and ACCT 33012 all with a minimum grade of C (2.000),,"
(Slashed with ACCT 53020)  Conceptual and practical issues surrounding: (1) financial reporting for investment activities of businesses when one firm possesses significant influence or control over another, (2) accounting for international business transactions, including the use of derivatives for hedging foreign exchange risk, and (3) translating foreign currency financial statements of foreign operations. Professional accounting research and written communication skills are emphasized. ",2017
INCOME TAXATION,ACCT,cumulative 2.500 GPA; and senior standing; and Accounting (ACCT) major; and ACCT 33001 and ACCT 33004 and ACCT 33010 and ACCT 33012 all with a minimum grade of C (2.000),,"
Introduction to Federal income tax for individual and corporate taxpayers. Detailed analysis of income recognition and deduction rules for individuals. Overview of tax rules related to corporate formations and distributions. Professional research skills are emphasized. 
",2017
INCOME TAXATION II,ACCT,cumulative 2.500 GPA; and senior standing; and Accounting (ACCT) major; and ACCT 43031,,"
(Slashed ACCT 53033) Advanced individual tax topics; income taxation of partnerships, S corporations and trusts; estate and gift taxation; tax administration and practice. Professional accounting research and written communication skills are emphasized. 
",2017
NONPROFIT ACCOUNTING AND AUDITING,ACCT,cumulative 2.500 GPA; and senior standing; and accounting (ACCT) major; and ACCT 33001 and ACCT 33004 and ACCT 33010 and ACCT 33012 all with a minimum grade of C (2.000),,"
(Slashed with ACCT 53034) Accounting, financial reporting, and auditing issues and techniques that are unique to government and nonprofit entities. Professional accounting research, written communication and ethical decision making skills are emphasized. ",2017
INTERNATIONAL ACCOUNTING EXPERIENCE,ACCT,junior standing; and accounting (ACCT) major; and special approval,,"
(Slashed with ACCT 53087) Firsthand exposure to international businesses and organizations generally relating to business and specifically relating to accounting and finance. Includes pre-trip orientation sessions, visits to international businesses and organizations, and opportunities for cultural activities. ",2017
ACCOUNTING INTERNSHIP (ELR),ACCT,minimum C (2.000) grade in ACCT 33001 or ACCT 33004; and junior standing; and accounting (ACCT) major; and cumulative 3.000 GPA and special approval (students must have a cumulative 3.000 GPA in all attempts of ACCT courses),,"
Study of activities related to concurrent on-the-job experience with cooperating industrial and public accounting firms. ",2017
VARIABLE TITLE WORKSHOP IN ACCOUNTING,ACCT,Senior standing and accounting (ACCT) major and special approval,,"
(Repeatable for credit)To be determined when a specific course is proposed for a particular term. ",2017
SPECIAL TOPICS: ACCOUNTING,ACCT,Senior standing and accounting (ACCT) major and special approval,,"
(Repeatable for credit) (Cross-listed with ACCT 53095) Special topics course that will be offered periodically with different topics and different faculty involved each time the course is offered. ",2017
INDIVIDUAL INVESTIGATION IN ACCOUNTING,ACCT,senior standing; and accounting (ACCT) major; and special approval,,"
(Repeatable for credit) Individual research into a current accounting topic. ",2017
