Course Number,Course Name,Department,Prerequisites,Description
45222,Marching Band,MUS,music (MUS) major,(Repeated registration permissible) Study and performance of literature and maneuvers for marching band.
45223,Wind Ensemble,MUS,music (MUS) major,(Repeated registration permissible) A select concert ensemble that performs the finest in wind instrument literature with emphasis on major original works. An audition is required before registering for this course.
45224,Basketball Band,MUS,music (MUS) major,(Repeated registration permissible) Study and performance of music for the basketball band.
45225,University Band,MUS,music (MUS) major,"(Repeated registration permissible) Study and performance of music literature for wind band appropriate for nonmusic majors, and for music education majors performing on secondary instruments."
45231,Jazz Ensemble,MUS,music (MUS) major,(Repeated registration permissible) Study and performance of music literature in the jazz idiom.
45241,Trombone Ensemble,MUS,music (MUS) major,(Repeated registration permissible) A thorough study of trombone performance in various-sized ensembles. Emphasis on original literature from over four centuries.
45251,Percussion Ensemble,MUS,music (MUS) major,(Repeated registration permissible) A comprehensive study of percussion performance in various-sized ensembles. Use of keyboard percussion instruments along with drums and accessories. Study of percussion ensemble literature.
45261,Bassoon Ensemble,MUS,music (MUS) major,"(Repeated registration permissible) Study and performance of music for multiple bassoons; emphasis upon refined ensemble playing, interpretation, leadership skills and arranging techniques."
45271,New Music Ensemble,MUS,music (MUS) major,(Repeated registration permissible) Study and performance of 20th-century chamber music with an emphasis on works by contemporary composers.
45281,Flute Ensemble,MUS,music (MUS) major,(Repeated registration permissible) Study and performance of music for multiple flutes; emphasis upon all aspects of ensemble playing and style considerations will be addressed in both chamber and conducted formats.
45311,Chamber Music (1 or 2)(Repeated registration permissible) The study and performance of music for small ensembles. Prerequisite: special approval.45321 Accompanying (1 or 2)(Repeated registration permissible) Accompanying instrumental and vocal soloists; piano ensemble works. Credit counted toward ensemble requirements. One-hour credit for two hours of assigned accompanying weekly. Prerequisite: special approval.47014 Folk Guitar for the Music Educator,MUS,music (MUS) major,Development of basic folk guitar performance skills for music education majors. Prerequisites: music education (MUED) major and MUS 23111. Special fee: $35—subject to change.47811 Instrument Class for the Choral/General Music Educator (1)Class instruction in the basic playing skills of band and orchestral instruments intended to provide familiarity with the common school instruments for the choral/general music major.
47811,Instrument Class for the Choral/General Music Educator,MUS,music (MUS) major,Class instruction in the basic playing skills of band and orchestral instruments intended to provide familiarity with the common school instruments for the choral/general music major.
48111,Eurhythmics,MUS,music (MUS) major,"Applied study of rhythm through kinesthetic, intellectual and emotional involvement. Movement experiences to strengthen concentration and communication between ear, brain and muscles that execute rhythm."
48112,Eurhythmics,MUS,music (MUS) major,See MUS 48111.
48211,Introduction to Piano Pedagogy,MUS,music (MUS) major,"Observation and teaching of individual and class lessons, children and adults. Study and performance of preparatory materials, elementary through intermediate piano literature."
48221,Elements of Accompanying I,MUS,music (MUS) major,"Techniques of accompanying; selected overview of art song literature including Italian, German, French and English songs; development of playing-at-sight skills."
48222,Elements of Accompanying II,MUS,music (MUS) major,"Continuation of accompanying techniques including opera accompanying, orchestral reductions and selected overview of literature for solo instrument and piano; continuation of playing-at-sight skills."
48241,Voice Pedagogy,MUS,music (MUS) major,"Survey of techniques, practices and materials of teaching voice."
48251,Pedagogy of Music Theory,MUS,music (MUS) major,The principles and techniques of teaching music theory.
48257,Pedagogy—Instrumental,MUS,music (MUS) major,"Principles and techniques of instruction. Literature survey. Analysis of instrumental problems and performance practice. Offered as needed for strings, woodwinds, brass, percussion, organ or guitar."
48393,Variable Title Workshop in Music (1-4)Offered for specific professional needs. Emphasis on performance and pedagogical skills. S/U grading. Prerequisite: special approval.48512 Improvisation,MUS,music (MUS) major,The development of musical improvisation skills not tied to any particular music style. Students will perform on their own applied instrument(s).
48598,Music Research (2-3)(Repeated registration permissible) Research or individual investigation for undergraduate students. IP grade permissible. Prerequisite: special approval.49525 Inquiry into Professional Practice,MUS,music (MUS) major,"Instruction in band, choral, general and orchestral music methods for music education majors. Focus on teacher leadership experiences and action research projects. Sixty-two field/clinical hours required. Prerequisites: music education (MUED) major and admission to student teachingApplied Music Students who plan to register for applied music for the first time must audition for the appropriate faculty member(s) prior to registering for the course.Private applied music instruction: Privately instructed performance courses are offered each semester. Performance majors register for 4 credit hours, receive a one-hour lesson weekly and attend the weekly studio class of their major performing medium. Non-performance majors register for 2 hours of credit, receive one half-hour lesson weekly and attend the weekly studio class of their major performing medium. Students must be a music (MUS) or music education (MUED) major. Applied music study for non-majors and non-minors is subject to faculty and studio availability and may be elected only with the special approval of the School of Music.The following courses are either 2 or 4 credit hours. Students electing 2  credits pay $100 per semester; students electing 4 credits pay $200 per semester.36111, 46111—Piano36311, 46311—Voice36411, 46411—Violin36412, 46412—Viola36413, 46413—Cello36414, 46414—Double Bass36511, 46511—Flute36512, 46512—Oboe36513, 46513—Clarinet36514, 46514—Bassoon36515, 46515—Saxophone36611, 46611—Trumpet36612, 46612—Horn36613, 46613—Trombone36614, 46614—Euphonium36615, 46615—Tuba36711, 46711—Percussion36912, 46912—GuitarClass Instruction: Classes in piano, voice, strings, woodwinds, brasses and percussion are available. The prerequisite for each course is cited in the Catalog description. The instruction fee ranges from a $20 to $120 flat fee.17011, 17012 Piano Class for Non-music Students (2 each)Development of basic skills required in playing piano, including familiarity with the keyboard and music notation."
17012,"Piano Class for Non-music Students (2 each)Development of basic skills required in playing piano, including familiarity with the keyboard and music notation. Prerequisite: MUS 17011—none;  17012—MUS 17011 or audition. Special fee: $45 flat fee—subject to change.17111 Piano Class (1 )Preparatory piano. Credit not acceptable on music major sequences. Piano literature and functional elements of sight-reading, transposition, harmonization and improvisation. Prerequisite: special approval. Special fee: $35 flat fee—subject to change.17112 Piano Class",MUS,music (MUS) major,"Prepartory piano. Credit not acceptable on music major sequences. Piano literature and functional elements of sight-reading, transposition, harmonization and improvisation."
17111,with a grade of C- (1.7) or better. Special fee: $35 flat fee —subject to change.27111 Piano Class,MUS,music (MUS) major,Continuation of piano classes. Credit acceptable on music major and minor sequences.
17111,with a grade of C (2.0) or better. Special fee: $45 flat fee—subject to change.27112 Piano Class,MUS,music (MUS) major,Continuation of piano classes. Credit acceptable on music major and minor sequences.
36111,"Applied Music—Piano (2 or 4)A comprehensive study of performance, technique and repertoire appropriate to music majors and minors. Individual study. Prerequisite: music (MUS) or music education (MUED) major.36311 Applied Music—Voice (2 or 4)A comprehensive study of performance, technique and repertoire appropriate to music majors and minors. Individual instruction. Prerequisite: music (MUS) or music education (MUED) major.36411 Applied Music—Violin (2 or 4)A comprehensive study of performance, technique and repertoire appropriate to music majors and minors. Individual instruction. Prerequisite: music (MUS) or music education (MUED) major.36412 Applied Music—Viola (2 or 4)A comprehensive study of performance, technique and repertoire appropriate to music majors and minors. Individual instruction. Prerequisite: music (MUS) or music education (MUED) major.36413 Applied Music—Cello (2 or 4)A comprehensive study of performance, technique and repertoire appropriate to music majors and minors. Individual instruction. Prerequisite: music (MUS) or music education (MUED) major.36414 Applied Music—Double Bass (2 or 4)A comprehensive study of performance, technique and repertoire appropriate to music majors and minors. Individual instruction. Prerequisite: music (MUS) or music education (MUED) major.36511 Applied Music—Flute (2 or 4)A comprehensive study of performance, technique and repertoire appropriate to music majors and minors. Individual instruction. Prerequisite: music (MUS) or music education (MUED) major.36512 Applied Music—Oboe (2 or 4)A comprehensive study of performance, technique and repertoire appropriate to music majors and minors. Individual instruction. Prerequisite: music (MUS) or music education (MUED) major.36513 Applied Music—Clarinet (2 or 4)A comprehensive study of performance, technique and repertoire appropriate to music majors and minors. Individual instruction. Prerequisite: music (MUS) or music education (MUED) major.36514 Applied Music—Bassoon (2 or 4)A comprehensive study of performance, technique and repertoire appropriate to music majors and minors. Individual instruction. Prerequisite: music (MUS) or music education (MUED) major.36515 Applied Music—Saxophone (2 or 4)A comprehensive study of performance, technique and repertoire appropriate to music majors and minors. Individual instruction. Prerequisite: music (MUS) or music education (MUED) major.36611 Applied Music—Trumpet (2 or 4)A comprehensive study of performance, technique and repertoire appropriate to music majors and minors. Individual instruction. Prerequisite: music (MUS) or music education (MUED) major.36612 Applied Music—Horn (2 or 4)A comprehensive study of performance, technique and repertoire appropriate to music majors and minors. Individual instruction. Prerequisite: music (MUS) or music education (MUED) major.36613 Applied Music—Trombone (2 or 4)A comprehensive study of performance, technique and repertoire appropriate to music majors and minors. Individual instruction. Prerequisite: music (MUS) or music education (MUED) major.36614 Applied Music—Euphonium (2 or 4)A comprehensive study of performance, technique and repertoire appropriate to music majors and minors. Individual instruction. Prerequisite: music (MUS) or music education (MUED) major.36615 Applied Music—Tuba (2 or 4)A comprehensive study of performance, technique and repertoire appropriate to music majors and minors. Individual instruction. Prerequisite: music (MUS) or music education (MUED) major.36711 Applied Music—Percussion (2 or 4)A comprehensive study of performance, technique and repertoire appropriate to music majors and minors. Individual instruction. Prerequisite: music (MUS) or music education (MUED) major.36912 Applied Music—Guitar (2 or 4)A comprehensive study of performance, technique and repertoire appropriate to music majors and minors. Individual instruction. Prerequisite: music (MUS) or music education (MUED) major.37111 Functional Piano",MUS,music (MUS) major,Development of keyboard facility for practical purposes in classroom. Credit-By-Exam with departmental approval.
40296,Independent Study: Music (1-3)(Repeated registration permissible) Individual investigation in music topics not offered as either regular coursework or beyond the scope of existing music major courses. Prerequisite: music (MUS) major and special approval.47012 Folk Guitar Class I,MUS,music (MUS) major,Development of basic folk guitar performance skills.
47013,Folk Guitar Class II,MUS,music (MUS) major,"Continued development of acoustic guitar performance skills, study of performance-related theory and related topics such as open tuning and slide guitar."
47311,Voice Class,MUS,music (MUS) major,"Class instruction in the fundamentals of correct breathing, tone production and diction."
47411,String Class,MUS,music (MUS) major,"(Repeatable for a total of 3 credit hours) Class lessons in basic playing skills, methodology, teaching materials and maintenance of string instruments to enable the student to teach string classes in public schools."
47511,Woodwind Class,MUS,music (MUS) major,(Repeatable for a total of 3 credit hours) Study of fundamental principles of performance on woodwind instruments; methods and materials for class and private instruction.
47611,Brass Class,MUS,music (MUS) major,(Repeatable for a total of 3 credit hours) Study of fundamental principles of playing and teaching brass instruments. Survey of materials and method books suitable for class and private instruction.
47711,Percussion Class,MUS,music (MUS) major,"Study of various percussion instruments (mallets, snare drum, timpani and auxiliary) and techniques of performance. Designed for music educator with no previous percussion experience."
