Course Number,Course Name,Department,Prerequisites,Description
31525,and 31622. Special fee: $110 flat fee—subject to change.41527 Sound Design and Technology II,THEA,special approval,"Studies in sound design, sound production and reinforcement for live performance. Advanced software applications will be explored. Prerequisites: THEA 41523 and special approval.41528 Theatre Sound Reinforcement (3)Studies in the theories and practice of audio mixing in support of live vocal and musical performance. Topics include wired and wireless microphones and real-time digital processing of audio. Prerequisites: THEA 41523 and special approval.41529 Advanced Wig and Makeup Techniques —Stage and Screen (3)Advanced study of the process of designing and executing wigs and makeup with an emphasis on standards in the profession. Some prosthetic work required."
41523,and special approval.41528 Theatre Sound Reinforcement,THEA,special approval,Studies in the theories and practice of audio mixing in support of live vocal and musical performance. Topics include wired and wireless microphones and real-time digital processing of audio. Prerequisites: THEA 41523 and special approval.41529 Advanced Wig and Makeup Techniques —Stage and Screen (3)Advanced study of the process of designing and executing wigs and makeup with an emphasis on standards in the profession. Some prosthetic work required.
41523,and special approval.41529 Advanced Wig and Makeup Techniques —Stage and Screen,THEA,special approval,Advanced study of the process of designing and executing wigs and makeup with an emphasis on standards in the profession. Some prosthetic work required.
41530,Automated Stage Lighting Programming,THEA,special approval,Studies in the application of automated lighting techniques to live performance emphasizing artistic style and concept through a range of programming problems.
41560,Theatre Fabrication Technology,THEA,special approval,"History of technical production practice, materials theory and application in scenic construction technology. Prerequisites: THEA 11622 and 21521 and special approval. Special fee: $80 flat fee—subject to change.41620 History of Period Styles for Theatre Designers (3)A survey of visual styles as related to historical and contemporary culture from antiquity through the 20th century with an emphasis on its application to theatrical design."
11622,and 21521 and special approval. Special fee: $80 flat fee—subject to change.41620 History of Period Styles for Theatre Designers,THEA,special approval,A survey of visual styles as related to historical and contemporary culture from antiquity through the 20th century with an emphasis on its application to theatrical design.
31522,or 31524 or 31622.41621 Presentation Media,THEA,special approval,"Advanced process techniques in rendering, model building and design presentation for the scenic, costume and lighting designer in traditional and new media. Prerequisites: junior standing and THEA 11522 and 11524 and 11622 and 21521. Special fee: $76 flat fee—subject to change.41622 Design Studio: Scenery (3)Advanced study in scenic design. Explores genres, styles and performance spaces, including practical considerations."
11522,and 11524 and 11622 and 21521. Special fee: $76 flat fee—subject to change.41622 Design Studio: Scenery,THEA,special approval,"Advanced study in scenic design. Explores genres, styles and performance spaces, including practical considerations."
31622,and special approval. Special fee: $50 flat fee—subject to change.41623 Television Production: Lighting,THEA,special approval,"Studies in the process and application of designing lighting for studio and event-based television production. Prerequisites: THEA 11522 and special approval.41701 Movement Form and Space I-The Actor's Physical Instrument (3)Development of technical skills emphasizing the physical components of expressive action through integration of breath, voice and body conditioning. Prerequisites: THEA 31701 and special approval.41726 Theatre Management (3)Principles and practices of managing theatrical-producing organizations. Problems of finance, personnel, policy, program building and public relations. Production participation as assigned."
11522,and special approval.41701 Movement Form and Space I-The Actor's Physical Instrument,THEA,special approval,"Development of technical skills emphasizing the physical components of expressive action through integration of breath, voice and body conditioning. Prerequisites: THEA 31701 and special approval.41726 Theatre Management (3)Principles and practices of managing theatrical-producing organizations. Problems of finance, personnel, policy, program building and public relations. Production participation as assigned."
31701,and special approval.41726 Theatre Management,THEA,special approval,"Principles and practices of managing theatrical-producing organizations. Problems of finance, personnel, policy, program building and public relations. Production participation as assigned."
41736,Production and Stage Management,THEA,special approval,"Detailed investigation of the methodology used in stage managing a professional theatrical production including paperwork, rehearsals and calling a show."
41801,Voice and Speech I- The Actor's Instrument,THEA,special approval,"The use of exercise and specific text work to explore ""centering"" as it relates to the vocal, physical and emotional process of the actor. Focus on extremes of emotional sounds and eliminating barriers and detrimental vocal habits/speech patterns. Prerequisites: THEA 31801 and special approval.41808 Acting Styles I-Shakespeare (3)The application of acting, movement, and voice and speech techniques to sonnets, monologues, soliloquies, and scenes from Shakespeare."
31801,and special approval.41808 Acting Styles I-Shakespeare,THEA,special approval,"The application of acting, movement, and voice and speech techniques to sonnets, monologues, soliloquies, and scenes from Shakespeare."
41892,Entertainment Arts and Technology Internship II,THEA,special approval,(Repeatable up to 10 credit hours) Intensive advanced professional experience in aspects of entertainment arts and technologies.
41992,"Theatre Production Internship (1-6)(Repeatable for a total of 12 credit hours) Intensive advanced training in practical aspects of production. Periodic seminars, laboratory sessions and performance in a theatre company. S/U grading; IP grade permissible. Prerequisites: junior standing and special approval.42092 Practicum II: Design/Tech",THEA,special approval,(Repeatable for a total of 99 credit hours) Advanced practical experience in theatre production under faculty supervision. S/U grading; IP grade permissible. Available for upper-division students only. Required of all theatre majors.
42192,Practicum II: Performance,THEA,special approval,(Repeatable for a total of 99 credit hours) Advanced practical experience in theatre performance under faculty supervision. S/U grading; IP grade permissible. Available for upper-division students only. Required of all theatre majors.
42292,Practicum II: Theatre Management,THEA,special approval,(Repeatable for up to 12 credit hours) Advanced practical experience in theatre management under faculty/staff supervision. Available for upper-division students only.
