15000,INTRODUCTION TO AERONAUTICS ,AERN,,,"Introduction to aeronautical and aerospace technology including historical development, underlying science and technical applications. The past ,present and future social, economic, technical and political impact of aviation are also explored.",2011
15100,WOMEN AND MINORITIES IN AVIATION ,AERN,,,"Course examines the roles and contributions of women and minorities in aviation and the historical, social, technological and political impact they have had on aviation and the aerospace industry.",2011
15250,FAA ORIENTATION ,AERN,AERN 15000.,,"Introduction to the Federal Aviation Administration with particular emphasis on its role and impact on air traffic management and the National Airspace System (NAS). Course addresses the unique aspects and requirements of federal employment, as well as federal regulations affecting flight operations and the FAA's associated supporting agencies.",2011
15740,ELEMENTS OF FLIGHT THEORY ,AERN,,TECH 15741.,Basic instruction in all areas which gives the student aeronautical knowledge required for a private pilot certificate. Corequisite: TECH 15741.,2011
15741,PRIVATE PILOT FLIGHT ,AERN,TECH 15000 and 2.5 GPA.,TECH 15740.,Flight course designed to fulfill FAA requirements for private pilot certificate.,2011
15742,PRIVATE PILOT HELICOPTER FLIGHT ,AERN,2.0 cumulative GPA and TECH 15740.,TECH 35101.,Flight course designed to fulfill Federal Aviation Administration (FAA) requirements for the private pilot helicopter certificate.,2011
15743,PRIVATE PILOT HELICOPTER FLIGHT ADD-ON ,AERN,2.0 cumulative GPA and TECH 15740 and 15741.,TECH 35101.,Flight course designed to fulfill Federal Aviation Administration (FAA) requirements for the private pilot helicopter certificate.,2011
25250,ELEMENTS OF AVIATION WEATHER ,AERN,AERN 15000.,,Aviation weather provides an up-to-date and expanded course for professional pilots and others whose interest in weather is primarily in its application to flight.,2011
25350,FUNDAMENTALS AIR TRAFFIC CENTER ,AERN,AERN 15250.,,"Introduction to the National Airspace System (NAS) and the orders, manuals and procedures associated with the purposes and directives of the air traffic control environment to include purposes and responsibilities of the ATC system.",2011
25351,FUNDAMENTALS OF AIR TRAFFIC CONTROL LABORATORY ,AERN,AERN 15250.,AERN 25350.,"Introductory laboratory course on air traffic management and the National Airspace System, the orders, manuals and procedures associated with the purposes and directives of the air traffic control environment. To include purposes and responsibilities of the ATC system.",2011
35001,AIRCRAFT FABRICATION ,AERN,AERN 15000 and PHY 13001.,,"The study and laboratory practice of government approved procedures used in the fabrication, repair and testing of certificated aircraft.",2011
35020,AIRCRAFT PROPULSION SYSTEMS ,AERN,AERN 15000 and PHY 13011.,,"A study of basic reciprocating and gas turbine engine theory. Course investigates powerplant construction, component function, including propeller and fuel systems, ancillary systems that support aircraft propulsive systems and performance characteristics.",2011
35030,INTRODUCTION TO CORPORATE AVIATION ,AERN,AERN 15000.,,Introduces students to the business and corporate sectors of commercial aviation. Examines business and corporate aviation from the joint perspectives of operations and maintenance management as well as flight operations.,2011
35040,AIRCRAFT SYSTEMS I ,AERN,PHY 23101; or PHY 13011 and 13012; and AERN 15000.,,"In-depth study of various aircraft systems including electrical systems, environmental control systems, and fuel systems as applied to aircraft.",2011
35095,SPECIAL TOPICS IN AERONAUTICS ,AERN,Aeronautics (AERN) major and sophomore standing.,,Specialized offerings of interest in response to emerging or needed curricular needs in aeronautics. Topics will be announced in the schedule of classes. Repeat registration permitted.,2011
35101,HELICOPTER THEORY AND OPERATION ,AERN,AERN 15000 and 25250.,,"Study of helicopter flight and operations that includes rotor system dynamics, control functions, major components, operation and performance.",2011
35150,AIRCRAFT STRUCTURES ,AERN,PHY 13011 and 13012; and AERN 15000.,,Aircraft structural design investigations dealing with theory and applications in aviation.,2011
35340,AIRPORT MANAGEMENT ,AERN,AERN 15000.,,"Introduction to the many functions that are involved in the operation and management of an airport. Includes an analysis of the development of the airport- airway system, airport legislation, airport planning and airport operations.",2011
35341,AIR TRANSPORTATION SYSTEMS ,AERN,AERN 15000.,,Descriptive course in airline operations as seen from the air carrier's business perspective. Emphasis is on business practices and techniques unique to aviation.,2011
35342,AIR TRAFFIC CONTROL ,AERN,AERN 15000 and 15740 and 25250.,,Study of the fundamental concepts of air traffic control and airspace management in the National Airspace System (NAS); with an emphasis on the interaction between terminal and en route traffic control functions.,2011
35343,EN ROUTE AIR TRAFFIC CONTROL ,AERN,AERN 25250 and 25350 and 35342.,AERN 35344.,"Introduction to en route operations of air traffic control. To include an understanding of en route charts, radio procedures and use of weather forecasting products.",2011
35344,AIR TRAFFIC CONTROL ,AERN,AERN 25250 and 25350 and 35342.,AERN 35343.,"Laboratory course with real-world, scenario-based introduction to en route operations of air traffic control. To include an understanding of en route charts, radio procedures and the us of weather forecasting products.",2011
35644,INSTRUMENT FLIGHT THEORY ,AERN,AERN 15740 and TECH 25250.,AERN 35645.,Comprehensive instruction presenting theoretical and practical aspects of instrument and weather flying.,2011
35645,INSTRUMENT PILOT FLIGHT ,AERN,AERN 25250 and 25743.,AERN 35644.,Comprehensive flight course for the professional pilot candidate to meet the requirements of the FAA instrument rating.,2011
35646,INSTRUMENT HELICOPTER FLIGHT ,AERN,AERN 15742 or 15743; special approval; and minimum cumulative 2.00 GPA.,AERN 35644.,Flight course designed to fulfill FAA requirements for the Instrument Helicopter Rating.,2011
35647,COMMERCIAL PILOT FLIGHT II ,AERN,AERN 35644 and 35645.,,Comprehensive flight course for the professional pilot candidate with emphasis on commercial flight maneuvers and instrument flight review.,2011
35648,INSTRUMENT HELICOPTER FLIGHT ADD-ON ,AERN,AERN 35645 and minimum cumulative 2.00 GPA.,AERN 35101.,Flight course designed to fulfill FAA requirements for the Instrument Helicopter Rating.,2011
35746,COMMERCIAL PILOT THEORY ,AERN,AERN 35644 and 35645.,,Comprehensive instruction covering all areas necessary to exercise the privileges of a commercial pilot.,2011
35747,COMMERCIAL PILOT FLIGHT III ,AERN,AERN 35644 and 35645. Pre/,AERN 35647. Corequisite: AERN 35746.,Comprehensive flight course for the professional pilot candidate to meet the requirements of the FAA commercial pilot certificate. Major emphasis on complex aircraft operations.,2011
35748,COMMERCIAL PILOT HELICOPTER FLIGHT ADD-ON ,AERN,2.0 cumulative GPA; and AERN 35747; and AERN 15742 or 15743.,AERN 35101.,Flight course designed to fulfill Federal Aviation Administration (FAA) requirements for the commercial pilot helicopter certificate.,2011
35749,COMMERCIAL PILOT HELICOPTER FLIGHT ,AERN,AERN 15742 or 15743; and minimum cumulative 2.00 GPA.,AERN 35746.,Flight course designed to fulfill FAA requirements for the Commercial Pilot Helicopter certificate.,2011
45030,AIRCRAFT SYSTEMS II ,AERN,AERN 35040.,,"Application and performance of various electrical, mechanical, hydraulic and computer systems as applied to aircraft.",2011
45092,AERONAUTICAL INTERNSHIP/COOPERATIVE EDUCATION,AERN,pecial approval.,,"(Repeatable for a total of 6 hours) Work experience in aerospace/aviation industry or related activity, laboratory or student professional organization.",2011
45096,INDIVIDUAL INVESTIGATION IN AERONAUTICS ,AERN,Sophomore standing and special approval.,,Work study of an individual nature on a topic relating to professional aviation. Repeatable for a total of 6 hours.,2011
45099,AERONAUTICAL STUDIES CAPSTONE ,AERN,enior standing.,,"An in-depth study of the student‟s area of focus within aeronautical studies, culminating to a senior level project. At the discretion of the aeronautics faculty, students may substitute another capstone course for this course. Students must pass this capstone with a grade of C (2.0) or better in order to graduate.",2011
45100,OPERATIONAL PLANNING IN AVIATION ,AERN,AERN 35340 and 35341; and FIN 36053.,,"Focus on both airport and airline operations through planning, design and management. Students function as project managers and work with simulation to run their own airport and airline with respect to financial and economic variables.",2011
45121,ADVANCED AEROSPACE PROPULSION ,AERN,,,A thorough study of propulsion systems used in the aeronautics industry beginning with an introduction to the reciprocating engine and ending with the study of modern rocketry. Emphasis is given to advanced systems such as gas turbine engines and hypersonic propulsion systems.,2011
45130,PHYSIOLOGY AND HUMAN FACTORS OF FLIGHT ,AERN,AERN 15000.,,A study of the interaction of the human body with flight and those human factors that affect flight operations.,2011
45135,AVIATION SAFETY THEORY ,AERN,,,Provides an in-depth study into aviation human safety theories and the basics of risk and safety management.,2011
45150,APPLIED FLIGHT DYNAMICS I ,AERN,MATH 11012 or MATH 12002; and PHY 13011.,,"An applied aircraft flight dynamics course that demonstrates aircraft, engine and propeller performance with the overall flight performance and stability of the typical subsonic airplane. Emphasis is placed on the aerodynamics of flight.",2011
45151,APPLIED FLIGHT DYNAMICS II ,AERN,AERN 45150.,,"Aerodynamics, flight dynamics, and flight performance of high performance aircraft. Course includes supersonic aerodynamics, flight stability and handling, and an in-depth investigation and analysis of flight performance parameters including lift, drag, load factor, climb performance, and turn performance.",2011
45200,STRATEGIC AVIATION MANAGEMENT ,AERN,AERN 35340 and AERN 35341 and AERN 45100; senior standing.,,"Serves as the capstone course for the aviation management area of concentration in aeronautics. As such, it is designed to address evolving issues and challenges in aviation management with a particular emphasis on airlines and airports through an application of previously mastered aviation management courses. Students must pass the course with a minimum grade of ""C"" (2.0).",2011
45250,AVIATION LAW ,AERN,AERN 15000.,,"Involves a study of the origins of Western jurisprudence, common law and aviation law as an integral part of law in the U.S. Also introduces international aviation law by lateral agreement as well as U.S. Constitutional law and its amendments as they relate to the structure and process of aviation law. Criminal and civil law as they relate to civil aviation are also addressed. Case studies are included.",2011
45291,AEROSPACE SENIOR SEMINAR ,AERN,Aeronautics (AERN) major and senior standing.,,"Seminar on selected topics relating to problems, issues and conditions of employment within aviation.",2011
45300,AIR TRAFFIC CONTROL CAPSTONE ,AERN,AERN 45320 and 45321.,,"Designed to prepare the student for the AT-Basics, AT-SAT, and to act as the culminating experience for the air traffic control program of study. Includes a combination of practical terminal and en route operations. A grade of ""C"" or higher must be achieved in order to graduate and receive a CTI endorsement.",2011
45320,AIR TRAFFIC CONTROL II ,AERN,AERN 35342.,AERN 45321.,"Advanced study of the concepts of air traffic control and airspace management in the National Airspace System (NAS), with an emphasis on tower and terminal operations.",2011
45321,AIR TRAFFIC CONTROL II LABORATORY ,AERN,AERN 35342.,AERN 45320.,Simulator-based laboratory that includes air traffic control experiences that integrate tower and terminal control procedures.,2011
45340,AIRCRAFT MAINTENANCE ,AERN,Aerospace (AERO) major and senior standing and special approval.,,Fundamentals of aircraft maintenance and resolving maintenance problems on the flight line.,2011
45343,EN ROUTE AIR TRAFFIC CONTROL II ,AERN,AERN 35342.,AERN 45344.,Advanced course on en route air traffic operations with emphasis on current and emerging practices in the National Airspace System (NAS). Course explores emerging paradigms in the Next Generation (NextGen) Air Traffic System.,2011
45344,EN ROUTE AIR TRAFFIC CONTROL II LABORATORY ,AERN,AERN 35342.,AERN 45343.,"Simulator-based advanced practical course on en route air traffic operations, with emphasis on current and emerging practices in the National Airspace System (NAS). Course explores emerging paradigms in the Next Generation (NextGen) air traffic system.",2011
45349,SYSTEMS MAINTENANCE AND RELIABILITY ,AERN,TECH 45340.,,Combines theories of systems and operations with practical experience to meet FAA standards for an airframe and power plant license (300 hours shop experience).,2011
45350,AVIONICS ,AERN,PHY 13011 and 13012; and AERN 15000; and TECH 21021.,,"A study of aviation electronic systems in flight vehicles that pertain to communication, navigation and air traffic control systems.",2011
45648,THEORY OF FLIGHT INSTRUCTION ,AERN,"AERN 35040, 35746, 35747 and 45150.",AERN 45649.,"Detailed fundamentals of teaching flight and ground instruction and the analysis of flight techniques, in order to meet requirements of FAR's part 61.185(a).",2011
45649,FLIGHT INSTRUCTOR/AIRPLANES ,AERN,AERN 35746 and 35747.,AERN 45648.,Flight course with emphasis on instructing techniques in aircraft from right seat. Includes student evaluation techniques to meet FAR requirements for CFI.,2011
45650,CERTIFIED FLIGHT ISNTRUCTOR HELICOPTER FLIGHT ,AERN,2.0 cumulative GPA; and AERN 35746 and 35749.,AERN 45648.,Flight course designed to fulfill FAA requirements for the Flight Instructor Helicopter certificate.,2011
45651,FLIGHT INSTRUCTOR-INSTRUMENTS ,AERN,AERN 45648 and 45649.,,Flight course with emphasis on flight instructing techniques involved with instrument flight and ATC procedures. Student evaluations included.,2011
45652,CERTIFIED FLIGHT INSTRUCTOR INSTRUMENT HELICOPTER FLIGHT ,AERN,2.0 cumulative GPA; and AERN 35646 or 35648; and AERN 45650 or 45659.,,Flight course designed to fulfill FAA requirements for the Flight Instructor Instrument Helicopter certificate.,2011
45653,MULTI-ENGINE PILOT FLIGHT ,AERN,AERN 35747.,,The course provides the required ground and flight instruction necessary to qualify students for the multi-engine rating from the FAA.,2011
45654,CERTIFIED FLIGHT INSTRUCTOR HELICOPTER FLIGHT ADD-ON ,AERN,2.0 cumulative GPA; and AERN 45649.,,Flight course designed to fulfill FAA requirements for the Flight Instructor Helicopter Add-on certificate.,2011
45655,ADVANCED MULTI-ENGINE PILOT FLIGHT ,AERN,AERN 45653.,,Ground flight instruction for proficiency and required hours in preparation for multi-engine instruction.,2011
45656,CERTIFIED FLIGHT INSTRUCTOR INSTRUMENT HELICOPTER FLIGHT ADD ON ,AERN,2.0 cumulative GPA; and AERN 45651.,,Flight course designed to fulfill FAA requirements for the Flight Instructor Instrument Helicopter Add-on certificate.,2011
45657,MULTI-ENGINE FLIGHT INSTRUCTOR ,AERN,AERN 45649 and TECH 45655.,,This course provides the necessary ground and flight instruction to professionally qualify students for the multi-engine instructor rating by the FAA.,2011
45659,BASIC ACROBATIC FLIGHT ,AERN,2.25 GPA and special approval.,,Consists of 15 hours of ground school and 15 hours of flight training reviewing commercial maneuvers and introducing basic aerobatic maneuvers and related classroom theory.,2011
45700,AIRCRAFT DESIGN ,AERN,AERN 15000; and TECH 21021; and PHY 13011 and 13012. Pre/,AERN 45030 and 45150 and 45350.,"Preliminary design of a fixed-wing aircraft for a specific mission: weight estimates; wing platform, airfoil and propulsion; selection airframe configuration and layout design; performance analysis; and overall systems integration.",2011
45710,TURBINE ENGINE THEORY AND OPERATION ,AERN,AERN 35020.,,"An in-depth study of the theory, operation and performance of turbine turboprop engines and associated systems.",2011
45711,TURBINE ENGINE THEORY AND OPERATION LABORATORY ,AERN,AERN 35020. Pre/corequisite: AERN 45710.,AERN 45710.,Laboratory using a turboprop flight simulator to provide instruction and demonstration of the operating characteristics and procedures associated with turbine/turboprop engines.,2011
45720,CREW RESOURCE MANAGEMENT ,AERN,AERN 45130.,,An in-depth study of the common principles of aviation crew resource management (CRM) and human factors as utilized by air transport flight crews.,2011
45721,CREW RESOURCE MANAGEMENT LABORATORY ,AERN,AERN 45130. Pre/corequisite: AERN 45720.,AERN 45720.,Flight simulator-based laboratory that includes flight simulator experiences that integrate CRM and LOFT in a multi crew environment.,2011
45730,APPLIED TRANSPORT CATEGORY AIRCRAFT SYSTEMS ,AERN,AERN 35020 and 35040 and 45030.,,"Course examines various systems in use on air transport aircraft. The course emphasis is on the principles, operation and limitations of complex, integrated systems found in modern aircraft.",2011
45740,FLIGHT MANAGEMENT SYSTEMS ,AERN,AERN 35040 and 45030 and 45350.,,"Course examines various advanced avionics systems used on air transport type aircraft. The course emphasis is on the principles, operation and limitations of integrated avionics related to the ""glass cockpit"" found on modern aircraft.",2011
45791,AVIATION SECURITY AND POLICY SEMINAR ,AERN,AERN 35340 and 35341 and 35342 and 45250.,,"Examines policies, practices, procedures and regulatory provisions developed to create and enhance security in civil aviation with a special emphasis on airlines, airports, airspace and agencies responsible for civil aviation security.",2011
55150,APPLIED FLIGHT DYNAMICS I ,AERN,"MATH 11012 or MATH 12002, PHY 13001 and13002 or PHY 23101 and 23102, and AERN 15000; and graduate standing.",,"A course relating aircraft, engine and propeller performance to the overall flight performance of the typical light airplane. Includes flight test project participation. Special course fee $10 cr./Hr. Subject to change.",2011
55350,AVIONICS ,AERN,PHY 13001 and 13002 or PHY 23101 and 23102; AERN 15000; and TECH 21021; and graduate standing.,,"A descriptive course that covers electronic systems in aviation, particularly from the standpoint of aircraft equipment its operational theory and practical use by the pilot.",2011
55700,AIRCRAFT DESIGN ,AERN,"PHY 13001 and 13002 or PHY 23101 and 23102; AERN 15000; and TECH 21021. Pre/corequisites: AERN 45030, and 45350 and 45150; and graduate standing.","AERN 45030, and 45350 and 45150; and graduate standing.","Preliminary design of a fixed-wing aircraft for a specific mission; weight estimates wing plat form airfoil and, propulsion selection airframe configuration and layout design performance analysis and overall systems integration.",2011
55791,AVIATION SECURITY AND POLICY SEMINAR ,AERN,graduate standing.,,"Analytical review of policies, practices procedures and regulatory provisions designed to create and enhance security in civil aviation with a special emphasis on the impact of emerging technologies on aviation security.",2011
61091,AEROSPACE SEMINAR ,AERN,Graduate standing.,,Discussions of selected technical topics related to aerospace technology. Repeat registration permitted for three semesters maximum.,2011
65300,AIRLINE TRANSPORTATION OPERATIONS ,AERN,Special approval and graduate standing.,,The study of scheduled and nonscheduled airline transport operations under federal air regulations (FAR).135.,2011
65496,AEROSPACE TECHNOLOGY ,AERN,Special approval and graduate standing.,,Individual investigation of selected topic from the field of aerospace.,2011
