71126,RESEARCH IN SOCIAL STUDIES TEACHING AND LEARNING ,CI,Doctoral standing.,,"During this course students will examine, discuss and study research in the teaching and learning of social studies as well as develop their own study of social studies teaching and learning.",2011
71127,TECHNOLOGY AND SOCIAL STUDIES ,CI,Doctoral standing.,,Course provides experiences with and study of various uses of technology in social studies teaching and learning. During the course we will examine implications and effects of technology on student learning teaching and society as a whole.,2011
71130,MULTICULTURAL EDUCATION:STRATEGIES ,CI,Doctoral standing.,,Teachers will be provided with knowledge and strategies for teaching children to function effectively in a pluralistic society.,2011
71133,ISSUES AND TRENDS IN ELEMENTARY SCIENCE ,CI,Doctoral standing.,,"New discoveries in science, including issues in society with direct science content. Emphasis is on practical and simple classroom applications.",2011
71134,RESEARCH TRENDS IN SCIENCE EDUCATION ,CI,Doctoral standing.,,Course in issues relating to research methods pertinent to science education.,2011
71140,CULTURE AND MULTICULTURALISM IN SCIENCE EDUCATION ,CI,Doctoral standing.,,This course provides a general introduction to the impacts of multiculturalism and the social studies of science on science education. Implications for science educational curriculum theory classroom practice and research are explored. Topics examined include race and gender in science education teaching the culture of science and teaching science in a global context.,2011
71141,NATURE OF SCIENCE IN SCIENCE EDUCATION ,CI,Doctoral standing.,,Course in issues relating to the nature of science as it impacts science education.,2011
71142,HISTORY OF INQUIRY IN SCIENCE EDUCATION ,CI,Doctoral standing.,,This course will investigate the continuing debate for what counts as science and how that vision has been represented throughout history. The impacts of the political economic and societal factors on the nature of scientific inquiry will also be discussed within a historical context.,2011
75007,MOTOR SKILL ACQUISITION AND PERFORMANCE ,CI,ELS 6/75030 and doctoral standing.,,"Examination of contemporary motor learning and control theories and laboratory experiences, with emphasis upon motor skill acquisition and performance as studied experimentally. Laboratory included.",2011
75043,SUPERVISION PROCESSES IN SPORT PEDAGOGY ,CI,Doctoral standing.,,A course designed to enhance the ability to develop more effective teaching/learning environments through the use of systematic observation and application of supervisory theory.,2011
75592,INTERNSHIP IN MOTOR DEVELOPMENT ,CI,Special approval and doctoral standing.,,"Supervised and supervisory experiences in motor development for all ages and abilities, including conceptual bases for assessment individualizations task analysis. Maximum of 6 hours applies to degree.",2011
77001,FUNDAMENTALS OF CURRICULUM ,CI,Doctoral standing.,,Orientation to the curriculum field. Theoretical examination of foundations elements design and development of school college and non school curricula.,2011
77002,CURRICULUM LEADERSHIP ,CI,doctoral standing.,,"Explores‟ the theories and practices of curriculum leadership with reference to the current politics of education and the democratic ideals of information-age, pluralistic societies. Mandated accountability reform is critically compared to invited professional renewal. CI 77001 or compatible professional experience with fundamentals of curriculum work is recommended.",2011
77003,TEACHER EDUCATION ,CI,Doctoral standing.,,"This course is designed to provide a broad overview of teacher education, including curriculum, organization, governance and policy.",2011
77004,PROFESSIONAL DEVELOPMENT IN TEACHING ,CI,Doctoral standing.,,"This course is designed to provide a broad overview and conceptual framework for professional development; its historical, cultural, psychological and social contexts.",2011
77005,INTERCULTURAL DIMENSIONS OF TEACHING AND LEARNING ,CI,doctoral standing.,,Increasing intercultural interaction in Departments and communities across the nation and around the world are prompting educational changes in terms of what is being taught and how it is being taught. Educators at all levels are increasingly being called upon to enhance their own intercultural competence and to consider how best to translate this to students in their charge. Addresses teaching and learning in the intercultural K-16 context.,2011
77010,CURRICULUM EVALUATION ,CI,CI 6/77001. Doctoral standing.,,"Students will focus on designing program evaluation related to assessment, development and implementation of curricula, critique national and local curricular programs, apply elements of evaluation models.",2011
77092,ADVANCED PRACTICUM IN CURRICULUM AND INSTRUCTION ,CI,Doctoral standing. Special approval.,,"Supervised program in curriculum design, development and/or implementation. Planned with and directed by a graduate faculty member. Students are required to complete Bureau of Criminal Investigation and Identification (BCII) and Federal Bureau of Investigation (FBI) background checks and submit the results to authorized personnel at their assigned „school/agency‟ before the first day of the semester in which student teaching/ internship will take place.",2011
77095,SPECIAL TOPICS IN CURRICULUM AND INSTRUCTION ,CI,Doctoral standing and special approval.,,"Specialized offerings in response to emerging or selected program needs in curriculum design, development and implementation.",2011
77096,INDIVIDUAL INVESTIGATION IN CURRICULUM AND INSTRUCTION ,CI,Doctoral standing and special approval.,,Directed independent reading and/or research of special interest or need in student's program. Planned with and directed by a graduate faculty member.,2011
77105,IMPROVING CLASSROOM INSTRUCTION ,CI,Doctoral standing.,,"Emphasizes motivation, varied materials and methods individual needs and sources of teacher help. Class members define goals and means.",2011
77107,CURRICULUM AND ORGANIZATION IN THE MIDDLE GRADES ,CI,Doctoral standing.,,"History, philosophy, curriculum and organization of Departments serving children ages 8- 15. Emphasis on development of programs and curriculum that are responsive to the needs of early adolescents.",2011
77108,TEACHING AND LEARNING IN THE MIDDLE GRADES ,CI,Doctoral standing.,,"Pedagogical theories and practices; approaches to instruction, relationship of teaching to learning and development for children, ages 8-15.",2011
77224,TEACHING MATHEMATICS USING COMPUTERS AND CALCULATORS ,CI,doctoral standing.,,The purpose is to develop knowledge of research and theories regarding teaching and learning mathematics via computing devices. Further to develop proficiency in the use of computing devices and software that would be used in the teaching and learning of mathematics.,2011
77225,RESEARCH IN MATHEMATICS EDUCATION ,CI,Doctoral standing.,,"Current research theory, methodology and results in mathematics education will be investigated. Implications for instructional practice and curriculum design will be examined.",2011
77226,IMPROVING MATHEMATICS INSTRUCTION IN MIDDLE CHILDHOOD ,CI,Doctoral standing.,,Instructional psychology and materials including technology for the effective teaching of mathematics in grade three through eight with a theoretical emphasis on cognitive development.,2011
77227,ASSESSMENT IN MATHEMATICS EDUCATION ,CI,"Completion of 2 of the following: ADED 52267, CI 67224, CI 67226, or ECED 50147. Doctoral standing.",,Investigation of standards and practices in mathematical assessments as recommended by NCTM and current research.,2011
77228,INTERVENTION IN MATHEMATICS INSTRUCTION ,CI,"Completion of 2 of the following: ADED 52267, CI 67224, CI 67226, or ECED 50147. Doctoral standing.",,Investigation of alternative methods of teaching mathematics to diverse learners who experience difficulties in learning mathematics.,2011
77240,INTRODUCTION TO ENVIRONMENTAL EDUCATION ,CI,Doctoral standing.,,"Survey course emphasizing current debates in environmental issues, exploring the interconnectedness of ecology, understanding the impact of culture and education on notions of environmental concerns, and how these ideas can be investigated within classroom contexts. The course is designed for teachers, science educators and other concerned citizens of the earth.",2011
77292,CLINICAL PRACTICUM IN MATHEMATICAL ASSESSMENT ,CI,"Completion of 2 of the following: ADED 52267, CI 67224, CI 67226, or ECED 50147. Doctoral standing.",,Experience in designing and administering both formal and informal assessments.,2011
77310,THEORY AND PRACTICE IN THE TEACHING OF READING ,CI,Doctoral standing.,,"Nature and development of reading, approaches to instruction, relation to learning and development.",2011
77311,INTEGRATED LANGUAGE ARTS INSTRUCTION ,CI,Doctoral standing.,,Issues and trends in instruction in listening and in oral and written expression.,2011
77312,TEACHING WRITING AS A PROCESS ,CI,Doctoral standing.,,Emphasizes a process approach to writing instruction in grades K through 12. Examines the steps and studies of composing evaluation and components of a Department-wide program.,2011
77314,SURVEY OF YOUNG ADULT LITERATURE ,CI,Doctoral standing.,,"Presents a survey of selected types of literature appropriate for students in middle Department, junior high and high Department. Emphasis on evaluating, selecting and teaching.",2011
77315,SURVEY OF CHILDREN'S LITERATURE ,CI,Doctoral standing.,,"Wide reading in children's literature, with particular application to school curriculum and field of reading.",2011
77316,CRITICISM OF CHILDREN'S LITERATURE ,CI,CI 6/77315. Doctoral standing.,,A critical study of outstanding children's literature from early times to present.,2011
77318,TEACHING DRAMA IN THE CLASSROOM ,CI,Doctoral standing.,,Presents an in-depth survey of selected types of drama appropriate for elementary and middle school children. Theory and practice are emphasized.,2011
77319,DIAGNOSIS AND REMEDIATION IN READING ,CI,CI 6/77310. Doctoral standing.,,Theory and application of diagnostic principles and remedial reading approaches with Department-age children. Cultural linguistic cognitive and affective factors in diagnosing and remediating reading problems.,2011
77323,CLINICAL PRACTICUM IN CORRECTIVE READING ,CI,CI 67319. Doctoral standing.,,Application of previous courses includes supervised diagnostic/prescriptive reading work with Department-age pupils and diagnostic/remedial reporting.,2011
77330,READING IN CONTENT AREAS ,CI,Doctoral standing.,,Information and competencies for improving students' reading and studying in the content areas. Focus on intermediate grades through postsecondary years.,2011
77331,LITERACY LEARNING IN EARLY YEARS ,CI,Doctoral standing.,,Emphasizes developmental nature of literacy learning in preschool and primary grades; provides techniques for establishing effective reading and writing programs for young children.,2011
77333,BLACK WOMEN AND LITERACY ,CI,Doctoral standing and special approval from instructor.,,"This graduate level course is designed to support inquiry into literacy and its implications for women from the African diaspora. Several aspects of literacy will be considered i.e. verbal, visual, and graphic. Questions will be raised about the implications of these forms of literacy for black women in different geographical locations.",2011
77337,THEORY AND PRACTICE IN TEACHING LITERATURE-SECONDARY AND COLLEGE ,CI,Doctoral standing.,,This course provides a rationale for and means of relating literary theory to classroom practice and pedagogical research. For secondary and post secondary English teachers.,2011
77338,TEACHING BASIC WRITERS-SECONDARY AND COLLEGE ,CI,Doctoral standing.,,Current theory and practices for teaching linguistically diverse writers at the secondary and post-secondary levels. Foundations for teaching language in the context of writing.,2011
77339,WRITING ASSESSMENT AND RESPONSE ,CI,Doctoral standing.,,"Exploration of issues in writing assessment, theoretical base for effective formative response to student writing, and design and implementation of writing assessment measures.",2011
77345,ORGANIZATION AND SUPERVISION OF READING PROGRAMS ,CI,Doctoral standing.,,"Background and strategies for organizing and supervising reading programs. Emphasis on the state of the field, roles and responsibilities and current issues.",2011
77350,COLLEGE/ADULT READING INSTRUCTION ,CI,Doctoral standing.,,Reading strategies for teachers of adult learners with emphasis on the role of the teacher and the development of programs.,2011
77351,PERSPECTIVES ON LITERACY RESEARCH ,CI,Curriculum and instruction (CI) major and doctoral standing.,,"Inquiry into basic concepts and agendas for research through a study of historical, landmark and ground-breaking studies in literacy.",2011
77352,LITERACY COACHING ,CI,,,"Focus on principles and strategies related to literacy coaching, p--adult, within classrooms, Departments and districts. CI 67310 or 77310; and 67319 or 77319; and 67323 or 77323; and 67330 or 77330; and MCED 50005 and doctoral standing.",2011
77392,ADVANCED PRACTICUM AND INTERNSHIP IN READING ,CI,Doctoral standing and special approval.,,Supervised program requiring application of theory and practices in reading in field settings. Planned with and directed by a graduate faculty member. Students are required to complete Bureau of Criminal Investigation and Identification (BCII) and Federal Bureau of Investigation (FBI) background checks and submit the results to authorized personnel at their assigned „school/agency‟ before the first day of the semester in which student teaching/ internship will take place.,2011
77395,SPECIAL TOPICS IN READING ,CI,Doctoral standing and special approval.,,Specialized offerings in response to emerging or selected program needs in reading.,2011
77396,INDIVIDUAL INVESTIGATION IN READING AND LANGUAGE ARTS ,CI,Doctoral standing and special approval.,,Directed independent reading and/or research of special interest or need in student's program. Planned with and directed by a graduate faculty member.,2011
77592,PRACTICUM MATH INTERVENTION ,CI,"ADED 52267, CI 67224 and 67226, ECED 50147. Doctoral standing.",,Practicum in Math Intervention.,2011
77791,SEMINAR IN MATHEMATICS EDUCATION ,CI,Doctoral standing.,,An in-depth exploration of the theoretical frameworks and methodologies used in current research in mathematics education will be conducted.,2011
80089,RESIDENCY I ,CI,Doctoral standing.,,Beginning doctoral seminar. Students begin to explore the field of curriculum and instruction by reading and discussing foundational and current theories and research in the field. Students will begin to identify and explore their research interests in the field.,2011
80090,RESIDENCY II ,CI,CI 80089; doctoral standing.,,"Advanced doctoral seminar. This will be a structured opportunity for students to synthesize research from the field, explore research options for their dissertation study, review literature for their research studies and discuss the development of their research.",2011
80199,DISSERTATION I ,CI,Doctoral standing.,,"Doctoral dissertation for which registration in at least two semesters is required, first of which will be semester in which dissertation work is begun and continuing until the completion of 30 hours.",2011
80299,DISSERTATION II ,CI,Doctoral standing; CI 80199.,,Continuing registration required of doctoral students who have completed the initial 30 hours of dissertation and continuing until all degree requirements are met.,2011
87000,THEORY AND RESEARCH IN TEACHING ,CI,Doctoral standing and special approval.,,Focuses on critical study of contrasting approaches to the study of teaching processes. Surveys issues to give students a more critical perspective and to provoke thought about the relationship among theory research and practice. Required of Curriculum and Instruction Ph.D. students.,2011
87001,THEORY AND RESEARCH IN CURRICULUM ,CI,CI 6/77001. Doctoral standing.,,"Focuses on historic and contemporary examples of curriculum theory and their application in curriculum design, development and evaluation. Examines modes of inquiry used by curriculum researchers and contemporary curriculum issues. Required of CI Ph.D students.",2011
87002,FORMS OF INQUIRY IN CURRICULUM AND INSTRUCTION ,CI,Doctoral standing.,,"Introduction to the history, context, philosophy and ethics of inquiry in curriculum and instruction. Emphasis on acquainting Curriculum and Instruction doctoral students with faculty lines of inquiry and research foci while preparing doctoral students for critical consumption of and significant contribution to inquiry in curriculum and instruction.",2011
87091,SEMINAR IN CURRICULUM AND INSTRUCTION ,CI,Doctoral standing and instructor's special approval.,,A wide range of topics for advanced graduate inquiry. Normally a balance of theoretical study and creative application.,2011
87098,RESEARCH IN CURRICULUM AND INSTRUCTION ,CI,Doctoral standing and special approval.,,Students pursue an individualized research project on a specialized topic with approval and under direction of instructor.,2011
87340,RESEARCH IN READING ,CI,Doctoral standing and special approval.,,An introduction to a perspective on psychological processes underlying levels of reading from pre-reading to mature reading with implications for instruction.,2011
87342,SEMINAR IN READING AND LANGUAGE ,CI,Doctoral standing.,,"Exploration of some of the issues, methods and findings on the relationship of reading and language. Examination of selected issues such as dialect bilingualism readability language based-strategies for reading instruction.",2011
87343,RESEARCH IN TEACHING OF WRITING ,CI,Doctoral standing.,,Issues and methodologies in research in the teaching of writing. Students will review the literature and conduct research in a significant area of writing instruction.,2011
87391,SEMINAR IN READING ,CI,Doctoral standing and special approval.,,Variable topic seminar for advanced study of specialized areas and topics. Normally designed around research and theory applied to practice.,2011
87398,RESEARCH IN READING AND LANGUAGE ARTS ,CI,Doctoral standing and special approval.,,Students pursue an individualized research project on a specialized topic with approval and under direction of instructor.,2011
87517,NEW LITERACIES IN PRACTICE ,CI,doctoral standing.,,"Developing technologies are changing the very definition of ""literacy."" Course designed to provide an overview of current (and past) theory and practices related to the growing line of inquiry known as “new literacies.” Participants of the class follow their own paths of inquiry related to the question: How is our definition of “literacy” changing? Participants engage in discussions of theoretical positions related to this question (from perspectives as “new literacies,” “multiliteracies,” and “arts-based knowing” to name a few) as well as encounter such ""nuts and bolts"" information as how to set up a blog or a wiki and basics of video editing. Appropriate for any educator who is interested in examining how “new literacies” are transforming our classrooms.",2011
87791,DOCTORAL SEMINAR IN MATHEMATICS EDUCATION ,CI,Doctoral standing and CI major and special approval from instructor.,,Doctoral Seminar in Math Education.,2011
