20091,PREPROFESSIONAL SEMINAR IN EDUCATIONAL STUDIES ,CULT,,,"Introduction to the nature and scope of educational service delivery across settings, and to the social and cultural foundations of educational policies and programs. Open to any university student and to those considering alternative careers in education.",2011
29535,EDUCATION IN A DEMOCRATIC SOCIETY ,CULT,,,"Students utilize readings, explore themes, broadly explore purposes of school in society and what knowledge, dispositions and performances are necessary to be a successful teacher today.",2011
39539,INTRODUCTION TO THE PHILOSOPHY OF EDUCATION ,CULT,Junior standing.,,An introduction to the philosophical analysis of educational problems focusing on the goals of education and the Department's role in achieving these goals.,2011
39595,SPECIAL TOPICS IN CULTURAL FOUNDATIONS ,CULT,,,Directed reading and/or research of special interest or need to small groups of students in cultural foundations. Planned with and directed by a faculty member. IP grade permissible.,2011
39596,INDIVIDUAL INVESTIGATION IN CULTURAL FOUNDATIONS ,CULT,pecial approval.,,Directed independent reading and/or research of special interest or need in student program. Planned with and directed by a faculty member.,2011
40093,VARIABLE TITLE WORKSHOP IN CULTURAL FOUNDATIONS ,CULT,pecial approval.,,Variable topics; designed to respond to specialized needs of various groups within the context of trends issues and problems in the educational foundations disciplines. S u graded.,2011
49570,SOCIAL FOUNDATIONS OF MULTICULTURAL EDUCATION ,CULT,,,"Explores the history, social context, and issues in multicultural education (formal PK-12) in the U.S. Students gain an appreciation of the challenges of equalizing opportunity of educational achievement, an understanding that is essential for 21st century educational leadership.",2011
50093,VARIABLE TITLE WORKSHOP IN CULTURAL FOUNDATIONS ,CULT,Graduate standing and special approval.,,"Offered on request of school system. Enrollment limited to teachers, administrators or supervisors who are employed in sponsoring system and who are accepted to the university. May be repeated once for total maximum credit of six hours.",2011
59570,SOCIAL FOUNDATIONS OF MULTICULTURAL EDUCATION ,CULT,graduate standing.,,"Explores the history, social context, and issues in multicultural education (formal PK-12) in the U.S. Students gain an appreciation of the challenges of equalizing opportunity of educational achievement, an understanding that is essential for 21st century educational leadership.",2011
60199,THESIS I ,CULT,Graduate standing and special approval.,,"Thesis student must register for total of 6 hours, 2 to 6 hours in a single semester distributed over several semesters if desired.",2011
60299,THESIS II ,CULT,CULT 60199. Graduate standing.,,Thesis students must continue registration each semester until all degree requirements are met.,2011
65530,FOUNDATIONS OF EDUCATION AND HUMAN SERVICES ,CULT,Graduate standing.,,"Inquiry into the assumptions and implications of educational policies and practices in education and human service settings through the application of historical, philosophical and sociological perspectives.",2011
66531,PROFESSIONAL PRACTICE IN A MULTICULTURAL SOCIETY ,CULT,Graduate standing.,,Interdisciplinary inquiry into issues of pluralism and its influence on professional practice in education and human service settings. Cross-cultural interaction will be analyzed; reflection on developing culturally responsive professional practice.,2011
69521,PROFESSIONAL PRACTICE IN A MULTICULTURAL SOCIETY ,CULT,graduate standing.,,Interdisciplinary inquiry into issues of pluralism and its influence on professional practice in education and human service settings. Cross-cultural interaction will be analyzed; reflection on developing culturally responsive professional practice.,2011
69522,ETHICS IN PROFESSIONAL PRACTICE ,CULT,graduate standing.,,An examination of ethics in departmenting and other educational settings through foundational study and issue analysis; strong case study and professional application emphasis.,2011
69530,MULTICULTURAL THEORIES AND SCHOLARSHIP IN EDUCATION ,CULT,graduate standing.,,"An investigation of multicultural theories in education, the social sciences and humanities as articulated in the works of major scholars. Approaches to research and scholarship and contemporary issues in public discourse is explored.",2011
69543,HIGHER EDUCATION IN THE UNITED STATES ,CULT,Graduate standing.,,"Examines the historical, philosophical, social, political and economic roots of current programs, policies, practices and commitments of institutions of higher education in the United States.",2011
69560,CONTEMPORARY PHILOSOPHY OF EDUCATION ,CULT,graduate standing.,,Explores a range of contemporary philosophical perspectives on the moral and political dimensions of education. Students will be introduced to the philosophical frameworks through which these questions are discussed within the field of philosophy of education and they will have opportunity to engage these debates in the course of carefully structured writing assignments.,2011
69564,HISTORY OF AMERICAN EDUCATION ,CULT,Graduate standing.,,"European origins and American innovations in colonial education, rise of common Department, completion of education ladder. Emphasis is on present status and recent developments.",2011
69565,HISTORY OF WESTERN EDUCATION ,CULT,Graduate standing.,,Educational ideals and practices of European and Western civilizations in their historical contexts. Evaluation of their influence on present educational thought and practice.,2011
69567,HISTORY OF HIGHER EDUCATION ,CULT,Graduate standing.,,"Overview and exploration of history of higher education in the United States. Survey course covers ancient and medieval European antecedents but focuses largely on American Higher Education from the seventeenth through the 20th century. Students explore changes in student body, curricula and purposes of higher education in the U.S. in the context of American culture.",2011
69568,GREAT IDEAS IN EDUCATION ,CULT,Special approval of instructor and graduate standing.,,An examination of major influential ideas in education through original sources from Plato to Skinner.,2011
69569,INTERNATIONAL EDUCATION: FOUNDATIONAL ISSUES ,CULT,graduate standing.,,"An introductory seminar to explore current foundational issues and challenges in education worldwide (non-formal, formal PK-advanced post-secondary education). Students gain an understanding of the socio-political, historical context of education worldwide and implications for local policy formation. An international-comparative approach connects and integrates cross-cultural literature, theoretical and research scholarship, on the impact of world dynamics on education. Students also explore the impact of education on economies and social compacts worldwide, with attention to inequalities or marginalities based on region, social status, ethnicity, race, religion, gender and disability.",2011
69570,MULTICULTURAL EDUCATION: THEORY AND POLICY ,CULT,Graduate standing.,,"Theoretical foundations of cultural pluralism, structural marginalization processes, knowledge construction, equity pedagogy and praxis in intercultural relations, democratic change processes and policy addressing inequities in institutional practices.",2011
69571,GLOBALIZATION AND EDUCATION ,CULT,Graduate standing.,,A multi-disciplinary exploration of the impact of globalization/localization on the delivery and uses of education and the dynamics of power and resistance in globalized education.,2011
69575,ANTHROPOLOGY AND EDUCATION ,CULT,graduate standing.,,"Students explore the contributions that cultural and social anthropologists have made to the study of education broadly conceived, focusing particularly on studies addressing the interrelationships among education, culture and forms of social inequity. Through engaging in critical readings of classic and contemporary educational ethnographics, students explore the myriad ways in which ""culture"" has been theoretically conceptualized as well as the implications of those conceptualizations for educational inquiry and practice.",2011
69591,SEMINAR IN CULTURAL FOUNDATIONS ,CULT,Graduate standing and special approval.,,Variable topic seminar for advanced study of specialized topics and areas; in cultural foundations; emphasis on theory and research findings as related to educational practice.,2011
69592,ADVANCED PRACTICUM AND INTERNSHIP IN CULTURAL FOUNDATIONS ,CULT,Graduate standing and special approval.,,"Supervised program in field setting involving application of theories, principles and methodology in cultural foundations of education; planned with and supervised by graduate faculty member.",2011
69595,SPECIAL TOPICS IN CULTURAL FOUNDATIONS ,CULT,graduate standing.,,Specific topic course offering in response to emerging student or program needs in cultural foundations of education.,2011
69596,INDIVIDUAL INVESTIGATION IN CULTURAL FOUNDATIONS ,CULT,Graduate standing and special approval.,,Students pursue an individual project on a specific topic in cultural foundations of education with approval and under direction of instructor.,2011
69598,RESEARCH IN CULTURAL FOUNDATIONS ,CULT,Graduate standing and special approval.,,Students pursue an individual research project on a specific topic in cultural foundations of education with approval and under direction of instructor.,2011
70093,VARIABLE TOPIC WORKSHOP IN CULTURAL FOUNDATIONS ,CULT,doctoral standing and special approval.,,"Offered on request of school system. Enrollment limited to teachers, administrators or supervisors who are employed in sponsoring system and who are accepted to the university. May be repeated once for total maximum credit of six hours.",2011
79510,PHILOSOPHY OF EDUCATION ,CULT,CULT 6/79560 or 6/79568. Doctoral standing.,,Analysis of selected philosophies of education through examination of philosophical problems of education.,2011
79530,MULTICULTURAL THEORIES AND SCHOLARSHIP IN EDUCATION ,CULT,doctoral standing.,,"An investigation of multicultural theories in education, the social sciences and humanities as articulated in the works of major scholars. Approaches to research and scholarship and contemporary issues in public discourse is explored.",2011
79543,HIGHER EDUCATION IN THE UNITED STATES ,CULT,Doctoral standing.,,"Examines the historical, philosophical, social, political and economic roots of current programs, policies, practices and commitments of institutions of higher education in the United States.",2011
79552,LEGAL FOUNDATIONS OF EDUCATON ,CULT,Doctoral standing.,,"The impact of the federal constitution, statutes and case law on public education is studied. Historical intent and current application of related laws are included.",2011
79560,CONTEMPORARY PHILOSOPHY OF EDUCATION ,CULT,doctoral standing.,,Explores a range of contemporary philosophical perspectives on the moral and political dimensions of education. Students will be introduced to the philosophical frameworks through which these questions are discussed within the field of philosophy of education and they will have opportunity to engage these debates in the course of carefully structured writing assignments.,2011
79564,HISTORY OF AMERICAN EDUCATION ,CULT,doctoral standing.,,"European origins and American innovations in colonial education, rise of common Department, completion of education ladder. Emphasis is on present status and recent developments.",2011
79565,HISTORY OF WESTERN EDUCATION ,CULT,Graduate standing.,,Educational ideals and practices of European and Western civilizations in their historical contexts. Evaluation of their influence on present educational thought and practice.,2011
79567,HISTORY OF HIGHER EDUCATION ,CULT,doctoral standing.,,"Overview and exploration of history of higher education in the United States. Survey course covers ancient and medieval European antecedents but focuses largely on American Higher Education from the seventeenth through the 20th century. Students explore changes in student body, curricula and purposes of higher education in the U.S. in the context of American culture.",2011
79568,GREAT IDEAS IN EDUCATION ,CULT,Special approval of instructor and doctoral standing.,,An examination of major influential ideas in education through original sources from Plato to Skinner.,2011
79569,INTERNATIONAL EDUCATION: FOUNDATIONAL ISSUES ,CULT,doctoral standing.,,"An introductory seminar to explore current foundational issues and challenges in education worldwide (non-formal, formal PK-advanced post-secondary education). Students gain an understanding of the socio-political, historical context of education worldwide and implications for local policy formation. An international-comparative approach connects and integrates cross-cultural literature, theoretical and research scholarship, on the impact of world dynamics on education. Students also explore the impact of education on economies and social compacts worldwide, with attention to inequalities or marginalities based on region, social status, ethnicity, race, religion, gender and disability. Gaining a broad understanding of the place of education in a rapidly changing world is essential for 21st century educational leadership and the formation of constructive policies for the future of both developed and developing countries.",2011
79570,MULTICULTURAL EDUCATION: THEORY AND POLICY ,CULT,Doctoral standing.,,"Theoretical foundations of cultural pluralism, structural marginalization processes, knowledge construction, equity pedagogy and praxis in intercultural relations, democratic change processes and policy addressing inequities in institutional practices.",2011
79571,GLOBALIZATION AND EDUCATION ,CULT,doctoral standing.,,A multi-disciplinary exploration of the impact of globalization/localization on the delivery and uses of education and the dynamics of power and resistance in globalized education.,2011
79575,ANTHROPOLOGY AND EDUCATION ,CULT,doctoral standing.,,"Students explore the contributions that cultural and social anthropologists have made to the study of education broadly conceived, focusing particularly on studies addressing the interrelationships among education, culture and forms of social inequity. Through engaging in critical readings of classic and contemporary educational ethnographies, students explore the myriad ways in which ""culture"" had been theoretically conceptualized, as well as the implications of those conceptualizations for educational inquiry and practice.",2011
80085,LEGAL RESEARCH IN EDUCATION ,CULT,CULT 79552 and doctoral standing.,,"Methods of legal research, case analysis and a ""uniform system of citation"" are studied.",2011
80090,DOCTORAL RESIDENCY SEMINAR ,CULT,Doctoral standing.,,Advanced doctoral residency seminar for students in all areas of educational foundations. Focus on current and emergent issues research and trends in education in multiple settings.,2011
80091,SEMINAR: GREAT ISSUES IN EDUCATION ,CULT,Open to doctoral students from any field.,,Interdisciplinary review of current great issues in education that are catalogs for presentation after discussion with membership of the course.,2011
80199,DISSERTATION I ,CULT,Doctoral standing and special approval.,,"Doctoral dissertation for which registration in at least two semesters is required, first of which will be semester in which dissertation work is begun and continuing until the completion of 30 hours.",2011
80299,DISSERTATION II ,CULT,Doctoral standing; CULT 80199.,,Continuing registration required of doctoral students who have completed the initial 30 hours of dissertation and continuing until all degree requirements are met.,2011
85535,INTERPROFESSIONAL STUDIES ,CULT,Doctoral standing.,,"Comprehensive analysis of issues affecting professional practice in education and human service resource settings. Examination of questions related to inter-professional collaboration on policy, research and practice.",2011
89571,COMPARATIVE AND INTERNATIONAL EDUCATION ,CULT,Doctoral standing.,,Comparative analysis of contemporary educational policies and structures in large-and small scale societies throughout the world.,2011
89581,PROSEMINAR IN CULTURAL FOUNDATIONS ,CULT,Doctoral standing,,Doctoral seminar to familiarize PhD students with cultural and social foundations of education as a field of study so that they may locate their inquiry within the relevant knowledge base and academic disciplines that comprise the cultural foundations of education.,2011
89582,SOCIAL PERSPECTIVES OF EDUCATION ,CULT,Doctoral standing.,,Examines selected social factors that influence the development of educational policies and patterns of research relating to school and non-school educational settings.,2011
89591,SEMINAR IN CULTURAL FOUNDATIONS ,CULT,Doctoral standing.,,Variable topic seminar for advanced study of specialized topics and areas in cultural foundations; emphasis on theory and research findings as related to educational practice.,2011
89592,ADVANCED PRACTICUM AND INTERNSHIP IN CULTURAL FOUNDATIONS ,CULT,doctoral standing and special approval.,,"Supervised program in field setting involving application of theories, principles and methodology in cultural foundations of education; planned with and supervised by graduate faculty member.",2011
89595,SPECIAL TOPICS IN CULTURAL FOUNDATIONS ,CULT,doctoral standing.,,Specific topic course offering in response to emerging student or program needs in cultural foundations of education.,2011
89596,INDIVIDUAL INVESTIGATION IN CULTURAL FOUNDATIONS ,CULT,doctoral standing and special approval.,,Students pursue an individual project on a specific topic in cultural foundations of education with approval and under direction of instructor.,2011
89598,RESEARCH IN CULTURAL FOUNDATIONS ,CULT,doctoral standing and special approval.,,Students pursue an individual research project on a specific topic in cultural foundations of education with approval and under direction of instructor.,2011
