51801,VOICE AND SPEECH I-THE ACTOR'S INSTRUMENT ,THEA,pecial approval and graduate standing.,,"The use of exercise and specific text work to explore „centering‟ as it related to the vocal, physical and emotional process of the actor. Focus on extremes of emotional sounds and eliminating barriers and detrimental vocal habits/speech patterns.",2011
51808,ACTING STYLES I-SHAKESPEARE ,THEA,graduate standing an special approval.,,"The application of acting, movement, and voice and speech techniques to sonnets, monologues, soliloquies, and scenes from Shakespeare.",2011
57063,HISTORY OF DANCE AS A THEATRICAL PHENOMENON I ,THEA,graduate standing and special approval of instructor.,,History of Dance from antiquity to 1900.,2011
57163,HISTORY OF DANCE AS A THEATRICAL PHENOMENON II ,THEA,pecial approval of instructor and graduate standing.,,History of the development of concert and theatrical dance forms from 1900.,2011
57174,PRINCIPLES OF DANCE COMPOSITION I ,THEA,Special approval and graduate standing.,,Movement exploration with emphasis on the concepts of design structure and form.,2011
60096,INDIVIDUAL INVESTIGATION-COSTUME HISTORY ,THEA,Special approval and graduate standing.,,The study of 20th-century costume and international dress.,2011
60196,INDIVIDUAL INVESTIGATION-HISTORIC TEXTILES ,THEA,Graduate standing.,,Identification and analysis of textile fabric as the reflection of culture.,2011
60199,M.F.A. THESIS PROJECT ,THEA,Special approval of adviser and graduate standing.,,Students must register for course during the semester of their M.F.A. thesis project. Not repeatable.,2011
60992,PROFESSIONAL THEATRE INTERNSHIP I,THEA,pecial approval of instructor and graduate standing. 3.000 OR,,"(Repeatable once) Intensive advanced training in practical aspects of production. Periodic seminars, laboratory sessions and performance in the Porthouse Theatre Company.",2011
61000,INTRODUCTION TO GRADUATE STUDY IN THEATRE ,THEA,pecial approval of instructor and graduate standing.,,Orientation to bibliography and research in the field of theatre with emphasis on application of research to performance.,2011
61094,COLLEGE TEACHING IN THEATRE ,THEA,pecial approval of instructor and graduate standing.,,"Strategies for teaching, issues on implications of pedagogical practice and responsibilities of academic leadership.",2011
61095,SPECIAL TOPICS ,THEA,pecial approval of instructor and graduate standing.,,Offered irregularly when unusual resources permit a topic different from existing courses. Topic will be announced when scheduled. Repeated registration permitted.,2011
61096,INDIVIDUAL INVESTIGATION: THEATRE AND DRAMA ,THEA,Special approval and graduate standing.,,Independent study of an area or problem approved by divisional graduate coordinator in consultation with project director. Repeatable for maximum of 6 credit hours.,2011
61098,RESEARCH,THEA,pecial approval of instructor and graduate standing.,,(Repeatable for credit) Research or individual investigation for master's-level graduate students. Credits may be applied toward meeting degree requirements if school approves.,2011
61110,HISTORY OF THEORIES OF ACTING AND SPACE I ,THEA,pecial approval of instructor. Prerequisite: special approval of instructor and graduate standing.,,History of theories of acting and space in the theatre from the beginning to ca. 1850.,2011
61111,HISTORY OF THEORIES OF ACTING AND SPACE II ,THEA,pecial approval of instructor and graduate standing.,,History of theories of acting and space in the theatre.,2011
61191,SEMINAR: THEATRE HISTORY AND THEORY ,THEA,Graduate standing.,,"An investigation of a period, historical/theoretical development, playwright/ practitioner/theorist (variable topics).",2011
61199,THESIS I ,THEA,Graduate standing.,,"Thesis students must register for a total of 6 hours, 2 to 6 hours in a single semester distributed over several semesters if desired.",2011
61201,SOFTWARE APPLICATIONS ,THEA,Special approval and graduate standing.,,"A survey of current software used in theatre production with an emphasis on applications for management, design and technical direction.",2011
61299,THESIS II ,THEA,THEA 61199 and graduate standing.,,Thesis students must continue registration each semester until all degree requirements are met.,2011
61303,ACTING III SCENE STUDY-NATURALISM AND ABSURD ,THEA,Special approval of instructor and graduate standing.,,"In-depth scene study in the genres of Naturalism and Absurd theatre. Exploration of the works of Chekhov, Strindberg, Beckett and others.",2011
61305,ACTING STYLES II: GREEK AND COMEDY OF MANNERS ,THEA,pecial approval of instructor and graduate standing.,,"Application of acting, movement, and speech techniques to these specific genres. Focus on style and physicalization using Greek and English Restoration playwrights as well as Molière, Wilde and others.",2011
61309,MASTER OF FINE ARTS COMPREHENSIVE PROJECT IN ACTING ,THEA,THEA 61000; special approval of instructor and graduate standing.,,"Intensive work in the development of the practical aspects of production; includes performance or exhibition of work, documentation of that work in a format appropriate for area and project, and an exit interview.",2011
61310,MASTER OF FINE ARTS DESIGN AND TECHNOLOGY CULMINATING PROJECT ,THEA,THEA 61000; special approval of instructor and graduate standing.,,"An intensive experience in the development of design and/or technical aspects of a theatrical production; the scope of work may include but not necessarily be limited to research, drawings and drafting, renderings and associated digital image, video or audio files. Documentation, appropriate for the area and project, is presented at an exit interview.",2011
61391,SEMINAR: PLAYWRITING ,THEA,Special approval and graduate standing.,,Intensive analysis of dramaturgical theory. Scope of the inquiry dependent upon individual interests of those enrolled.,2011
61497,PRODUCTION COLLOQUIUM ,THEA,Special approval and graduate standing.,,Collegial exploration of the intersections among creative and scholarly/critical/theoretical thinking. Students involved in the colloquium may be pursuing current creative projects under faculty supervision. Does not count toward degree.,2011
61521,ADVANCED THEATRE DRAFTING ,THEA,Special approval and graduate standing.,,"Advanced drafting techniques for the technical director, scenic designer and lighting designer. Includes film, television, industrial and engineering graphic techniques.",2011
61522,ADVANCED STUDIES IN LIGHTING DESIGN ,THEA,pecial approval of instructor and graduate standing.,,"Detailed exploration of the skills of designing lighting with emphasis on theatre, opera, ballet, alternative venues and professional standards.",2011
61524,ADVANCED STUDIES IN COSTUME DESIGN FOR STAGE AND SCREEN ,THEA,THEA 51524 and graduate standing.,,"Detailed exploration of skills in designing costumes for stage and screen. Emphasis on concept work, stylist work, accuracy in research, organizational skills and industry standards.",2011
61525,MILLINERY AND 3-D CHARACTERS ,THEA,pecial approval of instructor and graduate standing.,,Advanced studies of techniques of millinery construction and 3D character construction with an emphasis on current practice in the industry.,2011
61527,SHOP MANAGEMENT ,THEA,Special approval and graduate standing.,,Study of resource management for the professional shop. Topics business planning labor relations accounting budgeting and productivity techniques.,2011
61561,ADVANCED CONSTRUCTION THEORY ,THEA,Special approval and graduate standing.,,The theory and practice of structural and mechanical design for theatre production. Related issues in resource management for the professional shop.,2011
61621,ADVANCED STUDIES IN SCENE PAINTING ,THEA,Special approval and graduate standing.,,Advanced study of the techniques used in painting scenery for theatre and television. Emphasizes professional standards and the practical application of skills.,2011
61622,ADVANCED STUDY: SCENERY FOR STAGE AND SCREEN ,THEA,Special approval and graduate standing.,,"Detailed exploration of the skills of designing scenery with emphasis on theatre, opera, ballet, film, television and alternative venues and the professional standards associated with each area.",2011
61701,"MOVEMENT, FORM AND SPACE II-NEUTRAL AND CHARACTER MASK ",THEA,THEA 51701; special approval of instructor and graduate standing.,,Advanced skills and conditioning focusing on the physical and vocal qualities of characterization achieved through performance in masks.,2011
61702,MUSICAL THEATRE STYLES ,THEA,pecial approval of instructor and graduate standing.,,The study of diverse styles of choreography for the actor performing in Musical Theatre.,2011
61801,VOICE AND SPEECH II-VOCAL DEMANDS AND DIALECTS ,THEA,pecial approval of instructor and graduate standing.,,"Voice principles are covered in depth and detail with emphasis on their applications to dialects, singing and media voice work.",2011
61802,VOICE AND SPEECH III-THE ACTOR/SINGER ,THEA,THEA 51801; special approval of instructor and graduate standing.,,Training in methods and skills necessary for the singing actor. Focus on the integration and physicalization of lyrics and music.,2011
61806,SINGING FOR THE ACTOR ,THEA,THEA 51801; special approval of instructor and graduate standing.,,A comprehensive study of performance techniques and repertoire appropriate to the singing actor.,2011
61992,PROFESSIONAL THEATRE INTERNSHIP II ,THEA,pecial approval and graduate standing. 3.000 OR,,"Intensive advanced training in practical aspects of production. Periodic seminars, laboratory sessions and performance in a professional theatre company.",2011
62092,PRACTICUM: DESIGN/TECHNOLOGY ,THEA,pecial approval of instructor and graduate standing.,,"Practical experience for the graduate student in theatre design and technology under faculty supervision. SU grading, IP permissible.",2011
62192,PRACTICUM: PERFORMANCE ,THEA,pecial approval of instructor and graduate standing.,,Practical experience for the graduate student in theatre performance under faculty supervision.,2011
62292,PRACTICUM: THEATRE MANAGEMENT ,THEA,Special approval and graduate standing.,,Practical experience for the graduate student in theatre management under faculty/staff supervision. Repeatable for a total of 12 hours.,2011
62792,PRODUCTION DRAMATURGY,THEA,pecial approval of instructor and graduate standing.,,"(Repeatable for credit) Under faculty supervision, a student will serve as dramaturg to a school of Theatre and Dance production.",2011
62892,THEATRE PRACTICUM ,THEA,Special approval and graduate standing.,,"Practical experience for the graduate student in co-curricular theatre activities, under faculty supervision. Repeatable twice.",2011
62992,THEATRE PRODUCTION INTERNSHIP ,THEA,Special approval of adviser and graduate standing.,,"Intensive advanced training in practical aspects of production. Periodic seminars, laboratory sessions and performance in a theatre company or touring with Kent Theatre Ensemble. Repeatable for a maximum of 12 hours.",2011
63192,MENTORSHIP IN PERFORMANCE,THEA,graduate standing and special approval of instructor.,,"(Repeatable for a total of 6 credit hours) Development of advanced skills and abilities to mentor student performers in aspects of the profession, including professional behavior, understanding of the business and the actor‟s creative process. Major work done while participating in rehearsal and performance of main stage productions or assisting in THEA 451305 Professional Aspects. May be taken with THEA 62192 Practicum: Performance.",2011
64192,MENTORSHIP AT PORTHOUSE,THEA,graduate standing and special approval of instructor.,,"(Repeatable for a total of 6 credit hours) Development of advanced skills and abilities to mentor student performers in aspects of the profession, including professional behavior, understanding of the business and the actor‟s creative process. Major work done while participating in rehearsal of Porthouse productions. May be taken with THEA 62192 Practicum: Performance.",2011
65192,TEACHING PRACTICUM,THEA,THEA 61094; and graduate standing; and special approval of instructor.,,"(Repeatable for a total of 6 credit hours) Application of strategies for teaching acting and other aspects of the art of theatre and performance at the college level. Development of advanced skills in course preparation, classroom management and pedagogical practice. Major work done teaching or assisting with undergraduate- and/or graduate-level studio acting classes.",2011
67070,PRINCIPLES OF DANCE COMPOSITION II ,THEA,Special approval and graduate standing.,,Movement exploration with emphasis on the development of advanced choreographic techniques.,2011
72892,THEATRE PRACTICUM ,THEA,Special approval and doctoral standing.,,"Practical experience for the graduate student in co-curricular theatre activities, under faculty supervision. Repeatable twice.",2011
72992,THEATRE PRODUCTION INTERNSHIP,THEA,pecial approval of adviser and doctoral standing.,,"(Repeatable for a total of 12 credit hours)Intensive advanced training in practical aspects of production. Periodic seminars, laboratory sessions and performance in a theatre company or touring with Kent Theatre Ensemble.",2011
