Course Number,Course Name,Department,Prerequisites,Corequesites,Description
HIED 76670 ,"INTERNATIONALIZATION OF HIGHER EDUCATION INSTITUTIONS
",HIED,Doctoral standing.,None,"(Cross-listed with HIED 66670) Students study the historical and current development of the internationalization
of higher education institutions; explore higher education administrative leadership characteristics,
social/political/economic factors, and national and international relationships that have affected various countries
and regions; and examine rationales behind internationalization of higher education institutions, its meaning and
approaches, and the different strategies and organizational models in different types of higher education
institutions."
HIED 76671 ,"THE ADMINISTRATION OF MULTICULTURALISM AND DIVERSITY IN HIGHER
",HIED,Doctoral standing.,None,"EDUCATION
(Cross-listed with HIED 66671) Course covers racial/ethnic and inclusive diversity and multiculturalism in U.S
higher education settings. Diversity is discussed from a historical perspective providing a context for
contemporary experiences described by and about students, staff, faculty and administrators. Main topics
include multiculturalism in higher education in light of inclusive education; racial and ethnic diversity in higher
education history; benefits of diversity; faculty issues; student issues; administrator and leadership issues;
curriculum and pedagogy matters; research issues; law and policy issues and strategic planning for institutional
diversity in higher education."
HIED 76672 ,"INTERNATIONAL STUDENTS AND AMERICAN COLLEGES
",HIED,Doctoral standing.,None,"(Cross-listed with HIED 66672) Bridging theory and application with an emphasis on the latter. The course
begins with a national perspective and then concentrates on the various aspects and best practices of recruiting
and supporting international students at the institutional level."
HIED 76673 ,"RESEARCH IN ADMINISTRATION OF INTERNATIONAL HIGHER EDUCATION
",HIED,"Major in HigherEducation and Student Personnel (EAHE) or Educational Administration-Higher Education (EDHE) or special
approval from the instructor. Doctoral standing. 
",None,"(Cross-listed with HIED 66673) Examines and analyzes research related to higher education administration in
the field of international and global education. Implications for application of findings for improvement of
colleges and universities at home and abroad will be thoroughly discussed."
HIED 76674 ,"COMPARATIVE HIGHER EDUCATION
",HIED,"Major in Higher Education and StudentPersonnel (EAHE) or Educational Administration-Higher Education (EDHE) and doctoral standing. 
",None,"Students learn the differences between comparative, international and cross-border education. They reflect on
how the United States higher education system grew out of specific historical, cultural and socio-economic
contexts and analyze the higher education systems and structures of other selected countries and regions,
focusing on the contexts which have influenced their development. Students examine emerging trends in the
globalization of qualifications frameworks and quality assessment standards, and define their own positions in
aspects of the universal criteria/local contexts debate."
HIED 76675 ,"DESIGN AND DELIVERY OF EDUCATION ABROAD PROGRAMS
",HIED,doctoral standing.,None,"Participants examine the many critical aspects of designing, planning and implementing an education abroad
program; analyze its components, and, with others, design a new program. Students also consider the
institutional contexts in which the program design occurs, on a campus or third-party organizational level,
including design decisions about curriculum content and program delivery mechanisms, co-curricular activities,
safety issues and more. Students also develop skills in conducting needs assessments and program evaluations."
HIED 76676 ,"INTERCULTURAL COMMUNICATION FOR INTERNATIONAL EDUCATORS
",HIED,doctoral standing.,None,"Students examine both classic and evolving intercultural communication theories, with an emphasis on the
practical application of those theories to working in intercultural environments in higher education. Students
analyze cultural influences on individuals, through the reading of cultural biographies and reflection on cultural
influences in their own lives. Definitions of intercultural competence and strategies for intercultural learning,
particularly in higher education contexts, are reviewed, with implications for program design in education
abroad, work with international students, and other international education contexts, as relevant."
HIED 76677 ,"WORKFORCE, ECONOMIC AND COMMUNITY DEVELOPMENT IN COMMUNITY COLLEGES
",HIED,doctoral standing.,None,"Within the context of social, economic, and technology shifts, this course examines the role of the community
college in workforce, economic and community development."
HIED 76678 ,"ISSUES AND TRENDS IN COMMUNITY COLLEGE ADMINISTRATION
",HIED,doctoral standing.,None,"Addresses current salient issues in community college administration. A variety of topics are examined as
related to challenges for community college leaders arising from social, economic and political
shifts."
HIED 76679 ,"CAREER ADVISING: THEORY AND PRACTICE
",HIED,Doctoral standing.,None,"(Slashed with HIED 66679) Develop practical skills in providing developmentally appropriate theory based
academic and career advising to assist individuals in adding meaningful and purposeful work into their lives."
HIED 76680 ,"ADMINISTRATION OF CAREER AND ADIVISING SERVICES
",HIED,docotoral standing.,None,"(Slashed with HIED 66680) Examines contemporary issues in administration of career and academic advising
services. Challenges students to rethink the models and methods used to prepare individuals to enter the
workforce and navigate their careers."
HIED 76681 ,"ADMINISTRATION OF ADVISING SERVICES
",HIED,HIED 66653 or HIED 76653; and graduate standing.,None,"(Slashed with HIED 66681) Examines contemporary issues in administration of academic advising services.
Challenges students to rethink models and methods used to prepare individuals to enter the workforce and
navigate their careers."
HIED 76733 ,"INTERPERSONAL AND GROUP DYNAMICS IN EDUCATIONAL ORGANIZATIONS
",HIED,Doctoral standing.,None,"(Cross-listed with HIED 66733) Participants work in task groups learning about interpersonal, group and
intergroup dynamics in organizations through lectures, discussions and analysis of their in-group experiences."
HIED 76740 ,"THEORIES AND METHODS OF ORGANIZATIONAL DEVELOPMENT
",HIED,"Major in Higher Education and Student Personnel(EAHE) or Educational Administration-Higher Education (EDHE) or special approval from the instructor doctoral
standing. 
",None,"(Cross-listed with HIED 66740) Study of theorists/practitioners in organization development. Involves
exploration of consultant roles intervention theory methods of systems change applied to groups and
organizations. Cross listed with CHDS 77840."
HIED 76749 ,"ASSESSMENT AND EVALUATION IN HIGHER EDUCATION
",HIED,Doctoral standing.,None,"(Cross-listed with HIED 66749) This course is designed to provide an understanding of current assessment and
evaluation methods in higher education settings. Topics will span from individual classroom assessment through
institutional accreditation processes."
HIED 80080 ,"DISSERTATION PREPARATION SEMINAR
",HIED,doctoral standing and special approval.,None,Gain an in-depth understanding of the dissertation writing process. Complete dissertation proposal.
HIED 80199 ,"DISSERTATION I
",HIED,"doctoralstanding and special approval. 
",None,"(Repeatable for credit)Doctoral dissertation for which registration in at least two semesters is required, the first
of which is a semester in which dissertation work is begun and continuation of 30 hours."
HIED 80299 ,"DISSERTATION II
",HIED,"HIED 80199 anddoctoral standing. 
",None,"(Repeatable for credit)Continuing registration required of doctoral students who have completed the initial 30
hours of dissertation and continuing until all degree requirements are met."
HIED 86521 ,"ADVANCED EDUCATION LAW
",HIED,"HIED 6/76520 or HIED6/76652 or HIED 6/76518; and doctoral standing. 
",None,"This doctoral-level course is designed to provide the opportunity for students to gain additional knowledge in the
education law area; to improve writing skills; to begin writing for publication; to critically review their own work,
as well as work of others; and to defend their work before their peers."
HIED 86558 ,"ADVANCED EDUCATIONAL LEADERSHIP
",HIED,HIED 6/76657; and doctral standing.,None,"(Slashed with HIED 66558) This advanced leadership seminar is designed to provide the opportunity for
students to gain additional knowledge and skills in educational leadership, to improve research writing and
teaching skills; to share and discuss leadership knowledge and insights with their peers and to defend their work
before their peers."
HIED 86559 ,"ADVANCED STUDENT AND ADULT DEVELOPMENT
",HIED,"Majorin Higher Education and Student Personnel (EAHE) or Educational Administration-Higher Education (EDHE) or
special approval of the instructor; HIED 6/76653, doctoral standing. 
",None,"Helps develop an in-depth understanding of one or more current theories of student or adult development.
Students will gain additional knowledge in student development theory and theory creation."
