Course Number,Course Name,Department,Prerequisites,Corequesites,Description
MIS 84275 ,"CORPORATE AND GLOBAL STRATEGY
",MIS,doctoral standing.,None,"Focuses on review and integration of the several streams of literature dealing with strategy for, and
management of, the product-diversified and/or internationally-diversified firm. Also, in order to complement the
emphasis of other doctoral offerings on strategy formulation topics, this seminar places a special emphasis on
strategy process, organizational structure, and administrative mechanisms. In particular, it explores the
foundations as well as current research on corporate governance, broadly define. This includes (I) the set of
mechanisms available to align the interest of top managers to those of shareowners, as well as (II) the
mechanisms available to motivate and control middle managers so that their decisions and behaviors are aligned
with intended corporate and/or international strategy and goals."
MIS 84277 ,"ORGANIZATIONAL BEHAVIOR AND THEORY
",MIS,doctoral standing.,None,"An examination of theory and research on individual and group behavior in organizations. Special attention is
given to theories of motivation, job satisfaction, goal setting, task design, feedback systems, group dynamics,
power and teams."
MIS 84285 ,"TECHNOLOGY MANAGEMENT AND ENTREPRENEURSHIP
",MIS,doctoral standing.,None,"Covers topics pertaining to innovation management at micro-level (entrepreneurship, corporate
entrepreneurship), meso-level (networks), and macro-level (cross-country and within-country comparisons)."
MIS 84291 ,"SEMINAR IN MANAGEMENT SYSTEMS
",MIS,doctoral standing and special approval of instructor.,None,"(Repeatable for credit)Intensive investigation of selected topics in organization and strategic management.
Student will be expected to undertake research on a topic determined in joint consultation with the instructor."
