Course Number,Course Name,Department,Prerequisites,Corequesites,Description
MIS 24053 ,"INTRODUCTION TO COMPUTER APPLICATIONS
",MIS,None.,None,"(Equivalent to COMT 11000) Develop competency in the operation of contemporary software and hardware
applications. To develop an appreciation for the contribution of computers, software and the Internet to society."
MIS 24056 ,"FUNDAMENTALS OF BUSINESS STATISTICS
",MIS,"MATH 11010or MATH 11012 or MATH 12002. 
",None,"(Equivalent to BMRT 21004) Introduction to concepts in statistical methods and their applications to real world
problems. Examines both the theoretical and practical side of the different methods."
MIS 24065 ,"WEB PROGRAMMING
",MIS,MIS 24053.,None,"Principles of visual design as applied to Web site interface development. The course exposes students to the
basics of programming and relational database and how to develop a Web-based database driven interactive
information system."
MIS 24093 ,"VARIABLE TITLE WORKSHOP IN MANAGEMENT AND INFORMATION SYSTEMS
",MIS,Permission.,None,"(Repeatable for credit)Special workshop in management and information systems. Credits depend on scope of
project."
MIS 24163 ,"PRINCIPLES OF MANAGEMENT
",MIS,minimum sophomore standing.,None,"(Equivalent to BMRT 11009) Introductory course in management and organizational design. The leading
contributions in the area are reviewed and practical implications are developed. The course covers the principles
that most management professors have come to expect in an introductory course: planning, organizing, leading,
and controlling. In addition, the students need to be aware of critical issues managers must be aware of to
succeed: diversity, globalization, ethics, technology, among them. The course serves as an introduction to many
upper level business courses."
MIS 34032 ,"DATA AND FILE TECHNOLOGY
",MIS,MIS 24060.,None,"An introduction to file architecture and data base management systems. The application of these technologies is
detailed."
MIS 34036 ,"ENTERPRISE SYSTEMS AND BUSINESS PROCESSES
",MIS,"minimumcumulative 2.500 GPA; and MIS 24053 with a minimum C (2.000) grade; and MIS 24065. 
",None,"Introduction to the structure and use of Enterprise Systems and Business Processes. Course topics include Data
Navigation, Client Server Systems, Virtualization, Database, Security, Accounting and Procurement Processes,
ERP simulation games and hands-on experience with a professional ERP system."
MIS 34045 ,"SMALL SYSTEMS TECHNOLOGY
",MIS,MIS 24060.,None,"An examination of the role of small computer systems within an organization's information systems
environment."
MIS 34054 ,"USING INFORMATION SYSTEMS FOR SOLVING BUSINESS PROBLEMS
",MIS,"Cumulative 2.500 GPA; and MIS 24053 or COMT 11000. Course not open tocomputer information systems (CIS) majors. 
",None,"Examine key concepts about information systems that are relevant for business managers. The focus will be on
promoting an understanding of the use of IS in solving business problems. There will also be hands-on
assignments."
MIS 34055 ,"COMPUTER DECISION MODELING
",MIS,"Cumulative 2.500 GPA; and MIS 24053 or COMT 11000; and MIS24056 or MATH 10041 or BMRT 21004. Course not open to computer information systems (CIS) majors. 
",None,"Introduces students to the scientific decision-making tools of operations research and management science, and
also to the use of spreadsheet modeling for problem formulation and solution without the need for mathematics.
The concepts of modeling and better decision making are stressed along with illustrations from the various
functional areas of business."
MIS 34059 ,"SERVICE OPERATIONS MANAGEMENT
",MIS,Cumulative 2.500 GPA and MIS 34060.,None,"Provide students with the concepts and tools necessary to effectively manage service operations and to prepare
students for management opportunities in service firms that represent the fastest-growing sector of the
economy. The service management will be presented from an integrated viewpoint with a focus on customer
satisfaction. The course materials are organized around four modules (1) understanding services (2) designing
the service enterprise, (3) managing service operations and (4) toward world class-service."
MIS 34060 ,"OPERATIONS MANAGEMENT
",MIS,"MIS 24053 or COMT 11000;and MIS 24056 or MATH 10041 or BMRT 21004. 
",None,"A survey course in operations management that covers the managerial concepts and the quantitative tools used
in the design, planning operation and control of operations systems."
MIS 34064 ,"MANUFACTURING RESOURCE PLANNING
",MIS,Cumulative 2.500 GPA; and MIS 34060.,None,"Introduce students to the basic tools operations managers use to inform their decisions on a daily basis. The
course involves hands-on coverage of manufacturing resource planning tools, including forecasting and master
production schedules, bill of materials structuring, order entry and purchasing, capacity requirements planning,
routing, costing, customer service, shipping, invoicing and using an enterprise resource planning (ERP) software."
MIS 34065 ,"QUALITY ASSURANCE
",MIS,Cumulative 2.500 GPA; and MIS 34060.,None,"Introduction to importance of quality assurance and tools used to accomplish better quality in goods and
services. Topics TQM, Six Sigma, quality philosophies, sampling plans and statistical process control, ISO,
quality competition and awards."
MIS 34068 ,"SYSTEMS ANALYSIS AND DESIGN
",MIS,"minimumcumulative 2.500 GPA; and MIS 24053 or COMT 11000 with a minimum grade of C (2.000); and minimum C
(2.000) grade in MIS 24065, ENG 21011, COMM 15000 and MATH 11010. 
",None,"This is an introductory course in Systems Analysis and Design. Students will be presented with the concepts,
techniques, and methodologies that are required for the successful development of information systems.
Application of methods and concepts to real-world problems will be emphasized."
MIS 34070 ,"PROGRAMMING THEORY AND APPLICATIONS
",MIS,"minimum cumulative 2.500 GPA; and MIS 24053 with a minimum C (2.000) grade; and MIS 24065 with aminimum C (2.000) grade. 
",None,Programming in a strongly-typed language environment with an emphasis on problem-solving.
MIS 34080 ,"COMPUTER PROGRAMMING FOR BUSINESS I
",MIS,MIS 34070.,None,"Introduces a programming language currently used in business and industry for data processing, decision
making and other information systems applications."
MIS 34092 ,"PRACTICUM IN CAREER DEVELOPMENT
",MIS,"minimum 2.500 cumulativeGPA; and junior standing. 
",None,"In-depth training and development course designed to prepare students for resume presentation, job search,
interviewing, participation in the internship and career launching."
MIS 34157 ,"INTRODUCTION TO HEALTHCARE SYSTEMS MANAGEMENT
",MIS,none.,None,"Provides an overview of the management, economic and policy issues facing the healthcare, pharmaceutical,
biotechnology and medical device industries. The course perspective is global, with emphasis on the U.S. as the
largest and most profitable market."
MIS 34158 ,"MANAGERIAL AND TECHNOLOGICAL ASPECTS OF HEALTHCARE SYSTEMS MANAGEMENT
",MIS,MIS 34157.,None,"Introduce the main components of health care information technology, with emphasis on the components that
distinguish the health care delivery system from other business enterprises. Pepares students as clinical
managers and consultants who must rely upon or manage information technology to accomplish their objectives."
MIS 34159 ,"MANAGING HEALTHCARE SYSTEMS OPERATIONS
",MIS,MIS 34157.,None,"Operational process management, cost-control and productivity is critical to cost-effective healthcare. Covers
topics in improving operations such as patient flow, quality (concepts and mechanics) and process improvement.
Students become familiar with methods and resources for implementing change in a health care setting, such as
a hospital or outpatient clinic. Provides skills to assess current hospital operations and to identify the appropriate
tools to address various functional areas, useful for managers, consultants, clinical providers and others. Process
improvement methods such as lean thinking, six sigma, statistical tools, flowcharting, queuing models and other
tools are covered. Health care settings beyond the hospital, such as outpatient clinics, are included."
MIS 34165 ,"DYNAMICS OF LEADERSHIP
",MIS,MIS 24163 or BMRT 11009.,None,"This course discusses management and leadership concepts and does so by blending theory and practice. Cases
studies, practical application approaches, personal assessment and opportunities to develop individual and group
leadership skills are possible. In addition, many organizational behavior concepts are blended throughout the
course. Students that have already passed MIS 34175 will not receive graduation credit for MIS 34165."
MIS 34175 ,"LEARNING TO LEAD
",MIS,special approval.,None,"This is a hands-on learning and leadership course. Classroom time occurs over 4 days at a residential camp
before the semester begins. Students learn about leadership from professora, experts in the field, and each
other through interactive discussions and activities. During the semester students continue their leadership
development working with a personal mentor, and practice their skills through community service projects.
Students that have already passed MIS 34165 will not receive graduation credit for MIS 34175."
MIS 34180 ,"HUMAN RESOURCE MANAGEMENT
",MIS,"Cumulative 2.500 GPA;and MIS 24163 or BMRT 11009. 
",None,"Focuses on the importance of the management of human resources for any organization, its employees,
customers, shareholders, and the community where it is located. The topic helps students understand the
important issues that derive from managing people at work and the changing environment organizations face.
Students will learn the integral role human resources management plays to the success or failure of an
organization. Both practical and theoretical perspectives are presented."
MIS 34185 ,"INDIVIDUAL AND GROUP BEHAVIOR IN ORGANIZATIONS
",MIS,MIS 24163 or BMRT 11009.,None,"Determinants of individual and group behavior within work organizations. Topics covered include, motivation, job
design, learning, decision making, leadership and group behavior as they relate to performance and other
outcomes in work organizations."
MIS 34187 ,"INTERNATIONAL EXPERIENCE IN HUMAN RESOURCE MANAGEMENT
",MIS,"a minimum C grade in either MIS 34180 or BMRT 31006; and minimum2.520 overall GPA; and sophomore standing; and special approval. 
",None,"Guided introduction to applied Human Resource Management in another culture by examining opportunities and
challenges. Via select company tours, tour of historical sites and meetings with management from local
companies as well as U.S. companies doing business in foreign countries, students will be exposed to the current
HR functions and practices in a foreign country, such as selecting and managing a workforce, compliance with
the employment laws, employee training and development, expatriation repatriation, performance management,
and compensation issues."
MIS 34280 ,"SOCIAL RESPONSIBILITY IN THE WORKPLACE
",MIS,Cumulative 2.500 GPA; and MIS 24163 or BMRT 11009.,None,"Using a case-based approach to learning, this course provides information on what constitutes appropriate
business behavior by examining the major business and nonbusiness factors that influence business policies and
practices."
MIS 44007 ,"PROJECT MANAGEMENT AND TEAM DYNAMICS
",MIS,"minimum cumulative 2.500 GPA; and MIS 24053 with a minimum C (2.000) grade; and MIS24065. 
",None,"Overview of the principles, tools, and techniques of project management in organizations, with emphasis on
practical aspects of initiating, planning, executing, and costing information systems related projects. Practical
examples of computer information systems projects will be used to illustrate these principles and techniques."
MIS 44009 ,"THE BUSINESS CASE FOR SUSTAINABILITY
",MIS,minimum cumulative 2.500 GPA; and junior standing.,None,"Lays the foundation for sustainable development and the balance issues between economic, social and
environmental interests. It frames the business enterprise within the natural and social environments, and
surveys a variety of intersection points and the challenges they pose. Systems thinking and long term
perspective are used to understand the potential consequences of organizational choices regarding goals and
strategies, given consideration of how the natural environment increasingly drives the business environment."
MIS 44033 ,"ADVANCED COMPUTER PROGRAMMING FOR BUSINESS
",MIS,"minimum cumulative 2.500 GPA; and MIS 24053 with a minimumgrade of C (2.000); and MIS 24065 with a minimum grade of C (2.000); and MIS 34070. 
",None,"Covers Java programming language, including applications and applets, with emphasis on object-oriented
programming. The course also emphasizes problem solving, developing systems, structured programming and
programming style conventions."
MIS 44042 ,"NETWORK THEORY AND APPLICATIONS
",MIS,minimum cumulative 2.500 GPA; and MIS 24053 with minimum C (2.000) grade; and MIS 24065.,None,"Presentation of current and emerging network technologies and services in business applications and
performance issues. Topics include transmission media, modulation and signaling schemes, switching and
multiplexing techniques, local and wide area network protocols and standards, and internetworking devices."
MIS 44043 ,"DATABASE MANAGEMENT SYSTEMS
",MIS,minimum cumulative 2.500 GPA; and 24053 with a minimum C (2.000) grade; and MIS 24065.,None,"Development of skills and knowledge associated with the utilization, design, implementation, and administration
of database management systems in organizations. Emphasis is on enterprise-level database systems."
MIS 44044 ,"SYSTEMS ANALYSIS II
",MIS,"MIS24060. 
",None,"Physical system implementation: mapping logical data models and process models to physical data bases and
system design; system coding, testing, installation, conversion, training and automated tools."
MIS 44045 ,"INFORMATION SYSTEMS MANAGEMENT
",MIS,"senior standing; and minimum cumulative 2.500 GPA; and MIS 24053 with a minimum C (2.000)grade; and MIS 24065. 
",None,"Management of information systems resources in organizations of all types and sizes; IT best practices; the
effective and efficient use of IS in support of the organization’s mission and to achieve competitive advantage in
today’s global economy; the impact of IT on enterprises, users, customers, society, and the environment."
MIS 44048 ,"SOFTWARE INTEGRATION
",MIS,"Cumulative 2.500 GPA; minimum grade of C (2.000) in MIS 24053; and MIS24065; and senior standing. 
",None,"The design and implementation of information systems. Traditional and alternative development strategies are
investigated from a theoretical and applied perspective. Group project to implement information system with
software packages."
MIS 44049 ,"NETWORK MANAGEMENT AND CYBERSECURITY
",MIS,minimum cumulative 2.500 GPA; and MIS 24053 with a minimum grade of C (2.000); and MIS 24065.,None,"The course explores technologies and business issues related to computer networking and security, with
emphasis on the protocols in modern business networking such as Ethernet and TCP-IP. Topics also include
cybersecurity threats and defenses, privacy, cloud and parallel computing, and map-reduce."
MIS 44061 ,"OPERATIONS MANAGEMENT AND CONTROL
",MIS,Cumulative 2.500 GPA; and MIS 34061.,None,"Introduces the student to the key functions of an operations planning and control system. Operations planning
and control systems provide information for the efficient flow of materials, the effective utilization of people and
equipment and the proper coordination of internal activities with suppliers and customers."
MIS 44062 ,"SUPPLY CHAIN MANAGEMENT
",MIS,minimum 2.500 overall GPA and junior standing.,None,"Students learn the basic analytical tools needed to coordinate business operations across the value chain.
Course involves hands-on coverage of supply chain management with emphasis on supplier partnering and
development, customer relations management, strategic sourcing and pricing, e-business, measuring supply
chain performance, mass customization, planning supply and demand coordination in the supply chain."
MIS 44065 ,"STRATEGIES IN PRODUCTION AND OPERATIONS MANAGEMENT
",MIS,Cumulative 2.500 GPA; and MIS 44064.,None,"Senior project in industrial management. Applies concepts from all prior coursework to the solution of real and
simulated operating problems."
MIS 44091 ,"SEMINAR IN HUMAN RESOURCE MANAGEMENT
",MIS,minimum 2.500 cumulative GPA; and MIS 34180 or BMRT 21006.,None,"(Repeatable for credit) In-depth readings, discussion projects and presentations in a specialized area of human
resource management."
MIS 44093 ,"VARIABLE TITLE WORKSHOP IN MANAGEMENT AND INFORMATION SYSTEMS
",MIS,Cumulative 2.500 GPA.,None,(Repeatable for credit) Variable title workshop courses offered under management and information sciences.
MIS 44095 ,"SPECIAL TOPICS IN MIS
",MIS,Cumulative 2.500 GPA; and junior standing.,None,"(Repeatable for credit) Offered on a semester basis with different topics and differnt faculty involved each time
the course if offered."
MIS 44096 ,"INDIVIDUAL INVESTIGATION IN MANAGEMENT
",MIS,Special approval.,None,"(Repeatable for credit)Presents opportunity to undertake research. Approval of topic and agreement to work
with student must be secured from faculty member and the chairperson of the department prior to registration."
MIS 44152 ,"PROJECT MANAGEMENT
",MIS,Minimum cumulative 2.500 GPA and junior standing.,None,"This course covers the fundamental concepts, procedures and processes related to managing projects from
initiation through planning, execution and closing. It also introduces the principles, tools and methods used in
project management, and the use of project management software (ProjectLibre) in managing projects. The
topics covered in the course can be helpful in preparing for Project Management Professional (PMP) certification."
MIS 44163 ,"GLOBAL BUSINESS MANAGEMENT
",MIS,"senior standing andminimum 2.50 cumulative GPA; and minimum C (2.00) in ENG 21011, COMM 15000 and MATH 11010. 
",None,"Provides an overview of contemporary issues and theoretical frameworks in the field of international strategic
management using traditional lecture and practical application cases."
MIS 44183 ,"DEVELOPING AND TRAINING HUMAN RESOURCES IN ORGANIZATIONS
",MIS,"Cumulative 2.500GPA; and MIS 34180 or BMRT 21006l. 
",None,"Course focus is quality training design, based upon theory and empirical research. Implications for practice and
current challenges in employee training and development are also highlighted."
MIS 44185 ,"STAFFING HUMAN RESOURCES
",MIS,"a minimum C grade in either MIS 34180 or BMRT 31006;and a minimum 2.500 overall GPA. 
",None,"Staffing, development of systems to select, place, promote, and retain employees to enhance organizational
effectiveness and maintain legal compliance are core HRM activities in organizations. This course will provide
students with an understanding of the technical components of selection, including how to determine which
applicant characteristics should be examined, what procedures should be used to gather information, and how
that information should be combined to identify qualified job applicants. In addition, this course focuses on
promotion and retention of employees."
MIS 44187 ,"INTERNATIONAL EMERGING ENTERPRISES AND MARKETS
",MIS,"MIS 24163 with aminimum C grade; minimum overall 2.500 GPA; sophomore standing; and special approval. 
",None,"This course focuses on strategy and policy development and execution for gaining and sustaining global
competitive advantage. Strategic management of entrepreneurial and well-established firms, and operational
and financial structures of international firms and markets are discussed."
MIS 44191 ,"SENIOR RESEARCH SEMINAR IN MANAGEMENT
",MIS,Special approval.,None,"(Repeatable for credit)Combination of individual or group research and class discussion for superior students.
Investigations in administration and organization conducted in accordance with scholarly interests of
participants."
MIS 44192 ,"INTERNSHIP IN MANAGEMENT
",MIS,"MIS 24163 with minimum C grade; and minimum2.500 overall GPA; and special approval. 
",None,"(Repeatable for credit) A supervised field experience requiring a minimum of 145 hours of work at a cooperating
organization. Requires regular contact with instructor and preparation of an internship report connecting
academic coursework to on the job experiences."
MIS 44195 ,"ADVANCED TOPICS IN HUMAN RESOURCE MANAGEMENT
",MIS,"minimum 2.500cumulative GPA; and MIS 34180 or BMRT 21006. 
",None,"(Repeatable for a total of 6 credit hours) Advanced topics course that are offered on a yearly basis. Topics can
span the full range of HR functions. This course can also have a practicum format."
MIS 44284 ,"MANAGEMENT CAPSTONE
",MIS,"usites: ACCT 23020 and ACCT 23021; ECON 22060 and ECON 22061; and MKTG25010; and MIS 24053, MIS 24056, MIS 24163 and MIS 34060; and FIN 26074 and FIN 36053; and minimum
2.500 overall GPA; and senior standing; and General Business (GBUS) major. 
",None,"This course integrates various management concepts in informing a manager's strategic decision making
process. Students use case analyses and class lectures to demonstrate their leadership abilities in different
business scenarios."
MIS 44285 ,"INTEGRATED BUSINESS POLICY AND STRATEGY
",MIS,"ACCT 23020 and ACCT 23021; and ECON 22060 and ECON 22061; and MKTG25010; and MIS 24053, MIS 24163, MIS 24056 and MIS 34060; and FIN 26074 and FIN 36053; and minimum
cumulative GPA of 2.500; and major within the College of Business Administration; and senior standing. 
",None,"Integration of the functional areas of business in the formulation and implementation of policy. Projects and case
analyses of business situations provide students with the opportunity to apply analytical and creative problem
solving skills."
MIS 44292 ,"BUSINESS EXPERIENCE AND INTERNSHIP
",MIS,"minimum 2.500 cumulative GPA; and MIS 24053 with aminimum grade of C (2.000); and MIS 24065. 
",None,"(Repeatable for credit) Learning by experience by performing activities related to the information systems
profession in a cooperating organization."
MIS 44293 ,"WORKSHOP IN PROFESSIONAL IS CERTIFICATION
",MIS,"minimumcumulative 2.500 GPA; and MIS 24053 with a minimum C (2.000) grade; MIS 24065. 
",None,"Supervised workshop in which students are coached with the objective of passing a commercial certification
exam to obtain Microsoft, Cisco, or other vendor's Information Technology credential."
MIS 44295 ,"SPECIAL TOPICS IN INFORMATION SYSTEMS
",MIS,"minimumcumulative 2.500 GPA; and MIS 24053 with a minimum grade of C (2.000); and MIS 24065. 
",None,"(Repeatable for credit) Learn about the newest advances in Information Systems technology and how they
support business activity. The content of the course changes with each presentation."
MIS 44392 ,"BUSINESS CONSULTING AND PRACTICUM
",MIS,minimum 2.500 cumulative GPA; and junior standing.,None,"Provides decision-making tools for solving real-world problems by building synergies in prior knowledge to create
a synthesis of real life solutions delivery mechanisms underpinning them to pressing problems of the local and
international community. The practicum component includes consulting experience with both for profit and not-
for-profit business clients."
MIS 44445 ,"GLOBAL HUMAN RESOURCE MANAGEMENT
",MIS,"a minimum C grade in either MIS 34180 or BMRT 34180; and a minimum 2.500overall GPA; and senior standing; and student must be enrolled in the human resource management (HRM)
major or minor. 
",None,"The course examines the impact of internationalization and cross-cultural challenges on organizations, the
factors involved in selecting and managing an international workforce, the evaluation of employee relations and
employment law, and address issues such as employee training and development, expatriation repatriation,
performance management, and compensation issues, all from the perspective of managing an international
organization."
MIS 44492 ,"BUSINESS EXPERIENCE AND INTERNSHIP IN HUMAN RESOURCE MANAGEMENT
",MIS,"a minimum C grade in either MIS 34180 orBMRT 31006; and a minimum 2.500 overall GPA; and must be enrolled in the human resource management
(HRM) major or minor. 
",None,"(Repeatable for credit) Learning by experience by performing activities related to the Human Resource
Management profession in a cooperating organization."
MIS 44499 ,"HUMAN RESOURCE BUSINESS CONSULTING AND PROJECTS
",MIS,"a minimum C grade ineither MIS 34180 or BMRT 31006; and a minimum 2.500 overall GPA; and student must be enrolled in the
human resource management minor or major. 
",None,"This course bridges between Human Resource Managment coursework and the world of HRM practice. The
course will provide a variety of learning experiences to help students gain knowledge and practical experience to
prepare them to embark on careers in the HRM profession. Upon completion of this course, students should have
much to discuss in a job interview and a useful entry on your resumes."
MIS 44660 ,"PERFORMANCE MANAGEMENT AND COMPENSATION SYSTEMS
",MIS,"a minimum C grade in either MIS 34180 or BMRT 31006;and a minimum 2.500 overall GPA. 
",None,"The course provides overview of the performance management process, examines various approaches to
performance management, and discusses sources of performance management information. Also considers the
nature of the compensation systems and pay system mechanics, as well as methods for recognizing employee
contributions through compensation."
