Course Number,Course Name,Department,Prerequisites,Corequesites,Description
MIS 44763 ,"HUMAN RESOURCE ANALYTICS AND ERP SYSTEMS
",MIS,"a minimum C grade in either MIS 34180 or BMRT 31006; and minimum 2.500overall GPA. 
",None,"The course examines the use of HR data, metrics, analytics, and ERP systems to guide human resource
management decision making and support the strategic goals of the organization. We will learn the
characteristics of high quality data, introduce common analysis techniques, data interpretation and visualization,
and report assessment. Through lecture, readings, and problem solving exercises using enterprise resource
planning systems (SAP and Oracle), you will gain the knowledge and skills necessary to assess various human
resource management initiatives and formulate solutions to common human-resource-related problems. Upon
completion of the course, you will understand how HR analytics and ERP systems help an organization achieve
its strategic goals."
MIS 64005 ,"ANALYTICS FOR DECISION MAKING
",MIS,graduate standing.,None,"This course uses computer capabilities to analyze and understand a variety of statistical and business analytics
techniques and how to apply these techniques to solving business problems."
MIS 64011 ,"SYSTEMS SIMULATION
",MIS,graduate standing.,None,"Techniques and applications of computer simulation of existing or proposed real-world systems. Use of
simulation language, simulations studies, analysis and interpretation of results."
MIS 64013 ,"NONPARAMETRIC AND ROBUST STATISTICS
",MIS,MIS 64005 or 74005; and graduate standing.,None,"(Cross-listed with MIS 74013) A presentation of statistically sound techniques for those who need to be able to
use nonparametric or robust methods to deal with non-normal distributions or outliers (common problems) in
their data."
MIS 64017 ,"MULTIVARIATE STATISTICS
",MIS,MIS 64023 or 74023; and graduate standing.,None,"This course is devoted to a study of multivariate statistical methods. Topics include multivariate analysis of
variance, canonical correlation, principal component analysis, discriminant analysis cluster analysis and factor
analysis."
MIS 64018 ,"QUANTITATIVE MANAGEMENT MODELING
",MIS,graduate standing.,None,"A variety of optimization and heuristic modeling techniques are explored. Decision-making environments, model
selection, and interpretation are emphasized. Various linear and nonlinear mathematical programming
techniques are the primary topic but are supplemented with other optimization and heuristic techniques."
MIS 64019 ,"RESEARCH SEMINAR IN SUPPLY CHAIN MANAGEMENT
",MIS,"MIS64015 or 74015; and graduate standing. 
",None,"Research seminar designed primarily for students who seek an in-depth understading of the current research
literature in supply chain management and who are interested in doing research in supply chain management.
Students study the academic literature with emphasis on the development and use of analytical tools and
models to solve supply chain management problesm. Specifically, the course will address quantitative modeling
to support operational, tactical and strategic decision-making in supply chain management."
MIS 64020 ,"ADVANCED STATISTICAL MODELS
",MIS,MIS 64023 or 74023; and graduate standing.,None,"This is a special focus course for which the topics will vary. It will generally include sampling techniques,
experimental designs, similar statistical methods, internal and external validity and reliability issues."
MIS 64023 ,"LINEAR STATISTICAL MODELS AND APPLICATIONS
",MIS,"MIS64005 or 74005; and graduate standing. 
",None,"Models and applications of simple and multiple regression, correlation and analysis of variance."
MIS 64026 ,"GLOBAL SUPPLY CHAIN MANAGEMENT AND SUSTAINABLE STRATEGIES
",MIS,MIS 64041; and graduate standing.,None,"Introduces the knowledge base needed to coordinate business operations across global supply chains. Addresses
how to integrate traditional business operations so as to align them in support of inter-firm collaboration
required to compete globally. Investigates specific topics relevant to supply chain management and offers a
managerial orientation towards supporting global supply chain operations. Immerses students into responsible
supply chain practices around the globe with strong emphasis and orientation towards sustainable (green)
supply chains."
MIS 64028 ,"GLOBAL SUPPLY CHAIN BUSINESS MODELS
",MIS,"MIS64026 or 64036; and graduate standing. 
",None,"Focus on modeling techniques for supporting decision making in supply chain management. Introduces students
to the problems facing a global supply chain manager and the implementation of spreadsheet-based models for
solving problems that arise in the operation of a supply chain. Emphasis is placed on model formulation and
interpretation in support of decisions to coordinate and improve supply chain operations."
MIS 64029 ,"SUPPLY CHAIN AND VENDOR MANAGEMENT STRATEGIES
",MIS,MIS 64026; and graduate standing.,None,"Building global ""relationships"" are central pillars to effective supply chain management. There are strategic
relationships, tactical relationships, transactional relationships, internal relationships, and of course,
relationships with the government. As supply chains become global, managers have to consider cultural,
regulatory, and communication differences to create and operate within the global village. Students learn how to
deal with a rapidly changing landscape and understand how to deal with distributed resources, vendors, and
people across cultures and convictions."
MIS 64036 ,"BUSINESS ANALYTICS
",MIS,graduate standing.,None,"Overview of business analytics and its appropriate applications in various industries and functional areas. Critical
thinking, problem definition, problem solving, effective communication, and leadership are emphasized. Methods
such as data visualization and descriptive, predictive, and prescriptive analytics are covered from a broad
perspective. This course is applied, hands-on, and case-based. Cases emphasize the communication of
quantitative solutions to laypeople and required leadership during decision-making and implementation stages."
MIS 64037 ,"ADVANCED DATA MINING AND PREDICTIVE ANALYTICS
",MIS,"CS 63015, MIS 64036 and MIS 64082; and graduate standing.",None,"This course extends the coverage of data mining and predictive analytics. Topics will focus on the applied use of
these techniques in realistic settings. Statistical and machine learning techniques will be covered."
MIS 64038 ,"ANALYTICS IN PRACTICE
",MIS,"CS 63015, MIS 64036 and MIS 64082; and graduate standing.",None,"This course focuses on supporting techniques and managerial and professional skills necessary to being an
effective business analyst. Other topics include project management, requirements analysis, change
management, team dynamics, leadership, ethics, and effective communication between all stakeholders."
MIS 64041 ,"OPERATIONS, SERVICE AND SUPPLY CHAIN MANAGEMENT
",MIS,"MIS64005; and graduate standing. 
",None,"Develops a framework for analysis of operating problems. Uses computer, quantitative and behavioral models to
develop operating plans consistent with organizations' competitive (or service) strategy."
MIS 64042 ,"GLOBALIZATION AND TECHNOLOGY STRATEGY
",MIS,graduate standing.,None,"A critical assessment of how the interweaving of various technologies, innovation, and global business strategies
are shaping managerial and business decision-making."
MIS 64047 ,"MANUFACTURING TECHNOLOGY AND STRATEGY
",MIS,graduate standing and special approval of instructor.,None,"This course provides the student with an introduction to modern techniques in manufacturing and the necessary
strategic concepts to implement them. A similar discussion of service industries is also included."
MIS 64050 ,"ESSENTIALS OF BUSINESS MGMT
",MIS,"Non-College of Business Administration majors; andgraduate standing. 
",None,"This is an introductory management course that discusses functional areas of business and their strategic
positioning in delivering business solutions."
MIS 64080 ,"EMERGING HARDWARE AND SOFTWARE TECHNOLOGIES
",MIS,graduate standing and special approval of instructor.,None,"Investigation of selected emerging hardware and software technologies such as parallel processing systems,
computer languages and operation systems, artificial intelligence, neural networks and chaos theory."
MIS 64081 ,"DATA COMMUNICATIONS AND NETWORKING IN BUSINESS
",MIS,graduate standing and special approval of instructor.,None,"An introduction to telecommunications and computer networks. Topics include telecommunications technologies
and services communication standards and protocols local area networks and network management."
MIS 64082 ,"DATABASE MANAGEMENT AND DATABASE ANALYTICS
",MIS,graduate standing.,None,"The design, implementation and management of database management systems within organizations are
studied from an applied perspective. Additional emphases include data warehousing, structured query language
for analytics, and introductions to NoSQL databases and big data analytics."
MIS 64083 ,"INFORMATION SECURITY: A MANAGERIAL PERSPECTIVE
",MIS,"Admission to MBA program oradmission to MS IAKM program; and graduate standing. 
",None,"Introduction to the information security areas that managers must understand in order to deal with today's
security threat-laden environment. The emphasis is on the important principals and concepts that managers
utilize to develop effective security risk management programs."
MIS 64092 ,"INTERNSHIP IN BUSINESS ANALYTICS
",MIS,graduate standing and special approval.,None,"(Repeatable for credit) A supervised field experience at a cooperating organization. Requires regular contact with
instructor and preparation of an internship report connecting academic coursework to on-the-job experiences."
MIS 64098 ,"CAPSTONE PROJECT IN BUSINESS ANALYTICS
",MIS,"CS 63015, MIS 64036and MIS 64082; and special approval; and graduate standing. 
",None,"(Repeatable for credit) In this culminating project, students draw on the breadth and depth of the curriculum to
address an industry supplied problem individually or in small teams. Projects will explore prescriptive analytics
as is appropriate to their design project. Inprogress (IP) mark permissible."
MIS 64108 ,"APPLIED TOPICS IN HUMAN RESOURCE MANAGEMENT
",MIS,graduate standing.,None,"Course provides students an opportunity to learn about human resource management through an application of
the material to real-world problems. Topics covered may include but not be limited to job analysis, selection
methods, employee training, and performance evaluation."
MIS 64158 ,"LEADERSHIP AND MANAGERIAL ASSESSMENT
",MIS,"graduatestanding. 
",None,"Students develop an understanding of the leadership process. Through critical thinking, class discussions and
class activities, they build skills in leading others, leading themselves, and teamwork."
MIS 64160 ,"LEADERSHIP AND ORGANIZATIONAL CHANGE
",MIS,graduate standing.,None,"Course provides students in-depth knowledge of leading organization change. Covers analysis of existing
conditions, drivers of change and readiness for change along with methods of change and change
implementation."
MIS 64185 ,"BUSINESS STRATEGY
",MIS,graduate standing.,None,"Integrative approach to the study of policy formulation and implementation. Formalized planning systems
reviewed; case analysis of actual business situations helps student further develop analytical and communication
skills."
MIS 64263 ,"EMPLOYEE SELECTION AND APPRAISAL
",MIS,"Graduate standing and MIS64271. 
",None,"This course will focus primarily on issues associated with the person/job matching process in modern
organizations related to the selection and appraisal of employees."
MIS 64270 ,"ORGANZATIONAL ANALYSIS AND DESIGN
",MIS,graduate standing.,None,Course provides students an in-depth examination of all of the factors influencing human behavior at work.
MIS 64271 ,"HUMAN RESOURCE MANAGEMENT
",MIS,graduate standing.,None,"This course explores the management of a firm's human resources from practical and theoretical perspectives of
managing people at work. How high performance work practices (HPWPs) help businesses to motivate their
employees for strategic competitive advantage is emphasized."
MIS 64275 ,"STRATEGIC GLOBAL MANAGEMENT
",MIS,"Completion of 24 credit hours of graduate courses from the College of BusinessAdministration and graduate standing. 
",None,"Strategic global management explores micro-level concepts and strategic managerial alternatives within the
context of current global business operations in the political, economic and cultural environment facing today's
manager."
MIS 74005 ,"STATISTICS FOR MANAGEMENT I
",MIS,admission to MBA program; and doctoral standing.,None,"This course uses computer capabilities to use and understand a variety of statistical techniques and applies
these techniques to business problems."
MIS 74013 ,"NONPARAMETRIC AND ROBUST STATISTICS
",MIS,MIS 64005 or 74005; and doctoral standing.,None,"(Cross-listed with MIS 64013) A presentation of statistically sound techniques for those who need to be able to
use nonparametric or robust methods to deal with non-normal distributions or outliers (common problems) in
their data."
MIS 74017 ,"MULTIVARIATE STATISTICS
",MIS,MIS 64023 or 74023; and doctoral standing.,None,"This course is devoted to a study of multivariate statistical methods. Topics include multivariate analysis of
variance, canonical correlation, principal component analysis, discriminant analysis, cluster analysis and factor
analysis."
MIS 74018 ,"QUANTITATIVE MANAGEMENT MODELING
",MIS,doctoral standing.,None,"A variety of optimization and heuristic modeling techniques are explored. Decision-making environments, model
selection, and interpretation are emphasized. Various linear and nonlinear mathematical programming
techniques are the primary topic but are supplemented with other optimization and heuristic techniques."
MIS 74019 ,"RESEARCH SEMINAR IN SUPPLY CHAIN MANAGEMENT
",MIS,"MIS64015 or 74015; and doctoral standing. 
",None,"Research seminar designed primarily for students who seek an in-depth understading of the current research
literature in supply chain management and who are interested in doing research in supply chain management.
Students study the academic literature with emphasis on the development and use of analytical tools and
models to solve supply chain management problesm. Specifically, the course will address quantitative modeling
to support operational, tactical and strategic decision-making in supply chain management."
MIS 74020 ,"ADVANCED STATISTICAL MODELS
",MIS,MIS 64023 or 74023; and doctoral standing.,None,"This is a special focus course for which the topics will vary. It will generally include sampling techniques
,experimental designs, similar statistical methods, internal and external validity, andreliability issues."
MIS 74023 ,"LINEAR STATISTICAL MODELS AND APPLICATIONS
",MIS,"MIS64005 or 74005; and doctoral standing. 
",None,"Models and applications of simple and multiple regression, correlation and analysis of variance."
MIS 74041 ,"OPERATIONS MANAGEMENT
",MIS,"MIS 64005or 74005; and doctoral standing. 
",None,"Develops a framework for analysis of operating problems. Uses computer quantitative and behavioral models to
develop operating plans consistent with organizations' competitive (or service) strategy."
MIS 74042 ,"GLOBALIZATION AND TECHNOLOGY STRATEGY
",MIS,doctoral standing.,None,"Focus is on the strategic issues around how a firm should manage its technology in a global market. Strategic
issues include understanding the technological and competitive landscape, innovations, competitive advantages
in the high-tech marketplace, outsourcing and information ethics. The core emphasis in on integrated decision-
making in the age of globalization."
MIS 74047 ,"MANUFACTURING TECHNOLOGY AND STRATEGY
",MIS,doctoral standing and special approval of instructor.,None,"This course provides the student with an introduction to modern techniques in manufacturing and the necessary
strategic concepts to implement them. A similar discussion of service industries is also included."
MIS 74080 ,"EMERGING HARDWARE AND SOFTWARE TECHNOLOGIES
",MIS,doctoral standing and special approval of instructor.,None,"Investigation of selected emerging hardware and software technologies such as parallel processing systems,
computer languages and operation systems, artificial intelligence, neural networks and chaos theory."
MIS 74081 ,"DATA COMMUNICATIONS AND NETWORKING IN BUSINESS
",MIS,doctoral standing and special approval of instructor.,None,"An introduction to telecommunications and computer networks. Topics include telecommunications technologies
and services, communication standards and protocols, local area networks and network management."
MIS 74082 ,"DATABASE MANAGEMENT AND DATABASE ANALYTICS
",MIS,doctoral standing.,None,"The design, implementation and management of database management systems within organizations are
studied from an applied perspective. Additional emphases include data warehousing, structured query language
for analytics, and introductions to NoSQL databases and big data analytics."
MIS 74160 ,"LEADERSHIP AND ORGANIZATIONAL CHANGE
",MIS,doctoral standing.,None,"Develop understanding of the theories and techniques needed for the successful management of significant
organizational change with emphasis on discussion, exercises and case studies."
MIS 74185 ,"BUSINESS STRATEGY
",MIS,special approval and doctoral standing.,None,"Integrative approach to the study of policy formulation and implementation. Formalized planning systems
reviewed case analysis of actual business situations helps student further develop analytical and communication
skills."
MIS 74263 ,"EMPLOYEE SELECTION AND APPRAISAL
",MIS,doctoral standing.,None,"This course will focus primarily on issues associated with the person/job matching process in modern
organizations related to the selection and appraisal of employees."
MIS 74270 ,"ORGANIZATIONAL ANALYSIS
",MIS,special approval and doctoral standing.,None,"Theoretical basis and research findings are discussed, permitting the student to analyze and understand complex
work organizations. Data provided prepares the student to analyze, design and solve organizational problems
within the work environment."
MIS 74275 ,"STRATEGIC GLOBAL MANAGEMENT
",MIS,special approval and doctoral standing.,None,"Strategic global management explores micro-level concepts and strategic managerial alternatives within the
context of current global business operations in the political, economic and cultural environment facing today's
manager."
MIS 84007 ,"PHILOSOPHY OF SCIENCE AND BUSINESS MODELS
",MIS,doctoral standing.,None,"Introductory seminar for understanding the forms and the process of business research. Its major objective is to
help seminar participants understand the various philosophies that drive business research in an academic
community, and introductory methods of social science research. Additionally, the seminar seeks to develop
participant motivation to become a contributor to the organizational sciences communities by examining: 1. The
research process, methodologies and strategies. 2. Research Paradigms, Modes and Contexts of Inquiry. 3. The
nature of organizational sciences research. 4. The major streams of business research. 5. Understanding
ontological choice of constructs and defining epistemic relationships between constructs. 6. Building hypotheses
and socio-technical models. 7. Research design, data requirements and collection techniques, ethics and
philosophies."
MIS 84011 ,"SYSTEMS SIMULATION
",MIS,"special approvaland doctoral standing. 
",None,"Techniques and applications of computer simulation of existing or proposed real-world systems. Use of
simulation language, simulation studies, analysis of interpretation and of results."
MIS 84012 ,"SCHEDULING AND PLANNING
",MIS,doctoral standing in the College of Business Administration.,None,"Course is a doctoral seminar on scheduling and planning models that are used in operations and production
management. The goal is to expose students to a portfolio of scheduling and planning models to stimulate
research ideas in scheduling and planning models that will lead to the development of a research program for
your doctoral research."
MIS 84015 ,"STOCHASTIC MODELS
",MIS,doctoral standing.,None,"Mathematical modeling of systems involving one or more random variables, and stochastic processes: basic
probability theory; Poisson process, Markov chain and Markov process with applications to production, inventory,
reliability and queueing systems."
MIS 84045 ,"SOCIAL ISSUES IN INFORMATION SYSTEMS
",MIS,"doctoralstanding. 
",None,"Social issues in information systems arise at the interface between information systems and individuals, groups
and society. The course will begin with a broad exposure to current social issues, moving to an examination of
specific issues in detail with issues chosen by student interest and instructor consent."
MIS 84047 ,"VALUE AND SUPPLY CHAIN MANAGEMENT
",MIS,doctoral standing.,None,"This course is a doctoral seminar for students who seek an in-depth understanding of the current research
literature in supply chain management. The seminar is designed into three modules. The first module covers the
conceptual foundation for understanding value and supply chains from an interdisciplinary perspective. The
second module focuses on the basis of supply chain modeling using optimization and simulation. The third
module serves to integrate the previous modules with the objective of the student producing a research paper
for journal submission."
MIS 84080 ,"INNOVATION, ADOPTION, DIFFUSION
",MIS,doctoral standing.,None,"Provides students with theoretical foundations of adoption and diffusion of technological innovations in
organizations and society. Topics include: determinants of organizational innovation by acquisition; individual-
and organizational-level technology adoption; diffusion of technologies through social systems; and the infusion
and assimilation of technologies in organizations."
MIS 84081 ,"INFORMATION SYSTEMS STRATEGY AND INNOVATION
",MIS,doctoral standing.,None,"This course explores the basis of strategy, deployment and competition in high- technology industries. It
introduces conceptual frameworks based on cutting-edge research in economics and strategy. The frameworks
may seem abstract at first, but we will focus on mastering them will gain an in-depth understanding of how
high-technology industries work and how to develop strategies for managing firms in such industries. Students
will learn how to develop and apply such frameworks in their research."
MIS 84082 ,"DATABASE MANAGEMENT SYSTEMS
",MIS,doctoral standing.,None,"In-depth investigation of intelligent database management systems in support of business decision- making. An
understanding of relational databases is assumed. Object-orientation and other advanced database concepts will
be explored."
MIS 84108 ,"HUMAN CAPITAL SYSTEMS AND SHARED VALUE CREATION
",MIS,doctoral standing.,None,"Course provides a foundation for understanding human capital issues as seen through the lens of sustainability.
Students will learn how to articulate the paradigm of sustainability and apply it to a wide range of organizational
capacities including embedding sustainability within an organization and enabling an organization to pursue
value that is shared across economic, social and environmental domains."
MIS 84112 ,"RESEARCH METHODOLOGY
",MIS,doctoral standing.,None,"The objectives of this course are: to formulate a research problem and develop testable research hypotheses;
develop research skills by learning the different research methods and techniques; explain information contained
in research statistical outputs such as SAS and SPSS enable students to conduct meaningful and high quality
research in their specific field of interest."
MIS 84261 ,"STRATEGIC DECISION-MAKING AND HUMAN RESOURCE MANAGEMENT
",MIS,doctoral standing and special approval.,None,"Provides a first graduate-level introduction to the fundamental concepts of HRM/OB and strategic decision-
making."
MIS 84262 ,"BUSINESS AND ORGANIZATIONAL STRATEGY
",MIS,doctoral standing.,None,"Course focuses on developing a deep understanding of modern strategic theory in relation to other allied fields.
Students will review fundamental concepts of strategic thinking and theory development and then move to
contemporary theoretical issues including transaction-cost economics, the resource-based view, the emerging
theories of real options and of dynamic capabilities, strategic optimization and constraint theory, and dealing
with uncertainty through scenario-driven planning."
MIS 84263 ,"HUMAN RESOURCE MANAGEMENT
",MIS,doctoral standing.,None,"Course focuses on research theories, methods and issues in human resource management. Designed to develop
in students an appreciation for the existing state of research in human resource management and to begin to
articulate major issues and challenges in this field."
MIS 84266 ,"DIRECTED RESEARCH
",MIS,doctoral standing.,None,"Survey of the leading writers and research studies in the area of management systems. The course addresses
methodologies, major theoretical developments and practical applications."
