Course Number,Course Name,Department,Prerequisites,Corequesites,Description
NURS 10060 ,"INTRODUCTION TO PROFESSIONAL NURSING PRACTICE
",NURS,none.,None,"Focus on nursing’s development as a discipline and profession. The art and science of nursing including the
Scope and Standards of Practice, nursing theory, evidence based practice, and therapeutic communication will
be explored."
NURS 20010 ,"INTERPERSONAL AND COMMUNICATION SKILLS FOR HEALTH CARE PROFESSIONALS
",NURS,"nursing (NURS) major and sophomorestanding. 
",None,"A skill-development course, with readings, experiential learning activities and oral and written communication
assignments. It is designed to help students enhance their self-confidence in interacting with other people,
individually or in groups, and develop their capabilities in writing, leading groups and presenting information.
Assertiveness techniques, presentation of self, critical thinking and collaboration skills complement the
development of interpersonal and communication competencies. Active learning methods are used to facilitate
growth at any level of current student development."
NURS 20020 ,"FOUNDATIONS OF ASSESSMENT AND COMMUNICATION IN NURSING
",NURS,Special approval.,None,"Individuals are assessed as members of families and community members. Communication in nursing is
explored."
NURS 20025 ,"PHARMACOLOGY AND ALTERATIONS IN PHYSIOLOGICAL FUNCTIONING I
",NURS,uisiste: sophomore standing; and nursing (NURS) major. ,NURS 20020.,"(Repeatable for credit) This course provides nursing students with an introduction to the basic principles of
pathophysiology and pharmacology. It offers a general understanding of pathophysiologic processes of body
systems and the major classes of pharmacotherapeutic agents that are used to treat these pathophysiologic
processes. The course focuses on mechanisms of action, effects of medications, pharmacodynamics,
pharmacokinetics, as well as principles that guide the administration of medications, dosage, and nursing
responsibilities. Age and cultural differences related medication administration will be addressed throughout the
course."
NURS 20030 ,"FOUNDATIONS OF NURSING INTERVENTIONS
",NURS,NURS 20010 and NURS 20020 with a grade of C (2.000) or better.,None,"Foundations of nursing interventions focuses on selected aspects of nursing care to improve the health of
individuals within families and groups. Utilizes principles of the interpersonal process, nursing process and
professional nursing."
NURS 20950 ,"HUMAN GROWTH AND DEVELOPMENT FOR HEALTH PROFESSIONALS
",NURS,PSYC 11762 and sophomore standing.,None,"Examines theoretical principles and concepts of human growth and development throughout the life cycle
applicable to personal and professional activities essential to the accurate assessment of human needs and
understanding human behaviors."
NURS 21095 ,"SPECIAL TOPICS IN NURSING
",NURS,Sophomore standing.,None,(Repeatable for credit)Scheduled topics of interest to faculty and students.
NURS 21096 ,"INDIVIDUAL INVESTIGATION IN NURSING
",NURS,Sophomore standing and special approval.,None,"(Repeatable for credit)Designed for the student interested in exploration and research of material not covered in
required nursing courses."
NURS 25010 ,"INTRODUCTION TO ACCELERATED NURSING
",NURS,none.,None,"Focus is on nursing’s development as a discipline and a profession. Students use group process in developing the
necessary oral and written communication skills needed for practicing nurses. Provides students the tools to
succeed in an accelerated BSN program. Topics covered include time management, study skills, test taking
strategies, critical thinking and self care."
NURS 25020 ,"INTRODUCTION TO PROFESSIONAL NURSING AND INTERPERSONAL AND
",NURS,nursing (NURS) major; and special approval.,None,"COMMUNICATION SKILLS: LPN TRANSITION
Required for all LPN transition nursing undergraduate students. Focus is on the development of nursing as a
discipline and as a profession. Also a skill development course, with readings, experiential learning activities,
and oral and written communication assignments. Designed to help students enhance their self-confidence in
interacting with others, groups and presenting information. Assertiveness techniques, presentation of self,
critical thinking, and collaboration skills complement the development of interpersonal and communication
competencies. Active learning methods are used."
NURS 25030 ,"LPN 20020 PREPARATION COURSE-FOUNDATIONS OF NURSING PRACTICE AND
",NURS,nursing (NURS) major.,None,"COMMUNICATION
Designed to assist the licensed practical nurse who is enrolled in the KSU Baccalaureate Nursing (BSN) Program
of study. Reviews the nursing concepts of the professional nurse for LPNs in preparation for taking the CLEP
exam before they transition into the BSN nursing curriculum. Content includes therapeutic and interpersonal
communication, critical thinking and concept mapping, the nursing process, evidence-based practice, and client
education. Offered in a hybrid format with students having in-class, multipurpose lab, as well as web-based
assignments. Students have the option of practice in the lab and perform physical assessment skills."
NURS 25040 ,"LPN 20030 PREPARATION COURSE-FOUNDATIONS OF NURSING INTERVENTIONS
",NURS,nursing (NURS) major and special approval.,None,"Designed to assist the licensed practical nurse enrolled in the KSU Baccalaureate Nursing (BSN) Program of
study. The specific content includes: health, wellness, safety and mobility issues; infection control; care of the
surgical client; electrolyte and acid-base imbalances; and sensory, sleep and cognition issues. Students have
optional practice in the nursing lab and perform selected nursing skills, including physical assessment and
medication calculations."
NURS 30010 ,"PARENT AND NEWBORN NURSING
",NURS,NURS 20030 and NURS 20950 with minimum C (2.000) grade. ,"NURS30020. 
","A study of nursing assessment, need identification and evaluation for individuals and families during the child
bearing cycle."
NURS 30015 ,"PHARMACOLOGY FOR INFANTS, CHILDREN AND MATERNAL CHILD HEALTH
",NURS,None,None,"(Repeatable for credit) Provides additional information to better understand the complexity of pediatric
medications and their safe delivery to pediatric patients of all ages . Also, identifies safe practices for medication
administration to mothers and their newborns. Pre/corequisite: NURS 30010 or NURS 30020."
NURS 30020 ,"HEALTH CARE OF CHILDREN
",NURS,NURS 20020 and NURS 20030 with minimum C (2.000) grade.,NURS 30010.,"Nursing process in family-centered care of children including health and developmental promotion and illness
and restorative intervention."
NURS 30025 ,"PHARAMACOLOGY AND ALTERATIONS IN PHYSIOLOGICAL FUNCTIONING II
",NURS,sophomore standing; and nursing (NURS) major. ,NURS 20030.,"(Repeatable for credit) This course is a continuation of the study of pathophysiology and pharmacology for
nursing students. It provides a deeper understanding of pathophysiologic processes of body systems, the
management of disease states, interpretation of lab values, and the analysis of symptomology and nursing
indicators to allow students to initiate appropriate nursing actions as related to pharmacology and
pathophysiology. This course explores assessment of therapeutic effects, side effects, and adverse reactions of
medications and presents teaching skills needed to enhance patient education and pharmacologic literacy."
NURS 30030 ,"NURSING OF ADULTS
",NURS,NURS 20030 and NURS 20950 and BSCI 30130 with minimum C (2.000) grade. ,NURS 30040.,"Emphasizes health promotion and prevention of episodic illness and maintenance of health status. Utilizes
nursing process as foundation to provide nursing care composed of clinical experience in acute care settings."
NURS 30035 ,"NURSING OF ADULTS ACROSS THE LIFESPAN
",NURS,"minimum C (2.000) grade inNURS 20020, NURS 20030, NURS 20950 and BSCI 30030. 
",None,"(Repeatable for credit) Emphasizes the care of adults, focused on health promotion, prevention of episodic
illness, and maintenance of health status. Gerontologic changes and rehabilitation needs will be addressed.
Utilizes nursing process as a foundation to provide nursing care. Course is composed of classroom and clinical
experience in the acute, chronic, and rehabilitation care settings."
NURS 30040 ,"NURSING OF ADULTS WITH REHAB NEEDS AND/OR GERONTOLOGIC CHANGES
",NURS,NURS 20030 with minimum C (2.000) grade. ,NURS 30030.,"This course encompasses care of persons and families dealing with gerontologic changes and/or rehabilitation
needs."
NURS 30050 ,"BASIC NURSING INFORMATICS
",NURS,NURS 20020 with a grade of C (2.000) or better.,None,"Focuses on the use of nursing informatics for clinical nursing practice, inquiry and communication."
NURS 30060 ,"BASIC PHARMACOLOGY FOR NURSING PRACTICE
",NURS,"NURS20020 with minimum C grade. 
",None,"Introduction to general principles of pharmacology. Major classes of pharmacotherapeutic agents, mechanisms
of action, pharmacokinetics, dosage and administration; effects and nursing responsibilities."
NURS 30070 ,"HEALTH CARE POLICY
",NURS,"NURS 20030 with a minimum C (2.000)grade. 
",None,"This course looks at the organizational and societal context in which health care is delivered in the U.S. A
historical perspective is developed early in the semester. Building on this, the course explores existing health
care policy early in the semester. Building on this, the course explores existing health networks, forms of care
delivery, consumer needs and economics and funding."
NURS 31010 ,"APPLICATION OF STATISTICAL FINDINGS FOR EVIDENCE - BASED PRACTICE IN
",NURS,none.,None,"NURSING
This is a three credit course focusing on an introduction to statistical techniques with an emphasis on application
in the health care setting."
NURS 31095 ,"SPECIAL TOPICS IN NURSING
",NURS,NURS 20950.,None,(Repeatable for credit)Scheduled topics of interest to faculty and students.
NURS 31096 ,"INDIVIDUAL INVESTIGATION
",NURS,special approval.,None,"(Repeatable for credit)Designed for the student interested in exploration and research of material not covered in
required nursing courses."
NURS 35020 ,"TRANSCULTURAL NURSING AND HEALTH CARE
",NURS,junior standing.,None,"Provides students with the opportunity to explore and understand the role of the transcultural nurse in the care
of patients from multiple and diverse cultural groups."
NURS 35030 ,"PATHOPHYSIOLOGY: ANALYSIS AND APPLICATION OF THE NURSING PROCESS
",NURS,"minimum grade of C (2.000) in NURS 20020 and 20030 and 30030 and 30040 and 30060; nursing(NURS) major; and junior or senior standing. 
",None,"Enhances the understanding of pathophysiologic processes, the management of disease states, and analysis of
related concepts of pharmacology, symptomology and lab interpretation of data for the purpose of identification
of priority nursing diagnosis and formulation of care plans appropriate for individual disease processes."
NURS 35040 ,"COMPLEMENTARY AND INTEGRATIVE HEALTH
",NURS,none.,None,"(Repeatable for credit) Explores and critically analyzes complementary and integrative health therapies,
products, and supplements primarily being used in the United States through the review of evidenced based
research and case studies. Synthesizing the exploration of complementary and integrative health practices that
are often used in conjunction with traditional Western medicine, students examine the evolving Integrative
Health, which has also been called Integrative Medicine, or Complementary and Alternative Medicine."
NURS 35050 ,"ADVANCED MEDICAL SURGICAL SIMULATION
",NURS,"NURS 30030 and NURS30040 with a minimum C (2.000) grade. 
",None,"Provides students opportunities for critical thinking and decision making through the use of human patient
simulation. Theory, content and hands on application advance students' clinical judgement and competence in
caring for patients of advancing complexity and those in crisis situations."
NURS 35060 ,"CRITICAL THINKING AND TEST TAKING SKILLS
",NURS,enrolled in the College of Nursing.,None,"(Repeatable once for credit) The focus of this course is to understand the art of analyzing and evaluating one’s
thinking. The focus is on how a person thinks and how they can improve their thinking. This course is designed
for nursing students seeking to expand their critical thinking ability and improve studying and test taking skills.
This course promotes analysis and evaluation of problem solving abilities and requires self-directed, self-
disciplined and corrective thinking. The student will explore and develop individual plans with the course faculty
person to improve their studying and test taking skills."
NURS 35065 ,"STUDENTS HELPING STUDENTS: A STUDNET MENTORING COURSE
",NURS,"junior orsenior standing; and nursing (NURS) major. 
",None,"(Repeatable once for credit) This course is designed for the junior or senior student that has demonstrated a
strong understanding of one or more course topics and who desires to function in the role of a mentor or tutor.
Throughout the course the student will utilize skills learned in the course while engaging in a mentortutor
relationship with students of a lower class rank in need of mentoring andor tutoring."
NURS 40003 ,"COMPARATIVE HEALTH CARE: NURSING IN NORTHERN IRELAND
",NURS,2.750 cumulative GPA; and special approval.,None,"Includes a 2 week intensive study abroad that is conducted in Northern Ireland and includes seminars at the
University of Ulster and in select clinical settings. Students examine the cultural, political and economic forces
influencing health care and nursing needs; status of nursing education, licensure and practice; and health
disparities in Northern Ireland and compare them to the United states. An additional 1 credit hour web-based
option is offered the week immediately following the 2 weeks in Northern Ireland for students who choose the 3
credit hour option."
NURS 40005 ,"PROFESSIONAL NURSING DEVELOPMENT
",NURS,"NURS 20010or NURS 25010 and NURS 30010 and NURS 30030 and NURS 30040 and NURS 30050 and NURS 30060 - all
with a minimum C grade. 
",None,"Course focuses on professional development and the transition from student to graduate nurse, including
interviewing techniques and resume preparation. Explores health care economics and policy, political activism,
cultural competence, nursing theory, leadership of meetings and managing group dynamics, the future of
nursing and health care, nursing practice opportunities, role development, professional nursing organizations,
graduate education and specialty certification. Professional skill development continues from NURS 20010.
Students have the opportunity to attend a professional nursing organization meeting."
NURS 40010 ,"NURSING OF THE CRITICALLY ILL
",NURS,"NURS 30010 and NURS 30030 and NURS 30040 and NURS30050 and NURS 30060 - all with minimum C (2.000) grade. 
",None,"Holistic approach to assessing, intervening and evaluating critically ill persons. Nursing practice in critical care
settings with diverse populations."
NURS 40020 ,"COMMUNITY HEALTH NURSING
",NURS,"NURS30010 and NURS 30020 and NURS 30030 and NURS 30040 and NURS 30050 and NURS 30060 - all with
minimum C grade. ",NURS 40030.,"Concepts of community health nursing with emphasis on health promotion and prevention of population-based
health problems. Students are responsible for their transportation to field experience."
NURS 40030 ,"PSYCHIATRIC NURSING AND MENTAL HEALTH NURSING CARE
",NURS,"NURS 30010 and NURS 30020 and NURS 30030 and NURS30040 and NURS 30050 and NURS 30060 - all with minimum C grade. 
",None,"Focuses on the development of therapeutic relationships with individuals, families and vulnerable populations
across the lifespan who have potential and or identified mental health needs. Students will learn and apply
theory about mental health and illness."
NURS 40045 ,"INTEGRATION OF LEADERSHIP AND MANAGEMENT IN NURSING
",NURS,"NURS 30020 and NURS 30030 and NURS 30040 -all with minimum C (2.000) grade; and senior standing. 
",None,"Course provides students with the knowledge and skills for a beginning leadership position (team leader, module
leader and primary nurse), applicable to the care of patients in a health care environment. Course provides
students with opportunities to synthesize their nursing knowledge and collaborate with their clinical preceptor in
preparation for their professional nursing role."
NURS 40075 ,"INFORMATION AND PATIENT CARE TECHNOLOGY FOR HEALTHCARE PROFESSIONALS
",NURS,nursing (NURS) major.,None,"(Cross-listed with RSPC 40075). Focuses on the use of information management and information systems,
technology and the human technology interface utilized in healthcare. Students taking this course must be
registered nurses."
NURS 40085 ,"INQUIRY AND RESEARCH FOR PROFESSIONAL NURSING PRACTICE
",NURS,None,None,"Introduction to clinical inquiry and research for the professional nurse. Theoretical frameworks appropriate to
nursing are addressed in relation to research development. A nursing Evidence Based Practice project is
developed. Pre/corequisite:MATH 10041 or PSYC 21621; or SOC 32220 and 32221; GEOG 39002, BMRT 21004,
MATH 30011,MIS 24056 and PH 30002; and nursing (NURS) major."
NURS 40872 ,"INTRODUCTION TO EVIDENCE BASED PRACTICE
",NURS,"PSYC 21621 or SOC 32200 or PH 30002or NURS 31010. 
",None,"This course introduces the student to the process of identifying quality research studies and applying the
findings to nursing practice to improve patient outcomes."
NURS 41000 ,"CONCEPTS AND ISSUES FOR PROFESSIONAL NURSING PRACTICE
",NURS,nursing (NURS) major.,None,"Focuses on nursing concepts and theory, nursing process and the history of nursing as it relates to the
development of professional nursing and the role of the professional nurse. Students taking this course must be
registered nurses."
NURS 41095 ,"SPECIAL TOPICS
",NURS,none.,None,"(Repeatable for credit)Scheduled topics of interest to faculty and students. Topics to be announced when
scheduled."
NURS 41096 ,"INDIVIDUAL INVESTIGATION
",NURS,none.,None,"(Repeatable for credit)Designed for the student interested in exploration and research of material not covered in
required nursing courses."
NURS 42000 ,"LEADERSHIP AND MANAGEMENT FOR PROFESSIONAL NURSING PRACTICE
",NURS,nursing (NURS) major.,None,"Allows the registered nurse (RN) to utilize personal and professional knowledge and experiences in the study of
leadership and management. Facilitates discovery of how nursing and leadership theories define and enhance
practice. Assists the RN in analyzing the relationship between nursing, the professional nurse's
leadership/management roles, and the articulation between nursing research and practice. Students taking the
course must be registered nurses."
NURS 43000 ,"HEALTH PROMOTION IN PROFESSIONAL NURSING PRACTICE
",NURS,nursing (NURS) major.,None,"Utilizes the nursing process to explore health promotion and disease prevention across the lifespan and health
care settings. Theories and models are used to understand health behaviors. Includes role of the nurse; national
health objectives (Health People 2020); health literacy, education and counseling; transcultural considerations;
factors affecting health promotion; and specific health promotion strategies. Students taking this course must be
registered nurses."
NURS 43001 ,"HEALTH PROMOTION
",NURS,nursing (NURS) major.,None,"This course utilizes the nursing process to explore health promotion and disease prevention across the lifespan
and healthcare settings. Theories and models are used to understand health behaviors. The course includes the
role of the nurse; national health objectives; health literacy; education; counseling; transcultural considerations;
factors affecting health promotion; and specific health promotion strategies. This course fulfills the university
requirement for an ELR. Student must be a registered nurse."
NURS 44000 ,"POPULATION-BASED NURSING FOR PROFESSIONAL NURSING PRACTICE
",NURS,nursing (NURS) major.,None,"Focuses on concepts of population-based nursing practice with emphasis on improving the health of communities
and populations. Students taking the course must be registered nurses."
NURS 44002 ,"GLOBAL HEALTH IMMERSION: GENEVA, SWITZERLAND
",NURS,"sophomore standing in the Nursing (NURS) major;and special approval. 
",None,"(Slashed with NURS 54002) Participants explore a number of health concerns, policies, and challenges with
global importance and implications. Students will investigate current global health policies and themes, and
become familiar with experts in global health including governmental and nongovernmental organizations and
multinational agencies. Presentation are given by experts currently working in various regions of the world to
solve global problems such as HIV AIDS, post-war trauma, tuberculosis, and non-communicable disease
prevention, and environmental contamination."
NURS 45000 ,"HEALTH MAINTENANCE AND RESTORATION FOR PROFESSIONAL NURSING PRACTICE
",NURS,nursing (NURS) major.,None,"Focuses on issues related to health maintenance and restoration for individuals and families experiencing illness.
Students taking this course must be registered nurses."
NURS 45010 ,"HEALTHCARE POLICY AND DELIVERY SYSTEMS
",NURS,none.,None,"Web-based course looks at the organizational and societal context in which health care is delivered in the U.S.
An historical perspective is developed early in the semester. Building on this, the course explores existing health
care policy and delivery systems, including legislation, the professional disciplines, organizations and health
networks, forms of care delivery, consumer needs, and economics and funding. The ability of the current health
care system to serve all segments of the U.S. population is examined in depth. Global health needs are
examined as a minor theme. Ends with a focus on future forms of delivery that would improve the health care
status of the American population as a whole."
NURS 45020 ,"CRITICAL APPLICATION OF NURSING IN PHARMACOLOGY
",NURS,NURS 20020 and 20030 and 30060; and nursing (NURS) major; and junior or senior standing.,None,"Enhances application and analysis of pharmacology in nursing. Explores assessment of therapeutic effect, side
effects and adverse reactions of medications. Analyzes pathophysiological symptoms, lab values and nursing
indicators in order to allow students to initiate appropriate nursing actions as related to pharmacology. Further,
course presents teaching skills needed to enhance patient education and pharmacologic literacy."
NURS 45030 ,"PROFESSIONAL LITERACY: SKILLS TO CAREER ADVANCEMENT
",NURS,none.,None,"Explores career and professional growth through processes such as writing, publishing, presenting and portfolio
development."
NURS 45060 ,"NCLEX REVIEW PREPARATION
",NURS,senior standing.,None,"(Repeatable for a maximum of 6 credit hours) This course reviews nursing concepts and content important for a
registered nurse to make safe clincal judgments. Specific study strategies for passing the national licensure
exam will be reviewed. Students will practice answering NCLEX style questions."
NURS 45070 ,"HEALTH CARE NEEDS FOR INDIVIDUALS WITH DISABILITIES
",NURS,none.,None,"(Slashed with NURS 55070) Healthcare Needs for Individuals with Disabilities focuses on the developmental,
physical, and mental needs of the individual with disabilities. Strategies to identify and safely manage the unique
needs of individuals with disabilities will be provided."
NURS 46000 ,"HEALTH CARE POLICY
",NURS,junior level standing.,None,"Examines the organizational and societal context in which health care is delivered. Existing health care policy
and delivery systems are examined, including historical perspectives, legislation, professional disciplines,
organizations, health networks, forms of care delivery, consumer needs and economics and funding. The ability
of the current health care system to serve all segments of the U.S. population is examined in depth as well as
future forms of health care delivery. Global perspectives are also studied."
NURS 47000 ,"CAPSTONE CLINICAL FOR PROFESSIONAL NURSING PRACTICE
",NURS,NURS40075 and 41000. Pre/,None,"Allows RNs to apply previously learned nursing theory and clinical knowledge with their baccalaureate education
in the identification and implementation of a scholarly nursing project. This project utilizes, but is not limited to,
previously learned knowledge of leadership skills, principles of teaching/learning, health care policy, change
process, group process, team building, collaboration, healthcare policy and delivery systems, quality
improvement, evidence-based care, diversity, nursing roles, information technology and systems, population-
based care and ethical/legal issues. Students taking this course must be registered nurses."
NURS 47001 ,"CAPSTONE FOR PROFESSIONAL NURSING PRACTICE
",NURS,NURS40075 and NURS 41000. Pre/,None,"Allows RNs to apply previously learned nursing theory and clinical knowledge with their baccalaureate education
in the identification and implementation of a scholarly nursing project. This project utilizes, but is not limited to,
previously learned knowledge of leadership skills, principles of teaching learning, health care policy, change
process, group process, team building, collaboration, healthcare policy and delivery systems, quality
improvement, evidence-based care, diversity, nursing roles, information technology and systems, population-
based care and ethical legal issues. Students taking this course must be registered nurses."
