Course Number,Course Name,Department,Prerequisites,Corequesites,Description
NURS 50003 ,"COMPARATIVE HEALTH CARE: NURSING IN NORTHERN IRELAND
",NURS,3.000 cumulative GPA; graduate standing; and special approval.,None,"Includes a 2 week intensive study abroad that is conducted in Northern Ireland and includes seminars at the
University of Ulster and in select clinical settings. Students examine the cultural, political and economic forces
influencing health care and nursing needs; status of nursing education, licensure and practice; and health
disparities in Northern Ireland and compare them to the United states. An additional 1 credit hour web-based
option is offered the week immediately following the 2 weeks in Northern Ireland for students who choose the 3
credit hour option."
NURS 50093 ,"VARIABLE TOPIC WORKSHOP IN NURSING
",NURS,graduate standing and special approval.,None,"(Repeatable 15 times for credit)Topics of special interest to intensify knowledge in a particular area of graduate
nursing."
NURS 54002 ,"GLOBAL HEALTH IMMERSION: GENEVA, SWITZERLAND
",NURS,Nursing graduate standing.,None,"(Slashed with NURS 44002) Participants explore a number of health concerns, policies and challenges with
global importance and implications. Students investigate current global health policies and themes, and become
familiar with experts in global health including governmental and nongovernmental organizations, and
multinational agencies. Presentations are given by experts working in various regions of the world to solve
global problems such as HIVAIDS, post-war trauma, tuberculosis, refugee health, non-communicable disease
prevention, and environmental contamination."
NURS 55070 ,"HEALTH CARE NEEDS FOR INDIVIDUALS WITH DISABILITIES
",NURS,graduate standing.,None,"(Slashed with NURS 45070) Healthcare Needs for Individuals with Disabilities focuses on the developmental,
physical, and mental needs of the individual with disabilities. Strategies to identify and safely manage the unique
needs of individuals with disabilities will be provided."
NURS 60006 ,"INTRODUCTION TO FAMILY ASSESSMENT AND COUNSELING IN NURSING
",NURS,"Graduatestanding. 
",None,"Study of theoretical approaches to counseling interventions with families and couples. Current status of research
and evaluation of care is examined. Only students admitted to the family NP, Women's Health NP and Pediatric
NP concentrations or post-master's certificate programs may register for this course."
NURS 60010 ,"ADVANCED NURSING INFORMATICS
",NURS,graduate standing.,None,"This course focuses on the role of informatics in advanced nursing practice through examination and application
of theories, trends, and policies for generation, storage, retrieval, and analysis of health information. The use of
information structures, processes, and technology to support clinical decision-making to achieve patient and
healthcare outcomes is examined."
NURS 60012 ,"ADVANCED MENTAL HEALTH ASSESSMENT AND PSYCHOPATHOLOGY
",NURS,graduate standing; and nursing [NURS] major.,None,"Focuses on developing skills related to conducting a holistic mental health assessment and making psychiatric
diagnoses. Develops understanding of psychopathology, which is integral to assessment and diagnosis
processes."
NURS 60014 ,"LEADERSHIP IN NURSING AND HEALTH CARE MANAGEMENT
",NURS,graduate standing.,None,"This course provides an introduction to Nursing and Health Care Management with a focus on the nursing and
health care manager competencies and skills. Concepts explored include leadership and management theories as
they relate to the functions and responsibilities of nursing and health care administrator roles, analysis of
leadership style, and professional competencies for nurses and health care managers and administrators."
NURS 60015 ,"ADVANCED HEALTH ASSESSMENT
",NURS,graduate standing.,None,"Advanced Health Assessment comprises foundational skills including the comprehensive history, physical and
psychological assessment of the patient. Students apply the diagnostic reasoning process to develop a
comprehensive plan of care for patients in a variety of settings. Pre/corequisite: NURS 60045."
NURS 60020 ,"LEGAL AND REGULATORY MANAGEMENT FOR NURSE ADMINISTRATORS
",NURS,graduate standing.,None,"This course focuses on legal and regulatory structures and issues and explores the impact of these topics on
health care environments. Concepts and processes of accreditation, magnet designation, licensure and
government regulation will be explored."
NURS 60024 ,"HEALTH CARE ORGANIZATION STRUCTURE AND BEHAVIOR
",NURS,graduate standing.,None,"This course focuses on the structures and behaviors common in health care organizations. Historical
perspectives, organizational theories, and types and characteristics of health care organizations are explored."
NURS 60025 ,"HEALTH POLICY AND ADVANCED NURSING PRACTICE
",NURS,"graduatestanding. 
",None,"This course focuses on cost, quality and access as fundamental concepts of health policy. Students will analyze
historical and current policy initiatives that influence health care funding and delivery and consider the role of
government, organizations, the discipline of nursing, health care leaders, and individuals in setting health policy.
The impact of policies on nursing practice, health care delivery, and quality of life for citizens will be explored.
Students will examine the concept and practice of advocacy from a nursing perspective."
NURS 60030 ,"HEALTH PROMOTION ACROSS THE LIFESPAN FOR FAMILY PRACTICE
",NURS,graduate standing. ,NURS 60015.,"This course augments the Advanced Health Assessment course. Focus is on anticipatory guidance and health
promotional activities which are age- and developmentally-appropriate across the lifespan."
NURS 60045 ,"PATHOPHYSIOLOGY FOR THE ADVANCED PRACTICE REGISTERED NURSE
",NURS,"graduate standing in nursing. Prerequisite: graduate standing; andnursing (NURS) major. 
",None,"Provides graduate nursing students with a theoretic foundation of human physiology and the phenomena that
produce alterations or pathology in human physiologic function; and an understanding of the basis of disease
processes across the lifespan."
NURS 60050 ,"PHARMACOLOGY FOR WOMEN'S HEALTH NURSE PRACTITIONERS
",NURS,"NURS 60340, 60441 and 63492 and graduate standing. ","NURS 60440 andNURS 64892. 
","Web-based course focuses on pharmacology related specifically to women throughout their lifespan. Prepares
Advanced Nurse Practitioners to meet the pharmacological healthcare needs of women in primary healthcare
settings."
NURS 60051 ,"NEUROBIOLOGY AND PSYCHOPHARMACOLOGY OF MAJOR PSYCHIATRIC DISORDERS
",NURS,"graduate standing in the nursing[NURS] major. 
",None,"Focuses on the neurobiology of severe and persistent psychiatric disorders. Addresses fundamental principles
underlying psychopharmacology related to these disorders."
NURS 60101 ,"THEORETICAL BASIS FOR NURSING PRACTICE I
",NURS,graduate standing.,None,"This course will be used to study concepts and theories common to all specialty areas of nursing. It provides a
firm basis for advanced clinical nursing practice. Progress in theory development for nursing practice is
addressed."
NURS 60110 ,"ADULT GERONTOLOGY CLINICAL NURSE SPECIALIST I
",NURS,"NURS 60015, NURS 60403; andgraduate standing in adult gerontology clinical nurse specialist (AGCN) concentration or adult-gerontology
clinical nurse specialist (C844) certificate. Pre/Corerequisite: NURS 60441. ",NURS 61192.,"Introduction to the clinical nurse specialist role with adults and older adults experiencing common health and
illness conditions. The focus is on developing a foundation for evidence-based, patient-centered advanced
nursing care, including teaching, coaching and identification and management of symptoms, functional problems
and risk behaviors. The scientific and theoretical basis for interventions to achieve clinical outcomes in health
promotion and illness care for adults and older persons across the care continuum are explored. This course is
taken concurrently with NURS 61192 for clinical application."
NURS 60120 ,"ADULT/GERONTOLOGY PRIMARY CARE I
",NURS,graduate standing; and NURS60015 and NURS 60441. ,NURS 61292.,"Introduction to the care of adult-gero primary care patients. Identification and examination of evidence-based
primary health care problems, needs, and interventions. The course will focus on biological and behavioral
parameters at primary, secondary and tertiary levels of prevention."
NURS 60125 ,"FAMILY AND ADULT GERONTOLOGY NURSE PRACTITIONER ROLE
",NURS,graduatestanding; and NURS 60120 and NURS 61292. ,NURS 61892.,"This course continues to develop competencies of the Family and Adult-Gero Nurse Practitioner including
requirements for practice, and prescribing. Quality of health care delivery is examined."
NURS 60130 ,"ADULT GERONOTLOGY ACUTE CARE NURSE PRACTITIONER ROLE
",NURS,"NURS 60120, NURS 60441 and NURS 61292; graduate standing. ",NURS 61392.,"This course introduces the acute care nurse practitioner student to the role of inpatient medical management,
utilizing evidence based practice, and working with interdisciplinary team members. The student will also have
an experience caring for the under-served in the hospital and-or community setting. Additionally, the student
will participate in a simulation workshop, demonstrating common inpatient procedures. The student will also be
introduced to the role of the nurse practitioner, the professional responsibilities and stewardship."
NURS 60140 ,"WOMEN'S HEALTH CARE NURSE PRACTITIONER I
",NURS,graduate standing.Pre/,NURS 61492.,"Development of foundational basis for competent clinical practice in women's health is the basis for this course.
Emphasis is placed on the menstrual cycle, fertility control, and normal and abnormal gynecological conditions.
Course also emphasizes the coordination of care needed within the clinical setting through the diagnostic,
planning and evaluational components pertinent to clinical practice."
NURS 60151 ,"INDIVIDUAL PSYCHOTHERAPY
",NURS,NURS 60012 and NURS 60051; and graduate standing; and nursing[NURS] major. ,NURS 61592.,"Basic elements related to individual psychotherapy, as well as various theoretical approaches to individual
psychotherapy are examined."
NURS 60160 ,"PRIMARY CARE PEDIATRICS
",NURS,graduate standing; and NURS 60015 and NURS 60441. ,NURS 61692.,"Addresses the care of pediatric patients in a primary care setting. Focus is on the acute illnesses and
management of age and developmentally appropriate anticipatory guidance for infants and children."
NURS 60170 ,"PEDIATRIC ASSESSMENT FOR ADVANCED PRACTICE NURSE
",NURS,graduate standing. Pre/,NURS 61792.,"Initial pediatric assessment course emphasizes primary care of the infants, children and teens with a holistic
approach to well child development, health promotion, illness prevention, and management of developmental
challenges with a family centered approach."
NURS 60199 ,"THESIS I
",NURS,"specialapproval; and graduate standing. 
",None,"Thesis students must register for a total of 6 credit hours, 2 to 6 hours in a single semester distributed over
several semesters if desired. Guidelines are established by the College of Nursing."
NURS 60205 ,"INTRODUCTION TO APPLIED EPIDEMIOLOGY
",NURS,Graduate standing.,None,"(Slashed with NURS 80205) Seminar on basic epidemiology principles, concepts and procedures for disease
surveillance and investigation."
NURS 60210 ,"ADULT GERONTOLOGY CLINICAL NURSE SPECIALIST II
",NURS,graduate standing; andNURS 60110 and 61192. ,NURS 62192.,"Application and further development of the clinical nurse specialist (CNS) role introduced in NURS60110, with
continued emphasis on direct care competencies for adults and older adults experiencing common health and
illness conditions in a variety of settings. Evaluation of care outcomes including quality and safety are examined.
This course is taken concurrently with NURS62192 for clinical application."
NURS 60220 ,"PRIMARY CARE II: CHRONICALLY ILL ADULTS
",NURS,NURS 60125 and NURS 61892; and graduate standing. ,"NURS62292. 
","Focus of this course is to establish a knowledge base of appropriate collaboration and consultation within a
multidisciplinary approach to maximize the effectiveness of health care systems and community services in the
health care of adults."
NURS 60230 ,"ADULT GERONTOLOGY ACUTE CARE NURSE PRACTITIONER I
",NURS,NURS 60130 and NURS 61392; andgraduate standing. ,NURS 62392.,"The student will apply techniques for critical care evaluation and treatment for the adult gerontology patient,
specifically, in the acute care setting. The student will be instructed about pharmacotherapeutic and non-
pharmacotherapeutic treatment for acute, acute on chronic and chronic illness. This will be accomplished via
classroom lecture, case studies and simulation case studies."
NURS 60240 ,"WOMEN'S HEALTH CARE NURSE PRACTITIONER II
",NURS,"NURS 60140, NURS 61492 and NURS 60441; and graduate standing. Corerequisite: NURS 62492.",None,"The primary purpose of Women’s Health Care Nurse Practitioner II is the application of evidence- based practice
and research by advanced practice nurses in the promotion of health and wellness of women during the
reproductive years. The emphasis is on normal pregnancy focusing on prevention and health promotion as well
as the management of deviations from normal. Clinical assessment skills, including diagnosis, nursing
intervention, treatment, and evaluation, will be emphasized and the student is expected to concentrate efforts in
attainment and safe execution of skills pertinent to the women during the reproductive years."
NURS 60251 ,"FAMILY AND GROUP PSYCHOTHERAPY
",NURS,NURS 62592 and graduate standing. ,NURS 63592.,"Study of theoretical approaches to advanced psychiatric mental health nursing practice with individuals who are
experiencing identified mental health problems. Basic elements related to family and group psychotherapy are
examined."
NURS 60270 ,"PEDIATRIC NURSE PRACTITIONER I
",NURS,"NURS 60015, NURS 60170 and NURS 61792; and graduate standing. ","NURS62792. 
","Emphasizes the development of competent advanced practice nursing skills and comprehensive knowledge of
acute physical and psychosocial illnesses in children including diagnoses, management and evaluation in primary
care."
NURS 60299 ,"THESIS II
",NURS,NURS 60199; and graduate standing and special approval.,None,Thesis students must continue registration each semester until all degree requirements are met.
NURS 60310 ,"ADULT GERONTOLOGY CLINICAL NURSE SPECIALIST III
",NURS,NURS 60210and NURS 62192. ,NURS 63192.,"Development of clinical nurse specialist (CNS) competencies in the organizational sphere of influence, including
analysis of health promotion and care delivery models and their impact on patient health and organizational
outcomes. CNS leadership competencies involving consultation, mentoring, coaching, role modeling and
education with the interdisciplinary health care team are developed. Strategies for developing and evaluating
programs of care based on analysis of professional standards, clinical outcomes and cost effectiveness are
addressed. This course is taken concurrently with NURS63192 for clinical application."
NURS 60314 ,"INTERNSHIP IN HEALTH CARE MANAGEMENT
",NURS,NURS 65092 and BAD 64271 and BAD 6404 and graduate standing.,None,"Provides an opportunity for students to gain practical experience and be exposed to processes of strategy
creation, policy development, decision-making and patient care with the health care industry."
NURS 60315 ,"BUDGETARY AND FISCAL MANAGEMENT FOR NURSES
",NURS,graduate standing.,None,Examines management of fiscal resources in nursing service settings.
NURS 60320 ,"ADULT/GERONTOLOGY PRIMARY CARE III
",NURS,graduate standing; and NURS 60220 and 62292. ,NURS 63692.,"Synthesizes an understanding of the transition to the professional role of the primary care nurse practitioner.
Integration of practice, theory, leadership and evidence-based practice will all be applied to primary care."
NURS 60325 ,"PRIMARY CARE: FAMILY HEALTH AND CHRONIC ILLNESS
",NURS,NURS 60220 and NURS 62292; andgraduate standing. ,NURS 63292.,"The content of this course is organized around common health issues, needs and problems of women and
children. Additional focus is placed on health promotion and disease detection as related to pediatric primary
care, preconception, pregnancy, and post-partum patients."
NURS 60330 ,"ADULT GERONTOLOGY ACUTE CARE NURSE PRACTITIONER II
",NURS,NURS 60230 and NURS 62392; and graduatestanding. ,NURS 63392.,"The student will apply therapeutic measures for patients with specialty needs as it relates to acute, acute on
chronic and chronic illness. Additionally, the student will review therapeutic conversation with patient and
patient's family via case studies and role-play. Students will synthesize information on billing, coding,
credentialing and certification requirements."
NURS 60340 ,"WOMEN'S HEALTH CARE NURSE PRACTITIONER III
",NURS,"NURS60240, NURS 62492 and NURS 60506; and graduate standing. ",NURS 63492.,"Focus on the legal and business aspects associated with refinement of women's health nurse practitioner skills
and expansion of knowledge related to women's health in selected areas of concentration."
NURS 60353 ,"INDIVIDUAL, ORGANIZATION AND COMMUNITY CONSULTATION
",NURS,NURS 60251; and graduate standing. Pre/,NURS 63592.,"(Cross-listed with NURS 80353) Study of the theoretical approaches to psychiatric mental health advanced
practice nursing with organizations and communities. Emphasis is on learning consultation and liaison skills.
Students will develop skills in performing a community needs assessment and organizational analysis."
NURS 60355 ,"PRIMARY HEALTH CARE CONCEPTS FOR THE PSYCHIATRIC MENTAL HEALTH ADVANCE
",NURS,"NURS 60012, NURS 60015 andNURS 60051; and graduate standing. 
",None,"PRACTICE NURSE
Study of common co-morbid illnesses encountered with individuals experiencing severe mental illness. Issues
related to diagnosis, treatment, and referral are emphasized."
NURS 60370 ,"PEDIATRIC NURSE PRACTITIONER II
",NURS,NURS 60270 and NURS 62792. ,NURS 63792.,"Focuses on continued development of advanced practice nursing assessment skills for well and-or acute care of
infants, children and adolescents."
NURS 60372 ,"ADVANCED NURSING CARE OF THE CHRONICALLY ILL CHILD
",NURS,NURS 60370 and NURS63792; and graduate standing. ,NURS 63992.,"Emphasizes the development of competent advanced practice nursing skills and comprehensive knowledge of
chronic illness-conditions in children, including diagnoses, management and evaluation in primary care.
Concepts of chronic illness and interventions for families are explored."
NURS 60403 ,"METHODS OF INQUIRY
",NURS,graduate standing.,None,"(Cross-listed with NURS 80403) Surveys types of research designs and methods that produce evidence
contributing to positive patient outcomes. For each design the student learns essential elements, appropriate
use and the criteria for rigor within the context of patient outcomes."
NURS 60440 ,"WOMEN'S HEALTH CARE NURSE PRACTITIONER IV
",NURS,NURS 60340 and NURS 63492; and graduate standing. ,NURS 60050 and NURS 64892.,"Further development of a foundation for competent clinical practice within a health care setting. Introduces the
student to the practice of primary health care of women including premenopausal and menopausal women.
Included are principles of growth and development, health promotion, disease prevention and management of
common acute and chronic health problems. Emphasis is placed on the biological, psychological and sociocultural
aspects of care. Pathophysiology, assessment and diagnostic techniques specific to acute and common problems
are stressed. Nursing strategies related to health problems used to enhance, maintain and restore health are
emphasized. Also emphasized are the coordination of care needed within the clinical setting, collaboration and
use of community resources."
NURS 60441 ,"PHARMACOLOGY FOR ADVANCED PRACTICE NURSING
",NURS,Graduate standing.,None,"(Slashed with NURS 80441) A survey course addressing the fundamental principles of medication prescribing
and administration necessary for nurses in advanced practice. Course addresses pharmacodynamics,
pharmacokinetics and pharmacotherapeutics."
NURS 60450 ,"ETHICAL AND CULTURAL ISSUES FOR HEALTH PROFESSIONALS
",NURS,Graduate standing.,None,"(Slashed with NURS 80450) This course will examine varying cultural perspectives, including one's own and
critical ethical issues faced by today's health care providers."
NURS 60451 ,"HEALTH POLICY AND DELIVERY SYSTEMS FOR HEALTH CARE PROFESSIONALS
",NURS,Graduate standing.,None,"(Slashed with NURS 80451) This course focuses on health care policy, financing, and delivery systems. Students
explore the political, social, economic, and scientific bases of health policy formation, primarily in the U.S.;
opportunity exists for individual exploration of international health concerns of importance. ""State of the science""
assignments concern current research findings related to the health care delivery systems, and health policy and
outcomes. Economic drivers, and public and private funding for health services, are examined in all topic areas
throughout the course. Students will research a health policy or health care delivery issue of interest."
NURS 60452 ,"PSYCHIATRIC MENTAL HEALTH FAMILY NURSE PRACTITIONER ROLE
",NURS,graduate standing. Pre/,"NURS 60353 and NURS 60355. Corequisite: NURS64592. 
","This is the capstone course for students in the Psychiatric Mental Health Family Nurse Practitioner concentration.
Students further integrate and apply Psychiatric Mental Health Advanced Practice Nurse knowledge and learn
about their professional roles, coached by established Psychiatric Mental Health Advanced Practice Registered
Nurses."
NURS 60470 ,"PEDIATRIC NURSE PRACTITIONER III
",NURS,NURS 60372 and NURS 63992; and graduate standing. ,NURS 64792.,"Focus on synthesizing pediatric nurse practitioner knowledge and skills to provide expert care to a selected
population of pediatric clients."
NURS 60496 ,"INDEPENDENT STUDY
",NURS,Special approval and graduate standing.,None,"(Repeatable for credit)Readings and/or research supervised by a member of graduate faculty. Provides students
the opportunity to explore a content area in depth."
NURS 60498 ,"RESEARCH
",NURS,"Special approval andgraduate standing. 
",None,"(Repeatable for credit)Research or individual investigation supervised by a graduate faculty member. Repeat
registration permitted. Maximum of 9 credit hours may apply toward degree."
NURS 60506 ,"CLINICAL DIAGNOSTICS FOR ADVANCED PRACTICE NURSES
",NURS,graduatestanding. Pre/,None,"Prepares the student in the selection, use and interpretation of laboratory and other diagnostic tests for
screening, examination, and therapeutics in the care of ambulatory adults. The course examines comprehensive
laboratory and diagnostic techniques and guides the student in safe and appropriate application. The student is
be able to use their understanding of complex clinical situations to build specialty nursing knowledge.
Throughout this course the student is guided in the demonstration of sound clinical judgment in diagnostic
testing for patient assessment and evaluation using case management problems."
NURS 60540 ,"WOMEN'S HEALTH CARE NURSE PRACTITIONER V
",NURS,NURS 60050; and NURS 60440 and NURS 64892; and graduate standing. ,NURS 65892.,"Student performs in the advanced practice role with a specified population of clients of the student's choice in a
selected multidisciplinary care setting. Students have an opportunity to test the effectiveness of various
strategies inherent within the role of nurse practitioner and to demonstrate leadership through role
implementation under the guidance of the faculty. Student must achieve a ""B"" (3.0) or higher to complete
course."
NURS 60592 ,"NURSING EDUCATION PRACTICUM
",NURS,"NURS 60601and NURS 60602, NURS 60604 and NURS 60605; and graduate standing.",None,"(Repeatable for credit) Prepares students with practical experiences in curriculum design, implementation,
evaluation, and instruction with a master educator in the academic and or staff development setting."
NURS 60601 ,"CURRICULUM AND INSTRUCTION IN NURSING EDUCATION
",NURS,graduate standing. Pre/,"NURS 60015 and NURS60101. 
","For master's enrolled or master's prepared nurses learning to teach and facilitate critical thinking in the areas of
curriculum planning, design, development, implementation and evaluation in nursing education in the academic
and staff development settings."
NURS 60602 ,"ROLES AND EVALUATION FOR NURSING EDUCATION CURRICULA
",NURS,NURS 60601 and graduate standing.,None,"For master's enrolled or master's prepared nurses focusing on theory, history and techniques of evaluation and
testing for nurse educators in academic and staff development settings. Faculty and student roles, and legal and
ethical issues are addressed."
NURS 60604 ,"CLINICAL NURSING AND EDUCATION ISSUES IN A SPECIALTY AREA
",NURS,nursing graduate standing.,None,"This course focuses on exploration of pertinent issues applicable to clinical practice. Students will analyze how
this impacts their role as nurse educators within their specialty."
