Course Number,Course Name,Department,Prerequisites,Corequesites,Description
NURS 60605 ,"NURSING EDUCATION WITH TECHNOLOGY
",NURS,NURS 60601; andgraduate standing. ,NURS 60602 and NURS 60604.,"This course is designed for master's enrolled or master's prepared students with a focus in nursing education.
Theory, concepts and evidence are introduced to support the use of technology in nursing education. Students
gain an understanding of how to use and integrate a variety of technology tools as they prepare to deliver
educational offerings in academic ans staff development nursing settings."
NURS 61095 ,"SPECIAL TOPICS IN NURSING
",NURS,Graduate standing in nursing.,None,"(Repeatable for credit)Topics in nursing such as holistic health, selected pathological alterations and recent
developments. May include clinical practicum. May be repeated three times with approval for a maximum of 12
credits applied toward the degree."
NURS 61192 ,"ADULT GERONTOLOGY CLINICAL NURSE SPECIALIST I PRACTICUM
",NURS,NURS 60015; and graduate standing. Pre/,NURS 60441. Corequisite: NURS 60110.,"Clinical practicum of 210 hours with application of principles of clinical nurse specialist practice introduced in
NURS 60110. The student acquires direct care CNS competencies in specialty practice with adults and older
adults in a variety of health care settings in consultation with faculty and a clinical preceptor."
NURS 61292 ,"ADULT/GERONTOLOGY PRIMARY CARE I PRACTICUM
",NURS,NURS 60015; and graduate standing. ,NURS 60120.,Practicum for the concepts introduced in Adult-Gero Primary Care I. Includes 105 practicum hours.
NURS 61392 ,"ADULT GERONTOLOGY ACUTE CARE NURSE PRACTITIONER ROLE PRACTICUM
",NURS,graduate standing; and NURS 60120 and 61292. ,NURS 60130.,"(Repeatable for credit) This practicum introduces the student to the concepts of working with multi-disciplinary
teams and follows the content taught in NURS 60130 Adult Gerontology Acute Care Nurse Practitioner Role."
NURS 61492 ,"WOMEN'S HEALTH CARE NURSE PRACTITIONER I PRACTICUM
",NURS,graduate standing. Pre/,NURS 60015. Corequisite: NURS 60140.,Practicum for concepts introduced in Women's Health Care NP I. This course has 105 clinical hours.
NURS 61592 ,"INDIVIDUAL THERAPY PRACTICUM
",NURS,NURS 60012 and NURS 60051; and graduate standing. ,NURS 60151.,"Initial PMH nurse practitioner practicum emphasizes the development of knowledge and skills in mental health
assessment, individual psychotherapy, and psychopharmacologic therapies with individuals experiencing chronic
or acute mental illness. 210 practicum hours required including 105 child-adolescent and 105 adult-geriatric."
NURS 61692 ,"PRIMARY CARE PEDIATRICS PRACTICUM
",NURS,NURS 60015; and graduate standing.,NURS 60160.,"Practicum for Primary Care Pediatrics is the clinical experience to correspond with the content in the
corresponding didactic course. 105 hours of practicum."
NURS 61792 ,"PEDIATRIC ASSESSMENT FOR ADVANCED PRACTICE NURSE PRACTICUM
",NURS,NURS 60045 and NURS 60101; and graduate standing.Pre/,NURS 60170.,"This course is the clinical application of concepts introduced in Advanced Pediatric Assessment for Advanced
Practice Nurses. 105 hours of practicum."
NURS 61892 ,"FAMILY AND ADULT/GERONTOLOGY NURSE PRACTITIONER ROLE PRACTICUM
",NURS,graduate standing; and NURS 60120 and 61292. ,NURS 60125.,"Practicum for the concepts introduced in NURS 60125 Family and Adult-Gero Nurse Practitioner Role. Includes
105 practicum hours."
NURS 62192 ,"ADULT GERONTOLOGY CLINICAL NURSE SPECIALIST II PRACTICUM
",NURS,NURS60110 and NURS 61192; and graduate standing. ,NURS 60210.,"Application of principles of clinical nurse specialist (CNS) practice introduced in NURS 60210. The student
acquires direct care CNS competencies in specialty practice with adults and older adults in a variety of health
care settings in consultation with faculty and a clinical preceptor. 210 hours of practicum."
NURS 62292 ,"PRIMARY CARE II PRACTICUM: CHRONICALLY ILL ADULTS
",NURS,NURS 60125 and NURS 61892; and graduate standing. ,NURS 60220.,Practicum for the concepts introduced in Primary Care II: Chronically Ill Adults. 105 practicum hours.
NURS 62392 ,"ADULT GERONTOLOGY ACUTE CARE NURSE PRACTITIONER I PRACTICUM
",NURS,NURS 60130 and NURS 61392; and graduate standing. ,NURS 60230.,"(Cross-listed with NURS 82392) The student will apply techniques for evaluation and treatment of the adult-
gerontology patient in the acute care setting. The course includes approaches to pharmacotherapeutic and non-
pharmacotherapeutic treatment for acute, acute on chronic and chronic illness. 210 hours of practicum."
NURS 62492 ,"WOMEN'S HEALTH CARE NURSE PRACTITIONER II PRACTICUM
",NURS,NURS 60140 and NURS 61492; and graduate standing. Pre/,NURS 60240.,Practicum for concepts introduced in Women’s Health Care NP II. This course has 105 practicum hours.
NURS 62592 ,"MEDICATION MANAGEMENT AND INDIVIDUAL THERAPY PRACTICUM
",NURS,"NURS61592 and NURS 60151; and graduate standing. 
",None,"Second Psychiatric Mental Health Advanced Practice Nurse practicum emphasizes the continued development of
knowledge and skills in mental health assessment, individual psychotherapy, and psychopharmacologic therapies
with individuals experiencing chronic or acute mental illness. Students will also get experience working with a
Psychiatric Mental Health prescriber. Group supervision is provided. 105 practicum hours."
NURS 62792 ,"PEDIATRIC NURSE PRACTITIONER I PRACTICUM
",NURS,NURS 60015 and NURS 60170; and graduate standing. ,NURS 60270.,Practicum for the concepts introduced in Pediatric Nurse Practitioner I 105 hours of practicum.
NURS 63192 ,"ADULT GERONTOLOGY CLINICAL NURSE SPECIALIST III PRACTICUM
",NURS,NURS 60210 and NURS 62192; and graduate standing. ,NURS 60310.,"Acquires CNS systems and leadership competencies in specialty practice with adults and older adults in a variety
of health care settings in consultation with faculty and a clinical preceptor. 105 hours of clinical practicum."
NURS 63292 ,"PRIMARY CARE: FAMILY HEALTH AND CHRONIC ILLNESS PRACTICUM
",NURS,NURS 60220 and NURS 62292; and graduate standing.,NURS 60325.,"This course is a practicum of concepts introduced in NURS 60325 Primary Care: Family Health and Chronic
Illness course. 210 hours of practicum."
NURS 63392 ,"ADULT GERONTOLOGY ACUTE CARE NURSE PRACTITIONER II PRACTICUM
",NURS,NURS 60230 and NURS 62392; and graduate standing.,NURS 60330.,"(Cross-listed with NURS 83392) The student applies therapeutic measures for patients with specialty needs as it
relates to acute, acute on chronic and chronic illness. Demonstrates competency in direct acute care of patients
across the adult lifespan and demonstrate professional, compassionate care to patients and their significant
others. 210 hours of practicum."
NURS 63492 ,"WOMEN'S HEALTH CARE NURSE PRACTITIONER III PRACTICUM
",NURS,"NURS 60506; and NURS 60240 and NURS62492 with a minimum ""B"" (3.000) grade; and graduate standing. ",NURS 60340.,"Practicum concepts introduced in Women’s Health Care Nurse Practitioner III. This course has 105 clincial hours.
Student must achieve a ""B"" (3.0) or higher to progress."
NURS 63592 ,"FAMILY AND GROUP THERAPY
",NURS,NURS 62592; and graduate standing. ,NURS 60251.,"Third Psychiatric Mental Health Advanced Practice Nurse practicum emphasizes the development of knowledge
and skills in family and group psychotherapies with individuals experiencing chronic or acute mental illness."
NURS 63692 ,"ADULT GERONTOLOGY COMPREHENSIVE PRIMARY CARE III PRACTICUM
",NURS,NURS 60220 and NURS 62292; and graduate standing. ,NURS 60320.,Practicum for the concepts introduced in AdultGero Comprehensive Primary Care III. 210 hours of practicum.
NURS 63792 ,"PEDIATRIC NURSE PRACTITIONER II PRACTICUM
",NURS,NURS 60270 and NURS 62792; and graduate standing. ,NURS 60370.,Practicum for the concepts introduced in Pediatric Nurse Practitioner II. 105 hours of practicum.
NURS 63992 ,"ADVANCED NURSING CARE OF THE CHRONICALLY ILL CHILD PRACTICUM
",NURS,NURS 60270 and NURS 60270; and graduate standing. ,NURS 60372.,"Practicum for the concepts introduced in Advanced Nursing Care of the Chronically Ill Child. 105 hours of
practicum."
NURS 64002 ,"PROGRAM DEVELOPMENT AND EVALUATION FOR NURSE ADMINISRATORS
",NURS,graduate standing.,None,"This course focuses on processes for planning, developing and evaluating programs in health care. Analysis of
theories, models, issues, challenges related to program planning, development and evaluation relevant to the
nurse administrator are considered."
NURS 64202 ,"NURSING AND HEALTH CARE MANAGEMENT I SEMINAR
",NURS,"NURS 60014, NURS 60020, NURS 60024 and NURS60315; and graduate standing. ",NURS 64292.,"This course is the first of two capstone seminars with a practicum in a health care organization. Students
integrate and apply leadership and management knowledge and are coached in professional roles by established
nursing and health care management leaders."
NURS 64292 ,"NURSING AND HEALTH CARE MANAGEMENT I PRACTICUM
",NURS,"NURS60014, NURS 60020, NURS 60024 and NURS 60315; and graduate standing. ",NURS 64202.,"Application of principles of leadership and management introduced in 64202 and in other program courses.
Students acquire competencies related to leading others in a health care organization."
NURS 64302 ,"NURSING AND HEALTH CARE MANAGEMENT II SEMINAR
",NURS,NURS 64202 and NURS 64292; and graduate standing.,NURS 64392.,"This course is the second of two capstone seminars with a practicum in a health care organization. Students
further integrate and apply management knowledge and their professional roles coached by established nursing
and health care management leaders."
NURS 64392 ,"NURSING AND HEALTH CARE MANAGEMENT II PRACTICUM
",NURS,NURS 64202 and NURS 64292; and graduate standing. ,NURS 64302.,"Capstone clinical practicum with application of principles of leadership and management introduced in NURS
64392 and throughout the program. Students acquire competencies in leadership in health care organizations."
NURS 64592 ,"PSYCHIATRIC MENTAL HEALTH PRACTICUM IV: NURSE PRACTITIONER ROLE
",NURS,NURS 60353 and NURS 60355; and graduatestanding. ,NURS 60452.,"This is the capstone practicum course for students in the Psychiatric Mental Health Family Nurse Practitioner
concentration. Students further integrate and apply Psychiatric Mental Health Advance Practice Nurse knowledge
and learn about their professional roles, coached by established Psychiatric Mental Health Advanced Practice
Registered Nurses. 210 hours of practicum."
NURS 64792 ,"PEDIATRIC NURSE PRACTITIONER III PRACTICUM
",NURS,NURS 60372 and NURS 63992; and graduate standing. ,NURS 60470.,Practicum for the concepts introduced in Pediatric Nurse Practitioner III. 210 hours of practicum.
NURS 64892 ,"WOMEN'S HEALTH CARE NURSE PRACTITIONER IV PRACTICUM
",NURS,NURS 60340 and NURS 63492; and graduate standing. ,"NURS 60050 andNURS 60440. 
","This course is the clinical application of concepts introduced in Women’s Health Care NP IV. 105 hours of
practicum."
NURS 65092 ,"PRACTICUM:NURSING AND HEALTH CARE MANAGEMENT I
",NURS,None,None,"(Repeatable for credit)The required first of two capstone management practicums in a health care agency for
nurses. Students integrate and apply management knowledge and are coached in professional roles by
established nursing and health care management leaders. Prior to registration for this course, students must"
NURS 65192 ,"PRACTICUM:NURSING AND HEALTH CARE MANAGEMENT II
",NURS,NURS 65092 and graduate standing.,None,"(Repeatable for credit)The second of two capstone management practicums in a health care agency for nurses.
Students further integrate and apply management knowledge and their professional roles coached by
established nursing and health care management leaders. One credit hour managerial topics."
NURS 65892 ,"WOMENS HEALTH CARE NURSE PRACTITIONER V PRACTICUM
",NURS,"NURS 60050, NURS 60440 and NURS 64892; and graduate standing. ",NURS 60540.,Practicum for concepts introduced in Women’s Health Care Nurse Practitioner V. 210 hours in practicum.
NURS 70600 ,"CLINICAL SCHOLAR I
",NURS,doctoral standing and special approval.,None,"Focus is transitioning to the clinical scholar leader role within an identified area of advanced nursing practice.
Emphasis is placed on the epistemology underlying advanced nursing practice and the integration of theoretical
frameworks and evidence-based practice principles in achieving optimal health outcomes for individuals and
groups. Comprised of 2 didactic content hours per week and a clinical practicum of 7 hours per week."
NURS 70602 ,"SYNTHESIS AND APPLICATION OF EVIDENCE FOR ADVANCED NURSING PRACTICE
",NURS,doctoral standing.Pre/,NURS 70727.,"Focus is on the concepts, models, and methods for implementation of evidence-based nursing practice at both
individual clinician and system levels. Competencies for the identification, analysis, synthesis, and application of
evidence relevant to nursing and health care practice are developed. Factors that facilitate and impede
implementing and sustaining evidence-based practice are considered. Students learn skills necessary for
identification of clinical problems in advanced practice nursing and promoting adoption and implementation of
evidence-based solutions to promote patient health outcomes."
NURS 70605 ,"PROGRAM EVALUATION IN NURSING
",NURS,"special approval; and doctor of nursing practicestanding. 
",None,"Analysis of theories and models of program evaluation and their relationship to designs, processes, techniques,
and outcomes in nursing related evaluations."
NURS 70610 ,"CLINICAL SCHOLAR II
",NURS,NURS 70600; and doctoral standing; and special approval.,None,"Translating and integrating theory and scientific evidence into the clinical work of the advanced practice clinical
scholar is the focus of this second seminar course. Culturally-aware approaches are developed to resolve a
healthcare issue using theoretic models and principles of evidence-based practice to design innovative
interventions. Comprised of 2 didactic content hours per week and a clinical practicum of 14 hours per week."
NURS 70620 ,"DOCTOR OF NURSING PRACTICE SEMINAR
",NURS,doctoral standing.,None,"This course is an introduction and overview of the DNP degree as the foundation for translational science in
healthcare organizations. DNP Essentials and the associated competencies will be explored (i.e., DNP scholarly
inquiry, interdisciplinary collaboration, systems thinking, and organizational leadership). The structure and
function of the DNP committee and the requirements for the final scholarly project will be discussed. A
Committee Chair will be assigned. The role of the academic advisor and committee chairperson will be explained"
NURS 70630 ,"RESEARCH METHODS FOR EVIDENCE BASED PRACTICE
",NURS,"doctoralstanding. 
",None,"The focus of this course is to provide instruction regarding concepts related to statistical methods and their
application in evidence-based practice. Essentials of research methods in evidence-based practice will also be
covered. Students will learn to critically analyze and synthesize research findings."
NURS 70635 ,"APPLICATION OF EVIDENCE BASED PRACTICE
",NURS,NURS 70630; and doctoral standing.,None,"Focus of course is on the concepts, models, and methods for implementation of evidence-based nursing practice
at both individual clinician and system levels. Students will learn to design, implement and evaluate processes
and programs at the practice and organizational level to improve healthcare outcomes. Leadership attributes
necessary to lead change in practice will be discussed. Factors that facilitate and impede implementing and
sustaining evidence-based practice are considered."
NURS 70640 ,"ADVANCED LEADERSHIP IN HEALTHCARE
",NURS,doctoral standing.,None,"Advanced competencies of the doctoral-prepared advanced practice nurse for transformational leadership in
healthcare to improve patient and population health outcomes are addressed. Five key leadership competencies
including creating and leading change; self-knowledge; strategic vision; interpersonal communication; and
organizational effectiveness are presented with examples and case studies. Transcending themes of ethics,
research, interprofessional collaboration, creativity, and insuring accountability are addressed throughout the
course. Students conduct a self-assessment, and develop and implement individualized action plans for
advanced competency in interprofessional healthcare leadership."
NURS 70650 ,"ORGANIZATIONAL SYSTEMS
",NURS,"NURS 70640;and doctoral standing. 
",None,"Building on the skills in Advanced Leadership for Healthcare Providers, students will gain an understanding of
organizational culture and management structures that contribute to the design and delivery of healthcare.
Economic, political and cultural aspects of organizational systems will be discussed."
NURS 70670 ,"QUALITY IMPROVEMENT IN HEALTHCARE DELIVERY
",NURS,doctoral standing.,None,"Focus on the design, implementation and evaluation of quality and patient safety initiatives to improve
healthcare delivery at the individual patient and system levels. Data necessary to support quality initiatives will
be considered as well as policy, legal and ethical implications."
NURS 70680 ,"POPULATION HEALTH
",NURS,doctoral standing.,None,"Students will explore care delivery models and strategies for health promotion and disease prevention in
individuals, aggregates and populations. Gaps in care and healthcare access will be explored, including social,
cultural, economic, and policy and political barriers. The role of genomics in healthcare delivery of populations
will be discussed. Students will develop skills to design and evaluate health promotion and disease prevention
programs."
NURS 70685 ,"HEALTHCARE FINANCE AND ECONOMIC POLICY
",NURS,"doctoralstanding. 
",None,"Students will gain an understanding of healthcare finance, economics and policy on healthcare delivery systems.
The impact of current healthcare laws-policies (Affordable Care Act, HCAHPS, and other care delivery and
reimbursement strategies) will be discussed. The DNP prepared nurses' role in patient advocacy and policy
development will be discussed. Student will gain an understanding of cost-benefit analyses and creating budgets
to support the design, implementation and sustainability of healthcare delivery initiatives."
NURS 70692 ,"CLINICAL SCHOLAR PRACTICUM
",NURS,NURS 70610; and doctoral standing; and special approval.,None,"(Repeatable for credit)Synthesis of components of clinical scholar leader role comprises this practicum. Students
apply advanced leadership and clinical scholarship skills to developing and evaluating approaches to healthcare
problems in a practicum setting."
NURS 70705 ,"FOUNDATIONS OF RESEARCH METHODS IN NURSING
",NURS,doctoral standing. ,NURS 70710.,"Examines diverse paradigms and research methods as the foundation for scholarly inquiry in nursing knowledge
development. Students begin building a foundation for focused intellectual inquiry in a substantive area of
nursing."
NURS 70710 ,"HISTORY AND PHILOSOPHY OF NURSING SCIENCE
",NURS,Doctoral standing and special approval.,None,"This course examines the nature and metaphysics and epistemology and the influence of contemporary Eastern
and Western philosophies on the developing epistemology of disciplinary nursing knowledge."
NURS 70715 ,"THEORY CONSTRUCTION AND DEVELOPMENT IN NURSING
",NURS,"NURS 70710 anddoctoral standing. 
",None,"This course examines strategies for theory development including logical-empirical-deductive and inductive
approaches. Emphasis will be on elements and strategies used in theory building."
NURS 70720 ,"INTRODUCTION TO NURSING KNOWLEDGE DOMAINS
",NURS,Doctoral standingor special approval from Department. Pre- or ,None,"Introductory seminar analyzing selected theoretical and methodological approaches to knowledge development
in nursing. Emphasis on critical analysis of knowledge in areas of special interest."
NURS 70725 ,"QUANTITATIVE RESEARCH METHODS IN NURSING
",NURS,doctoral standing. ,NURS 70705 and NURS 70727.,"Extends students' knowledge of the theory and practice of quantitative research in nursing. Focus is on the
major types of quantitative design in nursing science. Theoretical and procedural issues related to design,
measurement and data management with a substantive area of nursing inquiry are emphasized. Akron
8200:825."
NURS 70727 ,"ADVANCED HEALTH CARE STATISTICS I
",NURS,Doctoral standing.,None,"Comprehension of bivariate and multivariate descriptive and inferential statistics designed for nurse researchers.
Applications to research problems in nursing. Akron 8200 827."
NURS 70730 ,"QUALITATIVE RESEARCH METHODS IN NURSING
",NURS,Doctoral standing.,None,"Selected qualitative research methods used to study nursing phenomena. Philosophical bases; design, data
collection and analysis; evaluation of rigor; and ethical issues for major qualitative methods will be analyzed
with regard to nursing phenomena."
NURS 70735 ,"NURSING AND HEALTH CARE POLICY
",NURS,"Doctoral standingand special approval. 
",None,"Critical examination of theories and processes of formulating state/national health care policy. Focus on health
issues, the political and legislative process and contemporary policy dilemmas."
NURS 70737 ,"ADVANCED HEALTH CARE STATISTICS II
",NURS,NURS 70727 and doctoral standing or special approval from department.,None,"Application of bivariate and multivariate descriptive and inferential statistics to research problems in nursing.
Akron 8200 837."
NURS 70745 ,"ADVANCED TOPICS IN QUANTITATIVE RESEARCH METHODS
",NURS,NURS 70725 and 70727 and doctoral standing. Pre- or ,None,"Focuses on integration and application of components of quantitative research design in nursing through
application of multivariate design principles to existing data sets. Advanced topics in methods, statistics and
measurement are addressed."
NURS 70747 ,"ADVANCED METHODS FOR NURSING RESEARCH:APPLICATION OF QUALITATIVE
",NURS,"NURS 70720 and NURS 70725 and NURS 70730. Doctoralstanding. 
",None,"METHODS
Theory, data collection and analysis used in qualitative nursing research with a focus on phenomenology,
grounded theory and ethnography."
NURS 70749 ,"ADVANCED METHODS FOR NURSING RESEARCH:GRANT DEVELOPMENT AND FUNDING
",NURS,"Doctoral standing or specialapproval from department; and NURS 70720. 
",None,"Advanced seminar on critical analysis of proposal and grant development, funding, peer review and advocacy
process with emphasis on the development of a grant proposal."
NURS 70751 ,"NURSING SCIENCE SEMINAR I
",NURS,NURS 70720; and doctoral standing.,None,"Seminar on critical analysis and synthesis of theoretical models and empirical research that form the foundation
for the student's research. Funding sources are examined."
NURS 70752 ,"NURSING SCIENCE SEMINAR II
",NURS,NURS 70720 and NURS 70751; and doctoral standing.,None,Seminar on advancement and development of scholarship through critical evaluation of scientific work.
NURS 70792 ,"FIELD EXPERIENCE IN NURSING
",NURS,"Doctoralstanding. 
",None,(Repeatable for credit)Individual enrollment in field experience settings related to nursing.
NURS 70795 ,"SPECIAL TOPICS IN NURSING
",NURS,Doctoral standing.,None,"(Repeatable for credit) Study of important topics in nursing practice, research on the profession. Offering in
response to existing interests and opportunities."
NURS 70796 ,"INDIVIDUAL INVESTIGATION IN NURSING
",NURS,Doctoral standing.,None,"(Repeatable for credit)Individual enrollment for independent study in nursing carried out by student under
supervision of a doctoral faculty member."
NURS 70798 ,"RESEARCH IN NURSING
",NURS,Doctoral standing.,None,"(Repeatable for credit)Research carried out by a student under faculty supervision. In-depth inquiry should
result in a paper or appropriate product."
NURS 71392 ,"DOCTOR OF NURSING PRACTICE SCHOLARLY PROJECT PRACTICUM I
",NURS,doctoral standing.,None,"This course is the first in a series of four courses beginning the second semester of enrollment culminating with
the completion of the scholarly project. The Committee Chair is the faculty of record. In the series, the student
will design the Scholarly Project, complete the project Defense of Proposal, submit for IRB approval, implement
the Scholarly Project, collect and analyze project data, and conduct the final Defense of Scholarly Project as well
as complete DNP Practicum hours. The Committee Chair will be responsible for the oversight of these activities."
NURS 72392 ,"DOCTOR OF NURSING PRACTICE SCHOLARLY PROJECT PRACTICUM II
",NURS,doctoral standing.,None,"This course is the second in a series of four courses beginning the second semester of enrollment culminating
with the completion of the scholarly project. The Committee Chair is the faculty of record. In the series, the
student will design the Scholarly Project, complete the project Defense of Proposal, submit for IRB approval,
implement the Scholarly Project, collect and analyze project data, and conduct the final Defense of Scholarly
Project as well as complete DNP Practicum hours. The Committee Chair will be responsible for the oversight of
these activities."
