Course Number,Course Name,Department,Prerequisites,Corequesites,Description
CHDS 78538 ,"ADVANCED MULTICULTURAL COUNSELING
",CHDS,"Doctoral standing; CHDS 6/77580, 6/77531.",None,"(Cross-listed with CHDS 68538) This course is designed to assist helping professionals in enhancing the
knowledge and skill components of multicultural counseling. Cultural and multicultural counseling experiences
with constructive feedback are provided."
CHDS 78592 ,"PRACTICUM IN COUPLES AND FAMILY THERAPY
",CHDS,doctoral standing in clinical mental health counseling (CMHC) or school counseling (SCON).,None,"(Cross-listed with CHDS 68592) An intensive-extensive supervised experience in the practice of couples and
family therapy. Live video and audio supervisory processes will be utilized to assist with skill development."
CHDS 80090 ,"DOCTORAL RESIDENCY SEMINAR IN COUNSELING AND HUMAN DEVELOPMENT
",CHDS,Doctoral standing.,None,"SERVICES
Focus on professional identity, current issues and trends and involvement in professional activities. Restricted
to students admitted to doctoral program in CHDS."
CHDS 80199 ,"DISSERTATION I
",CHDS,Doctoral standing.,None,"(Repeatable for credit)Doctoral dissertation, for which registration in at least two semesters is required first of
which will be semester in which dissertation work is begun and continuing until the completion of 30 hours."
CHDS 80299 ,"DISSERTATION II
",CHDS,"Doctoral standing;CHDS 80199. 
",None,"(Repeatable for credit)Continuing registration required of doctoral students who have completed the initial 30
hours of dissertation and continuing until all degree requirements are met."
CHDS 87392 ,"ADVANCED INDIVIDUAL COUNSELING PRACTICUM
",CHDS,"Grade of S in CHDS 67492 or 77492; and 67592 or 77592; and minimum grade of B- (2.700) inCHDS 88166 and doctoral standing. 
",None,"(Repeatable twice for credit) (Cross-listed with CHDS 67392) Supervised experience in counseling. Students
meet for individual supervision and in seminar groups to assess their effectiveness in helping relationships."
CHDS 87595 ,"SPECIAL TOPICS IN COUNSELING AND HUMAN DEVELOPMENT SERVICES
",CHDS,Doctoral standing and special approval.,None,"(Repeatable for credit)Presentation of topics of special interest to students in counseling and human
development services. Offered irregularly. Topics will be announced in schedule of classes booklet."
CHDS 87596 ,"INDIVIDUAL INVESTIGATION IN COUNSELING AND HUMAN DEVELOPMENT SERVICES
",CHDS,Doctoral standing and special approval.,None,"(Repeatable for credit)Student investigates one or more topics in counseling under supervision. Review
selected literature beyond normal course coverage. Arrangements with instructor must be made prior to
registration."
CHDS 88167 ,"ADVANCED COUNSELING PROCEDURES
",CHDS,"Grade of S in CHDS 67636 or 77636; and minimum grade of B- (2.700) in CHDS 67628 or77628; and doctoral standing. 
",None,"Development of understanding of more in-depth and complex counseling processes, case conceptualization
and treatment planning, and advanced skills for intervention. Didactic and role-playing methods will be used."
CHDS 88168 ,"ADVANCED COUNSELING THEORIES
",CHDS,"Grade of S inCHDS 77636 and doctoral standing. 
",None,"(Repeatable twice for credit) (Cross-listed with CHDS 68168) Consideration in depth of major counseling
theories, with special emphasis on comparative analysis. Original readings used."
CHDS 88281 ,"RESEARCH SEMINAR IN COUNSELING AND HUMAN DEVELOPMENT SERVICES
",CHDS,"EVAL 65510, 65511, 78716 and 78898. Doctoral standing.",None,"Topics or problems of current concern in counseling and human development services. Review of significant
studies, design strategies, instrumentation, data analysis and research issues. Topic to be announced in
schedule of classes booklet."
CHDS 88284 ,"SUPERVISION OF COUNSELING
",CHDS,Doctoral standing and special approval.,None,"This seminar focuses on supervisory processes in terms of theoretical perspectives and practices of
supervision. Reviews relevant literature related to the roles, functions and settings of clinical supervisor.
Includes supervisory experiences."
CHDS 88292 ,"INTERNSHIP IN COUNSELING AND HUMAN DEVELOPMENT SERVICES
",CHDS,Doctoral standing and special approval.,None,"(Repeatable for credit)Professional service in field setting appropriate for counseling, consulting and personnel
work, under supervision. May be repeated. Completion of program course requirements is necessary prior to
registration. Students are required to complete Bureau of Criminal Investigation and Identification (BCII) and
Federal Bureau of Investigation (FBI) background checks and submit the results to authorized personnel at
their assigned school/agency before the first day of the semester in which student teaching/ internship will
take place."
CHDS 88294 ,"COLLEGE TEACHING IN COUNSELING AND HUMAN DEVELOPMENT SERVICES
",CHDS,doctoral standing.,None,"(Repeatable for credit) Application of planning, instructional and evaluation skills. Doctoral students lead skill
training groups, lecture a large class and guide group discussion with faculty supervision. Arrangements for
this experience to be made before semester begins."
CHDS 88298 ,"INDIVIDUAL RESEARCH IN COUNSELING AND HUMAN DEVELOPMENT SERVICES
",CHDS,Doctoral standing and special approval.,None,"(Repeatable for credit)Individual research on selected aspect of counseling and human development services
under supervision of instructor. Arrangements with instructor must be made prior to registration."
