Course Number,Course Name,Department,Prerequisites,Corequesites,Description
JMC 53035 ,"ADVANCED TELEVISION NEW PRODUCING
",JMC,"graduatestanding and special approval. 
",None,Advanced understanding of how to produce news content for broadcast and the web.
JMC 53036 ,"RECORD PROMOTION
",JMC,journalism and mass communication (JMC) major and graduate standing.,None,"Class operates as an independent record label to critique, select, promote, publicize and seel original recorded
music."
JMC 53042 ,"STUDIO TELEVISION
",JMC,"Special approval andgraduate standing. 
",None,"Study of all positions of a live television program including technical directing, floor directing, graphics, digital
playback, and audio engineering. Two hours lecture and two hours lab."
JMC 54045 ,"PROMOTIONS FOR ELECTRONIC MEDIA
",JMC,"journalism and masscommunication (JMC) major and graduate standing. 
",None,Fundamental and latest trends in broadcast and cable promotion.
JMC 54050 ,"POST PRODUCTION SOUND
",JMC,"journalism and mass communication (JMC) major; and graduate standing; andspecial approval. 
",None,"(Cross-listed with JMC 44050) Creating post production sound for visual productions including digital cinema
and television."
JMC 55001 ,"ADV LIGHTING DIGITAL FILM/TV
",JMC,"journalism and mass communication(JMC) major; and graduate standing; and special approval. 
",None,"(Cross-listed with JMC 45001) Introduction to theory and technique of lighting for video production. Includes
critical analysis of video lighting situations, the various tools available to light various production locations
including interviews and multi-camera narrative scenes."
JMC 55005 ,"HISTORICAL DOCUMENTARY PRODUCTION
",JMC,graduate standing.,None,"Chronicles the evolution of the historical television documentary and demonstrates the step-by-step production
process required to create such a program. Students research and assemble a documentary with an overall
appreciation of this genre's purpose in both the television industry and the popular culture."
JMC 55010 ,"FEATURE FILM PREPRODUCTION
",JMC,"journalism and mass communication major;and graduate standing; and special approval. 
",None,"(Cross-listed with JMC 45010) Gives students practical, hands-on experience in the preproduction of a feature
length digital film. Students work on script revising, budgeting, location scouting, casting, developing a script
breakdown, and developing a daily production schedule for the film. Graduate students are expected to take a
leadership position in the preproduction of the film."
JMC 55011 ,"FEATURE FILM PRODUCTION
",JMC,graduate standing and special approval.,None,"(Cross-listed with JMC 45011) Provides students with a practical, hands -on experience in the production
process of shooting a feature length digital film. Students will study the theory of film making and work on
both the organizational and managerial aspects as well as the technical aspects of production. This includes
production management, craft services, daily call sheets, directing, lighting, cinematography and location
sound recording."
JMC 55013 ,"FEATURE FILM POST PRODUCTION
",JMC,"journalism and mass communication (JMC) major; andgraduate standing; and special approval. 
",None,"(Cross-listed with JMC 45013) Advanced Video editing course designed to offer students the experience in the
postproduction and finishing of a feature length digital narrative film. The students will refine their technical
and aesthetic skills through a combination of practice, reading, presenting, viewing and discussion. Students
are assigned specific scenes that they are to complete from string out and assembly cut to fine cut and
picture lock. Students work on sound effects, visual effects, titles or color correction. In addition, graduate
students assume a leadership position."
JMC 55020 ,"AVID EDITOR CERTIFICATION
",JMC,graduate standing.,None,"Prepares students to take the official Avid Media Composer MC 101 certification exam. Students who pass the
exam will be certified as Avid video editors."
JMC 55051 ,"REPORTING BROADCAST NEWS
",JMC,"JMC 50002 andgraduate standing. 
",None,"Gathering and preparing broadcast news, with emphasis on unique style and presentation methods of
broadcast media. Use of both audio and video recorders and editing equipment."
JMC 56000 ,"NEWSPAPER DESIGN
",JMC,JMC 50003 and graduate standing.,None,"Design of newspapers from small inside pages to elaborate feature pages. News judgment. Basic information
graphics and photo editing."
JMC 56001 ,"INFORMATION GRAPHICS
",JMC,Special approval and graduate standing.,None,"Introduction to shapes, color, type and combinations of these for computer-designed news graphics: maps,
charts, graphs and diagrams."
JMC 56003 ,"PRODUCING TELEVISION NEWS
",JMC,JMC 55051 and journalism and mass communication (JMC) major and graduate standing.,None,"Knowledge of the theory and practice of producing content for TV news and public affairs programs. Emphasis
is placed on understanding news philosophies, storytelling story selection and rundown placement."
JMC 56006 ,"EDITORIAL WRITING
",JMC,JMC 50002 and graduate standing.,None,Structure and purpose of editorial and column writing; study of editorial page practice in writing editorials.
JMC 56009 ,"REPORTING PUBLIC AFFAIRS
",JMC,JMC 50002 and graduate standing.,None,"Instruction and practice in reporting all areas of public affairs,including government and the courts. Use of
precision journalism techniques."
JMC 56016 ,"MAGAZINE PUBLISHING
",JMC,Special approval and graduate standing.,None,"Overview of magazine publishing-editorial, advertising, circulation and production. Analysis of magazines."
JMC 56018 ,"FEATURE WRITING
",JMC,"JMC 50002 and graduatestanding. 
",None,"Researching, writing and placement of feature stories in publications."
JMC 56020 ,"MAGAZINE DESIGN
",JMC,JMC 50002 and JMC 50003 and JMC 56016 and graduate standing.,None,Marriage of words and visuals for designing magazine layouts and covers in desktop publishing.
JMC 56021 ,"MAGAZINE WRITING AND EDITING
",JMC,JMC 50002 and JMC 50003 and graduate standing.,None,"Research, interviewing, writing and marketing of major magazine articles. Also editing techniques for
magazines."
JMC 56052 ,"ADVANCED BROADCAST NEWS PRACTICES
",JMC,JMC 55051 or JMC 56054 and graduate standing.,None,"Study of investigative news stories,newsroom operations editing and producing broadcast news programs.
Advanced projects in broadcast news."
JMC 56054 ,"BROADCAST DOCUMENTARY
",JMC,JMC 55051.,None,"Development of the documentary form for radio/TV; analysis, production of radio/ TV documentary; utilization
of audio/video recording/editing."
JMC 56056 ,"CYBERMEDIA PRODUCTION
",JMC,"journalism and mass communication (JMC)major; and graduate standing. 
",None,"Prepares journalism students to work on media delivered online or by tablet. Deals with multimedia news,
magazines, information design and photojournalism."
JMC 56057 ,"MOTION GRAPHICS FOR VIDEO EDITING
",JMC,"journalism and mass communication (JMC) major; and graduatestanding. 
",None,"Covers the creation of motion graphics for video editing from the perspective of a professional editor. Students
learn basic video effects such as digital matte creation and layered graphics for video productions. Students
also gain a basic understanding of how to covert and compress video files for various deliverable formats.
Adobe After Effects is the industry standard software application for creating motion graphics and will be used
extensively in this course."
JMC 56091 ,"NEW YORK MEDIA SEMINAR
",JMC,"graduate standing in the College of Communication andInformation. 
",None,"Introduction of students to the New York media, the thinking of industry professionals and the job
opportunities in the city. Students will attend presentations by media professionals and seminars to discuss
media based in New York City."
JMC 57003 ,"TEACHING HIGH SCHOOL JOURNALISM
",JMC,"Graduate standing and specialapproval. 
",None,Methods and materials for teaching journalism in high school.
JMC 57004 ,"DESKTOP PUBLISHING FOR HIGH SCHOOL JOURNALISM TEACHERS
",JMC,graduate standing.,None,Basics of InDesign desktop publishing program as it relates to high school newspapers and magazines.
JMC 58001 ,"MEDIA RELATIONS AND PUBLICITY
",JMC,Special approval and graduate standing.,None,"Planning and preparation of materials for use by news media, Both on paper and Online. Analysis of media
relations function and media relations strategies. Uses and limitations of mass media in public relations
practice."
JMC 58002 ,"PUBLIC RELATIONS TACTICS
",JMC,Graduate standing.,None,"Planning and preparation of face-to-face public relations tactics, including spokesperson training for on- and
off- camera appearances, special event planning, speeches and presentations with visual support and other
applications of ""writing for the ear."""
JMC 58003 ,"PUBLIC RELATIONS:ONLINE TACTICS
",JMC,"Specialapproval and graduate standing. 
",None,"Explore fundamentals of web site planning and design and provide hands-on skills development using the full
range of cyber media techniques. Includes emphasis on writing for online audiences."
JMC 58006 ,"PUBLIC RELATIONS PUBLICATIONS
",JMC,Special approval and graduate standing.,None,"Planning, writing and design of organizational publications including newsletters, brochures, fliers and
promotional materials."
JMC 59005 ,"MUSIC VIDEO PRODUCTION
",JMC,graduate standing.,None,"(Cross-listed with JMC 49005) Teaches the process of producing and directing a music video. It covers the
history and social impact of music videos. It includes some research into this social impact. Also
storyboarding, scriptwriting, working with rough cuts, shooting a video, creating and pitching proposals."
JMC 59021 ,"CORPORATE VIDEO
",JMC,Special approval and graduate standing.,None,"The use of video in the legal, medical and corporate environments. Emphasis is placed on the structure and
function of the medium within each environment."
JMC 60000 ,"INTRODUCTION TO GRADUATE STUDIES IN JOURNALISM AND MASS COMMUNICATION
",JMC,Graduate standing.,None,"An introductory survey of the various areas of professional and scholarly concentration in the fields of
journalism and mass communication. Consideration of the relationship between professional practice and
scholarly activity in those fields."
JMC 60001 ,"THEORY OF MASS COMMUNICATION
",JMC,Graduate standing.,None,"Introduction to theory of mass communication, with emphasis on the process and effects of mass
communication."
JMC 60002 ,"LEGAL PROBLEMS IN MASS COMMUNICATION
",JMC,Special approval and graduate standing.,None,"Case studies related to the first amendment, libel, invasion of privacy, regulation of broadcasting and new
media copyright, and access to information. Course focus will be the theories underlying these issues as well
as practical application of the legal concepts."
JMC 60003 ,"ETHICS OF MASS COMMUNICATION
",JMC,Journalism and mass communication (JMC) major and graduate standing.,None,Study of ethical problems of mass media in society; analysis of media policies; performance evaluation.
JMC 60004 ,"CYBERMEDIA LAW
",JMC,graduate standing.,None,"Investigates how the law affects those who gather information and publish online, including issues relating to
blogging, web site hosting, posting and online journalism, along with a basic ability to apply that knowledge in
specific situations. Focus is on both existing law and developing public policy."
JMC 60007 ,"RESEARCH METHODS IN MASS COMMUNICATION
",JMC,Special approval and graduate standing.,None,Introduction to methods of social science research which are applicable to study of mass communication.
JMC 60009 ,"SOCIAL ROLE OF THE MASS MEDIA
",JMC,"Journalism and masscommunication (JMC) major and graduate standing. 
",None,"Application of professional, theoretical, historical, economic and political perspectives to examine the role of
mass media in society both in terms of structure and function."
JMC 60010 ,"QUALITATIVE RESEARCH IN JOURNALISM AND MASS COMMUNICATION: DATA
",JMC,graduate standing.,None,"COLLECTION
Designed to develop skills in qualitative data collection in journalism and mass communication with primary
focus on human subjects and textual data."
JMC 60015 ,"ADVANCED MEDIA MANAGEMENT
",JMC,"JMC 50015 and graduatestanding. 
",None,"Theory and practice of management operations and problem-solving techniques specifically related to media
companies. Emphasis will be using case studies from the media."
JMC 60021 ,"ADVANCED MAGAZINE WRITING
",JMC,JMC 56016 and JMC 50005 and graduate standing.,None,"Course builds on content in JMC 56016 and 50006. Purpose is to refine and hone writing skills for nonfiction
magazine stories in print and online."
JMC 60040 ,"QUALITATIVE RESEARCH METHODS IN JOURNALISM AND MASS COMMUNICATION:
",JMC,graduate standing.,None,"DATA ANALYSIS
Emphasizes the development of skills in the analysis of data collected through qualitative research methods,
particularly interviews and ethnographies. Designed to help prepare graduate students who plan to use
qualitative methods in their academic or applied research, particularly those who are adopting these methods
for theses or dissertations."
JMC 60096 ,"INDIVIDUAL INVESTIGATION IN MASS COMMUNICATION
",JMC,Special approval and graduate standing.,None,"(Repeatable for a maximum of 6 credit hours)Individual investigation of selected area or problem approved by
graduate faculty."
JMC 60098 ,"RESEARCH
",JMC,Special approval and graduate standing.,None,"(Repeatable for credit)Research or individual investigation for master's level graduate students. Credits earned
may be applied toward meeting degree requirements if school approves. Maximum of 3 hours may be applied
to degree if school approves."
JMC 60195 ,"SPECIAL TOPICS SEMINAR
",JMC,Special approval and graduate standing.,None,"(Repeatable for credit)Study of important topics in mass communication. Offered irregularly in response to
existing interests and opportunities."
JMC 60196 ,"READINGS IN MASS COMMUNICATIONS
",JMC,Special approval and graduate standing.,None,"(Repeatable for credit)Student pursues course of readings approved by instructor to cover subject specialty
student cannot obtain from formal course offerings."
JMC 60199 ,"THESIS I
",JMC,Special approval and graduate standing.,None,"Thesis students must register for a total of 6 hours, 2 to 6 hours in single semester distributed over several
semesters if desired."
JMC 60295 ,"SPECIAL TOPICS IN COMPUTER LAB
",JMC,Special approval.,None,"(Repeatable for credit)Selected topics of special interest not covered in depth in existing courses; offered as
resources permit."
JMC 60296 ,"ADVANCED READINGS IN JOURNALISM AND MASS COMMUNICATION
",JMC,Graduate standing and special approval.,None,"(Repeatable for credit)Consolidation and synthesis of learning experiences in the graduate program.
Application of graduate study to future professional careers. Updates on latest developments in the fields of
JMC and their impact on the future of academic study and professional practice in the discipline."
JMC 60299 ,"THESIS II
",JMC,JMC 60199 and graduate standing.,None,Thesis student must continue registration each semester until all degree requirements are met.
JMC 60396 ,"MASTER'S PROFESSIONAL PROJECT
",JMC,Special approval and graduate standing.,None,"Completion and defense of a substantial professional project in one of the fields of journalism and mass
communication."
JMC 66010 ,"SPECIALIZED REPORTING
",JMC,JMC 56009 and JMC 55051 and graduate standing.,None,"Newsgathering techniques in specialty areas such as politics, labor, medicine, business and technology
techniques of team reporting."
JMC 66092 ,"INTERNSHIP IN JOURNALISM AND MASS COMMUNICATION
",JMC,Special approval and graduate standing.,None,"(Repeatable for credit)Experience in a department or company involving supervised professional
responsibilities in journalism and mass communication. Minimum 150 hours of work for each credit hour."
JMC 67076 ,"TEACHING BROADCAST JOURNALISM
",JMC,graduate standing and special approval.,None,"Deals with the base knowledge that a teacher needs to begin teaching broadcast journalism. This includes
modules on cultivating student broadcast journalism, project-based instruction, as well as one on legalities and
ethics along with production skills. While the primary focus is on teaching technique, class participants are
given basic journalism content in order to review, learn and or focus on teaching methods for that same
material."
JMC 67079 ,"TEACHING PHOTO EDITING
",JMC,"graduate standing and specialapproval. 
",None,"Utilization of current photo editing software provides users with powerful tools to acquire, manipulate, and
output a variety of images, from fine art to instructional and web graphics. The focus of this course is learning
the fundamental operations and controls of industry standard photo editing software and dialogue concerning
various issues in teaching and learning photo editing software."
JMC 67083 ,"TEACHING NEWS DESIGN
",JMC,graduate standing.,None,"Provides an introduction to the components of news content and design. This includes type and typography,
printing processes, photography, illustration, the thought process in creating a news product and further
introductions in the developing field of visual journalism. Shows journalism educators how a student media
staff can effectively communicate with readers through visual elements."
JMC 67085 ,"TEACHING PHOTOJOURNALISM
",JMC,graduate standing and special approval.,None,"Examines the components of photojournalism and prepares instructors to teach those components to their
students. In addition to traditional assignments and projects, instructors and students maintain a weekly
dialog. Students gain the following skills necessary to teach their classes: basic operation of a digital camera,
essential components of good photography, how to capture images that tell a story, strategies for covering
news, features and sporting events as well as portraits and group shots, strategies for organizing and
archiving images and ethical practices for capturing images and using them in publication work."
JMC 67087 ,"ADVISING YEARBOOK
",JMC,graduate standing and special approval.,None,"Students gain contextual information regarding yearbook roles in history and memory along with practical
skills for recruitment, staff organization, staffing and production, and incorporating the creation of the
yearbook into a classroom setting."
JMC 68000 ,"PUBLIC RELATIONS THEORY AND PROCESS
",JMC,Special approval and graduate standing.,None,"Introduces students to the profession of public relations by exploring both the theories and the processes
employed by PR practitioners. Course also explores the history and social role of public relations as well as
ethics and social responsibility."
JMC 68001 ,"PUBLIC RELATIONS MANAGEMENT
",JMC,JMC 68000 and graduate standing.,None,"Perspectives, skills needed to manage an organization's PR function, particularly strategic planning,
implementation and evaluation. Emphasis on managerial aspects of negotiating organizational relationships
with publics."
JMC 68004 ,"SOCIAL MEDIA AND PUBLIC RELATIONS
",JMC,"JMC68000 and JMC 68001; and JMC graduate student. 
",None,"Provides an in-depth study of social media and public relations, emphasizing how the two are used by
organizations to build stronger relations with consumers, media, analysts, and others."
JMC 68005 ,"STRATEGIC WRITING AND MESSAGING IN PUBLIC RELATIONS
",JMC,"JMC 68000 and JMC68001; and JMC graduate standing. 
",None,"Focuses on public relations writing and strategic messaging, a critical foundational skill. Course content
includes skill building in online channels and across traditional mediums."
JMC 68006 ,"VALUES AND ETHICS MANAGEMENT IN PUBLIC RELATIONS
",JMC,"JMC 68000 and 68001; and journalism and mass communication(JMC) major; and graduate standing. 
",None,"Explores the theory and application of ethics in public relations. Examines case studies, ethics theory, values
and management thought."
JMC 68008 ,"PUBLIC RELATIONS MEASUREMENT AND RETURN ON INVESTMENT
",JMC,"JMC 68000 and 68001; and journalism and mass communication (JMC) major; and graduatestanding. 
",None,Examines the strategic and tactical processes for measuring outcomes in public relations campaigns.
JMC 68009 ,"PUBLIC RELATIONS HISTORY AND THE MODERN WORLD
",JMC,"JMC 68000 and JMC 68001; and JMCgraduate student. 
",None,"Examines development of Public Relations as a profession, focusing on the Twentieth Century. Detailed study
of historical case studies, campaigns and initiatives."
JMC 68010 ,"PUBLIC RELATIONS INTERNAL COMMUNICATIONS
",JMC,"JMC 68000 and JMC 68001 and journalism and mass communication(JMC) major and graduate standing. 
",None,"Explores strategies and tactics of internal communications. Includes development of organizational intranets
and other employee-focused communications channels with special emphasis on social media to communicate
public relations messages."
JMC 68011 ,"FINANCIAL ISSUES IN PUBLIC RELATIONS
",JMC,JMC 68000 and JMC 68001; and JMC graduate student.,None,"Focuses on financial topics related to a career in public relations, particularly the role of communicators in the
growing field of investor relations."
JMC 80001 ,"THEORY OF MASS COMMUNICATION
",JMC,doctoral standing.,None,"Introduction to theory of mass communication with emphasis on the process and effects of mass
communication."
JMC 80004 ,"CYBERMEDIA LAW
",JMC,doctoral standing.,None,"Investigates how the law affects those who gather information and publish online, including issues relating to
blogging, web site hosting,posting and online journalism, along with a basic ability to apply that knowledge in
specific situations. Focus is on both existing law and developing public policy."
JMC 80010 ,"QUALITATIVE RESEARCH IN JOURNALISM AND MASS COMMUNICATION: DATA
",JMC,doctoral standing.,None,"COLLECTION
Designed to develop skills in qualitative data collection in journalism and mass communication with primary
focus on human subjects and textual data."
JMC 80040 ,"QUALITATIVE RESEARCH METHODS IN JOURNALISM AND MASS COMMUNICATION:
",JMC,doctoral standing.,None,"DATA ANALYSIS
Emphasizes the development of skills in the analysis of data collected through qualitative research methods,
particularly interviews and ethnographies. Designed to help prepare graduate students who plan to use
qualitative methods in their academic or applied research, particularly those who will be adopting these
methods for theses or dissertations."
JMC 80195 ,"SPECIAL TOPICS IN JOURNALISM AND MASS COMMUNICATION
",JMC,doctoral standing and special approval.,None,"(Repeatable for credit)Study of important topics in mass communication. Offered irregularly in response to
existing interests and opportunities."
JMC 90001 ,"Journalism Test Course
",JMC,None,None,
