Course Number,Course Name,Department,Prerequisites,Corequesites,Description
POL 60902 ,"POWER, CONFLICT AND THE POLITICS OF GENDER
",POL,graduate standing.,None,"Examines power disparities and gender as sources of conflict in multiple arenas—including family, community,
workplace and the political sphere. The intersections of gender and power in the generation and resolution of
social conflicts are examined. Emphases is placed on empowerment strategies and tactics used to transform
gendered conflicts and redress power imbalances."
POL 60903 ,"IDENTITY DRIVEN CONFLICTS
",POL,graduate standing.,None,"Explores the roles played by ethnicity, race, religion, culture and other elements of identity in the generation,
resolution and conduct of conflicts within and between groups. Physical and symbolic markers of difference
are examined in order to understand both why groups differentiate themselves from one another and how
mechanisms such as skin color, religious affiliation, ethnic background or cultural traditions can provide the
impetus for conflict or the grounds for resolution."
POL 60904 ,"SOCIAL MOVEMENTS AND NONVIOLENT CONFLICTS
",POL,graduate standing.,None,"The waging and escalating of conflicts by social movements through nonviolent actions frequently shifts
conflicts from one stage to another while also contributing to conflict transformation and to substantive social
and political changes. Focuses on social movement theories and practices, and on the complicated dynamics
of nonviolent action campaigns waged by social movements."
POL 60906 ,"POLITICAL VIOLENCE
",POL,"POL 60501 or POL 60901; andgraduate standing. 
",None,"Examines the dynamics, networks, interests and resource mobilization underlying state-sponsored political
violence, focusing on “low-intensity conflict” and counter-insurgency, paramilitarism and genocide. Of special
interest is the relationship of the state to various non-state actors, both perpetrators and victims, and the
role of the international community in domestic-level violence."
POL 60907 ,"TERRORISM AND HUMAN RIGHTS
",POL,graduate standing.,None,"Examines how governments try to adhere to the rule of law in managing terrorist threats in a post 9-11 era,
striking a balance between the competing demands of public safety, personal freedom and human rights.
Topics include understanding terrorism as a problem for western governments, the rule of law and human
rights."
POL 60991 ,"SEMINAR IN CONFLICT ANALYSIS AND MANAGEMENT
",POL,"graduatestanding. 
",None,"(Repeatable for a total of 9 credit hours) Seminar on current and important topics in Conflict Analysis and
Management. This course may be repeated for credit with departmental approval."
POL 61094 ,"COLLEGE TEACHING IN POLITICAL SCIENCE
",POL,Graduate standing.,None,"(Repeatable for credit)Staff training and experience in college teaching; colloquia on professional ethics and
responsibilities of political scientists. Maximum of 4 hours applicable toward Ph.D. requirements,with graduate
studies committee approval."
POL 61098 ,"RESEARCH
",POL,Graduate standing.,None,"(Repeatable for credit)Research or individual investigation for master's level graduate students. Credits may
be applied toward meeting degree requirements if department approves and a letter grade is given."
POL 61199 ,"THESIS I
",POL,Graduate standing.,None,"Thesis students must register for a total of 6 hours, 2 to 6 hours in a single semester distributed over several
semesters if desired."
POL 61299 ,"THESIS II
",POL,POL 61199 and graduate standing.,None,Thesis students must continue registration each semester until all degree requirements are met.
POL 69091 ,"SEMINAR:QUANTITATIVE METHODS
",POL,POL 60004 and graduate standing.,None,"(Repeatable a maximum of 3 times) Focuses on select topics in quantitative methods, including limited and
categorical dependent variables, hierarchical linear models, panel data, structural equation modeling, and Q
Methodology. More than one seminar may be offered."
POL 69095 ,"SPECIAL TOPICS IN POLITICAL SCIENCE AND PUBLIC POLICY
",POL,graduate standing.,None,(Repeatable for a maximum of 12 credit hours)Topics course.
POL 70002 ,"SCOPE AND EPISTEMOLOGY
",POL,Doctoral standing.,None,"Introduces students to the philosophy of science and scientific inquiry within the context of the social
sciences, and presents a broad survey of leading paradigms and debates within political science."
POL 70003 ,"QUANTITATIVE METHODS I
",POL,Doctoral standing.,None,"Provides a selective introduction to basic quantitative methods for the analysis of political and public policy
data dealing with basic descriptive and inferential statistics."
POL 70004 ,"QUANTITATIVE METHODS II
",POL,POL 70003 and doctoral standing.,None,"Introduces students to multivariate quantitative techniques appropriate for the analysis of political and public
policy data."
POL 70010 ,"QUALITATIVE RESEARCH METHODS
",POL,doctoral standing.,None,"Introduces the principles and methods of qualitative research, examining the place of qualitative research
alongside discussions about positivist, interpretivist and critical approaches. A variety of qualitative research
methods are introduced including: social observation and ethnography, interviewing, discourse analysis, oral
history, document analysis, historical analysis and case studies."
POL 70101 ,"PROSEMINAR IN AMERICAN POLITICS AND POLICY
",POL,Doctoral standing.,None,"This course provides a broad survey of the policymaking process in the U.S. government. Coverage includes
formal government structures as well as more informal networks of private groups that seek to influence
public policy at the national level."
POL 70102 ,"AMERICAN POLICY PROCESS
",POL,POL 70101 or POL 70301; and doctoral standing.,None,"This course emphasizes the politics of the policy process. Among topics covered are theories of policy
formulation implementation and evaluation."
POL 70103 ,"CONGRESS, THE PRESIDENCY AND THE COURTS
",POL,POL 70101 and doctoral standing.,None,"Focuses on the three branches of the U.S. government specifically congress the presidency and the judiciary.
Coverage includes institutional rules and procedures that shape the incentives of these political actors and
ultimately policy outcomes."
POL 70105 ,"FEDERALISM AND STATE POLICYMAKING
",POL,POL 70101 and doctoral standing.,None,"This course covers the theory and practice of federalism with emphasis on its consequences for policy
outcomes. Students also examine the transformation of the policy role of state governments in recent years."
POL 70106 ,"URBAN POLICY AND POLITICS
",POL,"POL 70101 orPOL 70301; and doctoral standing. 
",None,"Urban public policy takes place within the context of suburbanization and metropolitan sprawl. Issues raised in
this course include poverty, race and the role of business in local policymaking."
POL 70108 ,"AMERICAN POLITICAL BEHAVIOR
",POL,POL 70101 and doctoral standing.,None,"Explores scholarship on the behavior of non-elite political actors including various forms of electoral
participation, voting, psychological attachments, affect, cognitions, perceptions, attitudes and beliefs.
Additional topics include: ethnic, racial and gender politics; political participation; voting choice; political
psychology; politics and networks; macro politics; and connecting individual-level and macro-level findings
with democratic outcomes and citizen capacity."
POL 70191 ,"SEMINAR IN AMERICAN POLITICS AND POLICY
",POL,Doctoral standing.,None,"(Repeatable for credit)Seminar on current and important topics in American politics and policy. Subject matter
varies depending on the emerging issue. This course may be repeated for credit with departmental approval."
POL 70195 ,"SPECIAL TOPICS IN PUBLIC ADMINISTRATION
",POL,doctoral standing and special approval.,None,(Repeatable for credit)Various topics offered by the Master of Public Administration program.
POL 70198 ,"RESEARCH IN PUBLIC ADMINISTRATION
",POL,"political science (POL) major;and doctoral standing; and special approval. 
",None,"(Repeatable 3 times for credit) Research or individual investigation for graduate students. Credits earned may
be applied toward meeting requirements if department approves."
POL 70302 ,"BUREAUCRACY AND THE POLICYMAKING PROCESS
",POL,POL 70301 and doctoral standing.,None,"This course provides students with a theoretical and practical understanding of the bureaucracy as a unit of
analysis in policy studies. Of particular interest is the interaction of the bureaucracy with other policymaking
institutions and non-state actors."
POL 70304 ,"ANALYTIC TECHNIQUES OF POLICY-MAKING
",POL,POL 70301 and doctoral standing.,None,"This course covers the concepts, techniques and conventions for assessing economic efficiency when this is
one of the social and political goals relevant to public policymakers. Students are introduced to theories of
cost-benefit analysis as they pertain to public policy."
POL 70371 ,"GRADUATE INTRODUCTION TO PUBLIC ADMINISTRATION
",POL,political science (POL) major and doctoral standing.,None,"Introductory graduate course to the theory and study of public administration. Topics include: evolution and
characteristics of the modern nation state; core functions of public bureaucracy in any nation state;
intergovernmental relations; formal and informal institutions and their role in policy; legal-regulatory
processes; historical evolution of public administration as an academic field; major paradigms in organization
theory and internal organizational dynamics."
POL 70377 ,"PUBLIC BUDGETING AND FINANCIAL MANAGEMENT
",POL,political science (POL) major and doctoral standing.,None,"Focuses on two aspects of public financial analysis: budgeting and financial management. The topics in
budgeting are the basic purposes of budgets as mechanisms of resource control and allocation, and as legal
documents; distinct budget formats and cross-walking of formats; budget preparation; legislative review;
implementation and auditing. The topics in financial management are the mechanisms and tools for financing
public operations, debt management, fund accounting, analyzing budgets, and forecasting."
POL 70379 ,"PROGRAM EVALUATION I
",POL,Doctoral standing.,None,"Introduction to evaluation of government programs. Emphasis on familiarizing students with the theory and
specifically the techniques utilized under different evaluation formats."
POL 70386 ,"PUBLIC SECTOR INFORMATION TECHNOLOGY MANAGEMENT
",POL,political science (POL) major and doctoral standing.,None,"Management of information technology systems in the public sector. Specific focus on: planning and
acquisition of hardware and software and networking technologies, organizational governance and
implementation, information security and privacy, legal requirements, IT service delivery and emerging
enterprise technologies."
POL 70387 ,"ELECTRONIC GOVERNANCE
",POL,political science (POL) major and doctoral standing.,None,"An introduction to electronic governance with an emphasis on public administration. Examines the implications
of information and communication technology in public organizations with regard to democracy, civic
engagement, and performance improvement. Through case studies from the United States and across the
world, students become familiar with the factors and issues surrounding the implementation of electronic
governance on a comparative basis."
POL 70392 ,"INTERNSHIP IN PUBLIC ADMINISTRATION
",POL,"political science (POL)major; anddoctoral standing; and special approval. 
",None,"(Repeatable for credit)Provides an opportunity for students to gain practical experience and be exposed to
processes of public decision making and policy development."
POL 70501 ,"PROSEMINAR IN TRANSNATIONAL AND COMPARATIVE POLITICS AND POLICY
",POL,Doctoral standing.,None,"This course introduces students to the primary concepts, theories and subfields of comparative and
transnational politics. Each field of study is reviewed along with the primary sub-fields of analysis."
POL 70502 ,"GLOBAL GOVERNANCE
",POL,POL 70501 and doctoral standing.,None,"This course examines issues, problems and debates regarding global governance in the contemporary world.
Of primary interest is the array of actors in this process including nation-states, intergovernmental
organizations, and non-governmental organizations."
POL 70503 ,"FOREIGN POLICY ANALYSIS
",POL,POL 70501 and doctoral standing.,None,"This course provides an overview of the diverse analytic traditions and issues that relate to the study of
foreign policy. Areas of coverage include theories of foreign policy decision-making, levels of analysis, and
policy domains."
POL 70507 ,"CONFLICT TRANSFORMATION AND RECONCILIATION
",POL,POL 70501 or POL 70701; and doctoral standing.,None,"Cross-cultural analysis of transition from mass violence to justice and from protracted conflict to democracy.
Subjects of study include truth and reconciliation commissions, criminal tribunals, apologies, reparations, and
other aids to conflict transformation."
POL 70510 ,"POLITICS OF DEVELOPMENT
",POL,POL 70501 and doctoral standing.,None,"Surveys the scholarship on political development, examining the ways in which the conceptualization of
development has evolved over time, looking specifically at institutionalization, state failure and the role of civil
society."
POL 70511 ,"INTERNATIONAL POLITICAL ECONOMY
",POL,POL 70501 and doctoral standing.,None,"Introduces students to the study of how politics and economics interact on a global scale, covering the major
theories of IPE, the international monetary system, global trade, and the connections between international
economics and domestic development."
POL 70591 ,"SEMINAR IN TRANSNATIONAL AND COMPARATIVE POLITICS AND POLICY
",POL,Doctoral standing.,None,"(Repeatable for credit)Seminar on current and important topics in transnational and comparative politics and
policy. Subject matter varies depending on the emerging issue. This course may be repeated for credit with
departmental approval."
POL 70901 ,"PROSEMINAR IN CONFLICT ANALYSIS AND MANAGEMENT
",POL,doctoral standing.,None,"Covers the historical development of the conflict analysis and management field; conflict theories; the
dynamics by which conflicts escalate, stalemate, and de-escalate; and theories of conflict intervention,
resolution and transformation."
POL 70902 ,"POWER, CONFLICT AND THE POLITICS OF GENDER
",POL,doctoral standing.,None,"Examines power disparities and gender as sources of conflict in multiple arenas—including family, community,
workplace and the political sphere. The intersections of gender and power in the generation and resolution of
social conflicts is examined. Emphases is placed on empowerment strategies and tactics used to transform
gendered conflicts and redress power imbalances."
POL 70903 ,"IDENTITY DRIVEN CONFLICTS
",POL,doctoral standing.,None,"Explores the roles played by ethnicity, race, religion, culture and other elements of identity in the generation,
resolution and conduct of conflicts within and between groups. Physical and symbolic markers of difference
are examined in order to understand both why groups differentiate themselves from one another and how
mechanisms such as skin color, religious affiliation, ethnic background or cultural traditions can provide the
impetus for conflict or the grounds for resolution."
POL 70904 ,"SOCIAL MOVEMENTS AND NONVIOLENT CONFLICTS
",POL,doctoral standing.,None,"The waging and escalating of conflicts by social movements through nonviolent actions frequently shifts
conflicts from one stage to another while also contributing to conflict transformation and to substantive social
and political changes. Focuses on social movement theories and practices, and on the complicated dynamics
of nonviolent action campaigns waged by social movements."
POL 70906 ,"POLITICAL VIOLENCE
",POL,"POL 70501 or POL 70901; anddoctoral standing. 
",None,"Examines the dynamics, networks, interests and resource mobilization underlying state-sponsored political
violence, focusing on “low-intensity conflict” and counter-insurgency, paramilitarism and genocide. Of special
interest is the relationship of the state to various non-state actors, both perpetrators and victims, and the
role of the international community in domestic-level violence."
POL 70907 ,"TERRORISM AND HUMAN RIGHTS
",POL,doctoral standing.,None,"Examines how governments try to adhere to the rule of law in managing terrorist threats in a post 9-11 era,
thus striking a balance between the competing demands of public safety, personal freedom, and human
rights. Topics include understanding terrorism as a problem for western governments, the rule of law, and
human rights."
POL 70991 ,"SEMINAR IN CONFLICT ANALYSIS AND MANAGEMENT
",POL,"doctoralstanding. 
",None,"Repeatable for a maximum of 9 credit hours) Seminar on current and important topics in Conflict Analysis and
Management. This course may be repeated for credit with departmental approval."
POL 71094 ,"COLLEGE TEACHING IN POLITICAL SCIENCE
",POL,Doctoral standing.,None,"(Repeatable for credit)Staff training and experience in college teaching; colloquia on professional ethics and
responsibilities of political scientists. Maximum of 4 hours applicable toward Ph.D. requirements with graduate
studies committee approval."
POL 79091 ,"SEMINAR:QUANTITATIVE METHODS
",POL,POL 70004 and doctoral standing.,None,"(Repeatable a total of 3 times) Focuses on select topics in quantitativestatistical methods, including limited
and categorical dependent variables, hierarchical linear models, panel data, structural equation modeling, and
Q Methodology. More than one seminar may be offered."
POL 79095 ,"SPECIAL TOPICS IN POLITICAL SCIENCE AND PUBLIC POLICY
",POL,doctoral standing.,None,(Repeatable for a maximum of 12 credit hours)Topics course.
POL 81098 ,"RESEARCH
",POL,Doctoral standing.,None,"(Repeatable for credit)Research or individual investigation for doctoral students who have not yet passed their
candidacy examination. Credits may be applied toward degree if department approves and if letter grade
given."
POL 81199 ,"DISSERTATION I
",POL,Special approval and doctoral standing.,None,"(Repeatable for credit)Doctoral dissertation, for which registration in at least two semesters is required, and
the first of which will be semester in which dissertation work is begun and continuing until the completion of
30 hours."
POL 81299 ,"DISSERTATION II
",POL,"POL 81199 anddoctoral standing. 
",None,"(Repeatable for credit)Continuing registration required for doctoral students who have completed the initial 30
hours of dissertation and continuing until all degree requirements are met."
