Course Number,Course Name,Department,Prerequisites,Corequesites,Description
THEA 51191 ,"VARIABLE CONTENT SEMINAR:THEATRE HISTORY/LITERATURE/THEORY
",THEA,Graduate standing and special approval.,None,"(Repeatable for credit)Seminar focuses on selected topics in these areas, for example performance art,
performance theory or theatre in a multicultural society."
THEA 51301 ,"ACTING FOR THE CAMERA I
",THEA,"graduate standing and specialapproval. 
",None,"An introduction to the specific techniques used in film acting. The course provides students with the necessary
tools to make the transition from stage acting to camera acting."
THEA 51302 ,"ACTING FOR THE CAMERA II
",THEA,"graduatestanding and special approval. 
",None,"Further development on the specific techniques used in film acting as applied to the Graduate Actor. The
course continues to assist in making the transition from stage acting to camera acting."
THEA 51303 ,"ACTING I FOUNDATIONS/STANISLAVSKI AND MICHAEL CHEKHOV
",THEA,special approval special approval of instructor and graduate standing.,None,"The Stanislavski and Michael Chekhov Techniques: A thorough exploration of Stanislavski's Method of Psycho-
Physical Action, and the Michael Chekhov technique including atmosphere, psychological gesture, and qualities
of movement."
THEA 51304 ,"ACTING II: SCENE STUDY-MODERN AMERICAN REALISM
",THEA,special approval of instructor and graduate standing.,None,"The application of the Stanislavski and Michael Chekhov Techniques to in-depth scene study using the plays of
Odets, Miller, Williams, Shanley and others."
THEA 51305 ,"PROFESSIONAL ASPECTS:PERFORMANCE
",THEA,"Special approval of instructor andgraduate standing. 
",None,"A study of the practical demands and requirements of a professional acting career with particular emphasis on
audition skills. Also covered pictures and resumes, making rounds, professional unions, casting directors,
agents and managers, the job market and career prospects."
THEA 51306 ,"PROFESSIONAL ASPECTS:DESIGN AND TECHNOLOGY
",THEA,"special approval of instructor and graduatestanding. 
",None,"A study of the practical demands and requirements of a professional career in design and technology,
including portfolio development, resumes, unions, job market, financial matters and career prospects. Use of
computers as a resource and tool emphasized."
THEA 51308 ,"MUSICAL THEATRE AUDITION
",THEA,special approval and graduate standing.,None,"(Repeatable for a maximum of 4 credit hours) Explore the various genres and styles of American musical
theatre songs with specific emphasis on finding practical audition repertoire for each student. Performance and
research will be the primary activities in the class."
THEA 51309 ,"MUSICAL THEATRE SHOWCASE
",THEA,graduate standing and special approval.,None,"Development, promotion, and presentation of a Musical Theatre showcase for industry personnel in New York
City."
THEA 51401 ,"ADVANCED DIRECTING
",THEA,"Special approval of instructor and graduatestanding. 
",None,"Advanced work in directing for the theatre. Topics include director as creative interpretative artist, the director
and the actor. Students direct individual projects."
THEA 51499 ,"MUSICAL THEATRE SHOWCASE
",THEA,"Graduate Standing and specialapproval. 
",None,"Development, promotion and presentation of a Musical Theatre showcase for industy casting personnel in New
York City. Audition required prior to registration for this course."
THEA 51521 ,"ADVANCED LIGHTING TECHNOLOGY I
",THEA,Graduate standing and special approval.,None,"Advanced study of the technologies used in lighting design; conventional and intelligent fixtures, electricity,
projection techniques and special effects."
THEA 51522 ,"DESIGN STUDIO:LIGHTING
",THEA,Special approval and graduate standing.,None,"Advanced study of lighting design, emphasizing artistic style and concept through a variety of design
problems."
THEA 51523 ,"SOUND DESIGN AND TECHNOLOGY I
",THEA,"Graduate standing and specialapproval. 
",None,"Sound design for the theatre, sound production and sound reinforcement techniques. Introduction to
electronic equipment, mixing consoles, amplifiers, speakers."
THEA 51524 ,"DESIGN STUDIO:COSTUME
",THEA,Special approval and graduate standing.,None,"Advanced study in costume design. Genres, styles, in the context of performance spaces with an emphasis on
research, practical considerations of costume production and communication between designer/shop personnel
and designer/ director."
THEA 51525 ,"PROPS AND CRAFTS
",THEA,special approval of instructor and graduate standing.,None,Examination of the processes related to the creation and procurement of scenic and costume props.
THEA 51526 ,"ADVANCED LIGHTING TECHNOLOGY II
",THEA,graduate standing and special approval.,None,"This class will focus both on the practice of intelligent lighting programming and the technology of intelligent
lighting fixtures."
THEA 51527 ,"SOUND AND DESIGN TECHNOLOGY II
",THEA,THEA 51523 and special approval and graduate standing.,None,"Studies in sound design, sound production and reinforcement for live performance. Advanced software
applications will be explored."
THEA 51528 ,"THEATRE SOUND REINFORCEMENT
",THEA,"Graduatestanding and special approval. 
",None,"Studies in the theories and practice of audio mixing in support of live vocal and musical performance. Topics
include wired and wireless microphones and real time digital processing of audio."
THEA 51529 ,"ADVANCED WIG AND MAKEUP TECHNIQUES-STAGE AND SCREEN
",THEA,"special approval of instructor and graduatestanding. 
",None,"Advanced study of the process of designing and executing wigs and makeup with an emphasis on standards
in the profession. Some prosthetic work required."
THEA 51560 ,"THEATRE FABRICATION TECHNOLOGY
",THEA,special approval of instructor and graduate standing.,None,"History of technical production practice, materials theory and application in scenic construction technology."
THEA 51620 ,"HISTORY OF PERIOD STYLES FOR THEATRE DESIGNERS
",THEA,"special approval of instructorand graduate standing. 
",None,"A survey of visual styles as related to historical and contemporary culture from antiquity through the 20th
century with an emphasis on their application to theatrical design."
THEA 51621 ,"PRESENTATION MEDIA
",THEA,special approval and graduate standing.,None,"Advanced process techniques in rendering, model building and design presentation for the scenic costume and
lighting designer in traditional and new media."
THEA 51622 ,"DESIGN STUDIO:SCENERY
",THEA,Special approval and graduate standing.,None,"Advanced study in scenic design. Explores genres, styles, performance spaces, including practical
considerations."
THEA 51701 ,"MOVEMENT, FORM AND SPACE I-THE ACTOR'S PHYSICAL INSTRUMENT
",THEA,Special approval.,None,"Development of technical skills emphasizing the physical components of expressive action through integration
of breath, voice and body conditioning."
THEA 51702 ,"MOVEMENT AND DANCE FOR ACTORS
",THEA,graduate standing and special approval.,None,"(Repeatable for a maximum of 6 credit hours) Designed to acquaint actors with theatre dance techniques and
choreographic styles by concentrating on vernacular dances used throughout musical theatre. Course
combines basic ballet, jazz, and tap terminology."
THEA 51736 ,"PRODUCTION AND STAGE MANAGEMENT
",THEA,special approval and graduate standing.,None,"Advanced investigation of the methodology used in stage managing professional theatrical productions and
production management processes. Focus on production processes for various theatre, dance, opera and
entertainment genres."
THEA 51801 ,"VOICE AND SPEECH I-THE ACTOR'S INSTRUMENT
",THEA,special approval and graduate standing.,None,"The use of exercise and specific text work to explore ¿centering¿ as it related to the vocal, physical and
emotional process of the actor. Focus on extremes of emotional sounds and eliminating barriers and
detrimental vocal habits/speech patterns."
THEA 51802 ,"ENSEMBLE SINGING FOR MUSICAL THEATRE
",THEA,graduate standing and special approval.,None,"(Repeatable 6 times for credit) The study and performance of diverse styles specific to the musical theatre
canon for mixed voices."
THEA 51808 ,"ACTING STYLES I-SHAKESPEARE
",THEA,graduate standing an special approval.,None,"The application of acting, movement, and voice and speech techniques to sonnets, monologues, soliloquies,
and scenes from Shakespeare."
THEA 60196 ,"INDIVIDUAL INVESTIGATION-HISTORIC TEXTILES
",THEA,Graduate standing.,None,(Repeatable for credit)Identification and analysis of textile fabric as the reflection of culture.
THEA 60199 ,"M.F.A. THESIS PROJECT
",THEA,Special approval of adviser and graduate standing.,None,(Repeatable for credit)Students must register for course during the semester of their M.F.A. thesis project.
THEA 60992 ,"PROFESSIONAL THEATRE INTERNSHIP I
",THEA,"special approval of instructor andgraduate standing. 
3.000 OR ",None,"(Repeatable once) Intensive advanced training in practical aspects of production. Periodic seminars, laboratory
sessions and performance in the Porthouse Theatre Company."
THEA 61000 ,"INTRODUCTION TO GRADUATE STUDY IN THEATRE
",THEA,special approval of instructor and graduate standing.,None,"Orientation to bibliography and research in the field of theatre with emphasis on application of research to
performance."
THEA 61094 ,"COLLEGE TEACHING IN THEATRE
",THEA,special approval of instructor and graduate standing.,None,"Strategies for teaching, issues on implications of pedagogical practice and responsibilities of academic
leadership."
THEA 61095 ,"SPECIAL TOPICS
",THEA,"special approval of instructor and graduatestanding. 
",None,"(Repeatable for credit)Offered irregularly when unusual resources permit a topic different from existing
courses. Topic will be announced when scheduled."
THEA 61096 ,"INDIVIDUAL INVESTIGATION:THEATRE AND DRAMA
",THEA,"Special approval and graduatestanding. 
",None,"(Repeatable for a maximum of 6 credit hours)Independent study of an area or problem approved by divisional
graduate coordinator in consultation with project director."
THEA 61098 ,"RESEARCH
",THEA,"special approval of instructorand graduate standing. 
",None,"(Repeatable for credit) Research or individual investigation for master's-level graduate students. Credits may
be applied toward meeting degree requirements if school approves."
THEA 61110 ,"HISTORY OF THEORIES OF ACTING AND SPACE I
",THEA,"specialapproval of instructor. Prerequisite: special approval of instructor and graduate standing. 
",None,History of theories of acting and space in the theatre from the beginning to ca. 1850.
THEA 61111 ,"HISTORY OF THEORIES OF ACTING AND SPACE II
",THEA,"special approval of instructor and graduatestanding. 
",None,History of theories of acting and space in the theatre.
THEA 61201 ,"SOFTWARE APPLICATIONS
",THEA,Special approval and graduate standing.,None,"A survey of current software used in theatre production with an emphasis on applications for management,
design and technical direction."
THEA 61303 ,"ACTING III SCENE STUDY-NATURALISM AND ABSURD
",THEA,Special approval of instructor and graduate standing.,None,"In-depth scene study in the genres of Naturalism and Absurd theatre. Exploration of the works of Chekhov,
Strindberg, Beckett and others."
THEA 61305 ,"ACTING STYLES II: GREEK AND COMEDY OF MANNERS
",THEA,special approval of instructor and graduate standing.,None,"Application of acting, movement, and speech techniques to these specific genres. Focus on style and
physicalization using Greek and English Restoration playwrights as well as Molière, Wilde and others."
THEA 61309 ,"MASTER OF FINE ARTS COMPREHENSIVE PROJECT IN ACTING
",THEA,THEA 61000; special approval of instructor and graduate standing.,None,"Intensive work in the development of the practical aspects of production; includes performance or exhibition
of work, documentation of that work in a format appropriate for area and project, and an exit interview."
THEA 61310 ,"MASTER OF FINE ARTS DESIGN AND TECHNOLOGY CULMINATING PROJECT
",THEA,"THEA 61000; special approval of instructor and graduatestanding. 
",None,"An intensive experience in the development of design and/or technical aspects of a theatrical production; the
scope of work may include but not necessarily be limited to research, drawings and drafting, renderings and
associated digital image, video or audio files. Documentation, appropriate for the area and project, is
presented at an exit interview."
THEA 61521 ,"ADVANCED THEATRE DRAFTING
",THEA,Special approval and graduate standing.,None,"Advanced drafting techniques for the technical director, scenic designer and lighting designer. Includes film,
television, industrial and engineering graphic techniques."
THEA 61525 ,"MILLINERY AND 3-D CHARACTERS
",THEA,special approval of instructor and graduate standing.,None,"Advanced studies of techniques of millinery construction and 3D character construction with an emphasis on
current practice in the industry."
THEA 61527 ,"SHOP MANAGEMENT
",THEA,Special approval and graduate standing.,None,"Study of resource management for the professional shop. Topics business planning labor relations accounting
budgeting and productivity techniques."
THEA 61561 ,"ADVANCED CONSTRUCTION THEORY
",THEA,Special approval and graduate standing.,None,"The theory and practice of structural and mechanical design for theatre production. Related issues in resource
management for the professional shop."
THEA 61701 ,"MOVEMENT, FORM AND SPACE II-NEUTRAL AND CHARACTER MASK
",THEA,"THEA 51701; special approval of instructor and graduatestanding. 
",None,"Advanced skills and conditioning focusing on the physical and vocal qualities of characterization achieved
through performance in masks."
THEA 61702 ,"MUSICAL THEATRE STYLES
",THEA,"specialapproval of instructor and graduate standing. 
",None,The study of diverse styles of choreography for the actor performing in Musical Theatre.
THEA 61801 ,"VOICE AND SPEECH II-VOCAL DEMANDS AND DIALECTS
",THEA,special approval of instructor and graduate standing.,None,"Voice principles are covered in depth and detail with emphasis on their applications to dialects, singing and
media voice work."
THEA 61802 ,"VOICE AND SPEECH III-THE ACTOR/SINGER
",THEA,THEA 51801; special approval of instructor and graduate standing.,None,"Training in methods and skills necessary for the singing actor. Focus on the integration and physicalization of
lyrics and music."
THEA 61806 ,"SINGING FOR THE ACTOR
",THEA,THEA 51801; special approval of instructor and graduate standing.,None,A comprehensive study of performance techniques and repertoire appropriate to the singing actor.
THEA 61992 ,"PROFESSIONAL THEATRE INTERNSHIP II
",THEA,"special approval andgraduate standing. 
3.000 OR ",None,"(Repeatable for credit)Intensive advanced training in practical aspects of production. Periodic seminars,
laboratory sessions and performance in a professional theatre company."
THEA 62092 ,"PRACTICUM:DESIGN/TECHNOLOGY
",THEA,"special approval of instructor and graduatestanding. 
",None,"(Repeatable for credit)Practical experience for the graduate student in theatre design and technology under
faculty supervision. SU grading, IP permissible."
THEA 62192 ,"PRACTICUM:PERFORMANCE
",THEA,special approval of instructor and graduate standing.,None,"(Repeatable for credit; cross-listed with KBT 62192) Practical experience for the graduate student in theatre
performance under faculty supervision."
THEA 62292 ,"PRACTICUM:THEATRE MANAGEMENT
",THEA,Special approval and graduate standing.,None,"(Repeatable for a maximum of 12 credit hours)Practical experience for the graduate student in theatre
management under faculty/staff supervision."
THEA 62892 ,"THEATRE PRACTICUM
",THEA,Special approval and graduate standing.,None,"(Repeatable twice for credit)Practical experience for the graduate student in cocurricular theatre activities,
under faculty supervision."
THEA 62992 ,"THEATRE PRODUCTION INTERNSHIP
",THEA,Special approval of adviser and graduate standing.,None,"(Repeatable for a maximum of 12 credit hours) Intensive advanced training in practical aspects of production.
Periodic seminars, laboratory sessions and performance in a theatre company or touring with Kent Theatre
Ensemble."
THEA 63192 ,"MENTORSHIP IN PERFORMANCE
",THEA,graduate standing and special approval of instructor.,None,"(Repeatable for a total of 6 credit hours) Development of advanced skills and abilities to mentor student
performers in aspects of the profession, including professional behavior, understanding of the business and
the actor’s creative process. Major work done while participating in rehearsal and performance of main stage
productions or assisting in THEA 451305 Professional Aspects. May be taken with THEA 62192 Practicum:
Performance."
THEA 64192 ,"MENTORSHIP AT PORTHOUSE
",THEA,"graduate standing and special approval ofinstructor. 
",None,"(Repeatable for a total of 6 credit hours) Development of advanced skills and abilities to mentor student
performers in aspects of the profession, including professional behavior, understanding of the business and
the actor’s creative process. Major work done while participating in rehearsal of Porthouse productions. May be
taken with THEA 62192 Practicum: Performance."
THEA 65192 ,"TEACHING PRACTICUM
",THEA,"graduate standing;THEA61094 or special approval of instructor. 
",None,"(Repeatable for a total of 6 credit hours) Application of strategies for teaching at the college level.
Development of advanced skills in course preparation, classroom management and pedagogical practice. Major
work done teaching or assisting with undergraduate classes. SU graded."
THEA 72992 ,"THEATRE PRODUCTION INTERNSHIP
",THEA,special approval of adviser and doctoral standing.,None,"(Repeatable for a total of 12 credit hours)Intensive advanced training in practical aspects of production.
Periodic seminars, laboratory sessions and performance in a theatre company or touring with Kent Theatre
Ensemble."
